Heading,URL
Här börjar flygplanet brinna – mitt under flighten,/tv/nyheter/har-borjar-flygplanet-brinna-mitt-under-flighten/
Alla nobbar Trumps ofräscha erbjudande,/tv/nyheter/alla-nobbar-trumps-ofrascha-erbjudande/
Vild polisjakt mitt bland solande turister på Mallorca,/tv/nyheter/vild-polisjaktmitt-bland-solande-turister-pa-mallorca/
Ryske artisten: ”Åt helvete med kriget”,/tv/nyheter/ryske-rapparen-pa-scenen-at-helvete-med-kriget/
Kriminellas nya skräck i New York: Robot-polishundar,/tv/nyheter/kriminellas-nya-skrack-i-new-york-robot-polishundar/
Lavrovs ilskna varning: ”Vi glömmer inte”,/tv/nyheter/lavrovs-ilskna-varning-vi-glommer-inte/
Hör Försvarsmaktens meddelande till P4-lyssnarna,/tv/nyheter/hor-forsvarsmaktens-meddelande-till-p4-lyssnarna/
Murhafs succé – har sålt majblommor för 500 000,/nyheter/murhafs-succe-har-salt--majblommor-for-500-000-/
Alla nobbar Trumps ofräscha erbjudande,https://www.expressen.se/tv/nyheter/alla-nobbar-trumps-ofrascha-erbjudande
Därför fick tv-stjärnan sparken från Fox News,/nyheter/darfor-fick-tucker-carlson--sparken-fran-fox-news/
Kriminellas nya skräck i New York: Robothundar,/tv/nyheter/kriminellas-nya-skrack-i-new-york-robot-polishundar/
Lavrov varnar världen för en ”farlig tröskel”,/nyheter/lavrov-varnar-varlden--for-en-farlig-troskel-/
Så lurar Rysslands ”grå flotta” världen,/tv/nyheter/rysslands-gra-flotta-haller-oljehandeln-flytande/
Ryska svaret på röjda ukrainska uppgifterna,/nyheter/ryskt-svar-pa-ukrainska-etableringen-vid-cherson/
Biltillslag i Slovakien – kopplas till flickmordet,/nyheter/biltillslag-i-slovakien-kopplas-till-flickmordet/
Kritiken: Flyktingpengar gick till vapen i Sudan,/nyheter/kritiken-flyktingpengar-bakom-konflikten-i-sudan/
”Fasansfull situation – kan bli långdragen”,/nyheter/experterna-om-konsekvenserna-av-sudankonflikten/
Polisanställd greps med kokain i blodet,/nyheter/krim/polisanstalld-greps-med-kokain-i-blodet/
Grand Hôtels husfru: De nyrika var värst,/premium/nyheter/grand-hotels-husfru-de-nyrika-var-varst/
Möt kvinnorna bakom ”radhusporren”,/premium/nyheter/mot-kvinnorna-bakom-radhusporren/
Här börjar planet brinna – mitt under flygningen,/tv/nyheter/har-borjar-flygplanet-brinna-mitt-under-flighten/
Så ska toppadvokaten få Toves mördare friad,/nyheter/sa-ska-clea-sangborn--fa-toves-mordare-friad/
32-åringen förhördes i Emilie Meng-utredning,/nyheter/32-aringen-forhordes-i--emilie-meng-utredning/
Barnknepet kan skydda din Iphone,https://www.expressen.se/tv/nyheter/barnknepet-skyddar-din-iphone-mot-tjuvarnas-nya-metod
Ryska kravet: Ta av er kläderna innan jobbet,https://www.expressen.se/tv/nyheter/anstallda-tvingas-ta-av-sig-kladerna-i-ryska-butiken
Skottlossning mot bostad – ingen skadad,/nyheter/skottlossning-mot-bostad-i-husby/
Folkmassa stenade och brände 13 misstänkta gängmedlemmar,/nyheter/folkmassa-stenade-och-brande-13-misstankta-gangmedlemmar/
Vild polisjakt – mitt bland solande turister,https://www.expressen.se/tv/nyheter/vild-polisjaktmitt-bland-solande-turister-pa-mallorca
Infekterade tvisten om asylboendet: ”Sko sig”,/nyheter/infekterade-tvisten-om-asylboendet-sko-sig/
Galna teorin: Signal gör vaccinerade till zombies,/nyheter/galna-teorin-signal-ska-aktivera-covid-vaccinet/
Indien går om Kina – blir flest redan nästa vecka,/nyheter/indien-blir-flest-i-varlden-redan-nasta-vecka/
Lokförare på pendeltågen: ”Vi hoppas på strejk i maj”,https://www.expressen.se/tv/nyheter/tagvarden-blir-dod-eller-framtiden-for-var-jarnvagshistoria
Dömdes för mordet på Tove – vill byta advokat,/nyheter/krim/domdes-for-mordet-pa-tove-vill-byta-advokat/
Ytterligare en gripen: ”Varvas upp av rykten”,/nyheter/en-till-gripen-efter-mord-i-friluftsomrade/
Ny selfielag kan ge turister dyra böter,/nyheter/nya-lagen-boter-for-turister-som-tar-selfies/
CNN-profilen Don Lemon sparkas,/nyheter/cnn-profilen-don-lemon-sparkas-/
Boris Johnsons ilskna utfall: ”Jag är führern”,/nyheter/boris-johnsons-ilskna--utfall-jag-ar-fuhrern/
Han ska utmana Putin – vill rensa i ryska staten,/nyheter/han-ska-utmana-putin-vill-rensa-i-ryska-staten/
Jättedrake fattade eld på Disneyland,/tv/nyheter/panik-pa-disneyland-jattedrake-borjade-brinna/
Nu är första kvinnliga krockdockan färdig,https://teknikensvarld.expressen.se/nyheter/bilbranschen/forsta-kvinnliga-krockdockan-redo-att-presenteras/
Försvarets meddelande till svenska folket i P4,https://www.expressen.se/tv/nyheter/hor-forsvarsmaktens-meddelande-till-p4-lyssnarna
"Rais, 6, drunknade på lektion – lärare döms",/nyheter/rais-6-drunknade-under-lektion-domen-kommer/
L: Då kommer vi inte att stödja gårdsförsäljning,/nyheter/l-flera-fragetecken-kring-gardsforsaljning/
Barn akutvaccineras efter mässlingsfall,/nyheter/akutvaccinering-pa-barnsjukhus/
Risk för nytt tågkaos för Stockholms pendlare,/nyheter/risk-for-nytt-pendelkaos-i-stockholm/
Anställd filmade kvinnor under kjolen i hemlighet,https://www.expressen.se/tv/nyheter/disneyanstalld-filmade-under-kvinnors-kjolar-i-sex-ar
