Heading,URL
Militärfordon rullar in i centrala Moskva – efter Wagnerledarens hot,/tv/nyheter/militarfordon-rullar-in-i-centrala-moskva-efter-wagnerledarens-hot/
Rysk krigshelikopter störtade i Belarus,/tv/nyheter/rysk-militarhelikopter-uppges-ha-kraschat-i-belarus/
Pilot döms till straffkoloni efter ryska skräckbranden,/tv/nyheter/pilot-doms-till-straffkoloni-efter-ryska-skrackbranden/
Sanningen bakom bankande ljuden från ubåten,/tv/nyheter/sanningen-bakom-bankande-ljuden-fran-ubaten/
JUST NU: Påstår sig kontrollera ryskt högkvarter,/nyheter/wagner-chefen-havdar-ryssland-bombar-oss/
Bilderna visar – militära styrkor i ryska staden,/tv/nyheter/klipp-fran-rostov-visar-soldater-och-militarfordon-pa-gatorna/
Experten om Wagner: ”Kommer att krossas”,/nyheter/experten-om-wagner-kommer-att-krossas-totalt/
Polisens teori: Skjutne pojken inte måltavla,/nyheter/larm-om-skjutning-i-uppsala/
Se filmen inifrån bussen i Gottsunda,/tv/nyheter/se-filmen-inifran-bussen-efter-skottlossningen-i-gottsunda/
Miljardären: De försökte rea ut resa med ubåten,/nyheter/miljardaren-de-forsokte-rea-ut-resa-med-ubaten/
De dog av sina egna uppfinningar,/nyheter/de-dog-av-sina-egna-uppfinningar/
Hemliga ljudet – timmar efter ubåten försvann,/nyheter/implosionen-hordes-bara-timmar-efter-forsvinnandet/
Emelie fick fel datum tatuerade: ”Fick panik”,/nyheter/emelie-fick-fel-datum-tatuerade-pa-armen/
Polisen bröt upp rejv med 2 000 personer,/nyheter/polisen-brot-upp-rejv-med-2-000-personer/
Wien bästa staden att bo i – Stockholm rasar på lista,/nyheter/wien-basta-staden-att-bo-i-stockholm-rasar-pa-lista/
Sexhandeln i de nya citykvarteren,/nyheter/natterna-pa-malmskillnadsgatan/
"Floras bror Ardiwan, 15, sköts ihjäl",/nyheter/ardiwan-15-mordades-systern-inte-fatt-rattvisa/
”Du ska inte tro du får elprisstöd...”,/nyheter/politiska-snapsvisor-2023-av-viktor-barth-kron/
”Lionel Messi” gav order – då sprängdes trapphus,/nyheter/krim/dalennatverket-misstanks-ha-sprangt-rivalens-port-i-valdsvagen/
Därför kan kriget bli slutet för Putin,/nyheter/darfor-kan-kriget--bli-slutet-for-putin/
Bussförare dumpad för miljardär: ”Vad har han som inte jag har?”,/nyheter/bussforare-dumpad-for-miljardar-vad-har-han-som-inte-jag-har/
17-åring högg bekant i ryggen – får mildrat straff,/nyheter/17-aring-hogg-bekant-i-ryggen-far-mildrat-straff/
Fängslas i straffkoloni efter rysk skräckbrand,https://www.expressen.se/tv/nyheter/pilot-doms-till-straffkoloni-efter-ryska-skrackbranden
Elon Musks utspel: Vill slåss med Zuckerberg,/nyheter/elon-musk-utmanar-mark-zuckerberg-till-ufc-fight/
Ukraina: Har stoppat den ryska offensiven,/nyheter/ukraina-har-stoppat-den-ryska-offensiven/
Solglädjen till helgen – här blir det varmast,/nyheter/sa-blir-vadret-under-midsommarhelgen-toibd/
Risk för skyfall i norra Sverige,/nyheter/varning-skyfall-i-norrbotten-och-vasterbotten/
Förödelsen efter sprängda dammen: ”Stora problem”,/tv/nyheter/forodelsen-efter-sprangda-dammen-stora-problem-/
Svenska ubåtsexperten: ”Förintades i princip”,/nyheter/teorierna-det-hande-med-titan-4-000-meter-ner/
Bråkar med fågeln – förstår inte faran,https://www.expressen.se/tv/nyheter/brakar-med-fageln-forstar-inte-faran-
Varnar efter olyckan: ”Bristande kunskap”,/nyheter/varningen-dalig-kunskap-om-kemiska-risker-pa-jobb/
Sanningen om Andrew Tates förmögenhet,/nyheter/sanningen-om-andrew-tates-formogenhet-/
Kim Jong-Uns ilska efter misslyckandet,https://www.expressen.se/tv/nyheter/kim-jong-uns-ilska-efter-misslyckandet/
Turkiet kräver fler utlämningar,/nyheter/turkiet-kraver-fler-utvisningar/
Smällen: Arvtagarens exman kan fängslas,/nyheter/biltema-arvtagerskans-exmake-riskerar-fangelse/
Barnen som överlevde i Amazonas kan kidnappas,/nyheter/barnen-som-overlevde-i-amazonas-kan-kidnappas/
Putins drag till havs – ännu fler ”stridsdelfiner”,/nyheter/nya-stridsdelfiner-i-hamnen-pa-krimhalvon-/
Högsäsong för magsjuka – så undviker du smittan,/nyheter/hogsasong-for-magsjuka-sa-undviker-du-smittan/
Butikens drag – mitt i chokladbojkotten,/nyheter/city-gross-marabou-kampanj--nar-andra-bolag-bojkottar/
Ukrainska motoffensiven går sämre än förväntat,/nyheter/ukrainska-motoffensiven-gar-samre-an-forvantat/
Stort ”dolt hål” upptäckt under E4 – prognosen,/nyheter/hal-pa-e4-i-sodertalje/
Expert: Så undviker du olyckor i midsommar,/nyheter/experten-sa-undviker--du-olyckor-i-midsommar/
Farliga vägarna du ska undvika i midsommar,https://teknikensvarld.expressen.se/nyheter/bil-och-trafik/farligaste-vagarna-i-midsommar/
Brandmän förlöste bebis – är deras prao 18 år senare,/nyheter/brandman-forloste-bebis-ar-deras-prao-18-ar-senare/
Lasse slogs ut av blixten: ”Trodde jag skulle dö”,/nyheter/lasse-slogs-ut-av-blixten-trodde-jag-skulle-do/
Kristerssons plan: Inga stora skattesänkningar,/nyheter/ulf-kristersson-biltrafiken--ska-begransas-i-staderna/
Döda kannibalinsekter överallt: ”Äter varandra”,https://www.expressen.se/tv/nyheter/doda-kannibalinsekterna-tacker-staden-stinker/
Wagnerchefens utspel mot de ryska topparna,/nyheter/kriget-i-ukraina-22-juni/
