Heading,URL
Hot efter attackerna i Ryssland: ”Ni måste göra allt”,/tv/nyheter/hot-efter-attackerna-i-ryssland-ni-maste-gora-allt/
Minst 280 döda efter tågolycka i Indien,/tv/nyheter/minst-50-doda-efter-tagolycka-i-indien/
Tio timmar efter fallet – här är Bidens nya olycka,/tv/nyheter/tio-timmar-efter-fallet-har-ar-biden-nasta-olycka/
Mysteriet kring de försvunna barnen i Amazonas,/tv/nyheter/mysteriet-efter-de-forsvunna-barnen-i-amazonas/
"Trumps reaktion efter Bidens fall: ""Gjorde han det?""",/tv/nyheter/trumps-reaktion-efter-bidens-fall-gjorde-han-det/
Student försvann – film kan avslöja vad som hänt,/tv/nyheter/student-forsvann-film-kan-avsloja-vad-som-hant/
Liberalerna: Magdalena Anderssons hot på SVT – anmäla Gulan Avci,/nyheter/liberalerna-magdalena-anderssons-hot-pa-svt-anmala-gulan-avci/
14-åring blev halv miljon rikare av ”psammofil”,/nyheter/14-aring-blev-halv-miljon-rikare-av-psammofil/
Ryska staden brann – soldater slåss mot Putin,/tv/nyheter/ryska-staden-brinner-soldater-slass-mot-putin-/
Prigozjin: Ryssar försökte spränga oss,/nyheter/prigozjin-ryska-styrkor-forsokte-spranga-mina-man/
Tio timmar efter fallet – här är Bidens nya olycka,https://www.expressen.se/tv/nyheter/tio-timmar-efter-fallet-har-ar-biden-nasta-olycka/
Oron för att prata efter våldet: ”Kan bli skjuten”,/nyheter/unga-tycker-det-ar-coolt-att-hanga-med-gangen-/
”Eskilstuna har blivit ett rövhål”,/nyheter/chefredaktorens-harda-ord-eskilstuna-har-blivit-ett-rovhal/
Daniel vårdade en av skadade pojkarna,/nyheter/daniel-vardade-en-av-de-skadade-pojkarna-i-eskilstuna/
Ica-handlarnas hemliga samtal – avlyssnades,/nyheter/ica-handlarnas-hemliga--samtal-blev-avlyssnade/
Lyxiga detaljerna på IT- miljardärens superyacht,/nyheter/lyxiga-detaljerna-pa-it-miljardarens-superyacht/
"Miljardären föll för svenska Lisa, 27",/nyheter/it-miljardarens-lyxyacht-pa-besok-i-stockholm/
Sparkade vd:ns order: Stäng ute Expressen,/nyheter/sparkade-vdns-order-slang-ut-expressen/
Tjänstemannens lyxliv – på kommunbolaget,/nyheter/sa-levde-tjanstemannen-lyxliv-pa-kommunbolaget/
Skräcksekunderna på E6 – föraren somnar,https://www.expressen.se/tv/nyheter/gt/skracksekunderna-pa-e6-foraren-somnar/
Oron efter morden – och för nya blå linjen,/nyheter/expressen-fordjupning/oron-efter-morden-och-for-nya-bla-linjen/
"Mats Löfvings son Ludvig: ""Oförlåtligt”",/nyheter/mats-lofvings-son-ludvig-for-mig-ar-det-oforlatligt/
Man allvarligt skadad efter mordförsök,/nyheter/mordforsok-i-jonkoping-en-man-skadad/
Vitvalen Hvaldimir pekas ut som spion,/nyheter/hemliga-militarsalarna--tranades-i-skargarden/
Bidens tal till nationen: ”Krisen är avvärjd”,/nyheter/bidens-tal-till-nationen-krisen-ar-avvarjd/
Minst 200 döda i tågolycka i Indien – tre tåg i krasch,https://www.expressen.se/tv/nyheter/minst-50-doda-efter-tagolycka-i-indien/
Mc-olycka i Bromma – en person förd till sjukhus,/nyheter/mc-olycka-i-bromma-en-person-ford-till-sjukhus/
Donald Trump jämför sig själv med Mona Lisa,/nyheter/donald-trump-jamfor-sig-sjalv-med-mona-lisa/
Polisinsats vid USA:s ambassad i Stockholm,/nyheter/polisinsats-vid-usas-ambassad/
Sista orden till tonåringen när han hoppade ner i hajvattnet,/nyheter/sista-orden-till-tonaringen-nar-han-hoppade-ner-i-hajvattnet/
Mamman slog larm om sonens terrorplaner,/nyheter/mamman-slog-larm-om-sonens-terrorplaner/
Experten tipsar: Tre bästa begagnade bilarna just nu,https://teknikensvarld.expressen.se/nyheter/konsument/basta-begagnade-bilen-tre-tips-fran-mikael-stjerna/
Över 60 luftangrepp mot Ukraina – på 24 timmar,/nyheter/over-60-luftangrepp-mot-ukraina-pa-24-timmar/
Kritiken mot Lamotte – filmade studenter,/nyheter/joakim-lamotte-filmade-studenter-under-firande/
Likdelar hittas i ravin – kan vara åtta unga personer,https://www.expressen.se/tv/nyheter/likdelar-hittade-i-ravin-tros-atta-unga-personer/
Åklagaren begär att Tove‑rättegång skjuts fram,/nyheter/aklagaren-begar-att-tove-rattegang-skjuts-fram/
Fyndet vid skogsbrand: Jonathans stulna Volvo,/nyheter/skogsbrand-rasar-utanfor-finspang-xexqs/
Oro över Bidens ålder: ”Elefanten i rummet”,https://www.expressen.se/tv/nyheter/experten-bidens-alder-elefanten-i-rummet
Joe Biden faller handlöst på scen,/tv/nyheter/har-faller-joe-biden-handlost-pa-scen/
Nya krissiffran för L – interna SD-kritiken,/nyheter/sd-samarbetet-kritiseras-efter-nya-krissiffror-for-l/
AI-forskarens varning: 50 procents risk att vi utrotas,/nyheter/ai-forskarens-varning-50-procents-risk-att-vi-utrotas/
Regeringen vill stoppa villkorlig frigivning,/nyheter/regeringen-vill-stoppa-villkorlig-frigivning/
Pojke föll i hisschakt – livshotande skadad,/nyheter/pojke-foll-ner-i-hisschakt-livshotande-skadad/
Lobbygrupp hjälpte SD – krävde att få vara hemlig,/nyheter/lobbygrupp-hjalpte-sd-i-israel-kravde-att-fa-vara-hemlig/
USA höjer skuldtaket för att undvika kaos,/nyheter/skuldtaket-hojs-i-usa-kompromissen-godkand-av-senaten/
Så blir framtiden för Putin efter nästa val,/nyheter/sa-blir-framtiden-for-putin-efter-nasta-presidentval/
Stabsläge dagen efter knivdramat i Eskilstuna,/nyheter/stabslage-dagen-efter-knivdramat-i-eskilstuna/
