Heading,URL
Student försvann – film kan avslöja vad som hänt,/tv/nyheter/student-forsvann-film-kan-avsloja-vad-som-hant/
Håll ut – då blir det sommarvarmt igen,/tv/nyheter/meteorologens-dom-fortsatt-riktigt-kyligt/
Här faller Joe Biden handlöst på scen,/tv/nyheter/har-faller-joe-biden-handlost-pa-scen/
Intensiv eldstrid i skogen – soldaten: ”Han andas inte”,/tv/nyheter/ukrainska-rekryter-forbereder-sig-pa-strid-och-dod/
Mannen snattade glass – stryps på golvet av väktare,/tv/nyheter/polisen-misstanker-mannen-snattade-glass-misshandlades-av-vaktare/
Macrons varning: ”Tiden på Rysslands sida”,/tv/nyheter/macrons-varning-tiden-kommer-att-vara-pa-rysslands-sida/
"Tonåringar dödade och åt byns älskade svan: ""Trodde det var en stor anka""",/tv/nyheter/tonaringar-dodade-och-at-byns-alskade-svan-trodde-det-var-en-stor-anka/
Otroliga mötet – lodjuret dyker upp på Rogers altan,/tv/nyheter/otroliga-motet-lodjuret-dyker-upp-pa-rogers-altan/
JUST NU: Skogsbrand rasar,/nyheter/skogsbrand-rasar-utanfor-finspang-xexqs/
Lobbygrupp hjälpte SD – krävde att få vara hemlig,/nyheter/lobbygrupp-hjalpte-sd-i-israel-kravde-att-fa-vara-hemlig/
It-miljardärens lyxyacht på besök i Stockholm,/nyheter/it-miljardarens-lyxyacht-pa-besok-i-stockholm/
Trumps reaktion efter Bidens fall: ”På riktigt?”,https://www.expressen.se/tv/nyheter/trumps-reaktion-efter-bidens-fall-gjorde-han-det
Oväntade ilskan mot Putin i rysk stats-tv,/tv/nyheter/ovantade-ilskan-mot-putin-i-rysk-stats-tv-valj-nagon-annan/
Bombade på barndag: ”De är största lyckan”,/nyheter/putin-bombade-barn-pa-deras-dag-storsta-lyckan-ar-barn/
USA höjer skuldtaket för att undvika kaos,/nyheter/skuldtaket-hojs-i-usa-kompromissen-godkand-av-senaten/
Ica-handlarnas hemliga samtal – blev avlyssnade,/nyheter/ica-handlarnas-hemliga--samtal-blev-avlyssnade/
Hemliga militärsälarna tränades i skärgården,/nyheter/hemliga-militarsalarna--tranades-i-skargarden/
Våldtäktsstudie anmäldes – förundersökning nerlagd,/nyheter/valdtaktsstudie-anmaldes-forundersokning-nerlagd/
Jakten efter explosionen: DNA-test och polistillslag,/nyheter/jakten-efter-explosionen-pa-nord-stream-dna-test-och-polistillslag/
Hit leder spåren efter sabotagen vid rören,/nyheter/misstankta-sparen-fran-sabotaget-mot-nord-stream/
Oron efter morden – och för nya blå linjen,/nyheter/expressen-fordjupning/oron-efter-morden-och-for-nya-bla-linjen/
"Mats Löfvings son Ludvig: ""Oförlåtligt”",/nyheter/mats-lofvings-son-ludvig-for-mig-ar-det-oforlatligt/
M-anklagelsen: Vänstern kapade stadskarneval,/nyheter/m-anklagelsen-vanstern-kapade-stadskarneval/
Ung man död efter bråk utanför pizzeria,/nyheter/person-skadad-halsen-ford-till-ambulans/
Maffian på väg att ta över Amazonas,/nyheter/ex-polischefen-maffian-ar-regnskogens-nya-hot/
Lööfs väljare flyr C: ”Fruktansvärt dåligt”,/nyheter/loofs-valjare-flyr-c-fruktansvart-daligt/
"S, V och MP får egen majoritet i ny mätning",/nyheter/nu-presenteras-scbs-stora-undersokning/
Dom rivs upp: Utvisning av våldtäktsman stoppas,/nyheter/hovratten-stoppar-utvisning-av-valdtaktsman/
Oron: Erdogan kan få en känsla av makt,/nyheter/oron-erdogan-kan-fa-en-kansla-av-makt/
Extrema väderfenomenet slår till mitt i brandkaoset,/nyheter/vaderfenomen-drabbar-nova-scotia-mitt-i-brandkaoset/
VW släpper snabb Golf – med extrem prislapp,https://teknikensvarld.expressen.se/nyheter/bil-och-trafik/volkswagen-golf-r-333-officiell/
Håll ut – då blir det sommarvarmt igen,https://www.expressen.se/tv/nyheter/meteorologens-dom-fortsatt-riktigt-kyligt
Bilen mosades – Dennis överlevde: ”Blod överallt”,/nyheter/dennis-overlevde-allvarlig-bilkrasch-minns-inget/
Polisens jakt efter det dödliga kaoset i Solna,/nyheter/polisens-jakt-efter-brutala-kaoset-i-hagalund/
Amazonanställd stalkade kvinnor genom kamera,/nyheter/anstalld-pa-amazon-spionerade-pa-kvinnor-genom-overvakningskamera/
Tonåringar gripna efter knivdramat i Eskilstuna,/nyheter/knivattack-pa-skola-i-eskilstuna/
Student försvann – film kan avslöja vad som hänt,https://www.expressen.se/tv/nyheter/student-forsvann-film-kan-avsloja-vad-som-hant
Kristerssons väntan – på möte med Erdogan,/nyheter/kristerssons-vantan-pa-mote-med-erdogan-/
Snattade glass – stryps på golvet av väktare,https://www.expressen.se/tv/nyheter/polisen-misstanker-mannen-snattade-glass-misshandlades-av-vaktare
Färska spåren efter de försvunna barnen,/nyheter/farska-sparen-efter-de-forsvunna-barnen-i-amazonas/
Inför krismötet: Sågar skandal-vd:ns försvar,/nyheter/infor-krismotet-aklagare-sagar-skandal-vds-forsvar/
Avslöjandena som skakar Älvstranden,/nyheter/avslojandena-som-skakar-alvstranden/
Billströms klara budskap: ”Påbörja ratificeringen”,/tv/nyheter/billstroms-tydliga-budskap-till-turkiet-paborja-ratificeringen/
Stoltenberg: ”Sverige har uppfyllt sina åtaganden”,/nyheter/billstrom-jag-har-blivit-lovat-natomote-med-turkiet/
Churchills favorit-spion hade charm som vapen,/nyheter/detaljerna-om-churchills-favorit-spion-christine-granville/
Polisförbundet: Allvarliga brister innan Löfvings död,/nyheter/polisforbundet-stora-brister-i-polisens-arbete/
Pojke fastnade i hiss – föll fem våningar,/nyheter/person-till-sjukhus-efter-olycka-i-hiss/
Milstolpe i klassiska fabriken i Torslanda,https://teknikensvarld.expressen.se/nyheter/bilbranschen/nio-miljoner-volvo-bilar-fran-torslandafabriken/
Kina bygger om moskéer – ska bli mer kinesiska,/tv/nyheter/kinas-tvangsbygge-moskeer-ska-se-mer-kinesiska-ut/
Efter avhoppet – så gick det för Putins beskyddare,/nyheter/putins-beskyddare-hoppade-av-sokte-medborgarskap-i-israel/
Rädda Barnen stoppar pridefestival för barn,/nyheter/radda-barnen-stoppar-pridefestival-for-barn/
Föräldrarnas strid om sonen: ”Han är Putin”,/nyheter/foraldrarnas-strid-om--sonen-han-ar-putin/
Flera nya fynd i sökandet efter Madeleine McCann,/nyheter/nya-ledtradar-i-madeleine-mccann-fallet-flera-saker-hittade/
Hoppet om Maddie efter tysk upptäckt,/nyheter/nya-hoppet-om-maddie-efter-tyska-upptackten/
Tonåringar dödade och åt byns älskade svan,https://www.expressen.se/tv/nyheter/tonaringar-dodade-och-at-byns-alskade-svan-trodde-det-var-en-stor-anka
Ny anti-rökningskampanj – varning på varje cigg,/nyheter/ny-anti-rokningskampanj-varning-pa-varje-cigg/
Kvinna anklagade Biden – har flytt till Ryssland,/nyheter/tara-reade-anklagade-joe-biden-for-overgrepp-har-nu-flytt-till-ryssland/
Mamman kollar genom titthålet – då skjuter han,/nyheter/kvinnan-i-malmo-kikar-genom-titthalet-da-skjuter-han/
Här är regeringens nya drag mot kriminaliteten,/nyheter/regeringen-presenterar-nya--verktyg-mot-kriminaliteten/
Spionrapporten avslöjar Kim Jong-Uns hälsokris,/nyheter/spionrapporten-avslojar-kim-jong-uns-halsokris/
