Heading,URL
"Ryska fängelserekryten:
”Drönare flög mot oss”",/tv/nyheter/ryska-fangelserekryten-dronare-flog-mot-oss/
Här bogseras valen från stranden i Skåne,/tv/nyheter/har-bogseras-valen-fran-stranden-i-skane/
Märkliga maskar förbluffar: ”Min värsta mardröm”,/tv/nyheter/markliga-maskar-forbluffar-min-varsta-mardrom/
Flygplats stängdes – omringad av skogsbränder,/tv/nyheter/flygplats-stangdes-omringad-av-branden/
Här slår Ryssland till mot ukrainska hamnstaden,/tv/nyheter/rysk-dronarattack-mot-ukrainska-hamnstaden/
Rispanik i mataffärer efter nytt förbud,/tv/nyheter/rispanik-i-mataffarer-efter-nytt-forbud/
Nya drönarbilder visar förödelsen i Bachmut,/tv/nyheter/nya-dronarbilder-visar-forodelsen-i-bachmut/
Här lyfts Greta Thunberg bort av polis – igen,/tv/nyheter/har-lyfts-greta-thunberg-bort-av-polis-igen/
Tar bort svenska varor – svar på koranbränning,/tv/nyheter/plockar-bort-svenska-varor-som-svar-pa-koranbranning/
JUST NU: Fartyg med 3 000 bilar brinner – en död,/nyheter/fartyg-med-3000-bilar-brinner/
Terrorexpert: ”Hoten ökar både akut och långsiktigt”,/nyheter/terrorexpert-hoten-okar-bade-akut-och-langsiktigt/
Regeringen kallar till pressträff om krisen,/nyheter/regeringen-haller-presstraff-om-korankrisen/
Imamens kritik mot regeringens tystnad,/nyheter/imam-om-korankrisen-det-ar-helt-tyst/
Säljer snusbord byggt med över 1000 dosor,/nyheter/saljer-snusbord-byggt-med-over-1000-dosor/
Augustivändningen – slår om till högsommarvärme,/nyheter/augustivandningen-slar-om-till-hogsommarvarmen/
Ryskt luftvärn slås ut – stor explosion,/tv/nyheter/ukrainsk-robot-slar-ut-dolt-ryskt-luftvarn/
Experten: Därför låter Putin Prigozjin leva,/nyheter/experten-darfor-later-putin-prigozjin-leva/
De kinesiska ledarna som plötsligt försvann,/nyheter/kinesiska-ledare-som-plotsligt-forsvann/
Stora bränder rasar på Sicilien: ”Är lite läskigt”,/nyheter/stora-brander-rasar-pa-sicilien/
Strömavbrotten tystar musiken på Rhodos,/nyheter/stromavbrotten-tystar-musiken-pa-rhodos/
Svensk volontär tog sista-minuten-flyg,/tv/nyheter/svenska-volontaren-nu-ar-det-eld-igen-/
Gynekolog antastade kvinnor: ”Ett rovdjur”,/nyheter/gynekolog-antastade-kvinnor-som-ett-rovdjur/
"My, 30, dödades – terroristerna döms",/nyheter/my-30-dodades-terroristerna-doms/
Svensken dömd för terrordådet i Bryssel,/nyheter/nio-personer-doms-for-terrordad-i-bryssel-en-svensk-/
Musks bakslag – efter namnbytet på Twitter,/nyheter/musks-bakslag-efter-namnbytet-pa-twitter/
Här bogseras valen från stranden i Skåne,https://www.expressen.se/tv/nyheter/har-bogseras-valen-fran-stranden-i-skane
Kinas utrikesminister fick gå – raderas nu i tysthet,/nyheter/kinas-utrikesminister-har-raderats-fran-hemsidor/
Guvernören: Styrkor har intagit by nära Bachmut,/nyheter/guvernoren-styrkor-har-intagit-by-nara-bachmut-/
Skogsbrand sprider sig i svenskparadiset,/nyheter/skogsbrand-pa-gran-canaria-sprider-sig/
"Ellen, 25, har bara ett ben – nekas handikapptillstånd",/nyheter/ellen-uusitalo--25-har-bara-ett-ben-nekas-handikapptillstand/
Köttbullar saknas – nya ryska Ikeakopian sågas,/nyheter/ryska-kunder-sagar-ikeakopia-i-moskva/
Man ångrar sig – ska inte bränna koranen,/nyheter/man-drar-tillbaka-ansokan-om-koranbranning-utanfor-irans-ambassad/
Billström i möte med FN-toppar: ”Allvarligt”,/nyheter/s-kraver-att-regeringen-informerar-om-korankris/
Märkliga maskarna förbluffar: ”Mardröm”,https://www.expressen.se/tv/nyheter/markliga-maskar-forbluffar-min-varsta-mardrom
Polska beställningen till Saab: Spaningsflygplan,/nyheter/polska-bestallningen-till-saab-spaningsflygplan/
Sällsynt Ferrari kan säljas för 100-tals miljoner,https://teknikensvarld.expressen.se/nyheter/bil-och-trafik/ferrari-412-p-berlinetta-kan-bli-en-av-varldens-dyraste/
Gamla Saab-fabriken köps av hemlig investerare,https://teknikensvarld.expressen.se/nyheter/bilbranschen/nevs-fabriken-kops-av-hemlig-investerare/
Kreml: Putin åker till Kina i oktober,/nyheter/kreml-putin-till-kina-i-oktober/
Åklagaren bekräftar: Är mamman som är mördare,/nyheter/mordet-i-skinnskatteberg-kvinnan-ar-mamman/
Finanstopp misstänks för sexköp – lämnar uppdrag,/nyheter/finanstopp-misstanks-for-sexkop-lamnar-uppdrag/
Säpo kan höja terrornivån efter koranbränningarna,/nyheter/ordern-internt-ha-automatvapen-nara/
Britternas mardrömsdjur har etablerat sig i Sverige,/nyheter/britternas-mardromsdjur-har-etablerat-sig-i-sverige/
Obamas kock död – hittad vid ex-presidentens hem,/nyheter/obamas-kock-dod-hittad-vid-ex-presidentens-hus-/
Här drar supertyfonen in över Filippinerna,https://www.expressen.se/tv/nyheter/har-drar-supertyfonen-in-over-filippinerna
Minst 34 döda i kraftiga skogsbränder i Algeriet,/nyheter/minst-34-doda-i-kraftiga-skogsbrander-i-algeriet/
Estonias bogramp bärgad – kan bli viktig pusselbit,/nyheter/estonias-bogramp-har-bargats-viktig-pusselbit/
Extrema värmen på Sardinien: 48 grader,/nyheter/extrema-varmen-pa--sardinien-48-grader/
Nya bränder sprids: ”Ett krig med elden”,/nyheter/nya-brander-sprids-i-grekland-krig-med-elden/
Demonstrationer i Israel: ”Vi går mot inbördeskrig”,/nyheter/forre-premiarministern-vi-gar-mot-inbordeskrig-/
Demonstrant skjuts med vattenkanon,/tv/nyheter/israelisk-demonstrant-skjuts-med-vattenkanon/
Känd rappare häktad – efter helt nya lagen,/nyheter/kand-artist-haktad-ska-ha-dragit-in-ungdom-i-kriminalitet/
Order om evakuering på Korfu: ”Lämna nu”,/nyheter/ny-evakueringsorder-pa-grekiska-on-korfu-evakuera-nu/
Erdogan står fast – Natobeslut i höst,/nyheter/erdogan-star-fast-natobeslut-i-host/
Tar bort svenska varor – svar på koranbränning,https://www.expressen.se/tv/nyheter/plockar-bort-svenska-varor-som-svar-pa-koranbranning
Stort strömavbrott i Stockholm – trafikljusen slutade fungera,/nyheter/stort-stromavbrott-i-stockholm-pfy2i/
Dykare möter sillkungen – sägs förutspå domedagen,/tv/nyheter/dykare-moter-sillkungen-sags-forutspa-domedagen/
