Heading,URL
Julia kliver fram till elefanten – då går allting snett,/tv/nyheter/julia-kliver-fram-till-elefanten-da-gar-allting-snett/
Paniken i bilen – smälter till lava i infernot,/tv/nyheter/skogsbrand-far-bilen-att-smalta-ser-ut-som-lava/
Ryska soldaterna stormar turkiska fartyget: ”Stanna!”,/tv/nyheter/ryska-soldaterna-stormar-turkiska-fraktfartyget-stanna/
Ukrainsk attack mot ryskt stridsfordon – explosion,/tv/nyheter/ukrainsk-attack-mot-ryskt-stridsfordon-explosion/
Nya skräckvapnet mot Putin: ”Oidentifierbara”,/tv/nyheter/ukrainska-hotet-i-svarta-havet-kommer-bli-spannande-for-vara-fiender/
Tre döda efter larm om köttätande bakterie i New York,/tv/nyheter/tre-doda-efter-larm-om-kottatande-bakterie-i-new-york/
Säpos oro efter nya terrorutvecklingen,/nyheter/sapo-om-terrorhotet-finns-konkreta-exempel/
Expertens svar – så ska du agera,/nyheter/experten-om-terrorhotet-var-aktsam/
Wallström: Ryssland begår gravt miljömord,/nyheter/margot-wallstrom-ryssland-begar-miljomord-i-ukraina/
Svensk robot skjuter ner rysk ”helvetetsmaskin”,/tv/nyheter/svensk-robot-skjuter-ner-ryska-helvetetsmaskinen/
Galna teorin: Rymdlaser bakom megabranden,/tv/nyheter/galna-teorin-rymdlaser-utloste-branderna-pa-maui-/
Därför blir det tågkaos i Sverige – igen och igen,/nyheter/kritiken-efter-tagkaoset-en-for-stor-koloss/
Pojke föll ur buss – dog av sina skador,/nyheter/barn-dog-efter-fall-fran-buss/
Kina: Skapar laservapen som skjuter ”i oändlighet”,/nyheter/kinas-nya-laservapen-kan-skjuta-i-oandlighet/
Fyndläge på elbil – billig leasing nu,https://teknikensvarld.expressen.se/nyheter/konsument/fyndlage-pa-elbil-billig-leasing-nu/
Paniken inifrån bilen – smälter till lava i infernot,/tv/nyheter/skogsbrand-far-bilen-att-smalta-ser-ut-som-lava/
Äntligen – nu kan du läsa oss hos Readly,/nyheter/antligen-nu-kan-du--lasa-oss-hos-readly/
Många kommuner inte rustade för väderkaos,/nyheter/manga-kommuner-inte-rustade-for-vaderkaos-/
Riskerna med att äga en kinesisk bil i Sverige,https://teknikensvarld.expressen.se/nyheter/konsument/riskerna-med-att-aga-en-kinesisk-bil-i-sverige/
Hassan Mohammed mördade taxiföraren,/nyheter/hassan-mohammed-33-skot-taxichauffor-till-dods-i-goteborg/
H&M lämnar Myanmar efter ny rapport om övergrepp,/nyheter/hochm-lamnar-myanmar-efter-ny-rapport-om-overgrepp/
Carlsbergs chock – när Putin tog över,/nyheter/carlsbergs-vds-ord-efter-putins-overtagande/
Här kan du dricka alkohol – på Ikea: ”Ett antal AW”,/nyheter/har-kan-du-dricka-alkohol-pa-ikea-vissa-har-aw/
Åkesson backas av SD om semestern,/nyheter/efter-anklagelserna-sd-backar-akessons-semester/
Bluffskyltar på Mallorca – för att få bort turister,/nyheter/bluffskyltar-pa-mallorca-for-att-fa-bort-turister/
Hon skickade dödligt gift till Trump – får 22 års fängelse,/nyheter/hon-skickade-dodligt-gift-till-trump-far-22-ars-fangelse/
USA låter Danmark skicka F16 till Ukraina,/nyheter/usa-later-danmark--skicka-f16-till-ukraina/
Microsoft-chef mördad inför 2-årig dotter – exfrun gripen,/nyheter/microsoft-chef-mordad-infor-2-arig-dotter-exfrun-gripen/
Ska vi larma vid alla nya covidvarianter?,/nyheter/kronikorer/amina-manzoor/ska-vi-larma-vid-alla-nya-covidvarianter/
Pehrsons hårda krav efter kritiserade orden,/nyheter/johan-pehrsons-svar-kritiken-ar-berattigad/
Svarar efter kritiken: ”Blev knas och fel”,/nyheter/l-ledamoten-om-jomshof-gransen-gar-om-de-skulle-borja-uttala-sig-pa-samma-satt-om-judar/
Ännu fler avgångar med Gotlandsfärjan ställs in,/nyheter/annu-fler-avgangar-med-gotlandsfarjan-stalls-in/
Brand på Södermalm – kvinna förd till sjukhus,/nyheter/brand-pa-sodermalm-kvinna-ford-till-sjukhus/
Trump vill skjuta på rättegång till 2026,/nyheter/trump-vill-skjuta-pa-rattegang-till-2026/
Kraftig jordbävning skakade flera städer i Colombia,/nyheter/kraftig-jordbavning-skakade-flera-stader-i-colombia/
Småstadens brott under radarn – klanens grepp,/nyheter/krim/smastadens-brott-under-radarn-klanens-grepp/
21-årig man död i olycka på flygflottilj,/nyheter/ung-man-allvarligt-skadad-pa-flygflottilj-i-blekinge/
Iphoneägare ersätts för sega telefoner,/nyheter/iphone-anvandare-far-700-kronor-efter-stamning-mot-apple/
Draget mot turisterna – ”stänger stränderna”,https://www.expressen.se/tv/nyheter/lokalbornas-bluffdrag-efter-turisternas-strandkrigande
Arla sänker priset med tio procent,/nyheter/arla-sanker-priset-med-tio-procent-/
Tvillingarna la miljoner på att se ut som Barbie,/nyheter/tvillingarna-dolly-and-daisy-simpson-har-lagt-22-miljoner-pa-att-se-ut-som-barbie-dockor/
Så här ska du tänka kring terrorhotet,/nyheter/ny-terrorhotniva-sa-har-ska-du-tanka-/
Piloten dog mitt under flygning – 271 ombord,/nyheter/pilot-dog-under-flygning-med-271-passagerare-ombord-/
Larm om köttätande bakterie i New York,https://www.expressen.se/tv/nyheter/tre-doda-efter-larm-om-kottatande-bakterie-i-new-york
Mannen erkänner: Jag dödade min fru i villan,/nyheter/mannen-erkanner-dodade-frun-i-villan/
Studie: De förarna är värsta fartsyndarna,https://teknikensvarld.expressen.se/nyheter/bil-och-trafik/undersokning-bmw-forare-varsta-fartsyndarna/
Tecknen på att Putin förlorat sitt inflytande,/nyheter/wilhelm-agrell-myteriet--avslojade-putins-maktbas-/
Inget majoritetsstöd för att ändra ordningslagen,/nyheter/inget-stod-for-andring-av-ordningslagen/
Han vill bli MP:s nya språkrör efter Bolund,/nyheter/daniel-hellden-kandiderar-till-mp-sprakror/
Skott mot villa i Tumba – personer var i huset,/nyheter/skjutning-mot-villa-/
