Heading,URL
Mobilen exploderar i fickan – nya trenden oroar,/tv/nyheter/pensionarens-rop-pa-hjalp-efter-plotsliga-explosionen-i-brostfickan/
Försvarets nya vapen – 3 000 skott i minuten,/tv/nyheter/forsvarets-nya-vapen-3000-skott-i-minuten/
Oväntade attacken mot rysk militärbas: ”Enkelt”,/tv/nyheter/ovantade-attacken-mot-rysk-militarbas-enkelt/
Mordåtalade tonåringar vallas – i bostadsområdet i Gävle,/tv/nyheter/mordatalade-tonaringar-vallas-i-bostadsomradet-i-gavle/
Oro på Balkan efter nya stödet till Putin,/tv/nyheter/nya-stodet-till-putin-oroar-pa-balkan/
Kaos på motorvägen – räddar kon med lassot,/tv/nyheter/kaos-pa-motorvagen-fangar-kon-med-lasso/
Lukasjenka avslöjar sin sjukdom: ”Lugna ner er”,/tv/nyheter/lukasjenka-avslojar-sin-sjukdom-lugna-ner-er-/
Älgkon och kalven får problem – mitt på motorvägen,/tv/nyheter/algkon-och-kalven-far-problem-mitt-pa-motorvagen/
JUST NU: Krock på E4,/nyheter/tva-bilar-i-krock-pa-e4-vid-rosersberg/
Mördaren vill träffa offrets dotter: ”Jag är inte rädd”,/nyheter/mordaren-vill-traffa-offrets--dotter-jag-ar-inte-radd/
Kaos på motorvägen – räddar kon med lassot,/tv/nyheter/kaos-pa-motorvagen-fangar-kon-med-lasso/
Oväntade attacken mot rysk militärbas: ”Enkelt”,/tv/nyheter/ovantade-attacken-mot-rysk-militarbas-enkelt/
Putins ”Cyber-Gulag” – övervakar ryssarna,/nyheter/putins-nya-cyber-gulag-massovervakar-ryssarna/
Rysslands påstående – attackerade till havs,/nyheter/rysslands-pastaende-attackerade-till-havs/
Trumps rival klev fram – då blev det totalfiasko,/nyheter/desantis-skulle-annonsera-sin-kandidatur-da-kraschade-twitter/
Döda flickans mamma: ”Sånt ska inte få hända”,/nyheter/doda-flickans-mamma-hon-fattas-oss/
Minderårig misstänkt för 10-årig flickas död,/nyheter/minderarig-misstankt-for-vallande-till-annans-dod/
Försvarets nya vapen – 3 000 skott i minuten,https://www.expressen.se/tv/nyheter/forsvarets-nya-vapen-3000-skott-i-minuten/
Grevinnans sista ord – spelade in samtal,/nyheter/grevinnans-sista-ord-spelade-in-samtalet--/
Volkswagen uppdaterar lyxiga suven Touareg,https://teknikensvarld.expressen.se/nyheter/bil-och-trafik/elbil-laddhybrid/volkswagen-touareg-facelift-officiell/
Chefens rasande svar från spahotellet,/nyheter/vdns-rasande-svar-fran-spahotellet/
Han tog sitt liv efter 6 veckors praktik,/nyheter/han-tog-sitt-liv-efter-sex-veckors-jobb-pa-samhall/
Misstänkta spåren från Nord Stream,/nyheter/misstankta-sparen-fran-sabotaget-mot-nord-stream/
Fraktfartyg gick på grund i Suezkanalen,/nyheter/fartyg-har-gatt-pa-grund-i-suezkanalen/
Mordåtalade tonåringar vallas i bostadsområdet,https://www.expressen.se/tv/nyheter/mordatalade-tonaringar-vallas-i-bostadsomradet-i-gavle/
”Sveriges snålaste miljonär” försvarar Lena Andersson,/nyheter/sveriges-snalaste-miljonar--forsvarar-lena-andersson/
Mobil exploderar i fickan – nya oroande trenden,/tv/nyheter/pensionarens-rop-pa-hjalp-efter-plotsliga-explosionen-i-brostfickan/
Han förlorade 120 miljarder på en dag,/nyheter/han-forlorade-120-miljarder-pa-en-dag/
Blev förlamad – kan gå igen via ”digital brygga”,/nyheter/blev-forlamad-kan-ga-igen-via-digital-brygga/
Flera bilar i brand efter explosion i Hässleholm,/nyheter/explosion-i-centrala-hassleholm/
Forskarna: Då försvinner Saturnus ikoniska ringar,/nyheter/rymden/forskarna-da-forsvinner-saturnus-ikoniska-ringar/
Pappan försvarade sitt barn – blev ihjälslagen,/nyheter/pappan-forsvarade-sitt-barn-blev-ihjalslagen/
Åkesson petar Reinfeldt – slår gamla rekordsiffran,/nyheter/akesson-petar-reinfeldt-slar-gamla-rekordsiffran/
Är förslaget baserat på studier eller moralism?,/nyheter/kronikorer/amina-manzoor/ar-forslaget-baserat-pa-nya-studier-eller-moralism/
Bröllopståget stannar – orsakar dödskrock,https://www.expressen.se/tv/nyheter/brollopstag-stannar-mitt-i-tunnel-orsakar-dodskrock-/
Två explosioner på kort tid i Norrköping,/nyheter/tva-explosioner-pa-kort-tid-i-norrkoping/
Explosion – flera bilar totalförstörda,/nyheter/explosion-flera-bilar-totalforstorda/
Vd:ns nya försvar: Kollade inte policyn,/nyheter/vdns-nya-forsvar--kollade-inte-mutpolicyn/
Ilskan mot Gröna Lund – ungdomsgäng pekas ut,/nyheter/ilskan-mot-grona-lund-ungdomsgang-pekas-ut/
Mannens ord på gården: ”Min flickvän ligger död”,/nyheter/mannens-ord-pa-garden--min-flickvan-ligger-dod/
Ron DeSantis utmanar Donald Trump i valet,/nyheter/desantis-utmanar-trump-staller-upp-i-valet/
Källor: Hopp om medlemskap i juli,/nyheter/kallor-fortsatt-hopp-om-nato-medlemskap-i-juli/
"Mätning: S, V och MP hade fått 50 procent",/nyheter/rodgron-gladje-i-opinionen-s-v-och-far-50-procent/
Uppgifter: Söker efter Maddies rosa pyjamas,/nyheter/utredaren-om-sokandet-efter-maddie-basta-chansen-pa-16-ar/
Polisens fynd vid portugisiska sjön,/tv/nyheter/polisen-soker-efter-madeleine-mccann-lamnar-med-pasar-/
Oro på Balkan efter nya stödet till Putin,/tv/nyheter/nya-stodet-till-putin-oroar-pa-balkan/
95-årig kvinna död – polis sköt henne med elpistol,/nyheter/95-arig-kvinna-dod-polis-skot-henne-med-elpistol/
Nya lagen: Åldersgräns på energidryck i Norge,/nyheter/overens-om-aldersgrans-pa-energidryck-i-norge/
Man misstänks ha försökt mörda president Biden,/nyheter/man-misstanks-ha-forsokt-morda-president-biden/
Planerade terrordåd mot kyrka efter koranbränning,/nyheter/broder-gripna-for-terrorplaner-mot-svensk-kyrka/
Schulman backar efter Ica-kritiken: ”Slarvigt”,/nyheter/alex-schulman-backar-efter-ica-kritiken-slarvigt/
Jättefartyget på plats efter Rysslands raseri,/nyheter/jattefartyget-pa-plats-efter-rysslands-raseri/
”Det vi fruktade mest med AI är nu verklighet”,/nyheter/snapchat-ai-uppmanade-barn-till-sjalvskador/
Detaljerna bakom Ikeas nya varuhus,/nyheter/detaljerna-bakom--ikeas-nya-varuhus/
Nya BMW 5-serie – nu även som elbil,https://teknikensvarld.expressen.se/nyheter/bil-och-trafik/elbil-laddhybrid/nya-bmw-5-serie-och-i5-officiella-over-fem-meter-langa/
Tjeckien köper 246 stridfordon av Sverige,/nyheter/uppgifter-miljardaffaren-klar-tjeckien-koper-246-stridfordon-av-sverige/
Polis avlossade skott inne på sitt hotellrum,/nyheter/polis-avlossade-skott--inne-pa-sitt-hotellrum-/
Barnfamiljernas smäll: 9 000 mindre i månaden,/nyheter/barnfamiljernas-small-9-000-mindre-i-manaden--/
Älgkon och kalven får problem – mitt på motorvägen,/tv/nyheter/algkon-och-kalven-far-problem-mitt-pa-motorvagen/
