Heading,URL
Kvinnan hörde pipande ljud – då gjorde läkaren skräckupptäckt,/tv/nyheter/kvinnan-horde-pipande-ljud-da-gjorde-lakarna-skrackupptackt/
Extremhetta i Spanien – varmast någonsin,/tv/nyheter/extremhetta-i-spanien-varmast-nagonsin/
Elefanten får nog och attackerar kvinnan,/tv/nyheter/elefanten-far-nog-och-attackerar-kvinnan/
Domen om vädret i Valborg – så blir det,/tv/nyheter/domen-om-vadret-i-valborg-sa-blir-det/
Hakkors ristades in på elev med funktionsnedsättning,/tv/nyheter/hakors-ristades-in-pa-elev-med-funktionsvariation/
Katten ”Patches” väger 18 kilo – nu ska han banta,/tv/nyheter/katten-peaches-vager-18-kilo-nu-ska-han-banta/
Stenblocket rullar nedför skidbacke – ut på bilväg,/tv/nyheter/stenblocket-stortar-nedfor-skidbacke-ut-pa-bilvag/
JUST NU: Kvinna skadad efter urspårad fest,/nyheter/fest-sparade-ur-i-goteborg-kvinna-knivskadad/
Åkesson: Då kan vi utlösa regeringskris,/nyheter/akesson-da-kan-vi-utlosa-regeringskris/
"Här blir Biden uppläxad av ett barn: ”Vänta, va?”",https://www.expressen.se/tv/nyheter/biden-upplaxad-av-barn-efter-blunder-vanta-va-
Livet för Toves mördare i kvinnofängelset,/nyheter/livet-for-toves-mordare-i--okanda-kvinnofangelset/
Här knuffar läkaren mannen i tunnelbanan,/nyheter/krim/skracken-i-tunnelbanan-lakaren-knuffar-mannen/
Efter ryska räden – Ukraina redo för ”enorm offensiv”,/nyheter/efter-dadet-flaggar-om-en-enorm-markoffensiv/
Fallskärmsjägarna släpps i skärgård,/tv/nyheter/har-slapps-fallskarmsjagare-ner-i-svenska-skargarden/
Mystiska bränder – misstänker pyroman,/nyheter/misstankt-pyroman-harjar-i-norrkoping/
Uppgifter: Biden kan besöka Finland i juli,/nyheter/uppgifter-biden-overvager-besok-i-finland/
Läckan inifrån: Här är Putins plan för Baltikum,/nyheter/lackan-inifran-har-ar-putins-planer-for-baltikum-ett-hot/
Oligarken räddade Putin – fick lyxvilla beslagtagen,/nyheter/oligarken-raddade-putin-fick-lyxvilla-beslagtagen/
"Filippa, 13, tacksam för polisens agerande",/nyheter/filippa-13-tacksam--for-polisens-agerande/
Iranska marinen tar över fartyget – på väg till USA,https://www.expressen.se/tv/nyheter/larmet-til-usa-fran-oljefartyget-efter-irans-helikopterkupp
Svåra bakslagen i sökandet efter försvunna Anna-Karin,/nyheter/svara-bakslagen-i-kampen-for-att-hitta-anna-karin-53/
USA stoppar alla arméhelikoptrar,/nyheter/usa-stoppar-alla-armehelikoptrar/
Dottern såld för knark – sen blir hon mördad,https://www.expressen.se/tv/nyheter/luz-3-hittades-mordad-sald-av-mamman-for-knark-
Fritzl: En monstruös idé – så blev den verklighet,/nyheter/josef-fritzl-en-monstruos-ide-sa-blev-den-verklighet/
Misstankarna mot ungdomarna stärkta,/nyheter/misstankarna-mot-de-fyra-ungdomarna-har-starkts/
Byggde 68 millimeter för nära grannen – kostar tre miljoner,/nyheter/byggde-68-millimeter-for-nara-grannen-kostar-tre-miljoner/
Konstigaste sakerna som glömts i en Uber,/nyheter/konstigaste-sakerna-som-glomts-i-en-uber/
Begick mord under dejt – fortsatte med den efteråt,/nyheter/begick-mord-under-dejt-fortsatte-med-den-efterat/
Mänskliga kvarlevor hittade vid Arlanda,/nyheter/manskliga-kvarlevor-hittade-vid-arlanda/
Andersson: ”Ett sätt att tysta oppositionen”,/nyheter/andersson-ett-satt--att-tysta-oppositionen/
SD: Korruption som S drivit för egen skull,/nyheter/sds-lotteriangrepp-s-ilskan-mot-forslaget/
Personbil voltade – tre unga män till sjukhus,/nyheter/bil-voltade-tre-till-sjukhus-3pufm/
Jonathan får inte donera sperma – har 600 barn,/nyheter/jonathan-far-inte-donera-sperma-har-600-barn/
Domen om vädret i Valborg – så blir det,https://www.expressen.se/tv/nyheter/domen-om-vadret-i-valborg-sa-blir-det
Brandmän i slagsmål – kastades bort av polis,https://www.expressen.se/tv/nyheter/brandman-i-slagsmal-kastades-bort-av-polis/
Mördade mannen tog på sig knarkgömma,/nyheter/mordade-mannen-tog--pa-sig-knarkgomma/
Magnus hörde skotten: ”Kom i så snabb följd”,/nyheter/man-hittad-skjuten-i-bil/
Polisen utreder händelsen som mord,/tv/nyheter/man-skjuten-till-dods-i-goteborg/
Putins kryptiska flört med Erdogan i mötet,https://www.expressen.se/tv/nyheter/putin-till-erdogan-viktigt-att-utoka-relationen-/
Värmebölja slår mot Spanien – 40 grader,/nyheter/klimat/varmebolja-slar-mot-spanien-40-grader/
250 000 kaniner ska gasas till döds,/nyheter/klimat/spanien-vill-gasa-ihjal-250-000-kaniner/
Klimataktivist avbröt ministern i riksdagen,https://www.expressen.se/tv/nyheter/klimataktivist-skapade-tumult-under-riksdagsdebatt/
”Håll truten” – sedan tappade Aschberg det,/nyheter/hall-truten-sedan--tappade-aschberg-det/
Norsk polis: Troligtvis svenska män som dog,/nyheter/tre-doda-i-allvarlig-olycka-i-norge-/
Hakkors ristades in på elev med funktionsnedsättning,/tv/nyheter/hakors-ristades-in-pa-elev-med-funktionsvariation/
Mordmisstänkt man lider av psykisk störning,/nyheter/krim/mordmisstank-man-ar-psykiskt-sjuk/
Man döms till dagsböter efter hot mot Annie Lööf,/nyheter/man-doms-till-dagsboter-efter-hot-mot-annie-loof/
Populära småbilen lever farligt med nya EU-regler,https://teknikensvarld.expressen.se/nyheter/bil-och-trafik/euro-7-kan-ta-dod-pa-skoda-fabia-i-fortid/
Kommuntoppen: ”Klart man skulle polisanmält”,/nyheter/kommuntoppen-klart--man-skulle-polisanmalt/
Tjänstemannens lyxliv – på kommunbolaget,/nyheter/sa-levde-tjanstemannen-lyxliv-pa-kommunbolaget/
Utpekades i härva – får miljonkontrakt,/nyheter/utpekades-i-bjudreseharva--far-nytt-miljonkontrakt/
Erdogan ställer in på nytt efter plötsliga magsjukan,/nyheter/efter-magsjukan-erdogan-staller-in-fler-valmoten/
15-åringar döms för skjutning i Gubbängen,/nyheter/krim/15-aringar-doms-for--skjutning-i-gubbangen/
