Heading,URL
Prästerna flög på soldaten efter orden om kriget,/tv/nyheter/ukrainsk-soldat-i-vilt-slagsmal-med-praster/
Ryssland släpper video på misstänkta bombkvinnan,/tv/nyheter/ryssland-slapper-video-pa-misstankta-bombkvinnan/
Här porrsurfar politikern – mitt under sammanträdet,/tv/nyheter/har-porrsurfar-politikern-mitt-under-sammantradet/
Japanska militären övar på att brotta ner influencers,/tv/nyheter/japanska-militaren-ovar-pa-att-brotta-ner-influencers/
LIVE-TV: Senaste nyheterna med Expressen TV,/tv/nyheter/live/live-tv-senaste-nyheterna-med-expressen-tv-16/
Här sveper brinnande eldklot fram över Sverige,/tv/nyheter/se-videon-har-flyger-eldklotet-over-sverige/
Ryska kritiken inifrån: ”Rör oss mot nederlag”,/tv/nyheter/ryska-kritiken-inifran-ror-oss-mot-nederlag/
Försvunnen 4-åring hittas – lojal hund höll sällskap,/tv/nyheter/forsvunnen-4-aring-hittas-lojal-hund-holl-sallskap/
JUST NU: Allvarlig tågolycka,/nyheter/allvarlig-tagolycka-i-nederlanderna-/
Advokaten: Vi släpper inte Trumps ”mugshot”,/nyheter/advokaten-darfor-slapps-inte-donald-trumps-mugshot/
Ovanliga bilden inifrån Trump Force One,/nyheter/trump-pa-vag-till-new-york-tro-det-eller-ej/
Här anländer Trump till New York,/tv/nyheter/har-anlander-trump-till-new-york/
Företagarfamilj fick bygga lyxhus – 11 politiker åtalas,/nyheter/foretagarfamilj-fick-bygga-lyxhus-11-politiker-atalas/
Domen: Anders Adali ska betala 370 miljoner,/nyheter/ex-bankranaren-anders-adali-ska-betala-over-378-miljoner-i-skadestand/
Skulle rädda sin hund – fastnade på klippa,/tv/nyheter/skulle-radda-sin-hund-fastnade-pa-klippa/
Präst flög på soldat efter orden om kriget,/tv/nyheter/ukrainsk-soldat-i-vilt-slagsmal-med-praster/
Frågetecknen kring ryska hotet: ”Tömt allt”,/nyheter/ryska-hotbilden-mot-sverige-starks-pa-sikt/
Ryska drönarattacker mot viktiga hamnstaden,/nyheter/uppgifter-om-rysk-dronarattack-mot-odessa/
Föräldrarna till förgiftade flickan: Drack ättikan själv,/nyheter/foraldrarna-till-forgiftade-flickan-drack-attikan-sjalv/
Männens svåra liv med jättepenisarna,/nyheter/mannens-svara-liv-med-jattepenisarna-tufft/
Grand Hôtels husfru: De nyrika var värst,/premium/nyheter/grand-hotels-husfru-de-nyrika-var-varst/
Ryssland släpper video på misstänkta bombkvinnan,/tv/nyheter/ryssland-slapper-video-pa-misstankta-bombkvinnan/
Teorin: Här bär hon in bomben på kaféet,/tv/nyheter/teorin-har-bar-hon-in-bomben-pa-kafeet/
De syr kläder till Lager 157 – bor i skjul,/nyheter/de-syr-kladerna-till-lager-157-bor-i-skjul/
Tvingas ge svarta pengar till barnens tränare,/nyheter/foraldrar-tvingas-ge-svarta-pengar-till-barnens-tranare/
Svaret efter kritiken om kritiserade ”chat control”,/nyheter/ylva-johansson-om-eu--kan-bli-ett-paradis-for-pedofiler/
”Öppnar en bakdörr att missbruka”,/tv/nyheter/storsta-massovervakningen-pa-den-har-sidan-kinesiska-muren/
"”Lina”, 42: ”Vi är som tonåringar med pengar”",/premium/nyheter/har-traffas-svenska-par-for-sex-och-hemliga-ritualer/
M: Utred dem som åker till sitt hemland på semester,/nyheter/m-utred-dem-som-aker-till-sitt-hemland-pa-semester/
Australiens regering stoppar Tiktok,/nyheter/australiens-regering-stoppar-tiktok/
Evelyn har två vaginor: ”Den ena är för maken”,/nyheter/onlyfans-profilen-evelyn-miller-har-tva-vaginor/
"Trots protesterna: Sverige utvisar sjuka Kathleen, 74",/nyheter/trots-protesterna-sverige-vill-utvisa-alzheimersjuka-kathleen-74/
Här är störst chans till vårväder i påsk,/nyheter/har-ar-storst-chans-till-pangvader-i-pask-ez8yv/
Resa med elbil i påsk – nio tips hur du ska tänka,https://teknikensvarld.expressen.se/nyheter/bil-och-trafik/elbil-laddhybrid/9-tips-sa-planerar-du-din-resa-med-elbil-i-pask/
Hon blir första kvinnan att åka på uppdrag till månen,/nyheter/hon-blir-forsta-kvinnan-att-aka-pa-uppdrag-till-manen/
Udda militärövningen: Brottar ner influencers,/tv/nyheter/japanska-militaren-ovar-pa-att-brotta-ner-influencers/
Segerfesten i natt – firade med bratwurst,/nyheter/segern-i-natt-bratwurst-med-barbecuesas/
”Det spelar ingen roll att Marin blivit en fixstjärna”,/tv/nyheter/barth-kron-att-marin-blivit-en-fixstjarna-spelar-liten-roll/
Gängman misstänkt efter sprängning på nattklubb,/nyheter/man-begard-haktad-efter-explosionen-pa-avenyn/
Mannen: ”Pratade” med döda kvinnan i frysboxen,/nyheter/haktade-mannen-pratade-med-kvinnan-i-frysboxen/
Här porrsurfar politikern mitt under sammanträdet,/tv/nyheter/har-porrsurfar-politikern-mitt-under-sammantradet/
SD efter uppgifterna: ”Anmärkningsvärt”,/nyheter/sds-svar-efter-uppgifterna-anmarkningsvart/
Netanyahus vändning – sparkad minister tillbaka,/nyheter/netanyahu-tar-tillbaka-sparkade-forsvarsministern/
Heroinkirurgen döms – efter polisens tillslag,/nyheter/fangelse-for-heroinrokande-kirurg/
Macrons minister i Playboy – kritiseras,/nyheter/macrons-minister-i-playboy-stor-kritik-/
Död person upptäckt i vattnet vid Kvarnholmen,/nyheter/dod-kropp-hittad-vid-kvarnholmen-/
Kinesiska ballongen kom över känslig information,/nyheter/spionballongen-kom-over-kanslig-information/
Putins kraftiga svar: Ökar närvaron i väst,/nyheter/ryssland-starker-militaren-i-vast/
Nasas nya rymddräkt ska passa kvinnor på månen,/allt-om-resor/nyheter/nasas-nya-rymddrakt-ska-passa-kvinnor-pa-manen/
Kim Berglund om åren i skräckfängelset: ”Ensamt”,/nyheter/kim-eriksson-om-aren-i-skrackfangelset-ensamt/
Kvinna död i Göteborg – man misstänks för mord,/nyheter/kvinna-hittad-dod-man-misstanks-for-mord-7yazc/
Här sveper ett brinnande eldklot fram över Sverige,https://www.expressen.se/tv/nyheter/se-videon-har-flyger-eldklotet-over-sverige
