Heading,URL
Galna bilderna – fasaden faller från sjunde våningen,/tv/nyheter/skrackogonblicket-jattehuset-slukas/
Filmen visar förödelsen: ”Massattack mot oss”,/tv/nyheter/filmen-visar-forodelsen-tva-barn-bland-offren/
Mystiska hål i sökandet efter försvunna Madeleine McCann,/tv/nyheter/mystiska-hal-i-sokandet-efter-forsvunna-madeleine-mccann/
Skulle kissa i vattnet – får sin arm avbiten,/tv/nyheter/skulle-kissa-i-vattnet-far-sin-arm-avbiten/
JUST NU: Arlanda express har spårat ur – två till sjukhus,/nyheter/arlanda-express-har-sparat-ur/
Ryssarna attackerar i vågor – alla missar,/tv/nyheter/ryssarna-attackerar-i-vagor-alla-missar-/
Nya ryska taktiken: Översvämmar Ukraina,/nyheter/taktiken-i-kriget-spranger-dammar/
Pojke knivhuggen i park – svårt skadad,/nyheter/person-knivhuggen-stor-insats/
Åtalet: Societetskvinnan stal miljoner från hemlösa,/nyheter/atalet-societetskvinnan-stal-miljoner-fran-hemlosa/
Skräcksynen vid mannens säng: ”Jag blev chockad”,/nyheter/skracksynen-vid-mannens-sang-jag-blev-chockad/
Jackie Arklöv vill träffa offrets dotter,/nyheter/mordaren-vill-traffa-offrets--dotter-jag-ar-inte-radd/
Han tog sitt liv efter sex veckors praktik,/nyheter/han-tog-sitt-liv-efter-sex-veckors-jobb-pa-samhall/
Misstänkta spåren från Nord Stream,/nyheter/misstankta-sparen-fran-sabotaget-mot-nord-stream/
Gifte sig – mördades i sin brudklänning,/nyheter/gifte-sig-mordades-i-sin-brudklanning/
Oro bland poliser – vet inte vilka uppgifter som läckt,/nyheter/personuppgifter-om-polissokande-lackta/
Experten: Då blir det särskilt känsligt,/nyheter/sakerhetsexperten-da-blir-det-sarskilt-kansligt/
”Krävs en konfrontation för att besegra Trump”,/tv/nyheter/kravs-en-konfrontation-for-att-besegra-trump-/
Födelsedagspresenten blev pojkarnas död,/nyheter/fodelsedagspresenten-blev-pojkarnas-dod/
Skräcken på planet – man öppnar dörren,https://www.expressen.se/tv/nyheter/oppnar-nodgangen-i-luften-tvingas-nodlanda/
Norrmännen varnas: Håll er borta från ”spionvalen”,/nyheter/norrmannen-varnas-hall--er-borta-fran-spionvalen/
Natos försvarsplan: Dela upp Norden,/nyheter/natos-forsvarsplan-dela-upp-norden/
Turkiets löfte till USA – då släpps Sverige in,/nyheter/turkiska-loftet-till-usa-kommer-slappa-in-sverige/
”Vinsterna skulle vara mindre än riskerna”,/tv/nyheter/vinsterna-inrikespolitiskt-redan-gjorda/
Glädjebeskedet: Soligt i pingsthelgen,/nyheter/soligt-pa-pingstafton-i-stora-delar-av-landet/
102-åringens tips för ett långt liv: ”Bra sex”,/nyheter/102-aringens-tips-for-ett-langt-liv-bra-sex/
Galna bilderna – fasaden faller från sjunde våningen,/tv/nyheter/skrackogonblicket-jattehuset-slukas/
Mystiska frostskakningar slog till mot finsk stad,/nyheter/mystiska-frostskakningar--slog-till-mot-finsk-stad/
Mer än 800 fåglar hittade döda vid sjö,/nyheter/mer-an-800-faglar--hittade-doda-vid-sjo/
Mystiska hålen i sökandet efter försvunna McCann,https://www.expressen.se/tv/nyheter/mystiska-hal-i-sokandet-efter-forsvunna-madeleine-mccann
Hade död kvinna i frysen – levde på hennes pension,/nyheter/nya-misstankar-mot-mordmisstankt-i-varmland/
Notan för Stefan Ingves avtackning: En miljon,/nyheter/notan-for-stefan-ingves-avtackning-en-miljon/
Slagsmål och könsord på Liseberg: ”Var totalt kaos”,/nyheter/slagsmal-och-konsord-pa--liseberg-var-totalt-kaos/
Facket sågar polisen efter Löfving-rapport,/nyheter/polisen-lamnar-rapport-kring-lofvings-dod/
17-åriga flickor häktas för mordförsök i Malmö,/nyheter/flickor-begars-haktade-for-mordforsok/
Chefen köpte dyr ryggbiff – döms till böter i rätten,/nyheter/chefen-kopte-dyr-ryggbiff-doms-till-boter-i-ratten/
Man och kvinna hittades döda – bostad avspärrad,/nyheter/tva-hittade-doda-i-bostad-ofzrh/
Är förslaget baserat på studier eller moralism?,/nyheter/kronikorer/amina-manzoor/ar-forslaget-baserat-pa-nya-studier-eller-moralism/
Kritiken i M: Vill döda utredning om röstköp,/nyheter/kritiken-partiledningen-vill-begrava-utredning-om-rostkop-i-muf/
SD vill terrorstämpla ryska Wagnergruppen,/nyheter/sd-vill-terrorstampla-wagnergruppen-/
Pekades ut för mordet på Palme – träder fram,/nyheter/david-fredin-pekades-ut-for--palmemordet-trader-fram/
”Jag misstänkte att Palme var en spion”,/tv/nyheter/jag-misstankte-att-palme-var-en-spion/
Widding KU-anmäler L-ministrar: ”Allvarligt”,/nyheter/elsa-widding-ku-anmaler-johan-pehrson-och-mats-persson/
Skulle kissa i vattnet – får sin arm avbiten,https://www.expressen.se/tv/nyheter/skulle-kissa-i-vattnet-far-sin-arm-avbiten/
Tre åtalas för 12 år gammal gruppvåldtäkt,/nyheter/tre-atalas-for-12-ar-gammal-gruppvaldtakt/
Böndernas stora oro – rustar med ”war room”,/nyheter/sommaren-kan-bli-som-2018-lrf-rustar-med-war-room/
Han torterade och ströp sambo i studentlägenhet,/nyheter/mannen-erkanner-strop-sambo-i-studentlagenheten/
