Heading,URL
Oväntad syn i Stockholm – träd hänger uppochner,/tv/nyheter/ovantade-synen-mitt-i-stockholm-ek-upphangd-over-gatan/
Helene mitt i jordbävningen: ”Läskigare än tsunamin”,/tv/nyheter/jordbavning-i-marocko-laskigare-an-tsunamin/
Svinpest-scenariot: ”Död hand” på allt under ett par år,/tv/nyheter/scenariot-dod-hand-pa-allt-under-ett-par-ar/
Vinkris i Bordeaux – 80 miljoner liter vin ska förstöras,/tv/nyheter/vinkris-i-bordeaux-80-miljoner-liter-vin-ska-forstoras-/
Här grundluras ryssarna av ukrainska taktiken,/tv/nyheter/ukrainska-taktiken-lurar-ryssarna-med-fejkvapen/
Bryggan kollapsar – 80 studenter faller i vattnet,/tv/nyheter/bryggan-kollapsar-80-studenter-faller-i-vattnet-/
Knuffar ner man på spåret – igen och igen,/tv/nyheter/knuffar-ner-man-pa-sparet-doms-till-10-ars-fangelse/
Plötsligt rasar huset efter jordbävningen i Marocko,/tv/nyheter/har-rasar-byggnaden-i-marocko-/
Barnens kamp för att överleva – i dödens öken,/nyheter/har-tvingas-mammorna-begrava-sina-barn-i-sanden/
Ann Linde överfölls av ökänd gärningsman,/nyheter/ann-linde-berattar-om-overfallet-vralade-som-nar-man-foder-barn/
Lastbil exploderar – föraren fast i hytten,/tv/nyheter/lastbil-exploderar-foraren-raddas-i-sista-stund/
Forskare förbryllade av mystiskt ”gyllene ägg”,https://www.expressen.se/tv/nyheter/mystiskt-gyllene-agg-forbryllar-forskarna-som-en-skrackfilm
Här slår Ukraina till med hemlig natträd,/tv/nyheter/ukrainas-smygoperation-inne-bland-ryska-styrkorna/
Det händer med Wagner – efter Prigozjins död,/nyheter/bildt-wagnergruppen-dog-med-ledaren-prigozjin/
Nya pengar ska korta kön till cancervården,/nyheter/nya-pengar-ska-korta--kon-till-cancervarden/
Man svårt skadad efter skjutning – flera skott,/nyheter/person-skjuten-i-eskilstuna-njzwm/
Så går jakten till på smittade vildsvinen,/nyheter/jagarnas-jakt-pa-smittade-vildsvinen/
Scenariot: ”Död hand” på allt under ett par år,https://www.expressen.se/tv/nyheter/scenariot-dod-hand-pa-allt-under-ett-par-ar
Sju döda djur hittade – fler nya fall upptäckta,/nyheter/flera-nya-doda-vildsvin-hittade/
Skräcken efter regnen: ”Kommer hitta kroppar”,/nyheter/skracken-efter-regnen-kommer-hitta-kroppar/
"""Du kommer bli jagad resten av ditt liv""",/nyheter/krim/gangkriget-i-sundsvall-tog-fart-nar-21-aringen-bytte-sida/
Karin föll 7 meter – Mikael höll sig kvar,/nyheter/karin-overlevde-olyckan-i-jetline-pa-grona-lund/
Oväntad syn i Stockholm – träd hänger uppochner,https://www.expressen.se/tv/nyheter/ovantade-synen-mitt-i-stockholm-ek-upphangd-over-gatan
Misstanken mot paret: Plågade två små barn,/nyheter/par-haktade-misstankta-for-grov-misshandel-av-barn/
Landssorg i Marocko – över 2000 har dött,/nyheter/landssorg-i-marocko-men-ingen-hjalp-utifran/
Helene spelade in sista video till barnen,https://www.expressen.se/tv/nyheter/jordbavning-i-marocko-laskigare-an-tsunamin
Värsta jordskalven senaste 20 åren,/nyheter/11-varsta-jordbavningarna-senaste-tva-decennierna/
Lars-Olof stångades av älgko: ”Var ute efter mig”,/nyheter/lars-olof-stangades-av-algko-var-ute-efter-mig/
UD: Över tusen svenskar i jordbävningens Marocko,/nyheter/over-tusen-svenskar-pa-plats-i-marocko/
Guldrånare i krasch – stal bil och sköt skott,/nyheter/guldsmed-ranad-polisjakt--efter-tva-maskerade-man/
Misstogs för rymling – jagas av flirtiga fans,/nyheter/misstogs-for-terrorfange-pa-rymmen-blev-viral/
”Terrorkocken” gripen efter ovanlig rymning,/nyheter/forrymda-terrorfangen-gripen-i-london/
Beslutet: 80 miljoner liter vin ska förstöras,https://www.expressen.se/tv/nyheter/vinkris-i-bordeaux-80-miljoner-liter-vin-ska-forstoras-
Fler ryska drönardelar upptäckta i Rumänien,/nyheter/flera-misstankta-dronardelar-i-rumanien/
Vändningen – efter hårda anklagelsen: ”Stort krig”,/nyheter/pastod-att-musk-stoppat-ukrainsk-attack-pudlar/
Kravet på Lavrov – i hemliga FN-brevet,/nyheter/guterres-hemliga-brev-till-lavrov-om-sanktionerna/
Mordpatrullens panik av brevmissen i häktet,/nyheter/mordpatrullens-panik-efter-brevmissen-i-haktet/
Tyska panikdraget efter Polens svinpest-utbrott,/nyheter/tyska-panikdraget-efter-polens-svinpest-utbrott/
Förvandlade barnsjukhus till tortyrkammare åt IS,/tv/nyheter/forvandlar-barnsjukhus-till-tortyrkammare-at-is/
Sis nya krav – vill kunna neka tvångsplacerade,/nyheter/sis-vill-kunna-neka-unga-som-ska-tvangsplaceras/
Knuffar ner mannen på spåret – igen och igen,https://www.expressen.se/tv/nyheter/knuffar-ner-man-pa-sparet-doms-till-10-ars-fangelse
Barn dött i våldsdåd – grannarnas chock,/nyheter/grovt-valdsbrott-i-vallentuna/
Bönder vill slakta djur: ”Det låter lite överilat”,/nyheter/jordbruksverket-forhastat-att-slakta-grisar/
Svensk gripen i Thailand – spårades via sina bilder,/nyheter/svensk-gripen-i-thailand-sparades-via-sina-bilder/
Uppgifter: Polisen fick mordlarm – la åt sidan,/nyheter/krim/larm-om-bestallningsmord-dagar-innan-dodsskjutningen-i-uppsala/
Bisarra scenerna efter Kim Jong-Uns mössbyte,https://www.expressen.se/tv/nyheter/kim-jong-un-byter-mossa-mots-av-galna-applader
Bilist i rasande attack mot klimataktivister,https://www.expressen.se/tv/nyheter/har-gar-bilisten-till-valdsam-attack-mot-klimataktivisterna
Jägare specialtränas för att stoppa pesten,/nyheter/jagare-specialtranas--for-att-stoppa-pesten/
