Heading,URL
Karusellen kollapsar plötsligt i Ryssland – många skadade,/tv/nyheter/karusellen-kollapsar-plotsligt-i-ryssland-manga-skadade/
Smarta spåren i snön 8-åringens räddning,/tv/nyheter/smarta-sparen-i-snon-8-aringens-raddning/
Här blir det 24 grader varmt i helgen,/tv/nyheter/sommartemperaturer-att-vanta-till-helgen/
Prigozjins ilska – 500 döda Wagnersoldater på en dag,/tv/nyheter/prigozjins-ilska-500-doda-wagnersoldater-pa-en-dag/
Därför tejpades flygplanet innan start,/tv/nyheter/har-tejpas-flygplanet-med-silvertejp/
Bilist kraschar rakt in i uteservering,/tv/nyheter/bilist-kraschar-rakt-in-i-uteservering-/
Köpte drömhuset – hittade fullt med ormar i väggarna,/tv/nyheter/kopte-dromhuset-hittade-fullt-med-ormar-i-vaggarna/
Rovdjurets oväntade besök hos barnfamiljen,/tv/nyheter/rovdjurets-ovantade-besok-hos-barnfamiljen/
Mördarens drag inför den nya rättegången,/nyheter/kampen-om-expertvittnet-jambordiga-vapen/
Livet för Toves mördare i ökända fängelset,/nyheter/livet-for-toves-mordare-i--okanda-kvinnofangelset/
Trumps CNN-attack: ”Du är en äcklig människa”,/nyheter/trumps-cnn-attack-du-ar-en-acklig-manniska/
Rysk styrka flyr över fältet från Bachmut,/tv/nyheter/ryska-retratten-vid-bachmut-flyr-over-oppet-falt/
Ryska orden om kriget: ”Fienden är starkare”,/nyheter/ryska-orden-om-kriget-valdigt-svart-fienden-ar-starkare/
Nato: Här är Putins 3 stora krigsmisstag,/nyheter/nato-putins-tre-stora-krigsmisstag/
Bildt: ”Kreml hoppas att Erdogan ska sitta kvar”,/nyheter/bildt-kreml-hoppas-att--erdogan-ska-sitta-kvar/
Prinsessan Sofias förfest inför showen,/nyheter/prinsessan-sofia-pa--beyonce-konserten/
Två gripna efter insats – två bomber hittade,/nyheter/misstankt-farligt-foremal-i-tensta-tva-gripna/
Liten och tuff elbil från Alpine kommer nästa år,https://teknikensvarld.expressen.se/nyheter/bil-och-trafik/elbil-laddhybrid/alpine-a290_b-eldriven-sportbil-for-vardagen/
Putins monument försvaras av mc-klubb,/nyheter/forsvaras-av-mc-klubb--och-kameror-i-schweiz/
Nikita hittades död på alla hjärtans dag,/premium/nyheter/nikita-hittades-dod-pa-alla-hjartans-dag-vem-ar-jag-om-jag-inte-ar-din-mamma/
Kremls plan: Falska protester mot Erdogan,/nyheter/kremls-hemliga-plan-falska-protester-mot-erdogan-och-turkiet/
Misstanken: Här brände mördaren pengarna,/nyheter/krim/15-aringen-mordade-for-100-000-och-brande-mordpengarna-pa-nk/
6-åriga adoptivdottern visade sig vara 22 år,/nyheter/6-ariga-adoptivdottern-visade-sig-vara-22-ar/
Här blir det upp till 24 grader varmt i helgen,/tv/nyheter/sommartemperaturer-att-vanta-till-helgen/
Stor skogsbrand rasar – flygplan kallas in,/nyheter/stor-skogsbrand-i-ulricehamn-msb-skickar-plan/
Teorin om mordet: Skulle se ut som ett självmord,/nyheter/teorin-om-mordet-skulle-se-ut-som-ett-sjalvmord/
Mark Zuckerberg vann guld i jujutsu-turnering,/nyheter/mark-zuckerberg-vann-guld-i-jujutsu-turnering-/
Lyxskolan tillät privata datorer under proven,/nyheter/lyxskolan-tillat-privata--datorer-under-proven-/
Karusellen kollapsar i ryska nöjesparken,/tv/nyheter/karusellen-kollapsar-plotsligt-i-ryssland-manga-skadade/
Sanna Marin skiljer sig – efter 19 år med maken,/nyheter/sanna-marin-skiljer-sig/
Fritzls ord om familjen: ”Kommer återförenas”,/nyheter/fritzls-ord-om-familjen-kommer-aterforenas/
Republikanska politikern riskerar 20 års fängelse,/nyheter/george-santos-riskerar-20-ars-fangelse-for-bedrageri/
Mördarbin dödade sex – efter våldsam bussolycka,/nyheter/sex-dodade-av-mordarbin-buss-kraschade-in-i-bikupor/
Familjen hittade mannen på stranden – nya teorin,/nyheter/familjen-hittade-mannen--pa-stranden-nya-teorin-/
Gåtan med mannen på stranden: ”Sorgligt”,/nyheter/gatan-med-mannen-pa-stranden-vem-ar-han/
Ebba Buschs ledarskap ifrågasätts internt i KD,/nyheter/buschs-framtid-som-kd-ledare-diskuteras-internt-/
L om avhoppet: ”Väldigt tråkigt”,/nyheter/cecilia-malmstrom-lamnar-liberalerna/
Domarens uppmaning till GW: Var tyst i rätten,/nyheter/domaren-uppmanade-gw-vara-tyst-i-rattegang/
Oväntade förklaringen friade ”Rävens” mamma,/nyheter/ovantade-forklaringen--friade-ravens-mamma/
Smarta spåren i snön 8-åringens räddning,/tv/nyheter/smarta-sparen-i-snon-8-aringens-raddning/
En svårt skadad i ammunitionsfabrik,/nyheter/explosion-i-ammunitionsfabrik-fxuvx/
Hunden Mira hittade korv med glas i: ”Livsfarligt”,/nyheter/hunden-mira-hittade-korv-med-glasbitar-livsfarligt/
Så kan tågen påverkas i strejken: ”Beredda”,/nyheter/sa-kan-tagen-paverkas-i-strejken-beredda/
Truckförarens dyrbara tabbe – tappar pizzaugn på Ferrari,https://www.expressen.se/tv/nyheter/truckforarens-kostsamma-tabbe-tappar-pizzaugn-pa-ferrari
”Det är för krångligt att ha elbil i Sverige”,https://teknikensvarld.expressen.se/nyheter/konsument/det-ar-for-krangligt-att-ha-elbil-i-sverige/
Regeringen: A-traktorer ska köra med vinterdäck,https://teknikensvarld.expressen.se/nyheter/bil-och-trafik/regeringen-vill-infora-krav-pa-vinterdack-for-a-traktorer/
Här kraschar bilisten rakt in i uteservering,/tv/nyheter/bilist-kraschar-rakt-in-i-uteservering-/
Vd:n pekas ut i SVT – larmet från anställda,/nyheter/vdn-pekas-ut-i-svt-larmet-fran-anstallda-pa-gudrun-sjoden/
Mystiska Wagner-orden om Rysslands ”farfar”,/nyheter/wagner-ledarens-mystiska-ord-om-rysslands-farfar/
Passagerarens förvåning – planet lagas med tejp,https://www.expressen.se/tv/nyheter/har-tejpas-flygplanet-med-silvertejp/
Toppolitiker: Nu kan inte Trump vinna valet,/nyheter/toppolitiker-trump-kan-inte-vinna-valet-nu/
Trump fälls för sexuella övergrepp,/nyheter/trump-falls-for-sexuella-overgrepp/
Leendet efter domen: ”Vi är väldigt glada”,/tv/nyheter/leendet-efter-domen-vi-ar-valdigt-glada/
Experterna: Då inleder Ukraina våroffensiven,/nyheter/experterna-da-inleds-den-ukrainska-varoffensiven-/
