Heading,URL
Husses hånfulla gest – när kängurun försöker dränka hunden,/tv/nyheter/kanguru-forsoker-dranka-hund-da-rycker-husse-in/
Paniken ombord när motor exploderar i luften,/tv/nyheter/paniken-ombord-nar-motor-exploderar-i-luften/
"Israeliska soldatens reaktion: ""Vi är i krig!""",/tv/nyheter/israeliska-soldatens-reaktion-vi-ar-i-krig-/
Kvinnan voltar ett varv – landar sittande på bil,/tv/nyheter/kvinnan-voltar-ett-varv-landar-sittande-pa-bil/
Bilderna visar – här dödas Hamas-generalen,/tv/nyheter/bilderna-visar-har-dodas-hamas-generalen/
Hör smällen när Tel Aviv attackeras,/tv/nyheter/hor-smallen-nar-tel-aviv-attackeras/
Oväntat fynd i Göteborg – väldigt död späckhuggare,/tv/nyheter/gt/spackhuggare-har-flutit-i-land-i-goteborg/
Kvinnan antastar vakten i Stockholms t-bana: ”Obehagligt”,/tv/nyheter/kvinnan-antastar-vakten-i-stockholms-t-bana-obehagligt/
JUST NU: Ung man död efter trafikolycka,/nyheter/ung-man-avliden-efter-trafikolycka-i-fredags/
3 000 gömmer sig i ödestaden,/nyheter/har-gommer-sig-3-000--manniskor-i-odestaden-/
JUST NU: Uppgifter om vapenvila i Gaza,/nyheter/usa-overgangen-till-egypten-kommer-oppna-/
Kritiken mot SVT: ”Rasistisk fråga”,/tv/nyheter/kritiken-mot-svt-rasistisk-fraga/
Deras paradis blev ett slakthus: ”Allt förstört”,/nyheter/deras-paradis-blev-ett-slakthus-allt-forstort/
Kaj Linna har blivit pappa i Filippinerna,/nyheter/kaj-linna-har-blivit--pappa-i-filippinerna/
Mångmiljonären bakom Hamas attack mot Israel,/nyheter/mangmiljonaren-bakom-hamas-attack-mot-israel/
Kvinnan tar tag i vaktens underliv,/tv/nyheter/kvinnan-antastar-vakten-i-stockholms-t-bana-obehagligt/
Högra handen spelade död – dök upp i sändning,/nyheter/mustafa-benzema-aljiburi-spred-rykten-om-sin-dod-dok-upp-i-sandning/
”Har all rätt i världen att förakta honom för detta”,/nyheter/experterna-om-musks--han-mot-zelenskyj/
Mördade sin kidnappare – ”Jag högg för mitt liv”,/nyheter/mordade-sin-kidnappare-vid-tvattstugan-det-var-svart/
Husses hånfulla gest – när hunden attackeras,https://www.expressen.se/tv/nyheter/kanguru-forsoker-dranka-hund-da-rycker-husse-in
"Svenske Johan, 40, död i strid i Ukraina",/nyheter/svenske-johan-40dod-i-strid-i-ukraina/
Experterna: Då kan fredssamtal inledas,/nyheter/experterna-da-kan--fredssamtal-inledas-/
Skarakannibalens ursäkt till dottern – förklaringen,/nyheter/forklaringen-till-dottern-fran-skarakannibalen/
Pourmokhtari: Då packar jag väskan,/nyheter/pourmokhtari-vill-att-sd-sager-ja-till-min-klimatplan/
Rawa Majids hemliga bas – livet på flykt,/nyheter/krim/rawa-majids-hemliga-bas-vid-tiden-for-gripandet/
Jimmie Åkesson vill riva medborgarskap,/nyheter/jimmie-akesson-ingen-annan--losning-an-att-riva-medborgarskap/
Amanda Knox inför rätta igen om halloweenmordet,/nyheter/amanda-knox-infor-ratta-igen-om-halloweenmordet/
Palestinsk sexåring dödad i Chicago – utreder hatbrott,/nyheter/palestinsk-sexaring-dodad--i-chicago-utreder-hatbrott/
Hans Volvo V70 fick oväntat körförbud,https://teknikensvarld.expressen.se/nyheter/konsument/korforbud-pa-volvo-trots-plomberade-gastankar/
Paniken ombord när en motor exploderar,https://www.expressen.se/tv/nyheter/paniken-ombord-nar-motor-exploderar-i-luften/
Filmmakare och hans fru hittade döda,/nyheter/iransk-filmmakare-och-hans-fru-hittade-doda/
Miljardärens svar på Musks Sverige-skämt,/nyheter/musk-inbjuden-till-bro-av-svenska-miljardaren-/
Friad för mord – ersätts trots åklagarens protest,/nyheter/friad-for-mord-ersatts-trots-aklagarens-protest/
Israels ambassadör: Dådet var en pogrom,/nyheter/israels-ambassador-dadet-var-en-pogrom/
Arvtagare går mot seger i Ecuadorvalet,/nyheter/arvtagare-gar-mot-seger-i-ecuadorvalet/
Brand i villa: ”Den är fullt utvecklad”,/nyheter/brand-i-villa-den-ar-fullt-utvecklad/
Tjuvar stal 4 000 lådor sprit värt över 17 miljoner,/nyheter/tjuvar-stal-4-000-lador-sprit-vart-over-17-miljoner/
Man hittad svårt skadad i rondell,/nyheter/man-hittad-svart-skadad-i-rondell/
Kvinnan voltar ett varv – landar sittande på bil,https://www.expressen.se/tv/nyheter/kvinnan-voltar-ett-varv-landar-sittande-pa-bil/
Polisen utreder misstänkt grovt brott i Huddinge,/nyheter/misstankt-grovt-brott-i-lanna/
Israels förslag till FN – skapa ”humanitär zon”,/nyheter/fn-varnar-israel-kan-utfora-etnisk-rensning/
"Felicia, 25, ligger i koma i Thailand – familjens kamp",/nyheter/felicia-25-ligger-i-koma-i--thailand-familjens-kamp/
Två barn påkörda av bil i centrala Malmö,/nyheter/tva-barn-pakorda/
Späckhuggare hittad: ”Det luktade härsket”,/nyheter/spackhuggare-har-flutit-i-land-i-goteborg/
”Stor och imponerande – men väldigt död”,/tv/nyheter/gt/spackhuggare-har-flutit-i-land-i-goteborg/
Skola tvingas hålla stängt efter branden,/nyheter/storbrand-soder-om-stockholm-efdcx/
Bastubråket i Östersund – badkläder väcker debatt,/nyheter/bastubraket-i-ostersund-badklader-vacker-debatt/
"Fulla, 7, vet inte att hela familjen är död",/nyheter/fulla-7-vet-inte-att-hela-familjen-ar-dod/
Gängmän greps av insatsstyrkan i lyxbil,/nyheter/fem-gangkriminella-anhallna-i-linkoping/
Bråk vid McDonald's – man blev av med korten,/nyheter/klagade-pa-hog-musik-blev-av-med-korten-/
Svensk societetsman slog ut chaufförs tänder,/nyheter/svensk-societetsman-slog--ut-taxichauffors-tander/
