Heading,URL
Putins vändning: Kriget en tragedi,/tv/nyheter/varlden/putin-kriget-i-ukraina-ar-en-tragedi/
Rasar mot flygbolaget – avslöjas av filmen,/tv/nyheter/varlden/rasar-mot-flygbolaget-avslojas-av-filmen/
Helt plötsligt spricker fartyget på mitten,/tv/nyheter/varlden/helt-plotsligt-spricker-fraktfartyget-pa-mitten/
Himlen lyses upp – fyra Jas-plan i tät följd,/tv/nyheter/natthimlen-lyses-upp-fyra-jas-plan-i-tat-foljd/
Korsar floden – går in i dödszonen,/tv/nyheter/varlden/ukraina-haller-fronten-med-uppblasbar-bat/
Nya trenden – gosa med kossor,/tv/nyheter/varlden/har-kan-du-gosa-med-kossor-for-dryga-femhundralappen/
Expertens coronavarning: ”Ser en jättespridning”,/tv/nyheter/sverige/expertens-coronavarning-ser-en-jattespridning/
JUST NU: Skoldagarna blir längre,/nyheter/langre-skoldagar-med-mer-svenska-i-lagstadiet/
Hemlig uppmaning spreds genom sms,/nyheter/sverige/initiativ-till-protesten-mot-ulf-kristersson-spreds-via-sms/
Amnesty: ”Tänk på vad du säger”,/nyheter/sverige/amnesty-till-kristersson-tank-pa-vad-du-sager/
Strandhälls svar på kritiken: ”Ovärdigt”,/nyheter/sverige/strandhall-svarar-pa-kritiken-ovardigt-det-star-jag-for/
Expertens tre teorier om Putins vändning,/nyheter/varlden/expertens-tre-teorier--om-putins-vandning/
Rysk sångare dödas i ukrainsk hämndattack,/tv/nyheter/rysk-sangare-dodas-i-ukrainsk-hamndattack/
Nya vapnet som USA fruktar att Putin ska få,/nyheter/varlden/kriget-i-ukraina-22-november/
Här flyger bilen rakt in i gränsstationen,/tv/nyheter/varlden/har-flyger-bilen-rakt-in-i-amerikanska-gransstationen/
Unika födseln fångas på film,/tv/nyheter/varlden/unika-fodseln-fangas-pa-film/
Nya ko-trenden slår i England,/tv/nyheter/varlden/har-kan-du-gosa-med-kossor-for-dryga-femhundralappen/
SD-förslaget: Förhindra utländska butiksskyltar,/nyheter/sverige/sd-forslaget-forhindra-utlandska-butiksskyltar/
Vapenvilan skjuts upp – gisslan släpps inte nu,/nyheter/varlden/tillfalliga-vapenvilan-mellan-israel-och-hamas-skjuts-upp-/
Hamas yngsta fånge kan bli fri,/nyheter/varlden/yngsta-fangen-kan-bli-fri-litar-inte-pa-hamas/
Fyra av hans barn dog i Israels attack,/nyheter/varlden/mohammed-forlorade-fyra-av-sina-fem-barn-i-israels-attack/
Reaktioner efter bilden på mamman i åkturen,/nyheter/mamman-ammar-sin-dotter-mitt-under-akturen/
Rekordhög lön för nya rikspolischefen,/nyheter/rekordhog-lon-till-nya-rikspolischefen/
Abdisalan Yusuf hittad – flydde fängelsestraff,/nyheter/sverige/abdisalan-yusuf-gripen-efter-flykten-fran-sverige/
Kaoset och tragedierna i Patrick Sommerlaths liv,/nyheter/sverige/tragedierna-i-patrick-sommerlaths-liv/
SD:s landsdagar kan bana väg för Swexit,/nyheter/laget/sds-landsdagar-kan-bana-vag-for-swexit/
Paniken på gallerian när taket börjar rasa,/tv/nyheter/panik-pa-gallerian-nar-taket-borjar-rasa-in/
Omtyckta bilshowen tar en längre paus,https://teknikensvarld.expressen.se/nyheter/ovrigt/top-gear-tar-en-paus-for-alltid/
Kollegerna spionerade på Postnord-mannen,/nyheter/sverige/kollegerna-spionerade-pa-postnord-mannen/
Fast i Colombia med tvillingarna,/nyheter/varlden/tobias-fast-i-bogota-med-sina-tvillingar/
Här i lägret drömmer barnen om att få dö,/nyheter/har-i-lagret-drommer-barnen-om-att-fa-do/
Wilders vinner valet – överlägset störst,/nyheter/varlden/geert-wilders-vinner-valet-i-nederlanderna-overlagset-storst/
Turkiet godkänner inte Sverige nästa vecka,/nyheter/varlden/uppgifter-turkiet-godkanner-inte-sverige/
12 stora förändringar när vi går med i Nato,/nyheter/12-stora-forandringar-nar-vi-gar-med-i-nato/
Misstanken: Bergsprängare tillverkade termosbomber,/nyheter/sverige/polisen-misstanker-bergsprangare-tillverkade-termosbomber/
Folkmordsfrågan efter Kristerssons rättning,/tv/nyheter/folkmordsfragan-efter-kristerssons-rattning/
Fångar fick inte vinterskor – anstalt kritiseras av JO,/nyheter/sverige/fangar-fick-inte-vinterskor-jo-kritiserar-anstalt/
Europeiska bilköpare: ”Aldrig en kinesisk bil”,https://teknikensvarld.expressen.se/nyheter/bilbranschen/bilkopare-i-eu-aldrig-en-kinesisk-bil/
Ryktet om skolan: Införde förbud mot palestinasjalar,/nyheter/sverige/malmoskola-fick-kritik-for-sjalforbud-stammer-inte/
Gängmän gripna efter hoten mot börs-vd:n,/nyheter/sverige/gangman-gripna-efter-hoten-mot-bors-vdn/
Brandattentat mot vd:ns affärskollega,/nyheter/sverige/kuylenstiernas-kollega-utsatt-for-brandattentat/
FBI utreder bilkraschen: ”Inga tecken på terror”,/nyheter/varlden/bil-har-exploderat-vid-niagarafallen/
Mystiska män i västar gräver upp vägbrunnar,/nyheter/mystiska-man-i-varselvastar-graver-upp-vagbrunnar-/
Ilska mot Teslas drag för att runda strejken,/nyheter/sverige/teslas-drag-i-strejken-inte-alls-forvanade/
Misstanken: Här fångas domstolsläckan på bild,/nyheter/sverige/misstanken-har-fangas-domstolslackan-pa-bild/
Irriterat i S efter Helldéns ultimatum om kärnkraften,/nyheter/sverige/irriterat-i-s-efter-helldens-ultimatum-om-karnkraften/
Felet som Kristerssons högra hand utelämnar,/nyheter/sverige/johan-jakobssons-fel-om-bryggan-och-tradacket/
Putins hemliga vapen: ”Piska och pepparkaka”,/nyheter/varlden/putins-hemliga-vapen-pa--hemmaplan-krigsbloggare/
Begagnade elbilar sjunker mest i pris,https://teknikensvarld.expressen.se/nyheter/bilbranschen/sjunkande-priser-pa-begagnade-elbilar/
Naturfenomen gör Sverige större och Norge krymper,/nyheter/sverige/sverige-blir-storre/
Jas-planen lyser upp himlen – ett efter ett,https://www.expressen.se/tv/nyheter/natthimlen-lyses-upp-fyra-jas-plan-i-tat-foljd
Spelet och maktstriden bakom vd:ns comeback,/nyheter/varlden/maktstriden-bakom-altmans-comeback-till-open-ai/
Kaoset på Open AI – det här har hänt,/nyheter/laget/kaoset-pa-open-ai-det-har-har-hant/
Ungern tar inte upp Sveriges Natoansökan,/nyheter/varlden/ungern-tar-inte-upp-svensk-natoansokan/
Ukrainska oron för ryska vintertaktiken,/nyheter/varlden/ryska-planen-sla-ut-ukrainska-elnatet/
Ordern från Musk: Inget avtal i Sverige,/nyheter/sverige/medlaren-order-fran-elon-musk-att-inte-skriva-avtal/
Så ska gisslan i Gaza släppas,/nyheter/varlden/sa-ska-gisslan-i-gaza-slappas/
Kaosvarning: Snö och enorma vågor,/nyheter/sverige/smhi-varnar-for-sno-kommer-stora-trafiken/
Svaret på skolbråket: Man höggs i huvudet,/nyheter/sverige/efter-skolbraket-man-hoggs-i-huvudet-och-dumpades-i-skogen/
Mammans första ord efter dotterns död,/nyheter/mamman-i-soderhamn-vi-saknar-var-dotter/
Expertens coronavarning: ”Ser en jättespridning”,https://www.expressen.se/tv/nyheter/sverige/expertens-coronavarning-ser-en-jattespridning/
