Heading,URL
Civilt par svänger fel – attackeras av ryska styrkor,/tv/nyheter/paret-anfolls-av-ryska-styrkor-raddades-av-dronare/
Här slår jordbävningen till – mitt under nyhetssändningen,/tv/nyheter/har-slar-jordbavningen-till-mitt-under-nyhetssandningen/
Bilden när Putin knäböjer – äkta eller falsk?,/tv/nyheter/bilden-pa-en-knabojande-putin-akta-eller-falsk/
LIVE-TV: Senaste nyheterna med Expressen TV,/tv/nyheter/live/live-tv-senaste-nyheterna-med-expressen-tv-16/
Ryska jaktplan över Östersjön – för att stoppa USA:s bombplan,/tv/nyheter/ryssland-skickade-jaktplan-mot-amerikanska-bombare/
Xi Jinpings massorder i Moskva – amerikansk snabbmat,/tv/nyheter/xi-jinpings-massorder-i-moskva-bestaller-amerikansk-snabbmat/
Här svimmar mannen i rysk stats-tv,/tv/nyheter/har-svimmar-mannen-i-rysk-stats-tv/
Fyra brottsutredningar hänger över Trump,/tv/nyheter/har-ar-alla-utredningar-som-hanger-over-trump/
JUST NU: Larm om smällar – misstänkt mordförsök,/nyheter/larm-om-smallar-bostad-misstanks-ha-beskjutits/
Wagnersoldaternas liv i kriget: ”Kräks och gråter”,/nyheter/wagnersoldaten-nagra-grater-nagra-kraks/
Hotet i rysk stats-tv: Stora nordiska kriget,/tv/nyheter/nya-hotet-i-rysk-stats-tv-nordiskt-krig/
Ryska krisdraget – gamla stridsvagnar,/nyheter/ryska-vapenbristen-dammar-av-stridsvagnar-fran-1940-talet/
Barnens egna fynd efter Joullnars försvinnande,/tv/nyheter/joullnars-barn-efter-dodsfallet-alla-alskade-henne-det-var-for-tidigt/
Magnus dotter pekades ut som offret: ”Skärrad”,/nyheter/rykte-om-magnus-dotter-efter-mordet-i-skogen/
Frågetecknen om fallet Joullnar – det här vet vi,/nyheter/fragetecknen-om-fallet-joullnar-det-har-vet-vi/
"Joel, 26, dog i lavin –familjens stora sorg",/nyheter/joel-26-dog-i-lavinolyckan-i-verbier/
Jordbävningen slår till – mitt under sändning,/tv/nyheter/har-slar-jordbavningen-till-mitt-under-nyhetssandningen/
Flygbolag anställde vikarier baserat på deras bröststorlek,/nyheter/flygbolag-anstallde-vikarier-baserat-pa-deras-broststorlek/
Efterlysta av Sverige – jagas i hela världen,/nyheter/krim/efterlysta-av-sverige-jagas-i-hela-varlden/
Miljarder försvann i ”dödsobligationer”,/nyheter/miljarder-forsvann-i-dodsobligationer/
Träningsprofilen Elin Kjos är död,/nyheter/traningsprofilen-elin-kjos-ar-dod/
Vi tar en titt på Fords nya elbil Explorer,https://teknikensvarld.expressen.se/nyheter/bil-och-trafik/elbil-laddhybrid/ford-explorer-officiell-elbil-med-gener-fran-volkswagen/
Mammornas kamp när barnen fastnade i kriget,/nyheter/mammornas-kamp-for-barnen-som-blev-fast-i-kriget/
Hemliga paret som ligger bakom IsaDora,/nyheter/sa-byggde-ingrid-73-och-ingvar-78-ett-imperium/
Här kan ”normbrytande” hyresgäster vräkas,/nyheter/har-kan-normbrytande--hyresgaster-vrakas-/
Ryter ifrån om ”dom”: ”Mesta i livet är svårt”,/nyheter/ministern-ger-sig-in-i-dom-debatten-det-mesta-i-livet-ar-svart/
Man mördades 2021 – nu släpps fantombild,/nyheter/man-mordades-2021-nu-slapps-fantombild/
Taxiförarens beslut när kvinnan födde i bilen,/nyheter/taxiforarens-beslut-nar-kvinnan-fodde-i-bilen/
Systemet kan tvingas sälja vin i tappkranar,/nyheter/systembolaget-kan-tvingas-salja-vin-i-tappkranar/
Postnord får bakläxa om försenade brev,/nyheter/postnord-far-baklaxa-om-forsenade-brev/
Sveriges Radios sajt och app drabbade av störningar,/nyheter/sveriges-radios-webb-och-app-drabbade-av-storningar/
Ex-bankrånaren åtalad för jättelik momskupp,/nyheter/ex-bankranaren-atalad-for-jattelik-momskupp/
Wallströms Nato-kritik: ”Plågsam och genant”,/nyheter/wallstroms-nato-kritik-plagsam-och-genant/
Riksdagen har nu röstat ja till Nato,/nyheter/kangan-efter-billstroms-utspel-inte-aldras-sa-val/
Peter Hultqvist (S): ”Ändrat uppfattning”,/tv/nyheter/peter-hultqvist-s-efter-natoomrostningen-har-andrat-uppfattning-och-bestamt-mig/
"""Vill inte kalla det här gängkrig – det är terror""",/nyheter/vill-inte-kalla-det-har-gangkrig-det-ar-terror/
Oron i KD – hårda kritiken mot Busch,/nyheter/oron-inom-kd-small-for-partiet/
Buschs uppmaning till Ingerö innan anmälan,/nyheter/buschs-uppmaning-till--ingero-innan-anmalan/
Fyra brottsutredningar hänger över Trump,/tv/nyheter/har-ar-alla-utredningar-som-hanger-over-trump/
Nya detaljer om apornas sista tid i Furuviksparken,/nyheter/nya-detaljer-om-apornas-sista-tid-i-furuviksparken/
13-åring sköts av misstag – ville inte berätta i förhör,/nyheter/13-aring-skots-av-misstag-ville-inte-beratta-i-forhor/
Wagner ska släppa ”tusentals” soldater,/nyheter/wagner-ska-slappa-tusentals-soldater/
Nya bilden av kungen – är styrd av en elit,/nyheter/nya-bilden-av-kungen-ar-styrd-av-en-elit/
Hade förhållande med gängledare – sparkas,/nyheter/krim/hogsta-domstolen-sparkar-ut-nasta-gangsteradvokat/
Dibrani (S) räddade livet på drunknande bebis,https://www.expressen.se/tv/nyheter/adnan-dibrani-s-raddade-livet-pa-drunknande-bebis
Ryssland skickade jaktplan mot amerikanska bombare,https://www.expressen.se/tv/nyheter/ryssland-skickade-jaktplan-mot-amerikanska-bombare
Plötslig kollaps i rysk stats-tv – svimmar,/tv/nyheter/har-svimmar-mannen-i-rysk-stats-tv/
Fågelinfluensa på gård i Skåne – djur avlivas,/nyheter/fagelinfluensa-pa-gard-i-skane/
Experter: Fler banker kan kollapsa framöver,/nyheter/nagra-av-bankerna--kommer-blasa-omkull/
Chefsekonomen: ”Bostadsmarknaden ska ned betydligt mer i år”,/tv/ditv/nyheter/chefsekonomen-bostadsmarknaden-ska-ned-betydligt-mer-i-ar/
Misstänkt mynttjuv kan tvingas betala miljoner,/nyheter/misstankt-mynttjuv-kan--tvingas-betala-miljoner/
Varningen: ”Kan bli ett andra Bachmut”,/nyheter/varningen-kan-bli-ett-andra-bachmut/
”Det är fruktansvärt att höra faktiskt”,/tv/nyheter/reaktionen-efter-vdarnas-miljonregn-sinnessjukt-/
Konstiga stämningen i SVT – efter frågan om otrohet,https://www.expressen.se/tv/nyheter/konstiga-stamningen-i-svt-efter-fragan-om-otrohet
