Heading,URL
Här tystnar senatsledare igen – i 30 sekunder,/tv/nyheter/har-tystnar-senatsledare-igen-i-30-sekunder/
Amerikan fast i rysk straffkoloni: ”Får inte prata”,/tv/nyheter/amerikanen-inifran-ryska-skrackfangelset-far-inte-prata-/
Ministrarna överens: Isolerar Lukasjenka,/tv/nyheter/baltiska-draget-isolerar-lukasjenka-/
Filmar orkanen – då faller trädet,/tv/nyheter/filmar-orkanen-da-faller-tradet-over-hennes-hus/
Här öppnas 200 år gamla tidskapseln,/tv/nyheter/har-oppnas-200-ar-gamla-tidskapseln/
Drönarattacker förstörde ryska flyg,/tv/nyheter/flera-dronarattacker-mot-ryssland/
JUST NU: Minst 52 döda efter storbrand i Sydafrika,/nyheter/manga-doda-i-brand-i-johannesburg/
Flickan förgiftades med ättika – pappan ”oberörd”,/nyheter/flicka-forgiftades-med-attika-nya-upptackterna-i-fallet-/
Putins vapenvädjan i breven till diktatorn,/nyheter/putin-brevvaxlar-med-kim-jong-un-vadjar-om-vapen/
Sista hälsningen från Wagnerledaren,/tv/nyheter/wagnerledarens-sista-film-fran-afrika/
Kremls oro: Hemlighöll Prigozjins begravning,/nyheter/detaljerna-om-prigozjins-hemliga-begravning-/
Här slår polisen till mot männen efter biljakten,/tv/nyheter/efter-biljakten-har-slar-polisen-till-mot-mannen/
Passagerare svårt skadad efter biljakt,/nyheter/polisinsats-i-hornstull/
S-toppen: ”Jag var livrädd för att utmålas som rasist”,/nyheter/s-toppen-jag-var-livradd-for-att-utmalas-som-rasist/
Egor Putilov stämmer Säpo: Accepterar inte,/nyheter/forre-sd-tjanstemannen-egor-putilov-stammer-sapo/
Två explosioner på tio minuter i Göteborg,/nyheter/tva-explosioner-i-goteborg-pa-kort-tid/
Kristerssons kvällsskift: ”Ville se med egna ögon”,/nyheter/ulf-kristersson-foljde-med-polisen-ut-pa-jobb-ville-se-med-egna-ogon/
Motorväg spärrades av – misstänkt farligt föremål,/nyheter/misstankt-farligt-foremal-pa-e4-vagen-avstangd/
Nu ökar viltolyckorna – så undviker du dem,https://teknikensvarld.expressen.se/nyheter/bil-och-trafik/sa-undviker-du-hostens-viltolyckor/
Spionens storgräl – vill kunna krama frun,/nyheter/krim/spionen-peyman-kia-i-storgral-med-kriminalvarden-vill-kunna-krama-sin-hustru/
Bittes hämnd mot Jörn Donners otrohet,/nyheter/hamnden-mot-jorn-donner-kastade-askan-i-komposten-/
Karlatornet syns överallt: ”Hybris”,/nyheter/exklusiva-karlatornet--syns-overallt-hybris/
”Smash and grab”-kupp mot Åhléns-butik i natt,/nyheter/smash-and-grab-mot-butik-i-vallingby-centrum-/
Orkanen fällde jätteträd över guvernörens palats,/nyheter/orkanen-idalia-fallde-jatteek-over-guvernor-ron-desantis-bostad/
Filmar – då faller trädet över huset,/tv/nyheter/filmar-orkanen-da-faller-tradet-over-hennes-hus/
Explosion vid entrédörr till bostadshus i Nyköping,/nyheter/kraftig-explosion-i-nykoping/
Kraftig explosion vid dörr till bostad i Norsborg,/nyheter/kraftig-explosion-i-norsborg/
"William, 24, sparar 25 000 kronor – i månaden",/nyheter/william-24-sparar-upp-till-25-000-kronor-i-manaden/
”Blå supermåne” – det ovanliga fenomenet,/nyheter/sallsynta-fenomenet-i-kvall-syns-bla-supermane-pa-himlen-/
Se läsarnas bilder på nattens supermåne,/nyheter/chatta-om-supermanen-med-oss-jwxdp/
Pojkens meddelande i flaskan: ”Räddningsbåt”,/nyheter/david-52-hittade-flaskpost-i-malmo-/
Här blir senatsledaren tyst igen – i 30 sekunder,https://www.expressen.se/tv/nyheter/har-tystnar-senatsledare-igen-i-30-sekunder
Amerikan i ryska skräck- fängelset: ”Får inte prata”,https://www.expressen.se/tv/nyheter/amerikanen-inifran-ryska-skrackfangelset-far-inte-prata-
”Kommer alltid bära med sig händelsen”,/nyheter/brandmannen-tillbaka-efter-hissolyckan-fatt-allt-stod/
Valentina överlevde ryska robotattacken,/nyheter/valentina-70-overlevde-den-ryska-raketattacken-mot-kiev/
Äldre kvinnor hittade döda – misstänkt mord,/nyheter/uppgifter-misstankt-dubbelmord-i-kiruna/
Acne plockar bort ”Kurdiska räven”-ring,/nyheter/acne-plockar-bort-kurdiska-raven-ring-/
”Sverige kommer att bli en scen för terrorister”,/nyheter/s-koranbranningar-kan-vara-hets-mot-folkgrupp/
Polisens svar om kraven efter Mats Löfvings död,/nyheter/polisen-atgardar-brister-efter-lofvings-dod/
Kreml: Medvetet illdåd bakom Prigozjins död,/nyheter/kreml-medvetet-illdad-bakom-prigozjins-dod/
Väntat att nya varianten skulle hittas i Sverige,/nyheter/kronikorer/amina-manzoor/vantat-att-varianten-skulle-hittas-i-sverige/
Bekräftade fall av nya covidvarianten,/nyheter/nya-omikronvarianten-finns-nu-i-sverige/
Bilägarna förlorare när leasingbolagen sölar,https://teknikensvarld.expressen.se/nyheter/konsument/leasingbolag-sena-med-miljobilsbonus/
Expressens reporter väcktes av flyglarmet,/nyheter/laget/expressens-reporter-vacktes-av-flyglarmet/
Budskapet Ebba Busch har tatuerat in på armen,/nyheter/det-har-ebba-busch-tatuerat-in-pa-armen/
Tjörnhammar kan ta över efter omtalade tystnaden,https://www.expressen.se/tv/nyheter/efter-tystnaden-tjornhammar-kan-ta-over-norrtalje
Polisen vägrar svara om Mats Löfvings död,/nyheter/polisen-vagrar-svara-pa-fragor-om-mats-lofvings-dod-inspekteras/
17-årig pojke planerade mord på en elev – åtalas,/nyheter/17-arig-pojke-planerade-mord-pa-en-elev-atalas/
Polisen reagerar på video efter jättekaos,/nyheter/jattekaos-efter-derbyt-tumult-vid-bussar/
L och SD oense om anmälningsplikten,/nyheter/l-och-sd-oense-om-anmalningsplikten/
Misstänkt farligt föremål – stor avspärrning i Motala,/nyheter/misstankt-farligt-foremal-i-motala/
