Heading,URL
Detaljen som spär på rykten om Putins hälsa,/tv/nyheter/detaljen-som-sparr-pa-rykten-om-putins-halsa/
Paret avslöjas mitt i sexakten på flyget,/tv/nyheter/paret-avslojas-mitt-i-sexakten-pa-flyget/
Jätteplanet dundrar rakt mot berget: ”Herregud”,/tv/nyheter/jatteplanet-dundrar-rakt-mot-berget-herregud/
Här möts Putin och Kim – detaljen i handslaget,/tv/nyheter/putin-och-kim-mots-skakar-hand-i-40-sekunder/
Polisens kallblodiga ord – hånar offer i läckt samtal,/tv/nyheter/polisens-kallblodiga-ord-hanar-offer-i-lackt-samtal/
Analysen: ”Det är bråttom för Ryssland”,/tv/nyheter/analysen-det-ar-brattom-for-ryssland/
Här anländer Kim till Putin-mötet,/tv/nyheter/har-anlander-kim-till-putin-motet/
Vittnenas försök att rädda mannen,/nyheter/man-skjuten-i-centrala-stockholm-5xw7t/
Avslöjar paret mitt i vågade sexakten,https://www.expressen.se/tv/nyheter/paret-avslojas-mitt-i-sexakten-pa-flyget/
Jätteplanet dundrar rakt mot berget: ”Herregud”,/tv/nyheter/jatteplanet-dundrar-rakt-mot-berget-herregud/
”Kurdiska rävens” mamma efterlyst,/nyheter/kurdiska-raven-rawa-majids-mamma-efterlyst/
Sjojgus uppgivna svar på fråga om krigsvinst,/tv/nyheter/sjojgus-fragas-om-krigsvinst-uppgivna-svaret-/
Fruktad myra upptäckt i Italien – kan spridas,/nyheter/fruktad-myra-upptackt-i-italien-kan-spridas/
Nya eldrivna suven kan köra 70 mil per laddning,https://teknikensvarld.expressen.se/nyheter/bil-och-trafik/elbil-laddhybrid/nya-peugeot-e-3008-officiell-70-mils-rackvidd/
Leijonborg efter orden i SVT: ”Blev inte ledsen”,/nyheter/leijonborg-efter-svts-kommentar-inte-ledsen/
Plastpåsemissen: ”Kommer inte ihåg”,/nyheter/pehrsons-plastpasmiss-under-debatten/
Infekterad konflikt stör prestigebygget,/nyheter/infekterad-konflikt--stor-prestigebygget-/
Plastpåseskatten tas bort – nya beskedet,/nyheter/plastpaseskatten-tas-bort-helt/
S-ministrarnas liv med miljonfallskärmar,/nyheter/s-ministrarnas-nya-liv--far-miljoner-i-avgangsvederlag/
Mammorna begraver sina döda i sanden,/nyheter/har-tvingas-mammorna-begrava-sina-barn-i-sanden/
Mordpatrullens panik av brevmissen i häktet,/nyheter/mordpatrullens-panik-efter-brevmissen-i-haktet/
Sverige tar in 48 pjäser för precisionsattacker,/nyheter/sverige-tar-in-48-pjaser-for-precisionsattacker/
Uppmaningen till Biden: Ställ inte upp till omval,/nyheter/uppmaningen-till-biden-stall-inte-upp-till-omval/
Misstänks ha mördat Maddie – desperata bönen till vänner,/nyheter/misstanks-ha-mordat-maddie-desperata-bonen-till-vanner/
Detaljen som spär på rykten om Putins hälsa,/tv/nyheter/detaljen-som-sparr-pa-rykten-om-putins-halsa/
Kims fjäsk för Putin: ”Stöttar alla beslut”,/nyheter/nordkoreas-flagga-hissad-pa-rymdbas-i-ryssland/
T-banan stängs mellan Slussen och Gamla stan,/nyheter/sl-stanger-av-tunnelbanan-mellan-slussen-och-gamla-stan/
Ryska påståendet: Förstört flera ukrainska drönare,/nyheter/ryska-pastaendet-forstort-flera-ukrainska-dronare/
Veronica tvingades avliva sina grisar: ”En tung dag”,/nyheter/veronica-tvingades-avliva-sina-grisar-tung-dag/
C-förslag till drabbade: Snabba utbetalningar,/nyheter/centerns-krav-snabba--utbetalningar-till-drabbade/
Nya draget i jakten på smittade vildsvin,/nyheter/statsepizootologen-borjar-nu-testa-utanfor-avsparrningarna/
Ny skottlossning: ”Blev väckt av mamma i panik”,/nyheter/skottlossning-i-uppsala-rxp6h/
Ulf Kristerssons svar om ”Kurdiska räven”,/nyheter/kristerssons-svar-pa-kritiken-om-kurdiska-raven/
Politikern hade sex online – bad följarna om ”dricks”,/nyheter/politikern-susanna-gibson-hade-sex-online-bad-foljarna-om-dricks/
Polisens kallblodiga ord – hånar offer i läckt samtal,https://www.expressen.se/tv/nyheter/polisens-kallblodiga-ord-hanar-offer-i-lackt-samtal
Kör om Sverige – tack vare bantningsmedicin,/nyheter/gar-om-sverige-tack-vare-bantningspillren/
"S, V och MP i utspel om koranbränningarna",/nyheter/s-v-och-mp-i-gemensamt-utspel-mot-ulf-kristersson/
Ebba Busch backar från utspel om strypt bistånd,/nyheter/ebba-busch-backar-fran-utspelet-om-strypt-bistand/
Slängde ut sin vän i snön – åtalas för hennes död,/nyheter/kvinna-slangde-ut-sin-van-atalas-for-hennes-dod/
"Mogos Amanuel, 25, sköts till döds",/nyheter/krim/mogos-amanuel-tesfemariam-25-skots-till-dods-i-uppsala/
”Nått en omfattning vi inte sett tidigare”,/nyheter/polis-om-grova-valdet-i-uppsala--en-omfattning-vi-inte-sett-tidigare/
Martin Melins miss på öppningen: ”Olämpligt”,/nyheter/martin-melin-brot-mot-kladkoden-pa-riksmotets-oppnande/
Bushs chock – blev serverad av Prigozjin: ”Jag överlevde”,/nyheter/george-w-bush-serverades-av-prigozjin-jag-overlevde/
Kristerssons krav på Iran: Frige Floderus,/nyheter/sveriges-krav-pa-iran-floderus-maste-friges/
