Heading,URL
Ryska jättebranden nådde krutfabrik: ”Apokalyptiskt”,/tv/nyheter/ryska-jattebranden-nadde-krutfabrik-apokalyptiskt-/
Vilda teorin om Meghan – påstås ha förklätt sig,/tv/nyheter/vilda-teorin-om-meghan-pastas-ha-forklatt-sig/
Här intar trupperna svenska skärgårdsön,/tv/nyheter/har-intar-trupperna-svenska-skargardson/
Hjälteinsatsen – räddar alla från sjunkande båten,/tv/nyheter/hjalteinsatsen-raddar-alla-fran-sjunkande-baten/
"Dramatiska sekunder när
planet störtar mot marken",/tv/nyheter/dramatiska-sekunder-nar-planet-stortar-mot-marken/
Trots alla spekulationer: ”Inga tecken på offensiv”,/tv/nyheter/inga-tecken-pa-nagon-storre-ukrainsk-motoffensiv/
JUST NU: Man anhållen efter dödsskjutning,/nyheter/larm-om-skjutning-i-jakobsberg/
Spekulationerna om Putin inför paraden,/nyheter/teorin-dubbelgangare-tar-putins-plats-pa-roda-torget/
Ryska taktiken – för att locka migranter,/nyheter/ryska-taktiken-for-att--locka-migranter-till-kriget/
Smyganfall på ryska trupper från Belarus,/tv/nyheter/belarusiska-terrorbataljonens-smyganfall-pa-ryska-trupperna/
Oväntade förklaringen friade ”Rävens” mamma,/nyheter/ovantade-forklaringen--friade-ravens-mamma/
”Skamlös vinhora” ger SD-ledaren svar på tal,/nyheter/miss-shameless-svar-efter-akessons-kritik/
Hjälteinsatsen – när båten sjunker,/tv/nyheter/hjalteinsatsen-raddar-alla-fran-sjunkande-baten/
Förklaringen bakom Margrethes nobb,/nyheter/forklaringen-bakom--margrethes-nobb/
Marinchefen: Vi behöver växa – krävs mer pengar,/nyheter/har-ovar-svenska-soldater-strid-med-brittiska-marinkaren/
Här intar trupperna svenska skärgårdsön,/tv/nyheter/har-intar-trupperna-svenska-skargardson/
24-årig polis kom hem från jobbet – sköts ihjäl,/nyheter/24-arig-polis-kom-hem-fran-jobbet-skots-ihjal/
Kremls plan: Falska protester mot Erdogan,/nyheter/kremls-hemliga-plan-falska-protester-mot-erdogan-och-turkiet/
Misstanken: Här brände mördaren pengarna,/nyheter/krim/15-aringen-mordade-for-100-000-och-brande-mordpengarna-pa-nk/
”13-åring” döms för upplopp och skott,/nyheter/krim/13-arig-pojke-doms-for--paskupplopp-och-skjutning/
Anklagas för att ha bränt koran – nu har de hängts,/nyheter/anklagas-for-att-ha-brant-koran-nu-har-de-hangts/
Märkliga klimateffekten – grodorna kväker högre,/nyheter/markliga-klimateffekten-grodorna-kvaker-hogre/
Melissa hittad av familjen – 50 år efter kidnappning,/nyheter/melissa-hittad-av-familjen-50-ar-efter-kidnappning/
Sjuksköterska misstänkt 20 mord: ”Hjälpte dem”,/nyheter/sjukskoterska-i-nederlanderna-misstanks-for-mer-an-20-mord/
Musks besked: Twitter rensar bort gamla konton,/nyheter/musks-besked-twitter-rensar-bort-gamla-konton/
Spår av ”gömda planeter” upptäckta kring stjärnan,/nyheter/spar-av-gomda-planeter-upptackta-kring-stjarnan/
Interna mejl: SD vill se över GD:n på SiS,/nyheter/interna-mejl-sd-vill-se-over-gdn-pa-sis/
Ryska jättebranden nådde krutfabrik: ”Apokalyptiskt”,https://www.expressen.se/tv/nyheter/ryska-jattebranden-nadde-krutfabrik-apokalyptiskt-/
Åtta ihjälkörda – han satt bakom ratten,/nyheter/atta-doda-i-brownsville-han-satt-bakom-ratten/
Texasskytt utreds för möjligt hatbrott,/nyheter/texasskytt-utreds--for-mojligt-hatbrott/
Polisens fantombild: Har du sett den här mannen?,/nyheter/polisens-fantombild-har-du-sett-den-har-mannen/
Kvinnan stalkade sitt ex – hällde fiskkött i brevlåda,/nyheter/kvinnan-stalkade-sitt-ex-hallde-fiskkott-i-brevlada/
Extremhetta i april – flera rekord krossade,/nyheter/klimat/varmaste-dagen-uppmatt-i-flera-lander-nagonsin/
Man död efter bett från orm: ”Oerhört sällsynt”,/nyheter/man-dod-efter-ormbett-i-tanum-oerhort-sallsynt/
16-åring oigenkännlig efter Tiktok-utmaning,/nyheter/16-aring-brand-over-hela-kroppen-efter-tiktok-utmaning/
Uppgifter: Taxi tillhör bekant till mordoffret,/nyheter/krim/uppgifter-taxi-tillhor-bekant-till-mordoffret/
26-åring trodde kvinna var agent – attackerade,/nyheter/man-atalas-for-mordet-i-baronbackarna/
"Maja Hellman, 18, överklagar domen",/nyheter/maja-hellman-18-overklagar-domen/
Bröt sig in och tände eld hos Wallenberg,/nyheter/23-aring-doms-for-mordbrand-8gwrp/
Explosion vid port: ”Small så det ekade”,/nyheter/larm-om-explosion-small-till-sa-det-ekade/
Jessicas läppförstoring gick fel – läpparna blev enorma,https://www.expressen.se/tv/nyheter/jessicas-lappforstoring-gick-fel-lapparna-blev-enorma
Presidentkandidaten: CIA mördade Kennedy,/nyheter/presidentkandidaten-cia-mordade-kennedy/
Missen: Polisen topsade inte utpekade mördaren,/nyheter/missen-maries-mordare-kunde-ha-hittats-i-tid/
Hotellgäst vaknade av att portiern sög på hans tår,/nyheter/hotellgast-vaknade-av-att-portiern-sog-pa-hans-tar/
Jättebrand i Moskva mitt i Putins förberedelser,https://www.expressen.se/tv/nyheter/jattebrand-i-moskva-mitt-i-putins-forberedelser/
Skräcken inför Putins svar: ”Har inget val”,/nyheter/skracken-infor-putins-svar-har-inget-val/
