Heading,URL
Fotbollslagets panik – tappar kontrollen över lyxbilen,/tv/nyheter/fotbollslagets-panik-tappar-kontrollen-over-lyxbilen-/
Hemlig detalj tros avslöja Putins bluff,/tv/nyheter/markliga-agerandet-tros-ha-avslojat-putins-bluff/
Tas på bär gärning – tar till det drastiska,/tv/nyheter/tas-pa-bar-garning-tar-till-det-drastiska/
Gigantiskt eldhav när de tankar bilen,/tv/nyheter/gigantiskt-eldhav-nar-de-tankar-bilen-/
Prigozjins död har stärkt Putins position i Ryssland,/tv/nyheter/kriget-i-ukraina-kan-paga-manga-ar-till/
Hästen bryter sig loss – läraren gör det otänkbara,/tv/nyheter/skandalbilder-pa-lararen-sparkar-och-slar-ponnyn-i-huvudet/
Brandmännens chock när de ser det som visar sig i lågorna,/tv/nyheter/brandmannens-chock-nar-eldtornadon-visar-sig-/
JUST NU: En död i attacker mot Cherson,/nyheter/en-dod-i-attacker-mot-cherson/
Kända piloten ”Juice” död – Zelenskyjs sorg,/nyheter/kanda-piloten-juice-dod-zelenskyjs-sorg/
Ryska soldatens chock – hamnar i fel skyttevärn,/tv/nyheter/ryska-soldatens-chock-hamnar-i-fel-skyttevarn/
Stormy Daniels viktpik: ”Själv är jag oskuld”,/nyheter/klirr-i-kassan-for-trump-efter-historiska-bilden/
Sekunden senare dyker hon in hos alligatorerna,/tv/nyheter/slanger-sig-rakt-in-borjar-brottas-med-alligatorerna/
Experterna om Putins nya strategi i kriget,/nyheter/experterna-om-putins--nya-strategi-i-kriget-/
Iranska hotet mot USA:s krigsskepp,https://www.expressen.se/tv/nyheter/amerikanska-krigsskeppet-svarmas-av-iranska-dronarna
Soldaten som sköt ihjäl bin Ladin gripen,/nyheter/han-dodade-usama-bin-ladin-har-gripits-av-polis/
Han ska bli den förste att avrättas med kväve,/nyheter/han-ska-bli-den-forste-att-avrattas-med-kvave/
Fyra döda i skjutning – skytt tog sig in i butik,/nyheter/fyra-doda-efter-skjutning-i-florida/
Dödade pojkvännen och hans vän i en bilkrasch,/nyheter/dodade-pojkvannen-och-hans-van-i-bilkrasch/
Här säljs cannabis vid Lollo och Bernie,/nyheter/har-saljs-cannabis-vid-lollo-och-bernie/
Larmet om mamman före misstänkta mordet,/nyheter/larmet-om-mamman-fore-misstanka-mordet-pa-stena-line-/
Sekunden senare dyker hon in hos alligatorerna,https://www.expressen.se/tv/nyheter/slanger-sig-rakt-in-borjar-brottas-med-alligatorerna
Lagets panik – tappar kontrollen över lyxbil,/tv/nyheter/fotbollslagets-panik-tappar-kontrollen-over-lyxbilen-/
Tas på bär gärning – tar till det drastiska,https://www.expressen.se/tv/nyheter/tas-pa-bar-garning-tar-till-det-drastiska/
Beskjutna lägenheten kopplad till tidigare mord,/nyheter/krim/beskjutna-lagenheten--kopplad-till-tidigare-mord/
Bedragen i 40 år – Bittes hämnd mot Jörn Donner,/nyheter/hamnden-mot-jorn-donner-kastade-askan-i-komposten-/
Claire gick ut med hunden och försvann – nu har kropp hittats,/nyheter/claire-gick-ut-med-hunden-och-forsvann-nu-har-kropp-hittats/
Meteorologens larm under helgen: Skyfall,/nyheter/meteorologens-varning-infor-helgens-skyfall/
Gigantiskt eldhav när de tankar bilen,https://www.expressen.se/tv/nyheter/gigantiskt-eldhav-nar-de-tankar-bilen-/
Vännerna firade att skolan var slut – dog i bilolycka,/nyheter/vannerna-firade-att-skolan-var-slut-dog-i-bilolycka/
Fem skjutna – en död i Köpenhamn,/nyheter/skjutning-i-christiania-flera-traffade/
Jomshof om kritiken: ”Diskuterat internt”,/nyheter/jomshof-om-kritiken-diskuterat-internt/
Man fick flera sparkar mot huvudet vid krog,/nyheter/man-fick-flera-sparkar-mot-huvudet-vid-krog/
”Sveriges bästa” nummer säljs på auktion: ”Enkelt”,/nyheter/sveriges-basta-telefonnummer-auktioneras-ut/
Teori bakom attacken: Strypa Putins hållhake,/nyheter/uppgifter-ukraina-bakom-sabotaget--mot-nord-stream/
Ryska faktafelet – i angrepp mot Sverige,/nyheter/zacharovas-faktafel-i-angreppet-mot-sverige/
Två gripna efter skogsbränderna,/nyheter/grekland-tva-gripna-efter-skogsbrander/
Jätteblunder avslöjar turisternas tabutilltag,https://www.expressen.se/tv/nyheter/turisternas-tabutilltag-mitt-i-kanda-kulturlandmarket
Rispriset skenar – slår mot världens fattigaste,/nyheter/rispriset-skenar-slar-mot-varldens-fattigaste/
Dadgostar: Beskatta bankernas övervinster,/nyheter/v-beskatta-bankernas-overvinster/
Hästen bröt sig loss – hon gör det otänkbara,https://www.expressen.se/tv/nyheter/skandalbilder-pa-lararen-sparkar-och-slar-ponnyn-i-huvudet
Åkesson om nästa val: Regering eller opposition,/nyheter/akesson-farligt-att-vilja-forbjuda-koranbranningar/
Synar Trumps ”viktnedgång”,/nyheter/donald-trump-overlamnar-sig-till-ratten-i-georgia/
Säljer kaffemuggar med Trumps ”mugshot”-bild,/tv/nyheter/saljer-kaffekopp-och-t-shirt-med-trumps-mugshot-bild/
Åklagarens plan: Hålla rättegången i oktober,/nyheter/aklagarens-plan-rattegang-mot-trump-redan-i-oktober/
Ivanka Trumps liv på privata ön,/nyheter/detaljerna-kring-ivanka-trumps-nya-lyxhus-ritningarna-inifran/
Så har världens bild av Sverige förändrats,/nyheter/sa-har-bilden-av-sverige-forandrats-islamfientligt/
Ilska mot flygpersonal efter livsfarliga draget,https://www.expressen.se/tv/nyheter/masskritiken-mot-flygpersonalen-efter-livsfarliga-draget
"Ingvar, 82, bets av björnen – två gånger",/nyheter/ingvar-82-bets-av-bjornen-tva-ganger/
Person död efter brand i lägenhet,/nyheter/person-dod-efter-lagenhetsbrand-cc3gl/
Kvinna räddad efter natt i svampskogen,/nyheter/stor-raddningsinsats-efter-forsvunnen-kvinna/
Rapporten: Detaljerna bakom nya bombteorin,/nyheter/detaljerna-bakom-bombteorin-pa-wagnerplanet/
Polis jagar misstänkt våldtäktsman med hund,/nyheter/utreder-overfallsvaldtakt-i-helsingborg/
Thornbergs svar efter Kjöllers kritik,/nyheter/thornbergs-svar-efter-hanne-kjollers-kritik/
Spionen i storgräl – vill kunna krama sin hustru,/nyheter/krim/spionen-peyman-kia-i-storgral-med-kriminalvarden-vill-kunna-krama-sin-hustru/
Chocken när de ser det omöjliga i lågorna,/tv/nyheter/brandmannens-chock-nar-eldtornadon-visar-sig-/
Parets lycka: Tvillingarna kom på deras födelsedag,/nyheter/paret-fick-tvillingar-pa-sin-fodelsedag/
Demiroks svar efter kritiserade Cuf-filmen,/nyheter/demiroks-svar-efter-kritiserade-cuf-filmen/
”Hunden räddade livet på jägaren”,/nyheter/tva-nya-bjornattacker-/
Rekordstora jakten riskerar öka farorna,/nyheter/rekordstora-bjornjakten-kan-oka-farorna/
