Heading,URL
Kvinnan antastar vakten i Stockholms t-bana: ”Obehagligt”,/tv/nyheter/kvinnan-antastar-vakten-i-stockholms-t-bana-obehagligt/
Hamas attack till havs – skjuts ihjäl i vattnet,/tv/nyheter/hamas-attack-till-havs-skjuts-ihjal-i-vattnet/
Fräcka jeansligan – stal byxor för 130 000 kr,/tv/nyheter/fracka-jeansligan-stal-byxor-for-130-000-kr/
Smygattack med drönare – slår ut pansarfordonet,/tv/nyheter/smygattack-med-dronare-slar-ut-pansarfordonet/
Märkliga beslaget på flygplatsen – 10 000 rävsvansar,/tv/nyheter/markliga-beslaget-pa-flygplatsen-10-000-ravsvansar/
Enorma krigsfartyget går in i svenska hamnen,/tv/nyheter/enorma-krigsfartyget-gar-in-i-svenska-hamnen/
JUST NU: 5 000 kvadrat brinner,/nyheter/storbrand-soder-om-stockholm-efdcx/
JUST NU: Skott mot två kvinnor i radhus,/nyheter/skott-mot-bostad-norr-om-stockholm-pa9ue/
Pourmokhtari: Då packar jag väskan,/nyheter/pourmokhtari-vill-att-sd-sager-ja-till-min-klimatplan/
Sista livstecknet från Liri – fördes till Gaza av Hamas,/nyheter/sista-livstecknet-fran-liri-fordes-till-gaza-av-hamas/
Ambulansen skakas om av explosionen,/tv/nyheter/ambulansen-skakas-om-av-explosionen/
”Soldater och civila – alla är våra fiender”,/nyheter/tidigare-hamas-ledaren-soldater-och-civila-alla-ar-vara-fiender/
Skämdes för lukten – insåg inte faran,/nyheter/skamdes-for-lukten-i-sitt-sovrum-insag-inte-faran/
Märkliga beslaget: Tusentals rävsvansar,/tv/nyheter/markliga-beslaget-pa-flygplatsen-10-000-ravsvansar/
Därför lever prinsessan Birgitta ensam på Mallis,/nyheter/sanningen-om-separationen-fran-maken-darfor-lever-prinsessan-birgitta-ensam-pa-mallorca/
Ukrainska staden larmar: Attackerar med allt de har,/nyheter/ukrainska-staden-larmar-attackerar-med-allt-de-har/
Hans Volvo V70 fick oväntat körförbud,https://teknikensvarld.expressen.se/nyheter/konsument/korforbud-pa-volvo-trots-plomberade-gastankar/
"Felicia, 25, ligger i koma i Thailand – familjens kamp",/nyheter/felicia-25-ligger-i-koma-i--thailand-familjens-kamp/
Svensk societetsman slog ut chaufförs tänder,/nyheter/svensk-societetsman-slog--ut-taxichauffors-tander/
Rymde från HVB-hem – mördade två kvinnor,/nyheter/rymde-fran-hvb-hem-misstankt-for-dubbelmord/
Två anhållna efter mordet i Västberga,/nyheter/krim/tva-anhallna-efter--mordet-i-vastberga/
”Leken” för att barnen inte ska se de mördade,/nyheter/krim/valdsvagen-stegrar-mord-och-terror-mot-barnfamiljer/
Rawa Majids hemliga bas – livet på flykt,/nyheter/krim/rawa-majids-hemliga-bas-vid-tiden-for-gripandet/
Jimmie Åkesson vill riva medborgarskap,/nyheter/jimmie-akesson-ingen-annan--losning-an-att-riva-medborgarskap/
Kvinnan antastar vakten i Stockholms tunnelbana,https://www.expressen.se/tv/nyheter/kvinnan-antastar-vakten-i-stockholms-t-bana-obehagligt
Skott mot lägenhet – mordförsök i Malmö,/nyheter/skott-mot-lagenhet-mordforsok-i-malmo/
Nazister dök upp på demonstration för Gaza,/nyheter/nazister-dok-upp-pa--demonstration-for-gaza/
Barnmördarnas vänskap i fängelset: ”Oskiljaktiga”,/nyheter/barnmordarnas-vanskap-i-fangelset-oskiljaktiga/
"Eric, 34, hyllas – lär sina döttrar veta sitt värde",/nyheter/pappan-hyllas-lar-sina-dottrar-veta-sitt-varde/
Hamas hemliga plan – dokumenten visar,/nyheter/sa-planerade-hamas-attacken-hemliga-kartan/
Skottskadad man hittad utomhus – stor insats,/nyheter/skottskadad-man-hittad-i-karlskrona/
Dubbla varningar – här slår busvädret,/nyheter/dubbla-varningarna-har-kommer-busvadret/
”Vaktade” parkering – fick foten överkörd,/nyheter/brak-om-p-plats-vid-ullared/
Tusentals soldater ska patrullera franska gator,/nyheter/tusentals-soldater-pa-franska-gator/
Kristersson: ”En slags importerad antisemitism”,/nyheter/kristersson-en-slags-importerad-antisemitism/
Ryska affärsmannens underjordiska verkstad,/nyheter/rysk-affarsman-bygger-hus-med-underjordisk-verkstad-vid-muskobasen/
Franskläraren Dominique mördad – misstänkt terror,/nyheter/fransklararen-dominique-bernard-dog-i-knivdadet/
Judiska Sharon tvingades söka skydd – i Stockholm,/nyheter/judiska-sharon-26-tvingades--ta-skydd-i-stockholm/
Märkliga beslaget: 10 000 rävsvansar,https://www.expressen.se/tv/nyheter/markliga-beslaget-pa-flygplatsen-10-000-ravsvansar/
Paret tog en sista bild – trodde de skulle dödas,/nyheter/paret-tog-en-sista-bild-trodde-de-skulle-dodas-av-hamas--/
Volvo visar effektiva Supertruck 2,https://teknikensvarld.expressen.se/nyheter/bil-och-trafik/volvo-visar-effektiva-supertruck-2/
Vapenman gick från bar till bar – hotade,/nyheter/pistolman-hotade-flera-barer-i-goteborg/
Säger nej till erkännande av urfolk,/nyheter/australien-nej-till-erkannande-av-urfolk/
Höbalsattack mot kommunhus: ”Udda”,/nyheter/hobalsattack-mot-kommunhus-lite-udda/
Kristerssons ledarskap ifrågasätts internt: ”Unikt”,/nyheter/kristerssons-ledarskap-ifragasatts-internt-unikt/
