Heading,URL
Drama i Kosovo – tre män och en polis dödade,/tv/nyheter/drama-i-kosovo-tre-man-och-en-polis-dodade/
Infernot efter ryska soldaternas misstag,/tv/nyheter/ryska-stridsvagnen-tittar-fram-da-gar-allt-fel/
Stora brittiska protester efter förbudet mot ökända hundrasen,/tv/nyheter/stora-brittiska-protester-efter-forbudet-mot-okanda-hundrasen/
Skräckhem avslöjat: Råttor åt på bebisen,/tv/nyheter/skrackhem-avslojat-rattor-at-pa-bebisen/
Hotet mot Ukraina: ”Kan bli stort hinder”,/nyheter/hotet-mot-ukraina-kan-bli-stort-hinder/
Ny rysk luftattack mot Odessas hamn,/nyheter/ryskt-luftangrepp-mot-odessa/
Ukrainska blixtdraget efter ryskt smyganfall,/tv/nyheter/dramatiska-vandningen-mitt-under-raddningsinsatsen/
Uppgifter: Rawa Majid får skydd av polischef,/nyheter/uppgifter-kurdiska-raven-skyddas-av-turkisk-polischef/
Mammans egna ord om ”Kurdiska räven”,/nyheter/mammans-egna-ord-om-kurdiska-raven-det-gick-jattebra-tills-han-blev-18/
Här är männen som vill leda Miljöpartiet,/nyheter/har-ar-mannen-som--vill-leda-miljopartiet/
Jagas av polisen – kör över sin mamma,https://www.expressen.se/tv/nyheter/jagas-av-polisen-kor-over-sin-mamma
Ismail Abdos vädjan till Morgan Johansson,/nyheter/ismail-abdo-ville-slippa-fangelse-sen--attackerade-han-fange/
Hyr bostäder på Airbnb – för att begå mord,/nyheter/gangen-hyr-bostader-pa-airbnb--for-att-bega-mord/
Små barn försvann – hittades efter dagar,/nyheter/tva-smabarn-forsvann-har-hittats-efter-fem-dagar/
Passagerare fick 16 000 för fisar under flygningen,/nyheter/passagerare-fick-16-000-for-fisar-under-flygningen/
"Erik, 71, sköts ihjäl på puben – var inte målet",/nyheter/erik-71-skots-ihjal-pa-puben/
Samtalet till pubens ägare: ”Det skjuts”,/nyheter/pubagaren-vi-kanske-reser-oss-igen/
Kinas flytande barriär – larmet från grannen,/nyheter/larmet-om-kina-har-satt-in-flytande-barriar/
Nya teorin: De lurades att åka med ubåten,/nyheter/nya-misstankar-om-titanic-ubatens--implosion-de-lurades-ombord/
Här shoppar pojken efter mordet i Skogås,/nyheter/polisen-misstanker-har-shoppar-misstankte-mordaren-pa-nk-efter-att-ha-skjutit-15-aring-i-huvudet/
Stående ovation för nazist i parlamentet,/nyheter/staende-ovation-for-nazist-i-kanadensiska-parlamentet/
Nasakapseln störtade i öknen – kan avslöja rymdhemligheter,/tv/nyheter/rymdkapseln-landar-efter-sju-ar-i-rymden-/
Företagets svar om schaktningar vid E6,/nyheter/foretagets-svar-om-schaktningarna-vid-e6/
E6 slets sönder – massiva sprickan,/nyheter/nya-bilderna--efter-skredet/
,/nyheter/kartan-visar-sa-kan-du-kora-efter-raset-pa-e6/
Brand i turistbuss – totalstopp på E4,/nyheter/brand-i-turistbuss-pa-e4-vagen-avstangd/
Kaosscener i Paris – polisen drar vapen,https://www.expressen.se/tv/nyheter/kaosscener-i-paris-polisen-drar-vapen/
Misstänks för mord – skrev ”tog hand om alltihop” i mejl,/nyheter/misstanks-for-mord-skrev-tog-hand-om-alltihop-i-mejl/
Drama i Kosovo – tre män och en polis dödade,/tv/nyheter/drama-i-kosovo-tre-man-och-en-polis-dodade/
Skottlossning i Rinkeby: ”Skjutit genom dörren”,/nyheter/polisinsats-i-rinkeby/
Svindyra räkmackan snart ett minne blott,/nyheter/beslutet-infor-pristak--for-dyra-flygplatsmaten/
Ökänd maffialedare död – mördade 12-årig pojke,/nyheter/italiensk-maffialedare-dod/
"Svenska Malte, 5, har 900 000 följare på Tiktok",/nyheter/malte-5-har-over-900-000-foljare-pa-tiktok/
Wagneravhoppare släppt av norsk polis,/nyheter/wagneravhoppare-slappt-av-norsk-polis/
Fick p-bot på halv miljon efter tvist med bilverkstad,/nyheter/fick-p-bot-pa-halv-miljon-efter-tvist-med-bilverkstad/
Sitter fast under bron – 230 meter upp i luften,https://www.expressen.se/tv/nyheter/sitter-fast-under-bron-230-meter-upp-i-luften/
Man gripen – misstänkt mordförsök i Halmstad,/nyheter/man-gripen-misstankt-mordforsok-i-halmstad/
Mc-förare död efter viltolycka i Forsvik,/nyheter/mc-forare-dod-efter-krock-med-alg/
Snyggast bilar gör Volvo – slår svenskarna fast,https://teknikensvarld.expressen.se/nyheter/ovrigt/volvo-ar-snyggast-enligt-svenskarna/
Ökända rasen bet Lina: ”Vill fortfarande ha en”,/nyheter/amerikansk-bully-bet-lina--jag-vill-fortfarande-ha-en/
Brittiska protester mot förbudet,/tv/nyheter/stora-brittiska-protester-efter-forbudet-mot-okanda-hundrasen/
Blev attackerade – vill förbjuda hundrasen,/nyheter/attackerades-nu-vill-de-forbjuda-rasen-i-sverige/
Irans krav på Sverige – mötet med Billström,/nyheter/irans-tva-krav-pa-sverige/
Se de mystiska klippen på de oidentifierade objekten,https://www.expressen.se/tv/nyheter/se-de-mystiska-klippen-pa-oidentifierade-objekten/
Rymdkapsel landar i öken – efter sju år,/nyheter/nasa-redo-for-rymdkapselns-hemkomst/
Intern kritikstorm mot nya gröna M-strategin,/nyheter/kritikstorm-mot-nya-m-strategin-for-vindkraft/
Skottlossning mot lägenhet i Uppsala,/nyheter/skottlossning-mot-lagenhet-i-uppsala-f5ren/
"Sabrina, 41, hittad död i alligatorns mun: ”Sorg”",/nyheter/sabrina-41-dodad-i-valdsam-alligatorattack/
Låste upp kvinnas hem med försvunnen nyckel,/nyheter/laste-upp-kvinnas-hem-med-forsvunnen-nyckel/
