Heading,URL
Ryska fiaskot fångat på film – nu har videon läckt,/tv/nyheter/ryska-fiaskot-fangat-pa-film-nu-har-videon-lackt/
Efter vägglusutbrottet – skadedjursexpertens tips,/tv/nyheter/efter-vagglusutbrottet-skadedjursexpertens-tips-/
Blixten slår ner – då lyser himlen upp: Apokalyptiskt,/tv/nyheter/blixten-slar-ner-da-lyser-himlen-upp-apokalyptiskt/
Turistens chock efter apans olämpliga drag,/tv/nyheter/turistens-chock-nar-apan-gor-det-forbjudna/
”Nu kan vi se saker som rör sig otroligt snabbt”,/tv/nyheter/nu-kan-vi-se-saker-som-ror-sig-otroligt-snabbt/
Trumps galna ord: ”Räkna med att skjutas”,/tv/nyheter/trumps-galna-utspel-rakna-med-att-skjutas/
Erodgans hot mot EU: “Byta ut Köpenhamn”,/tv/nyheter/erdogans-kopehamnshot-infor-eu-rattvisa/
Flera skott mot radhus i Uppsala,/nyheter/skott-mot--radhus-i-uppsala/
Kapten och 55 man dog i ubåtsolyckan,/nyheter/kaptenen-och-hans-55-mannar-dog-pa-ubaten/
Iransk flicka i koma – moralpolisen pekas ut,/nyheter/iransk-flicka-i-koma-moralpolisen-anklagas/
Rysslands ilska efter bluffdraget mot Putin,/tv/nyheter/ukrainska-skamtet-ringer-upp-ryska-armen/
Så undviker du att gå helt tomhänt från SAS,/nyheter/folkaktien-sas-ar-dod-tipsen-till-smaspararna/
Oron: Eurobonus tappar sitt värde,/nyheter/det-hander-med-dina-eurobonus-poang/
Kamera avslöjar budet – allas stora mardröm,https://www.expressen.se/tv/nyheter/har-kastar-chaufforen-matleveransen-in-i-vaggen
Talmannen avsätts – han vill ta över,/nyheter/representanthuset-rostar-bort-mccarthy/
Hände för tredje gången – föräldrarnas chock,/nyheter/hande-for-tredje-gangen-foraldrarnas-chock/
Donald Trump drabbad av dubbla bakslag,/nyheter/donald-trumps-dubbla-bakslag/
Viktigaste punkterna i nya Tove-rättegången,/nyheter/krim/domare-i-toverattegangen-anmals-for-jav/
Lundintopparnas liv i lyx under rättegången,/nyheter/lundin-oil-topparnas-liv-under-rattegangen-deras-hakte-ar-grand-hotel/
Barn i dödskraschen – turister på bussen,/nyheter/bussolycka-i-italien-minst-20-doda/
Buss föll tio meter: ”Apokalyptisk scen”,/tv/nyheter/minst-21-doda-i-italien-buss-foll-tio-meter/
Flera skjutna vid skola i USA – uppmaningen,/nyheter/flera-skjutna-vid-skola-i-usa/
Högg ihjäl maken – sedan fortsatte hon med middagen,/nyheter/hogg-ihjal-maken-sedan-fortsatte-hon-med-middagen/
"""Vi förnedrades av våra flickvänner""",/nyheter/micke-pontus-och-jonas-blev-fornedrade-av-sina-flickvanner/
Rapparens tillhåll på idrottsplatsen,/nyheter/fore-mordet-rapparens-tillhall-pa-idrottsplatsen/
Segelbåten var i Sverige före sabotaget,/nyheter/misstankta-baten-i-sverige-fore-nord-stream-sabotaget/
Blixten slår ner – då lyser himlen upp: Apokalyptiskt,https://www.expressen.se/tv/nyheter/blixten-slar-ner-da-lyser-himlen-upp-apokalyptiskt/
Ryska fiaskot fångat på film – nu har videon läckt,https://www.expressen.se/tv/nyheter/ryska-fiaskot-fangat-pa-film-nu-har-videon-lackt/
Bostäder sprängdes trots polisbevakning,/nyheter/bostader-bevakades-av-polis-sprangdes-anda/
Man anhållen för mordet på Layth,/nyheter/man-anhallen-for-mordet-pa-layth/
Kaos i Paris inför OS: ”Kommer och suger blod”,https://www.expressen.se/tv/nyheter/efter-vagglusutbrottet-skadedjursexpertens-tips-/
De dog när superbilar körde om samtidigt,/nyheter/de-dog-nar-superbilar-korde-om-samtidigt/
Här krockar lyxbilarna,/tv/nyheter/lyxbilarna-kor-om-en-efter-en-da-smaller-det/
Man skjuten i halsen – är allvarligt skadad,/nyheter/skottlossning-vid-butik-i-malmo/
Man häktad för mord på okänd kvinna i Umeå,/nyheter/krim/man-haktad-for-mord-pa-kvinna-okant-vem-hon-ar/
"Sara, 22, larmar om jobbet på Chiquelle",/nyheter/sara-22-larmar-om-jobbet-pa-chiquelle/
Svarade mitt i lektion – var Nobelkommittén,/nyheter/hoga-odds-for-upptackter-om-rymdens-mysterier/
”Nu kan vi se saker som rör sig otroligt snabbt”,/tv/nyheter/nu-kan-vi-se-saker-som-ror-sig-otroligt-snabbt/
Blodbadet som banade väg för Putins makt,/nyheter/blodbadet-som-banade--vag-for-putins-makt/
Youtuber gjorde skämtfilm – blev skjuten i bröstet,/nyheter/youtuber-skamtade-i-video-blev-skjuten-i-brostet/
SD:s hårda poliskrav: ”Måste ha ny ledning”,/nyheter/sd-fornyar-avgangskrav-mot-rikspolischefen/
”En åttaåring hade fått pokémonkort”,/nyheter/martin-melin-en-attaaring-hade-fatt-pokemonkort/
Kristersson om Nato: ”Kan inte lova något”,/nyheter/kristersson-kan-inte-lova-natobeslut/
Ilska mot EU-beslutet: ”Riskerar människoliv”,/nyheter/ilskan-mot-eu-direktivet-for-ambulanspersonal-riskerar-manniskors-liv-/
Greps efter mordet – åtalas tolv år senare,/nyheter/man-atalas-for-12-ar-gammalt-mord-pa-mamma/
Polisstudent misstänks ha slagit och tafsat på kolleger,/nyheter/krim/polis-misstanks-ha-slagit-och-tafsat-pa-kolleger/
Haverikommissionen utreder raset på E6,/nyheter/haverikommissionen-utreder-raset-pa-e6/
Privatleasingen för dyr? Sälj ditt avtal,https://teknikensvarld.expressen.se/nyheter/konsument/sa-saljer-du-ditt-leasingavtal-pa-bilen/
Kristerssons krisdrag: Bjuder in partiledarna,/nyheter/ulf-kristersson-bjuder-in-till-mote-i-sakerhetsradet-/
Turisten häpnar när apan gör det förbjudna,https://www.expressen.se/tv/nyheter/turistens-chock-nar-apan-gor-det-forbjudna
Så mycket makt har Instagram-jättarna,/nyheter/laget/sa-mycket-makt-har--instagram-jattarna/
