Heading,URL
Korallernas skelett smälter av värmen i vattnet,/tv/nyheter/koraller-smalter-sina-skelett-i-extremvarmen/
Platserna som lockar till sig terrorattentat,/tv/nyheter/platserna-som-lockar-till-sig-terrorattentaten/
Vildsvinsattack i tunnelbana – två personer till sjukhus,/tv/nyheter/vildsvin-gar-till-attack-pa-tunnelbanestation-/
Drönarattack mot rysk flottbas – stor explosion,/tv/nyheter/dronarattack-mot-rysk-flottbas-stor-explosion/
Fontana: ”Drag för mig är en superpower”,/tv/nyheter/fontana-drag-for-mig-ar-en-superpower-/
1 000 demonstranter stormar festival på Järvafältet,/tv/nyheter/1000-demonstranter-stormar-festival-pa-jarvafaltet-/
Turister fortsätter rusa efter solstolar,/tv/nyheter/turister-fortsatter-rusa-efter-solstolar/
Röd panda har fött tvillingar – arten hotad,/tv/nyheter/rod-panda-har-fott-tvillingar-utrotningshotad/
Skottlossning i Haninge – en död och en skadad,/nyheter/en-person-allvarligt-skadade-i-haninge/
Iryna hyllas som hjältinna efter ryska mordförsöket,/nyheter/iryna-poserar-i-ukrainska-playboy-hyllas-som-hjaltinna/
Explosioner nära Krim – rysk tanker skadad,/nyheter/explosioner-nara-krim-rysk-tanker-skadad/
Här sprängs ryska fartyget av drönaren,/tv/nyheter/har-spranger-kamikazedronaren-fartyget/
Kvinna ramlade ur husbil – föraren märkte inget,/nyheter/kvinna-ramlade-ur-husbil-foraren-markte-inget/
Boende fast i lägenheter efter kraftig explosion,/nyheter/explosion-i-sodertalje-lagenhetshus-drabbat/
Plötsliga vildsvinsattacken i tunnelbanan,https://www.expressen.se/tv/nyheter/vildsvin-gar-till-attack-pa-tunnelbanestation-/
Abel lever gömd: ”Varför ska klaner styra över oss?”,/nyheter/okanda-klanens-grepp-om-vattenpipkafeerna/
Mysteriet: Valrossunge hittad långt från havet,/nyheter/kroppskontakt-ska-radda-valrossunge-i-alaska/
Björn eller människa? Nu är mysteriet löst,https://www.expressen.se/tv/nyheter/bjorn-eller-manniska-nu-ar-mysteriet-lost
Äventyrare död – föll från 68:e våningen,/nyheter/aventyraren-foll-fran-68-vaningar/
Ryska ”monstret” hade sexslav i 14 år,/nyheter/ryska-monstret-hade-kvinnlig-sexslav-i-14-ar/
"Jakob, 48, var sexberoende",https://www.expressen.se/nyheter/jakob-48-var-sexberoende-onanerade-tills-han-fick-sar/
Ryssar tar över Phuket: ”Skrämt bort svenskar”,/nyheter/ryssar-tar-over-phuket-skramt-bort-svenskar/
Lokalborna ryter ifrån – i svenskparadiset,/nyheter/ilskan-mot-turisterna-i-svenskparadiset/
Turister fortsätter rusa efter solstolar,/tv/nyheter/turister-fortsatter-rusa-efter-solstolar/
Korallernas skelett smälter av värmen,https://www.expressen.se/tv/nyheter/koraller-smalter-sina-skelett-i-extremvarmen/
Polisen efter kaoset: ”Ett fantastiskt jobb”,/nyheter/polisen-efter-kaoset-pa-jarvafaltet-ett-fantastiskt-jobb-/
L varnade för upplopp: ”De kraftsamlar”,/nyheter/liberalerna-varnade-for-upplopp-skickade-mejl-till-wanngard/
Därför utbröt stora festivalkravallerna,/nyheter/betlehem-isaak-klart-att-frustationen-byggs-upp/
Man hittad död i bostad – kvinna anhållen för mord,/nyheter/bostad-avsparrad-efter-grovt-brott-i-malmo/
Hon pekas ut som ”ny superstjärna” hos S,/nyheter/s-loftet-vill-fora-partiet-at-vanster-klyftorna-okar/
Svenskarna som väljer att dö i Thailand,https://www.expressen.se/nyheter/svenskarna-som-valjer-att-do-i-thailand-flyr-svenska-aldrevarden/
Kalabalik i New York efter löfte om gratis Playstation,/nyheter/kaos-i-new-york-efter-lofte-om-gratis-playstation/
Föräldern fick ensam vårdnad trots övergrepp,/nyheter/foralder-fick-ensam-vardnad-om-sitt-barn-trots-regelbundna-overgrepp/
Tv-meteorologerna: Då finns det chanser till sol,/nyheter/tv-meteorologerna-da--finns-det-chanser-till-sol/
L-toppen: Regeringen bör peta Söder från uppdraget,/nyheter/l-toppen-regeringen-bor-peta-soder-fran-uppdraget/
Försvaret bekräftar: ”Vi flyger nära ryska gränsen”,/nyheter/forsvaret-bekraftar-vi-flyger-nara-ryska-gransen/
Misstanken: Duo blåste myndighet på 556 000,/nyheter/misstanken-duo-blaste--myndighet-pa-556-000/
Platserna som lockar till sig terrorattentat,https://www.expressen.se/tv/nyheter/platserna-som-lockar-till-sig-terrorattentaten
Navalnyj döms igen – får 19 års fängelse,/nyheter/navalnyj-doms-till-19-ars-fangelse/
Död man hittad i Avesta – mördades med yxa,/nyheter/dod-man-hittad-i-avesta-mordad-med-yxa/
Gul varning för skyfall och kraftiga åskskurar,/nyheter/smhi-varnar-for-skyfall-och-kraftiga-askskurar/
Misstänkt mord – adress kopplas till gängkriminell,/nyheter/man-i-70-arsaldern-misstankt-mordad/
Kraftig smäll – sen stod centralstationen i lågor,/nyheter/brandattentat-mot-kafe-i-lund/
Bilder: Se när lågorna slår upp genom taket,/tv/nyheter/lunds-centralstation-brinner-efter-misstankt-attentat/
Greta Thunberg drar sig ur festival,/nyheter/greta-thunberg-drar-sig-ur-festival-greenwashing/
Fontana: ”Drag är min styrka och superpower”,https://www.expressen.se/tv/nyheter/fontana-drag-for-mig-ar-en-superpower-/
"Fick ett telefonsamtal – nu ska Melker, 15, spela EM",/nyheter/fick-samtal-nu-ska--melker-15-spela-em/
”Sorglig dag för USA – skulle aldrig hända”,/nyheter/trump-har-landat-i-dc-pa-vag-mot-domstol/
Trump: Washington är smutsigt och förfallet,/tv/nyheter/trump-washington-ar-smutsigt-och-forfallet/
Tove-rättegången i hovrätten flyttas,/nyheter/hovrattsforhandlingen-i-tove-fallet-flyttas-fram/
Full bilist krockade med lös ko på motorvägen,/nyheter/full-billist-korde-i-fel-korriktning-krockade-med-los-ko-pa-e22/
Underliga kuppen förbryllar i kyrkan,https://www.expressen.se/tv/nyheter/underliga-kuppen-forbryllar-i-kyrkan
”En ledamot skulle aldrig bära svastika i riksdagen”,/nyheter/pride-invigt-skulle-aldrig-bara-svastika-i-riksdagen/
SD-källor: ”Han gick långt över gränsen”,/nyheter/sds-gruppledare-soders-hojda-tonlage-ar-problematisk/
Prideordföranden: ”Har god säkerhet”,/tv/nyheter/kanner-att-vi-har-god-sakerhet/
