Heading,URL
Varg och järv i dramatisk strid om död älg,/tv/nyheter/vargen-och-jarvens-dramatiska-strid-om-doda-algen/
Här tränas Putins barnsoldater i skolan,/tv/nyheter/har-tranas-putins-barnsoldater-i-skolan/
LIVE-TV: Senaste nyheterna med Expressen TV,/tv/nyheter/live/live-tv-senaste-nyheterna-med-expressen-tv-16/
Arlandarånaren: ”Jag fick ligga på pengarna där bak”,/tv/nyheter/arlandaranaren-jag-fick-ligga-pa-pengarna-dar-bak/
Här attackerar ryska planet USA-drönaren,/tv/nyheter/har-attackerar-ryska-planet-usa-dronaren/
JUST NU: Förseningar i pendeltågstrafiken,/nyheter/forseningar-i-pendeltagstrafiken/
Bydén: Arbetet klart – Sverige ”redo” för Nato,/nyheter/overbefalhavare-micael-byden-forsvarsmakten-redo-for-nato/
Natos oro för Putins nya upprustning,/nyheter/natos-oro-putins-nya-upprustning-vid-gransen/
Var femte moderat ger regeringen underkänt,/nyheter/var-femte-moderat-ger--regeringen-underkant/
"Åtal väntas för mordet på Tove, 21",/nyheter/krim/atal-vantas-for-mordet-pa-tove-21/
16-årig flicka borta – polis går ut med bild,/nyheter/16-arig-flicka-forsvunnen/
Forskarnas framsteg: Möss med två pappor,/nyheter/forskarnas-framsteg-moss-med-tva-pappor/
Storbritanniens varning till Putin: ”Konsekvenser”,/nyheter/storbritanniens-varning-till-putin-konsekvenser/
Här tränas Putins barnsoldater i skolan,/tv/nyheter/har-tranas-putins-barnsoldater-i-skolan/
Rysslands hemliga spionring sprängd,/nyheter/rysslands-hemliga--spionring-sprangd/
Johan Ingerö anmäldes – KD: ”Vi har gått igenom”,/nyheter/ingero-anmaldes-kd-agerade-inte/
Cannabisbråket före Skyttedals anmälan,/nyheter/ingero-forsokte-stoppa-skyttedal-fran-30-minuter/
Pekades ut i Botkyrka- härvan – slår nu tillbaka,/nyheter/han-pekades-ut-i-botkyrka-harvan-slar-tillbaka-mot-anklagelserna/
Kremls försvar: ”Smittats av russofobisk infektion”,/nyheter/kremls-forsvar-smittats-av-russofobisk-infektion-/
Läcka avslöjar Putins planer för Moldavien,/nyheter/ny-lacka-inifran-kreml-avslojar-putins-hemliga-planer-for-moldavien/
Christel är en av Markaryds miljardärer,/nyheter/fick-jobb-i-receptionen-nu-ar-christel-miljardar/
Ryska befälhavarna som blev Putins blodiga bödlar,/nyheter/befalhavarna-som-blev-putins-blodiga-bodlar/
Efterlysta av Sverige – jagas i hela världen,/nyheter/krim/efterlysta-av-sverige-jagas-i-hela-varlden/
”Jag har redan allt – behöver inte lyxa”,/nyheter/jag-har-ju-redan-allt-jag-behover-inte-lyxa/
Rusning till Gekås när matpriserna skenar,/nyheter/rusning-till-gekas-nar-matpriserna-skenar/
Därför kostar maten mer här än i Norge,/nyheter/lagre-matpriser-i-norge-an-sverige-trots-samma-forsvagning-av-kronan/
Familjens radhus förstört av bomben,/nyheter/familjen-i-hasselby-fick-sitt-radhus-forstort-av-gangbomben/
”Det omöjligas gräns – går inte att leva i det”,/nyheter/jerzy-sarnecki-om-bombdadet-inte-funnits-har-tidigare/
Bomb placerad hos rapparens anhörig,/nyheter/uppgifter-anhoriga-till-gangkopplad-rappare-utsatta-i-explosionen-i-hasselby/
"Nathalie, 17: ”Hittar glassplitter i håret”",/tv/nyheter/17-ariga-nathalie-vaknade-av-smallen-i-hasselby-hittar-fortfarande-glas-i-haret/
Självhjälpsgurun anklagas – för ”okontrollerbar ilska”,/nyheter/flera-anklagelser-mot-sjalvhjalpsgurun-marianne-williamson/
Vargen och järven strider om död älg,https://www.expressen.se/tv/nyheter/vargen-och-jarvens-dramatiska-strid-om-doda-algen
Sexualsadisten André Falk dömd för nya våldtäkter,/nyheter/krim/sexualsadisten-andre-falk-domd-for-nya-valdtakter/
Tror sig vara Madeleine McCann – har insjuknat,/nyheter/tror-sig-vara-madeleine-mccann-pastas-ha-insjuknat/
Nya fyndet på Mars: Kan finnas vatten kvar,/nyheter/nya-fyndet-pa-mars-det-kan-finnas-vatten-kvar/
200 gripna under pensionsprotester i Frankrike,/nyheter/200-gripna-under-pensionsprotester-i-frankrike/
Våldsamma protester i Paris mot pensionsreform,/tv/nyheter/valdsamma-protester-i-paris-mot-pensionsreform/
Man med kniv gjorde ”utfall” vid tågstation,/nyheter/knivbevapnad-man-greps-vid-tagstation-i-vaxjo/
Shekarabi om S agerande i ”snippa”-målet: ”Inte rätt”,https://www.expressen.se/tv/nyheter/gt/ardalan-shekarabi-s-uppenbart-att-det-inte-blev-ratt
Frisören skulle parkera om bilen – sköts till döds,/nyheter/krim/fyra-atalas-for-mord-och-valdsbrott-i-haninge/
Historien bakom ”Kurdiska räven”,/nyheter/krim/historien-bakom-kurdiska-raven-knarket-och-valdet/
Arlandarånaren: ”Jag fick ligga på pengarna”,https://www.expressen.se/tv/nyheter/arlandaranaren-jag-fick-ligga-pa-pengarna-dar-bak
Då godkänner Ungern Sverige och Finland,/nyheter/ungern-kan-slappa-in-sverige-i-nato-31-mars/
Man död efter misshandel på station i Helsingborg,/nyheter/man-dod-efter-misshandel-pa-station/
Oväntade larmsamtalet: ”Är biten av en zebra”,/tv/nyheter/ovantade-larmsamtalet-ar-biten-av-en-zebra/
Uppgift: Paludan kopplas till män i Wagnergruppen,/nyheter/uppgifter-paludan-kopplas-till-soldater-i-wagnergruppen/
En av världens mest udda bilar är till salu,https://teknikensvarld.expressen.se/nyheter/bil-och-trafik/john-dodds-the-beast-ute-pa-auktion/
Gigantiskt fenomen driver mot Florida,/tv/nyheter/gigantisk-stinkande-tangklump-pa-vag-mot-floridas-strander/
Larmet: ”Fulknark” i omlopp – fem döda,/nyheter/larmet-fulknark-i--omlopp-fem-doda-/
Filmerna visar – här kastar ”hjälten” sten,https://www.expressen.se/tv/nyheter/prisad-forebild-for-unga-var-sjalv-med-i-upploppet
Här regnar glas från skyskrapan,/tv/nyheter/har-regnar-glas-fran-skyskrapan/
Svensk man död efter kraftig brand i Norge,/nyheter/svensk-man-dod-i-brand-i-norge/
Rätten tog paus – då utbröt slagsmål,/nyheter/slagsmal-utanfor-tingsratten-mitt-under-mordrattegang/
Räntechefen: Kanske inte ska höja mer nu,/nyheter/riksbankshojdare-tvekar-om-rantehojningar/
Centralen utrymdes – hundratal fick lämna,/nyheter/t-centralen-i-stockholm-utryms/
Varning för jättehalka – 12 bilar krockade,/nyheter/polisen-varnar-for-halka-i-skane-flera-olyckor-/
Explosionen fångas på grannens film,https://www.expressen.se/tv/nyheter/har-exploderar-bomben-mitt-i-radhusomradet/
Här är nya Chat GPT – 8 galna saker den kan,/nyheter/har-ar-nya-chat-gpt-8-galna-saker-den-kan/
Sonen överlevde lågorna – klättrade upp på parabol,/nyheter/krim/sonen-overlevde-lagorna-klattrade-upp-pa-parabolen/
