Heading,URL
Kritiken: Ignorerar döende man – för att slå världsrekord,/tv/nyheter/kritiken-mot-klattrarna-ignorerade-doende-man/
Ska ut med hunden – ser inte vad som lurar bakom hörnet,/tv/nyheter/ska-ut-med-hunden-ser-inte-vad-som-lurar-bakom-hornet/
Tjuvarna kapar fel bil – oväntade vändningen,/tv/nyheter/tjuvarna-kapar-fel-bil-ovantade-vandningen/
Tre punkter som talar för Trump i presidentvalet,/tv/nyheter/tre-punkter-som-talar-for-trump-i-nasta-ars-presidentval/
Robot träffar populära hotellet – lokalbefolkningen flyr,/tv/nyheter/robot-traffar-fn-hotellet-lokalbefolkningen-flyr/
Här sprängs ryska supervapnet,/tv/nyheter/har-sprangs-ryska-supervapnet/
8-årig flicka trycks in i resväska – kidnappas,/tv/nyheter/8-arig-flicka-raddad-efter-kidnappning/
Våldsamma videon – anställd slår ner elev brutalt,/tv/nyheter/valdsamma-videon-anstalld-slar-ner-elev-brutalt/
Spränger ammunitionslager – tackar ”svenskbrigaden”,/tv/nyheter/spranger-ammunitionslager-tackar-svenskbrigaden/
JUST NU: Översvämning i Örebro,/nyheter/oversvamningar-i-orebro/
JUST NU: Sökinsats efter skott mot polis,/nyheter/polis-beskjuten-i-ostersund/
”Sopdrottningen” byter ut Bodström: ”Han är ytlig”,/nyheter/sopdrottningen-byter-ut-bodstrom-han-ar-ytlig/
Putins nya bekymmer – valutan störtdyker,/nyheter/ryska-rubeln-pa-rekordlaga-nivaer-igen-/
Ny historiebok får kritik – svaret: ”Fängsla dem”,/tv/nyheter/ryske-programledaren-vill-fangsla-journalister-/
Wagner kan lämna: ”Finansiella problem”,/nyheter/wagnergruppen-ser-ut-att-lamna-belarus-finansiella-problem/
Bodybuildern mördade exfrun – sände allt live,/nyheter/bosniska-bodybuildern-sande-mordet-live-pa-instagram/
Björnen skumbadar – bubblar i diskmedel,/tv/nyheter/bjornen-skumbadar-bubblar-i-diskmedel/
Ska ut med hunden – ser inte vad som gömmer sig,https://www.expressen.se/tv/nyheter/ska-ut-med-hunden-ser-inte-vad-som-lurar-bakom-hornet
Jakob var sexberoende – fick sår av onanin,/nyheter/jakob-48-var-sexberoende-onanerade-tills-han-fick-sar/
Ökända klanens grepp om vattenpipkaféerna,/nyheter/okanda-klanens-grepp-om-vattenpipkafeerna/
Nytt åtal närmar sig för Donald Trump,/nyheter/nytt-atal-kan-narma-sig-for-donald-trump/
De är fast på ön efter kaoset: ”Katastrofalt”,/nyheter/de-ar-fast-pa-gotland-efter-farjekaoset-katastrofalt/
Gotlands drag i krisen: Öppnar Ica Maxi arena,/nyheter/resenarer-fast-pa-gotland-kan-tvingas-sova-i-gymnastiksalar/
Rösterna från Gotland: ”Måste komma hem”,/tv/nyheter/rosterna-fran-gotland-jag-maste-komma-hem/
"Muhammad, 14, klämdes ihjäl: ”Älskad av många”",/nyheter/muhammad-14-klamdes-ihjal-alskad-av-manga/
Bilderna visar: Här är Hans brutala framfart,/nyheter/bilderna-efter-stormen-hans-brutala-framfart/
SMHI varnar – risk för försenad Hans-effekt,/nyheter/nytt-regnovader-pa-vag-in-over-sverige/
...men snart slår vädret om till sol: ”25 grader”,/nyheter/varmen-pa-vag-tillbaka-kan-bli-over-25-grader/
Mikroplaster hittade i patienters hjärtvävnad,/nyheter/mikroplaster-hittade-i-patienters-hjartvavnad/
Utpekade mördarens egna ord om mordet,/nyheter/utpekade-mordarens-ord--om-mordet-pa-stuvkallaren/
Här är det vi bråkar mest om under semestern,https://www.expressen.se/allt-om-resor/nyheter/har-ar-det-vi-brakar-mest-om-under-semestern
Denice förlorade dottern vid födseln: ”Så maktlös”,/nyheter/denice-forlorade-sin-dotter-vid-forlossningen-/
Kritiken: Ignorerar döende man – för att slå rekordet,https://www.expressen.se/tv/nyheter/kritiken-mot-klattrarna-ignorerade-doende-man/
89 döda i skogsbränderna – husen markeras med X,/nyheter/minst-89-doda-i-branderna-hus-markeras-med-x/
Man hittade bombdel i sin trädgård efter explosionen,/nyheter/man-hittade-bombdel-fran-explosion-i-falkenberg/
Efter våldet i Stockholm: ”Vi fortsätter kampen”,/nyheter/efter-valdet-i-stockholm-vi-fortsatter-kampen/
Tre saker som talar för Trump i presidentvalet,https://www.expressen.se/tv/nyheter/tre-punkter-som-talar-for-trump-i-nasta-ars-presidentval/
Domarens varning till Donald Trump i rätten,/nyheter/domarens-varning-till-donald-trump/
Tjuvarna kapar fel bil – då bryter helvetet loss,https://www.expressen.se/tv/nyheter/tjuvarna-kapar-fel-bil-ovantade-vandningen
Svensk döms till 95 års fängelse för dödsturné,/nyheter/svenske-mordaren-doms-till-95-ars-fangelse-i-barcelona/
Anställd slår ner elev på skolbuss: ”Oacceptabelt”,/tv/nyheter/valdsamma-videon-anstalld-slar-ner-elev-brutalt/
Ryskt stridsflygplan har kraschat i Kaliningrad,/nyheter/ryskt-stridsflygplan-har-kraschat-i-kaliningrad/
Gift med Norges störste spion: ”Gråtit så mycket”,/nyheter/var-gift-med-norges-storste-spion-gratit-sa-mycket/
Upptäckten: Champagne har börjat få en ny smak,/nyheter/upptackten-champagne--har-borjat-fa-en-ny-smak/
Långa köer när kunder får vittring på surströmming,/nyheter/infor-surstrommingspremiaren-langa-koer-och-tomma-butikshyllor/
8-åriga flickan trycks in i resväska – kidnappas,https://www.expressen.se/tv/nyheter/8-arig-flicka-raddad-efter-kidnappning
Svenskarna flydde från bränderna: ”Vi blev fast”,/nyheter/magnus-och-nilla-befann-sig-mitt-bland-branderna-pa-hawaii/
Bränderna eldas på av klimatförändringar,/nyheter/branderna-eldas-pa-av-klimatforandringar/
Förödelsen på Hawaii: ”Värsta i vår historia”,/nyheter/forodelsen-pa-hawaii-varsta-naturkatastrofen-i-var-historia/
Ordern innan stormen: Skydda porträtten på Kim,/nyheter/ordern-innan-stormen-skydda-portratten-pa-kim-jong-un/
Kallade korridorsgrannar för ”grisar” – kastas ut,/nyheter/kallade-korridorsgrannar-for-grisar-kastas-ut-/
Ryssland varnar för att ingripa militärt i Niger,/nyheter/efter-militara-beslutet-i-niger-ryssland-varnar/
Hunter Biden granskas av särskild utredare,/nyheter/hunter-biden-granskas-av-sarskild-utredare/
Se upp: Här kommer ett regn av stjärnfall,/nyheter/se-upp-har-kommer-ett-regn-av-stjarnfall/
Klippan rasar plötsligt – strandgästernas panik,/tv/nyheter/klippan-rasar-plotsligt-strandgasternas-panik/
"Misstänkte 15-åringen var vän med Layth, 14",/nyheter/krim/misstankte-15-aringen--var-van-med-layth-14/
Tonåring häktas efter Layths försvinnande,/nyheter/efter-layths-forsvinnande-tonaring-begars-haktad/
