Heading,URL
Experten: ”Ryska flottan förlorar mot ett land utan en flotta”,/tv/nyheter/experten-ryska-flottan-forlorar-mot-ett-land-utan-en-flotta/
Upptäckten: Världens tyngsta djur – någonsin,/tv/nyheter/peruansk-koloss-utmanar-blavalen/
Planet störtar mitt i rusningstrafiken,/tv/nyheter/planet-stortar-mitt-i-rusningstrafiken/
Eritreansk festival stormad i Kanada – nio förda till sjukhus,/tv/nyheter/eritreansk-festival-stormad-i-kanada-nio-forda-till-sjukhus/
"1,5 miljon människor samlade för påve Franciskus",/tv/nyheter/15-miljon-manniskor-samlade-for-pave-franciskus/
Svenskarnas livsfarliga mc-färd: ”Måste ta slut nu”,/tv/nyheter/akte-pa-turisttata-vagen-utsattes-for-livsfara/
Här skakas butiken i Kina av kraftigt jordskalv,/tv/nyheter/har-skakas-butiken-i-kina-av-kraftigt-jordskalv/
Extremovädret Hans drar fram – varningar efter stora blixtregnet,/nyheter/blixtkaos-och-osregn-fler-varningar-nar-hans-har-dragit-in/
Hur påverkas du av ovädret Hans?,/nyheter/skicka-in-bilder-hur-paverkas-du-av-ovadret-hans/
Svenskarna i klimathelvetet: ”Det blir som en skräckfilm”,/nyheter/svenskarna-i-klimathelvetet-det-blir-som-en-skrackfilm/
”Betalar man inte så bränner de lokalerna”,/tv/nyheter/gt/minidokumentar-klanen-och-kafeerna/
Ökända klanens grepp om vattenpipkaféerna,/nyheter/okanda-klanens-grepp-om-vattenpipkafeerna/
Paniken när kontrollant upptäcker det förbjudna,/tv/nyheter/blev-stoppad-av-granspolisen-hade-ryggsacken-fylld-med-apor/
Putins ammunitionslager sprängd – av ryska soldater,/tv/nyheter/putins-ammunitionslager-sprangs-av-ryska-soldater/
Experternas nya kärnvapenslarm,/nyheter/larmet-allvarlig-risk-for-undergang-av-karnvapen/
Utpekade mördarens egna ord om mordet,/nyheter/utpekade-mordarens-ord--om-mordet-pa-stuvkallaren/
Här sker tillverkningen av din kommande bil,https://teknikensvarld.expressen.se/nyheter/bilbranschen/vad-tillverkas-var/
Inifrån swingersklubben: Koderna och vilda sexet,/premium/nyheter/inifran-swingersklubben-koderna-och-vilda-sexet/
Han ligger bakom tusentals mord,/nyheter/claver-berinkindi-ligger-bakom-tusentals-mord-1/
Äventyrare död – föll från 68:e våningen,/nyheter/aventyraren-foll-fran-68-vaningar/
Matpriserna stiger – trots medvetna konsumenter,/nyheter/matpriserna-stiger-trots-medvetna-konsumenter/
GW:s två teorier om misstänkta mordet,/nyheter/gws-tva-teorier-om-misstankta-mordet/
Tesla Model Y kommer sist i räckviddstest,https://teknikensvarld.expressen.se/nyheter/bil-och-trafik/elbil-laddhybrid/tesla-model-y-kommer-sist-i-rackviddstest/
Äldre man skadad i skjutning – en gripen,/nyheter/skottlossning-i-malmo-fdwfk/
Musk: Min fajt med Zuckerberg livesänds,/nyheter/musk-fajten-med-zuckerberg-livesands-pa-x/
Hon pekas ut som ”ny superstjärna” hos S,/nyheter/s-loftet-vill-fora-partiet-at-vanster-klyftorna-okar/
Kravet om rättegångarna mot Trump: Sänd allt live,/nyheter/krav-livesand-rattegangarna-mot-trump/
Nya Tiktok-trenden – påstås ”läka” ögonen,https://www.expressen.se/tv/nyheter/nya-tiktok-trenden-olja-ska-laka-ogonen
Eritreansk festival stormad i Kanada,/tv/nyheter/eritreansk-festival-stormad-i-kanada-nio-forda-till-sjukhus/
Sparkade anställda rasar mot prins Harry,/nyheter/sparkade-anstallda-rasar-mot-prins-harry-han-gor-ingenting/
Otroliga upptäckten – världens tyngsta djur,https://www.expressen.se/tv/nyheter/peruansk-koloss-utmanar-blavalen
Kocken Roland Persson är död: ”Stort tomrum”,/nyheter/kocken-roland-persson-har-dott-barnens-sorg/
Minst 30 döda efter tågolycka i Pakistan,/nyheter/mist-30-doda-efter-tagolycka-i-pakistan-/
Kreml: Putin vinner med 90 procent av rösterna,/nyheter/kreml-putin-vinner-med-90-procent-av-rosterna/
Vädjan från kräkkaoset på fjället: ”Kom inte hit”,/nyheter/vadjan-fran-krakkaoset-pa--kebnekaise-kom-inte-hit/
Avvisas från Sverige efter Järvaupploppet,/nyheter/ett-15-tal-personer-avvisas-fran-sverige-efter-upploppet-pa-jarvafaltet/
Ny ukrainsk attack mot broar till Krim,/nyheter/ukrainsk-attack-mot-krimbroar-20000-utan-gas/
Enorma folksamlingen – trotsar värmen för påven,https://www.expressen.se/tv/nyheter/15-miljon-manniskor-samlade-for-pave-franciskus/
Planet störtar mitt i rusningstrafiken,https://www.expressen.se/tv/nyheter/planet-stortar-mitt-i-rusningstrafiken/
Sågar fängelseförslag: ”Som att kissa på sig”,/nyheter/sagar-regeringsforslaget-som-att-kissa-pa-sig/
En död efter båtolycka utanför Halmstad,/nyheter/batolycka-i-halmstad-tva-personer-raddade/
Butiken skakar av kraftiga jordskalvet,https://www.expressen.se/tv/nyheter/har-skakas-butiken-i-kina-av-kraftigt-jordskalv/
Stenevi sågar Kristersson: ”Släppt in homofoberna”,/nyheter/stenevi-sagar-kristersson-slappt-in-homofoberna/
”Så fint och viktigt att man börjar gråta”,/tv/nyheter/fran-prideparaden-visa-upp-trygghet-och-stolthet-som-sverige-erbjuder/
Prideparaden lockade halv miljon människor,/nyheter/arrangoren-prideparaden-lockade-en-halv-miljon/
Billströms modeval på Pride – trendigt eller tre år sent?,/nyheter/tobias-billstroms-stilval-i-prideparaden/
Experten: Fem fronter där Ukraina slåss mot Putin,/nyheter/experten-ukrainas-fem-olika-fronter-mot-putin/
Förarlös båt kör i väg – se modiga polisinsatsen,https://www.expressen.se/tv/nyheter/har-kor-baten-ivag-utan-forare-se-den-modiga-polisinsatsen/
Två män begärs häktade efter misstänkta mordet,/nyheter/tva-man-begars-haktade-mord-utreds-i-astorp/
Branden under kontroll – men ny har blossat upp,/nyheter/branden-vid-spansk-franska-gransen-under-kontroll/
Atleter rasar – fick simma i bajsvatten,/nyheter/atleter-rasar-fick-simma-i-bajsvatten-/
Galna Barbie-trenden för att få ”längre” hals,/nyheter/galna-barbie-trenden-for-att-fa-langre-hals/
Hotade att läcka sexfilm – mördades av influencer,/nyheter/hotade-att-lacka-sexfilm-mordades-av-influencer/
"Påvens rekordpublik – 1,5 miljoner besökare kom",/nyheter/paven-lockade-miljonpublik-utanfor-lissabon/
Nya detaljer avslöjade om rymdfenomenet,/nyheter/nya-detaljer-avslojade--om-rymdfenomenet/
Iryna hyllas som hjältinna efter ryska mordförsöket,/nyheter/iryna-poserar-i-ukrainska-playboy-hyllas-som-hjaltinna/
Barn sjuka efter lek – skumbad pekas ut,/nyheter/barn-sjuka-efter-lek-skumbad-pekas-ut/
Schibbye: Festivalbråk del av stegrad konflikt,/nyheter/schibbye-festivalbrak-del-av-stegrad-konflikt/
Ulf Kristersson om kaoset på Järvafältet: ”Farligt”,/nyheter/ulf-kristersson-bryter-tystnaden-om-kaoset-pa-jarvafaltet-farligt/
Därför utbröt stora festivalkravallerna,/nyheter/betlehem-isaak-klart-att-frustationen-byggs-upp/
Efter Playstation-kaoset – profilen hotas med åtal,/nyheter/overvager-rattsliga-atgarder-mot-kai-cenats-efter-playstation-kaoset/
