Heading,URL
Gigantisk stinkande tångklump på väg mot Floridas stränder,/tv/nyheter/gigantisk-stinkande-tangklump-pa-vag-mot-floridas-strander/
Detaljen i Putins möte med ”attackhunden”,/tv/nyheter/detaljen-i-putins-mote-med-attackhunden/
Oväntade larmsamtalet: ”Är biten av en zebra”,/tv/nyheter/ovantade-larmsamtalet-ar-biten-av-en-zebra/
LIVE-TV: Senaste nyheterna med Expressen TV,/tv/nyheter/live/live-tv-senaste-nyheterna-med-expressen-tv-16/
Prisad förebild för unga – var själv med i upploppet,/tv/nyheter/prisad-forebild-for-unga-var-sjalv-med-i-upploppet/
JUST NU: Radhuset sprängt – en skadad,/nyheter/kraftig-explosion-i-vastra-stockholm/
Hårda orden mot KD: ”Saknar motstycke”,/nyheter/harda-orden-mot-kd-saknar-motstycke/
Cannabisbråket före Skyttedals anmälan,/nyheter/ingero-forsokte-stoppa-skyttedal-fran-30-minuter/
Busch: Därför fick Ingerö sparken,/tv/nyheter/sa-forklarar-ebba-busch-att-ingero-far-sparken/
Oväntade larmsamtalet: ”Är biten av en zebra”,/tv/nyheter/ovantade-larmsamtalet-ar-biten-av-en-zebra/
"Familjens farväl av Tove, 21, i Vetlanda",/nyheter/krim/familjens-farval-av-tove-21-i-vetlanda/
Ryssland rustar – ska rekrytera 400 000 fler,/nyheter/ryssland-rustar-for-att-rekrytera-400-000-soldater/
Detaljen i Putins möte med ”attackhunden”,/tv/nyheter/detaljen-i-putins-mote-med-attackhunden/
Larmet: ”Fulknark” i omlopp – fem döda,/nyheter/larmet-fulknark-i--omlopp-fem-doda-/
Christel är en av Markaryds miljardärer,/nyheter/fick-jobb-i-receptionen-nu-ar-christel-miljardar/
Gigantisk tångklump hotar badstränder,/tv/nyheter/gigantisk-stinkande-tangklump-pa-vag-mot-floridas-strander/
BMW ser en framtid med bensin- och dieselmotorer,https://teknikensvarld.expressen.se/nyheter/bilbranschen/bmw-fortsatter-med-forbranningsmotorer-i-manga-ar-till/
Ny läcka visar Putins planer för Moldavien,/nyheter/ny-lacka-inifran-kreml-avslojar-putins-hemliga-planer-for-moldavien/
Efterlysta av Sverige – jagas i hela världen,/nyheter/krim/efterlysta-av-sverige-jagas-i-hela-varlden/
”Jag har redan allt – behöver inte lyxa”,/nyheter/jag-har-ju-redan-allt-jag-behover-inte-lyxa/
Här är nya Chat GPT – 8 galna saker den kan,/nyheter/har-ar-nya-chat-gpt-8-galna-saker-den-kan/
Kvinnlig kriminalvårdare hade relation med fånge,/nyheter/kvinnlig-kriminalvardare--hade-relation-med-fange/
Sonen överlevde lågorna – klättrade upp på parabol,/nyheter/krim/sonen-overlevde-lagorna-klattrade-upp-pa-parabolen/
Friad efter Dumpens text – får inte jobba kvar,/nyheter/skolanstalld-friad-efter-dumpen-uthangning-far-inte-jobba-kvar/
SVT:s plan: Skicka in hyllad filmare i fängelse,/nyheter/svts-plan-skicka-in-hyllad-filmare-i-fangelse/
Prisad förebild för unga – var själv med i upploppet,https://www.expressen.se/tv/nyheter/prisad-forebild-for-unga-var-sjalv-med-i-upploppet
Notan för nya Slussen saltas till 21 miljarder,/nyheter/notan-for-nya-slussen-saltas-till-21-miljarder/
Iranska aktivisten släpps – blev torterad i fängelset,/tv/nyheter/har-slapps-iranska-aktivisten-fri-torterades-i-fangelset/
Inga militära garantier om Sverige hotas,/nyheter/inga-militara-garantier-om-sverige-hotas/
Sonens tårar i rätten – när filmklippet visades,/nyheter/krim/tarar-och-utbrott-i-ratten-forsta-rattegangsdagen/
Så fångade polisen de misstänkta tonårsrånarna,/nyheter/sa-fangade-polisen-de-misstankta-tonarsranarna/
Världspremiär för billig elbil från Volkswagen,https://teknikensvarld.expressen.se/nyheter/bil-och-trafik/elbil-laddhybrid/volkswagen-id-2all-concept-en-liten-billig-elbil/
Ryska plan avbröts av Nato – flög nära Estland,/nyheter/ryska-plan-genskjutna-av-nato-flog-for-nara-estland/
Minnesgudstjänsten för Mats Löfving övervakas,/nyheter/minnesgudstjansten-for--mats-lofving-overvakas/
Muf-ordförande Douglas Thor: ”Tänker inte avgå”,/nyheter/muf-ordforande-douglas-thor-jag-tanker-inte-avga/
Film på barnmisshandel spreds – mamman döms,/nyheter/film-pa-barnmisshandel-spreds--mamman-doms/
Spelbolags-vd lurade kunderna på miljoner,/nyheter/spelbolags-vd-lurade-kunderna-pa-miljoner-/
Flixtrain ställer in tåg – ”skadas på spåret”,/nyheter/flixtrain-staller-in-tag-skadas-pa-sparet/
Niinistö väntar sig ett Natosvar från Erdogan,/nyheter/niinisto-vantar-sig-ett-natosvar-fran-erdogan/
Chocken efter svenskans misstänkta barnamord,/nyheter/vannen-jag-ar-chockad-over-vad-som-hant/
Putins ”attackhund” svårt sjuk – rädd för förgiftning,/nyheter/putins-attackhund-svart--sjuk-radd-for-forgiftning/
Han styr vapen och knark från paradisö,/nyheter/han-styr-vapen-och-knark-fran-paradiso/
Få bäst betalt för din bil – så säljer du den,https://teknikensvarld.expressen.se/nyheter/konsument/sa-saljer-du-bilen-pa-blocket-steg-for-steg/
Scholz: Jobbar hårt för svenskt medlemskap,/nyheter/scholz-jobbar-intensivt-for-svenskt-natomedlemskap/
Populära laddboxar förbjuds att säljas,https://teknikensvarld.expressen.se/nyheter/konsument/easee-laddboxar-far-forsaljningsforbud/
Påskens biljettkaos – går att boka SJ-konkurrent,/nyheter/kaos-hos-sj-bokbara-biljetter-hos-konkurrenten/
Tre av tio ensamstående har svårt att köpa bra mat,/nyheter/inflationen-slar-hart-mot-barnfamiljer-3-av-10-har-svart-att-kopa-naringsrik-mat/
Emma Frans om corona: Underskattade viruset,/nyheter/emma-frans-underskattade-coronaviruset/
Buschs ord om polis-anmälan mot Ingerö,/nyheter/ebba-busch-ord-om-polisanmalan-mot-ingero/
Skyttedal: Gick ”på nytt” över en gräns,/nyheter/skyttedal-om-anmalan-gick-pa-nytt-over-grans/
