Heading,URL
Brandmännen buar ut Vance – två gånger,/tv/nyheter/varlden/brandmannen-buar-ut-vance-tva-ganger/
Rysk toppmodern stridsvagn sprängs,/tv/nyheter/varlden/rysk-toppmodern-stridsvagn-sprangs/
Turistparadiset översköljt av död fisk,/tv/nyheter/varlden/turistparadiset-overskoljt-av-dod-fisk/
Capri-färjan tappar kontrollen – kraschar,/tv/nyheter/varlden/capri-farjan-tappar-kontrollen-kraschar/
Artisten avbryter mitt i låten: ”Oacceptabelt”,/tv/nyheter/varlden/idol-sangarens-starka-reaktion-efter-braket-i-publiken/
Planet nödlandar på vägen: ”Nära att träffa vår bil”,/tv/nyheter/varlden/planet-nodlandar-pa-vagen-nara-att-traffa-var-bil/
Här flyr skytten efter mordet i Upplands-Bro,/tv/nyheter/sverige/har-flyr-skytten-efter-mordet-i-upplands-bro/
Ny enorm brand på rysk oljedepå,/tv/nyheter/varlden/rysk-oljedepa-i-lagor-efter-ukrainsk-attack/
Björnen blir rasande – attackerar tränaren,/tv/nyheter/varlden/cirkusbjorn-pa-hoverboard-attackerar-tranaren/
JUST NU: E45 avstängd efter krock,/nyheter/sverige/e45-avstangd-efter-krock-/
JUST NU: En skadad i brand,/nyheter/sverige/brand-i-flerfamiljshus-amhsd/
JUST NU: SMHI varnar – nytt oväder slår till,/nyheter/sverige/varnar-for-nytt-askovader-/
Radarbilderna visar blixtarnas framfart,/tv/nyheter/sverige/radarbilder-har-drar-blixtarna-fram-over-sverige/
Därför vägrar Putin delta i fredssamtal,/nyheter/varlden/darfor-vagrar-putin-delta-i-nya-fredssamtal/
Kändiskocken dömd för brutalt mord på paradisön,/nyheter/varlden/kandiskocken-domd-for-brutalt-mord-pa-paradison/
Artisten avbryter: ”Oacceptabelt”,/tv/nyheter/varlden/idol-sangarens-starka-reaktion-efter-braket-i-publiken/
Testar Sveriges värsta löparbacke: ”Ger upp”,/tv/nyheter/sverige/reporterns-reaktion-pa-demonbacken-ger-upp/
En kroppsscanning kan göra mer skada än nytta,/nyheter/kronikorer/amina-manzoor/du-behover-inte-scanna-din-kropp-for-sjukdomar/
Brandmännen buar ut Vance – två gånger,https://www.expressen.se/tv/nyheter/varlden/brandmannen-buar-ut-vance-tva-ganger
Trumps hån mot Harris: ”Ser henne inte”,/tv/nyheter/varlden/trumps-han-mot-harris-ser-inte-ut-som-en-ledare/
Kamala Harris oväntade drag: Väljer republikan,/nyheter/varlden/kamala-harris-lovar-att-utse-republikan-till-minister/
Fallskärmsjägare slår till mot rysk topp-stridsvagn,/tv/nyheter/varlden/rysk-toppmodern-stridsvagn-sprangs/
Rysslands hot efter Expressens reportage,/nyheter/sverige/ryska-varningen-efter-expressens-reportage/
Reportagen Ryssland inte vill att du läser,/nyheter/varlden/dronarpiloter-ryssar-pa-flykt-och-livet-vid-fronten/
Detaljerna som avgör presidentvalet i USA,/nyheter/laget/delstaterna-som-avgor-presidentvalet-i-usa/
Armén slår tillbaka mot Donald Trump,/nyheter/varlden/armen-slar-tillbaka-mot-donald-trumps-kampanj/
Giftig snäcka stängde populära turiststranden,/nyheter/varlden/giftiga-violsnackan-stangde-strand-pa-gran-canaria/
Miljonwhiskyn såldes på systemet: ”Väljer inte pris”,/nyheter/sverige/miljonwhisky-sald-pa-systembolaget/
"Trippelmördaren sköt Ferhat, 40, till döds",/nyheter/krim/ferhat-blev-trippelmordarens-forsta-offer/
Ryska styrkorna rycker närmare viktiga staden,/nyheter/varlden/kriget-i-ukraina-29-augusti/
Känslosamma orden om Bidens samtal,/nyheter/varlden/kamala-harris-kanslosamma-ord-om-joe-biden/
Ewa-Gun lurades av bluffsajten: ”Så dum”,/nyheter/sverige/expolisen-ewa-gun-lurad-av-bluffsajt-kande-mig-dum/
Hade sönder krukan – bjuds in till museet igen,/nyheter/varlden/fyraaring-hade-sonder-krukan-bjuds-in-till-museet-igen/
Misstänkta föremål – boende varnas,/nyheter/sverige/misstankta-foremal-i-malmo/
Ny lag: EU förbjuder populära bilbarnstolar,https://teknikensvarld.expressen.se/nyheter/konsument/eu-lag-stoppar-forsaljning-av-populara-bilbarnstolar/
Svensk svårt skadad – vittnen ville hjälpa,/nyheter/varlden/vittnen-forsokte-stoppa-attacken-i-notting-hill/
Tre allvarligt skadade efter blixtnedslaget,/nyheter/sverige/atta-skadade-efter-blixtnedslag-pa-lidingo/
Han fick polio – skräcken efter första fallet i Gaza,/nyheter/varlden/han-ar-forsta-poliofallet-i-gaza-en-chock-for-mig/
Parterna är överens om humanitär paus,/nyheter/varlden/humanitar-paus-i-gaza/
Uppmanar topparna: Sluta med krypskyttet,/nyheter/sverige/uppmanar-m-topparna-sluta-med-krypskyttet/
Militärens skarpa ord – efter Putins triumf,/nyheter/varlden/putins-triumf-militarens-varning/
Enorm brand på rysk oljedepå efter attack,/tv/nyheter/varlden/rysk-oljedepa-i-lagor-efter-ukrainsk-attack/
Polischefen som hoppade av – därför fick han nog,/nyheter/sverige/polischefen-som-hoppade-av-darfor-fick-han-nog/
JLC-stjärnornas nya planer för guldhuset,/nyheter/uthyres-hus-med-guldlage/
S-utspelet: Bli svetsare – inte Bianca Ingrosso,/nyheter/sverige/socialdemokraterna-vill-ta-kampen-mot-bianca-ingrosso/
Smittspridningen av covid-19 väntas öka,/nyheter/sverige/smittspridningen-av-covid-19-vantas-oka-i-host/
Färja tappar kontrollen – kör rakt över båtarna,/tv/nyheter/varlden/capri-farjan-tappar-kontrollen-kraschar/
Turistparadis översköljt av döda fiskar – stinker,https://www.expressen.se/tv/nyheter/varlden/turistparadiset-overskoljt-av-dod-fisk
Utan bonusar väljer tyskarna bort elbilar,https://teknikensvarld.expressen.se/nyheter/bilbranschen/elbilarna-fortsatter-tappa-i-tyskland/
Dödade sin syster – döms inte för mord,/nyheter/sverige/knivmordade-sin-syster-nu-far-han-sin-dom/
Biljätten trappar upp satsning på hybrider,https://teknikensvarld.expressen.se/nyheter/bilbranschen/hyundai-storsatsar-pa-hybrider/
IS planerade att döda tusentals Swift-fans,/nyheter/varlden/cia-de-ville-doda-tusentals-pa-swift-konsert/
Bästa bilköpen just nu – expertens tre tips,https://teknikensvarld.expressen.se/nyheter/konsument/bast-i-klassen-enligt-sanne-hansen/
Tältläger nedbrunnet – en person skadad,/nyheter/sverige/brand-i-taltlager-i-hogdalen/
Värmen försvinner – kraftigt oväder drar in,/nyheter/sverige/varmen-forsvinner-kraftigt-ovader-drar-in/
Plan tvingas nödlanda: ”Nära att träffa vår bil”,/tv/nyheter/varlden/planet-nodlandar-pa-vagen-nara-att-traffa-var-bil/
Björnen blir rasande – attackerar tränaren,/tv/nyheter/varlden/cirkusbjorn-pa-hoverboard-attackerar-tranaren/
Här flyr skytten efter mordet i Upplands-Bro,/tv/nyheter/sverige/har-flyr-skytten-efter-mordet-i-upplands-bro/
Operan agerar – solisten önskade livet ur reporter,/nyheter/sverige/kungliga-operan-agerar-solist-onskade-livet-ur-expressens-reporter/
Säpos varning – ökad risk för ryska sabotage,/nyheter/varlden/sapo-varnar-okad-risk-for-ryska-sabotage-/
Här fattar färjan eld utanför New York,https://www.expressen.se/tv/nyheter/varlden/farja-fattade-eld-utanfor-new-york
Elitens vågade sexlekar,/nyheter/hemliga-poolsexpartyt-pa-herrgarden--kvinnornas-njutning-star-i-centrum-/
”Ligger kvar livlös”,/nyheter/sverige/expressen-dok-hamburgerkungen/
Dykaren jagas för sabotaget,/nyheter/varlden/ukrainske-dykaren-volodymyr-zhuravlov-44-efterlyst-for-sprangningen-av-nord-stream/
Bluffmetoden som kändisar använder,/nyheter/sverige/bluffen-med-kandisarnas-laserbehandling-jattetragiskt/
Polisen: Han är ”Ghost”,/nyheter/sverige/polisen-sakra-efter-langa-jakten-han-ar-ghost/
