Heading,URL
Här ljuger Tucker Carlson i sin video från Moskva,/tv/nyheter/varlden/cnn-faktagranskar-tucker-carlsons-omtalade-video/
Thaituristen får nog – anfaller säkerhetsvakten,/tv/nyheter/varlden/thaituristen-far-nog-anfaller-sakerhetsvakten/
Enorm explosion skakar rysk stad,/tv/nyheter/varlden/enorm-explosion-skakar-rysk-stad/
Filmen visar brutala misshandeln efter skotten,/tv/nyheter/sverige/filmen-visar-brutala-misshandeln-efter-skotten/
Margaretas konto töms – bedragaren: Bryr mig inte,/tv/nyheter/har-toms-margaretas-konto-bedragarnas-metoder-fran-insidan/
Mörka hemligheten bakom ärvda tavlan,/tv/nyheter/varlden/arvde-tavla-nar-slakting-gick-bort-morka-hemligheten/
Teslaföraren gör det förbjudna – politiker rasar,/tv/nyheter/varlden/politikern-rasar-mot-teslaforarens-agerande/
Marcus Wandt återvänder – sista hälsningen hem,/tv/nyheter/varlden/marcus-wandt-atervander-fran-rymden-/
Barnvagn rullar mot floden – bebis hamnar i vattnet,/tv/nyheter/varlden/barnvagn-rullar-mot-floden-bebis-hamnar-i-vattnet-/
JUST NU: Iranska attentat stoppade,/nyheter/sverige/sapo-har-stoppat-flera-iranska-attentat/
JUST NU: Två saknas – och två till sjukhus,/nyheter/sverige/larm-om-explosion-prdgs/
Hon festade med kunga- familjen – knivhögg exet,/nyheter/sverige/hon-festade-med-kungafamiljen-atalas-for-mordforsok/
Myndigheterna: Ät mycket mindre kött,/nyheter/sverige/sa-ska-svenskarna--ata-enligt-nya-malen/
Kreml går emot Tucker Carlson: ”Har inte rätt”,/nyheter/varlden/kreml-gar-emot-tucker--carlson-har-inte-ratt/
Putins robotar upp i rök i stor explosion,/tv/nyheter/varlden/enorm-explosion-skakar-rysk-stad/
Tysklands krigsbeslut: ”Tagit ledartröjan i EU”,/nyheter/experterna-om-tyska--miljardstodet-till-ukraina/
Sida ökar svenska biståndet till Gaza,/nyheter/sverige/johan-forssell-sida-okar-bistandet-till-gaza/
Man tog sitt liv – efter Dumpens uthängning,/nyheter/sverige/man-tog-sitt-liv-skyller-pa-dumpens-uthangning/
285 år gammal citron har sålts på auktion,/nyheter/sverige/citron-fran-1700-talet-sald-pa-auktion-unikt/
Ilskan efter filmen – kör med nya Apple-prylen,/tv/nyheter/varlden/politikern-rasar-mot-teslaforarens-agerande/
Mörka hemligheten bakom ärvda tavlan,/tv/nyheter/varlden/arvde-tavla-nar-slakting-gick-bort-morka-hemligheten/
Turist i Thailand får nog – attackerar vakt,/tv/nyheter/varlden/thaituristen-far-nog-anfaller-sakerhetsvakten/
Fyraåring drack populära drycken – höll på att dö,/nyheter/varlden/albie-4-drack-populara-drycken-holl-pa-att-do/
Syramannens flykt längs Themsen: Kan ha hoppat,/nyheter/varlden/syramannen-abdul-ezedis-flykt-langs-themsen-kan-ha-hoppat/
Så kan Taylor Swift avgöra USA-valet,/nyheter/laget/taylor-swifts-makt--over-trump-och-biden/
60 meter högt radiotorn försvann: ”Förstår inte”,/nyheter/varlden/60-meter-hogt-radiotorn-sparlost--forsvunnet-jag-forstar-inte/
USA: Har dödat hjärnan bakom drönarattacken,/nyheter/varlden/usa-har-dodat-hjarnan-bakom-dronarattacken/
Tre ur Skistar-vd:ns familj blev mördade,/nyheter/sverige/okanda-traumat-for-skistars--vd--tre-ur-familjen-mordades/
Misshandlades brutalt efter skottlossningen,/tv/nyheter/sverige/filmen-visar-brutala-misshandeln-efter-skotten/
Här är Natos stora planer för Sverige,/nyheter/sverige/nu-testas-natos-planer-for-sverige-de-tre-kritiska-punkterna-for-forsvaret/
Kvinnornas ord – inifrån kända fängelset,https://www.expressen.se/nyheter/sverige/kvinnofangarnas-egna-ord-inifran-hinseberg/
Började som sommarjobb – nu har de 400 anställda,/nyheter/sverige/sommarjobbet-vaxte-till-en-snabbmatskedja/
Strömmer KU-anmäls igen för visitationszoner,/nyheter/sverige/strommer-ku-anmals-igen-for-visitationszoner/
Ny superjord upptäckt – finns i beboeliga zonen,/nyheter/varlden/ny-superjord-upptackt-finns-i-beboeliga-zonen/
Ryssland: Sverige rädda för att avslöja sanningen,/nyheter/varlden/ryssland-sverige-radda-for-att-avsloja-sanningen/
M-toppens chatthån: ”Mina springpojkar”,/nyheter/sverige/m-toppens-chatthan-mina-springpojkar/
”Dödstjärnan” kan ha underjordiskt hav,/nyheter/varlden/dodstjarnan-kan-ha-underjordiskt-hav/
Israel nobbar Hamas förslag till vapenvila,/nyheter/varlden/netanyahu-avvisar-hamas-forslag/
Koranbrännaren Salwan Momika utvisas till Irak,/nyheter/sverige/migrationsdomstolen-fastslar-utvisningen-av-salwan-momika-/
Planerar resa till Ungern: ”Hitta tid i almanackan”,/nyheter/varlden/kristersson-planerar-resa-till-ungern/
Natos stora planer för Sverige: Får nyckelroll,/nyheter/sverige/nu-testas-natos-planer-for-sverige-de-tre-kritiska-punkterna-for-forsvaret/
Gav behandlingen patienterna alzheimer?,/nyheter/gav-behandlingen-patienterna-alzheimer/
Här töms Margaretas konto – bedragaren: ”Bryr mig inte”,/tv/nyheter/har-toms-margaretas-konto-bedragarnas-metoder-fran-insidan/
S-kravet på regeringen: Hårdare press på banker,/nyheter/sverige/dambergs-krav-pa-regeringen-satt-press-pa-bankerna/
Svenska turisterna lider med hotellens städare,/nyheter/varlden/svenska-turisterna-lider-med-charterhotellens-stadare-pa-teneriffa/
Larmet: ”Vi känner oss som slavar”,/nyheter/varlden/larmar-pa-kanarieoarna--kanner-oss-som-slavar/
Tv-stjärnornas sågning av Carlsons Putin-skryt,/nyheter/varlden/kriget-i-ukraina-7-februari/
Marcus Wandt återvänder – sista hälsningen hem,/tv/nyheter/varlden/marcus-wandt-atervander-fran-rymden-/
Coca-Colas nya smak: ”Vill prova något nytt”,/nyheter/varlden/har-ar-coca-colas-nya-smak-/
M-toppen får stark kritik för bilder: ”Vanlig buskis”,/nyheter/sverige/toppmoderat-delade-sexistiska-bilder-star-for-det/
SJ:s vd ber om ursäkt efter vinterns tågkaos,/nyheter/sverige/sjs-vd-ber-om-ursakt--efter-vinterns-tagkaos/
Svenskarnas förtroende för kinesiska elbilar lågt,https://teknikensvarld.expressen.se/nyheter/bil-och-trafik/elbil-laddhybrid/svenskar-har-storst-fortroende-for-elbilar-fran-volvo/
Så svek samhället flickan i ättikafallet,/nyheter/sverige/sa-svek-samhallet-flickan-i-attikafallet/
Svenska utredningen om Nord stream läggs ner,/nyheter/sverige/aklagarens-besked-om-nord-stream/
Kreml bekräftar: Tucker Carlson har träffat Putin,/nyheter/varlden/kreml-tucker-carlson-har-intervjuat-putin/
Kritiken mot chefens utspel: ”Helt fel svar”,/nyheter/sverige/kritiken-mot-chefens--utspel-helt-fel-svar/
Så levde det iranska agentparet i Sverige,/nyheter/sverige/sa-levde-det-iranska-agentparet-i-sverige/
Åklagaren: Vet vad som hände,/nyheter/sverige/aklagaren-i-soderhamn-vet-vad-som-forgiftade-/
Mörk hemlighet bakom familjens ärvda tavla,https://www.expressen.se/tv/nyheter/arvde-tavla-nar-slakting-gick-bort-morka-hemligheten
Rawa Majids chattar efter mordet i Tullinge,/nyheter/sverige/fyra-personer-atalas-for-tullingemord/
Okända skotten som startade våldsvågen,https://www.expressen.se/nyheter/sverige/okanda-skotten-som-skapade-sprickan-i-foxtrot
Klarnagrundaren: Rika borde beskattas mer,/nyheter/sverige/klarnagrundaren-rika-borde-beskattas-mer/
Utredningen klar – hård kritik mot Biden,/nyheter/varlden/utredning-mot-joe-biden-klar-inget-atal-att-vanta/
Domarnas tuffa sågning av Trump,/nyheter/varlden/domstol-trump-inte-immun-mot-atal-om-uppror/
Hamas föreslår vapenvila – ska få slut på kriget,/nyheter/varlden/hamas-foreslar-vapenvila-i-135-dagar-/
Channel 4: Inga bevis för Israels anklagelser,/nyheter/varlden/chanel-4-inga-bevis-for-israels-unrwa-anklagelser/
