Heading,URL
Attack mot FN-skola i Gaza – flera döda,/tv/nyheter/varlden/attack-mot-fn-skola-i-gaza-flera-doda/
Kvinnans nonchalans efter extrema biljakten,/tv/nyheter/varlden/kvinnans-nonchalans-efter-extrema-biljakten/
Fjärås-älgen gör succé – viral över hela världen,/tv/nyheter/sverige/algen-gar-barsark-i-garaget-i-fjaras/
Plötsligt får vulkanen liv – sprutar ut ett eldinferno,/tv/nyheter/varlden/plotsligt-far-vulkanen-liv-sprutar-ut-ett-eldinferno/
Mystiska fenomenet på stranden i dykparadiset,/tv/nyheter/varlden/bisarra-videon-fran-dykparadiset-hoppande-sardiner-/
Politiker attackeras med färg,/tv/nyheter/varlden/politiker-attackeras-med-farg/
Kim Jong-un skickar artilleripjäs till Putin,/tv/nyheter/varlden/putins-nya-supervapen-mystiska-stridsfordonet/
Jake Pauls hyllning till Mike Tyson,/tv/nyheter/varlden/jake-pauls-hyllning-till-mike-tyson/
JUST NU: Stor rysk attack mot Kiev,/nyheter/varlden/stor-rysk-attack-mot-kiev/
JUST NU: Biljakt efter stulen bil,/nyheter/sverige/polisen-prejade-stulen-bil-i-helsingborg/
JUST NU: Explosion vid port på Östermalm,/nyheter/sverige/larm-om-explosion-pa-ostermalm/
”Obehagligt att det händer”,/tv/nyheter/sverige/obehagligt-att-det-hander/
Anderssons känga – efter interna kritiken,/nyheter/sverige/magdalena-anderssons-svar-pa-interna-kritiken/
Chockbetyget till Biancas goodiebag: ”Ingen gräns”,https://www.expressen.se/tv/nyheter/sverige/chockbetyget-till-biancas-goodiebag-finns-ingen-grans-
Misstanken: Tonårsliga utpressade ”pedofiler”,/nyheter/krim/misstanken-tonarsliga-jagade-pedofiler-ranade-och-utpressade/
Oron över Trumps nya försvarsminister,/nyheter/varlden/tatueringen-som-kan-bli-trumps-huvudvark/
Netflixprofil vädjar till Trump: Benåda mig,/nyheter/varlden/netflixprofil-vadjar-till-trump-benada-mig/
Körde ner i poolen – fastnar på botten,https://www.expressen.se/tv/nyheter/varlden/korde-ner-i-poolen-fastnar-pa-botten
26-åringens husköp för 189 000 – på Amazon,/nyheter/varlden/26-aringen-kopte-ett-hus-for-189-000-pa-amazon-glomde-lasa-det-finstilta/
Tonåring övningskör – kraschar in i restaurang,/tv/nyheter/varlden/tonaringen-ovningskor-kraschar-in-i-restaurangen/
Inifrån skräckfängelset – värsta av de värsta,/tv/nyheter/varlden/bilderna-inifran-skrackfangelset/
Sälja eller köpa först? Så lyckas du med bostadsaffär,/nyheter/sverige/salja-eller-kopa-forst-sa-lyckas-du-med-bostadsaffaren/
Attack mot FN-skola i Gaza – flera döda,https://www.expressen.se/tv/nyheter/varlden/attack-mot-fn-skola-i-gaza-flera-doda/
Fjärås-älgen gör succé – viral över hela världen,/tv/nyheter/sverige/algen-gar-barsark-i-garaget-i-fjaras/
Mopedist hånar polisen – gasar genom villaidyll,/tv/nyheter/sverige/vansinnesfarden-genom-villaomradet-pekar-finger-at-polisen/
Hög rysk militär sprängd i sin bil,/tv/nyheter/varlden/hog-rysk-militar-sprangd-i-sin-bil/
Här kämpar Biden för att hålla sig på benen,/tv/nyheter/varlden/bidens-osakra-steg-vacker-halsofragor/
Här knuffar rånaren 91-åringen i trappan,/tv/nyheter/har-knuffar-ranaren-91-aringen-i-trappan/
Fjärås-älgen gör succé – viral över hela världen,/tv/nyheter/sverige/algen-gar-barsark-i-garaget-i-fjaras/
Stora ryska attacken i Kursk stoppas brutalt,/tv/nyheter/varlden/stora-ryska-attacken-i-kursk-stoppas-brutalt/
Stjäl fartkameror för miljoner – filmar allt,/tv/nyheter/sverige/stjal-fartkameror-for-miljoner-filmar-allt/
Sista resterna av det första scoopet,/nyheter/sverige/rest-fran-expressens-bombplan-i-skolas-skyddsrum/
80 år med Expressen – och mycket är sig likt,/nyheter/kronikorer/klas-granstrom/80-ar-med-expressen-och-mycket-ar-sig-likt/
Avhopparen: Kims soldater kommer fly,/nyheter/varlden/avhoppare-nordkoreanska-soldater-inte-redo-/
Valpen Otis dog av ovanliga sjukdomen,/nyheter/sverige/valpen-otis-dog-av-ovanliga-sjukdomen-leptospiros/
Varnar: Flera fall av dödlig hundsjukdom,/nyheter/sverige/flera-fall-av-dodlig-hundsjukdom-i-goteborg/
Lagliga droger förbjuds – nya finns redan i butik,/nyheter/sverige/lagliga-droger-forbjuds-nya-finns-redan-i-butik/
Jägare död – fick träd över sig,/nyheter/sverige/jagare-fick-trad-over-sig/
Expertdomen om ryska krigsinsatsen: ”Uselt”,/nyheter/varlden/expertdomen-om-ryska-krigsinsatsen-uselt/
Titanic-hjältens klocka såld för rekordbelopp,/nyheter/varlden/titanic-hjaltens-klocka-sald-for-rekordbelopp/
Skott mot cockpit på passagerarplan,/nyheter/varlden/skott-mot-cockpit-pa-passagerarplan/
Här är världens bästa ost 2024,/nyheter/varlden/klubbat-har-ar-varldens-basta-ost-2024/
Lara Trumps guldläge – efter valhyllningarna,/nyheter/varlden/lara-trumps-guldlage-efter-valhyllningarna/
Bidens uppseendeväckande placering på världsledarfotot,/nyheter/varlden/bidens-uppseendevackande-placering-pa-varldsledarfotot/
Kvinnans nonchalans efter extrema biljakten,https://www.expressen.se/tv/nyheter/varlden/kvinnans-nonchalans-efter-extrema-biljakten/
Plötsligt får vulkanen liv – sprutar ut ett eldinferno,https://www.expressen.se/tv/nyheter/varlden/plotsligt-far-vulkanen-liv-sprutar-ut-ett-eldinferno/
Storbrand på Willys,/nyheter/sverige/storbrand-pa-willys-i-sundsvall/
Danmarks största julgran har vält – stod i två dagar,/nyheter/varlden/danmarks-storsta-julgran-har-valt-stod-i-tva-dagar/
Man påkörd vid bärgning i Hallsbergs kommun,/nyheter/sverige/man-pakord-vid-bargning-i-hallsbergs-kommun/
Bidens budskap till Xi om Nordkorea,/nyheter/varlden/bidens-budskap-till-xi-om-nordkorea/
Är värd 112 miljarder – utmanar häcklare vid Lidl,/nyheter/varlden/ar-vard-112-miljarder-utmanar-hacklare-vid-lidl/
Fjärås-älgen gör succé – viral över hela världen,https://www.expressen.se/tv/nyheter/sverige/algen-gar-barsark-i-garaget-i-fjaras/
Trump väljer oljechef till energiminister,/nyheter/varlden/trump-valjer-oljechef-till-energiminister/
Hotade sina slavar med bombbälte,/nyheter/sverige/hon-motte-utpekade-slavagarens-blick-i-ratten/
Snösmocka på väg: ”Händelserikt väder”,/nyheter/sverige/lagtryck-pa-vag-in-handelserikt-vader/
Bakslag för Tesla – nobbas av HD,/nyheter/sverige/bakslag-for-tesla-hd-tar-inte-upp-overklagan/
Norske miljardären Olav Thon är död,/nyheter/sverige/norsk-miljardar-dod-blev-101-ar/
Mystiska fenomenet på stranden i dykparadiset,https://www.expressen.se/tv/nyheter/varlden/bisarra-videon-fran-dykparadiset-hoppande-sardiner-/
Kastar färg mitt i politikerns ansikte,https://www.expressen.se/tv/nyheter/varlden/politiker-attackeras-med-farg
SMHI varnar för ishalka: ”Förrädisk”,/nyheter/sverige/kallare-vader-intar-sverige-smhi-varnar/
Delar av fasaden föll från hus: ”Panik”,/nyheter/sverige/fasadplattor-foll-fran-hus-i-centrala-stockholm/
Räddades från bråk – sen hittades han död,/nyheter/sverige/larmen-fore-dodskorningen-pa-e18/
Tonåring övningskör rakt in i restaurang,https://www.expressen.se/tv/nyheter/varlden/tonaringen-ovningskor-kraschar-in-i-restaurangen
Musk: Genier – kom hit och jobba gratis,/nyheter/varlden/musk-genier-kom-och-jobba-gratis/
Orbáns stöd till Putin: Riktar känga mot EU,https://www.expressen.se/tv/nyheter/varlden/orban-kanga-till-eu-hav-ryska-sanktioner
Ebba Busch: Se över invandrares rösträtt,/nyheter/sverige/busch-se-over-invandrares-rostratt-i-kommun--och-regionval/
Polisens rivstart – miljonbeslagen,/nyheter/sverige/miljonbeslag-pa-bara-en-vecka-med-nya-lagen/
Musk stämmer Microsoft – fruktar konkurrensen,/nyheter/varlden/elon-musk-stammer-microsoft/
Messis nya energidryck – en kopia av succén?,/nyheter/varlden/messis-mas-plus-stammer-prime-energidrycksbraket/
"Vad hände då Molly, 14, dog?",/nyheter/sverige/mollys-hemlighet-sista-festen-som-tar-hennes-liv/
Varningen: ”De här däcken är livsfarliga”,/tv/nyheter/sverige/nya-vinterdacksregeln-sa-undviker-du-korforbud/
Namnbytet efter ilskan,/nyheter/sverige/jag-ar-hatad-for-fan-av-halva-sverige/
