Heading,URL
Melanias iskalla blick efter skämtet,/tv/nyheter/varlden/skamtet-som-far-melania-trump-att-rodna/
Döv man nedslagen – elchockas av polis,/tv/nyheter/varlden/dov-man-nedslagen-elchockas-av-polis/
Historiskt beslut i Texas – avrättning skjuts upp,/tv/nyheter/varlden/historiskt-beslut-i-texas-avrattning-skjuts-upp/
Kärleksakt på station orsakar översvämning,/tv/nyheter/varlden/karleksakt-pa-tagstation-orsakar-oversvammning-/
Ilskan mot Putin: ”Bakom våra ryggar”,/tv/nyheter/ilskan-mot-putin-bakom-vara-ryggar/
Låtsades leta gasläcka – dolde mörk sanning,/tv/nyheter/varlden/latsades-leta-gaslacka-dolde-mork-sanning/
Märklig röst hörs i SVT: ”Uppenbart fel”,/tv/nyheter/sverige/plotsligt-dyker-rosten-upp-i-svt-sandningen/
Kraschade in i lastbil full med fyrverkerier,/tv/nyheter/varlden/kraschade-in-i-lastbil-full-med-fyrverkerier/
JUST NU: Explosion i Beirut,/nyheter/varlden/explosion-i-beirut-efter-maning-att-evakuera/
Segervapnet som Trump hoppas på: ”Rädda städerna”,/nyheter/varlden/trump-tror-att-invandringen-blir-segervapen-aven-2024/
Tar över ledning inför USA-valet,/nyheter/varlden/ny-prognos-har-tagit-over-ledningen-infor-usa-valet/
Skottlossning mot flera lägenheter,/nyheter/sverige/larm-om-smallar-i-fittja-7qcan/
Har inte varit på jobbet på 19 år – får sparken,/nyheter/sverige/kvinna-har-inte-varit-pa-jobbet-pa-19-ar-far-sparken/
Förfallet i New York,/nyheter/varlden/forfallet-i-new-york-folk-har-inte-ens-skor/
Jag blir skraj – känner inte längre igen USA,/nyheter/varlden/jag-blir-skraj-kanner-inte-langre-igen-usa/
Försöker smita från notan – urartar totalt,https://www.expressen.se/tv/nyheter/varlden/forsoker-smita-fran-notan-urartar-totalt
De åt av förgiftade kakorna – berättar,/nyheter/sverige/mohamed-och-asaad-at-av-forgiftade-kakorna/
Sjukhusets svar om förgiftade familjen,/nyheter/sverige/sjukhusets-svar-familjen-forgiftad-av-hasch/
”Död” donator vaknade när hjärtat skulle tas ut,/nyheter/varlden/dod-donator-vaknade-nar-hjartat-skulle-tas-ut/
Esther sörjde döde maken – då kom chockbeskedet,/nyheter/varlden/esther-sorjde-dode-maken-da-kom-chockbeskedet/
"Teodor, 11, attackerad av björn – pappans ord",/nyheter/sverige/bjorn-attackerade-pappa-och-son-i-edsbyn/
Fem svenskar häktade i Finland,/nyheter/sverige/fem-svenskar-haktade-i-finland/
Trump om Xi: ”Vet att jag är galen”,/nyheter/varlden/trump-om-xi-vet-att--jag-ar-fucking-galen/
Skrev under upprop – blev mångmiljonär,/nyheter/varlden/john-skrev-under-musks-upprop-blev-mangmiljonar/
Ryssland rycker fram – områden evakueras,/nyheter/varlden/ryssland-rycker-fram-omraden-evakueras/
Grov misshandel – en till sjukhus,/nyheter/sverige/grov-misshandel-i-eslov-man-ford-till-sjukhus/
Stulna Vinted-bilder användes på sexsajt,/nyheter/varlden/stulna-vinted-bilder-anvandes-pa-sexsajt/
Nekade gäst på Burger King – blev följd av gäng,/nyheter/sverige/nekade-gast-pa-burger-king-blev-foljd-av-gang/
Återvände gravid från sin mammaledighet – sparkades,/nyheter/varlden/atervande-gravid-fran-sin-mammaledighet-sparkad/
Här flyger drönaren mot Netanyahus hus,/tv/nyheter/varlden/har-flyger-dronaren-mot-netanyahus-hus-/
Videoklippet på Sinwars död – propagandavapen,/nyheter/varlden/irans-ayatolla-hamas-overlever-sinwars-dod/
Bil har kört in i ett skyltfönster,/nyheter/sverige/bil-har-backat-in-i-skyltfonster-i-stockholm/
Trumps hyllning till hustrun Melania,/nyheter/varlden/trumps-hyllning-till-hustrun-melania/
Kropp föll ut på gatan ur en begravningsbil,/nyheter/varlden/kropp-foll-ut-pa-gatan-ur-en-begravningsbil/
IS-anhängare gripen – ska ha planerat attack,/nyheter/varlden/is-anhangare-gripen-ska-ha-planerat-attack/
Åtta till sjukhus: ”Tänts eld på flera platser”,/nyheter/sverige/larm-om-brand--i-flerbostadshus/
Expertens krigslösning: ”Inför en 'no fly'-zon”,/nyheter/varlden/expertens-krigslosning--infor-en-no-fly-zon/
Tre misstänks – 11 barn hölls gömda,/nyheter/sverige/elva-barn-misstanks-ha-hallits-gomda-av-trio/
Bästa knepen för att klara högskoleprovet,https://www.expressen.se/tv/nyheter/sverige/geniets-utmaning-ett-hogskoleprov-fran-1977
Äger elva bandvagnar – efter försvinnandet,/nyheter/sverige/foreningen-ager-elva-bandvagnar/
Mysteriet i Skåne: 70 militärfordon är borta,/nyheter/sverige/mysteriet-i-skane-70-militarfordon-ar-borta/
Varningen till Andersson: ”Kommer att förlora valet”,/nyheter/sverige/kritiken-vaxer-inom-s-andersson-varnas/
Mordmisstänkta mamman ger sin version: ”Ett offer”,/nyheter/krim/mordmisstankta-mamman-ger-sin-version-ett-offer/
Avbryter direkt när han inser varför alla buar,https://www.expressen.se/tv/nyheter/varlden/avbryter-talet-inser-varfor-alla-buar
Detaljerna bakom Hamasledarens död,/nyheter/varlden/slumpartade-motet-detaljerna-bakom-hamasledarens-dod/
Experten: Tre scenarier på vad som kan hända,/tv/nyheter/varlden/experten-tre-scenarier-pa-vad-som-kan-handa/
Fångar Sinwars sista sekunder före döden,/tv/nyheter/varlden/videon-visar-hamasledarens-yahaya-sinwars-sista-sekunder-i-livet-/
Kvinna i 30-årsåldern gripen för mordförsök,/nyheter/sverige/grovt-valdsbrott-i-gavle/
Trumps raseri efter hånet om tröttheten,/nyheter/varlden/trumps-ilska-efter-harris-han-om-trottheten/
Utspelet som fick Trump att ilskna till,/tv/nyheter/varlden/orden-som-fick-trump-att-ilskna-till/
Bilderna inifrån Ryssland – som Putin ville stoppa,https://www.expressen.se/tv/nyheter/varlden/filmen-uppges-visa-nordkoreanska-trupper-i-ryssland
Epa i krock med taxi – tonårsflicka gripen,/nyheter/sverige/epatraktor-krockade-med-taxi/
Egna orden efter bråket i P4: ”Utsattes för drev”,/nyheter/sverige/brandao-jonssons-egna-ord-om-p4-braket-/
Här öppnas ett nytt kontor för mönstring,/nyheter/sverige/snart-mojligt-att-monstra-i-umea/
Fick bensin på sig – började brinna,/nyheter/sverige/tva-svart-brannskadade-i-lilla-edet/
Terrormisstänkt flögs från Sverige,/nyheter/sverige/terrormisstankt-flogs-fran-sverige-i-hemlig-insats/
Dadgostar stoppas från Judiska rådets gästlista,/nyheter/sverige/judiska-centralradet-nobbar-nooshi-dadgostar/
Man död efter olycka – klämdes av kran,/nyheter/sverige/larm-om-olycka-en-fastklamd/
Pehrson öppnar för totalt vinststopp för friskolor,/nyheter/sverige/pehrson-oppnar-for-totalt-vinststopp-for-friskolor/
Skott mot lägenhet i södra Stockholm,/nyheter/sverige/skott-mot-lagenhet-i-arsta/
Kinesisk drönarjätte stämmer Pentagon,/nyheter/varlden/kinesisk-dronarjatte-stammer-pentagon/
"John-Gilbert, 24, har trattbröst-diagnos",/nyheter/sverige/john-gilbert-24-om-okanda-diagnosen-visste-inte-att-jag-hade-det/
Trumps märkliga ord: Inga kor med Harris,/nyheter/varlden/trumps-markliga-ord-inga-kor-med-harris/
"Vad hände då Molly, 14, dog?",/nyheter/sverige/mollys-hemlighet-sista-festen-som-tar-hennes-liv/
Svaret om lyxlivet: ”Kära någon”,/nyheter/sverige/revisorns-svar-om-bella-nilssons-lyxliv-ah-kara-nagon/
Sexjakten på författarna,/nyheter/sverige/oanstandiga-inviterna-sa-jagas-forfattarna/
Dykaren jagas för sabotaget,/nyheter/varlden/ukrainske-dykaren-volodymyr-zhuravlov-44-efterlyst-for-sprangningen-av-nord-stream/
Miljonlöner på Northvolt,/nyheter/sverige/sa-mycket-tjanar-northvolt-topparna/
