Heading,URL
Avfyra granatkastare under brottningsmatch,/tv/nyheter/varlden/rakar-avfyra-granatkastaren-mitt-under-brottningsmatchen/
Hundens oväntade drag mitt i fyrverkeriet,/tv/nyheter/varlden/hundens-ovantade-reaktion-bar-ivag-de-smallande-fyrverkerierna/
Tårögd kvinna stjäl scenen från Trump,/tv/nyheter/varlden/tarogd-kvinna-stjal-scenen-fran-trump-alskar-dig/
Planet stank – tvingades vända: ”Nära att kvävas”,/tv/nyheter/varlden/planet-tvingas-vanda-pa-grund-av-stank-nara-att-kvavas/
"Ana, 40, försvann – svenska vännens oro",/tv/nyheter/sverige/svenska-vannens-oro-jag-ar-helt-forkrossad/
Kristerssons skratt efter frågan om Nato,/tv/nyheter/sverige/kristerssons-skratt-efter-fragan-om-nato/
Vilda polisjakten mitt i centrum – polisen döms,/tv/nyheter/sverige/vilda-polisjakten-mitt-i-centrum-polisen-doms/
"Vilgot, 11, kan härma 20 fåglar",/tv/nyheter/vilgot-11-kan-harma-20-faglar/
Soldaterna beskjuts – omringade av ryssar,/tv/nyheter/varlden/soldaterna-beskjuts-omringade-av-ryssar/
Färre förseningar än Sverige – trots kriget,/nyheter/sverige/ukraina-har-farre-tagforseningar-an-sverige-trots-kriget/
Stora oenigheten om järnvägens framtid,/nyheter/sverige/stora-oenigheten-om-jarnvagens-framtid/
Mystiska natten före hans död: ”Tumult”,/nyheter/varlden/mystiska-natten-fore-navalnyjs-dod-tumult/
Navalnyjs sista tid i ökända fängelset,/nyheter/varlden/navalnyjs-sista-tid-i-okanda-fangelset/
Tårögd kvinna stjäl scenen från Trump,/tv/nyheter/varlden/tarogd-kvinna-stjal-scenen-fran-trump-alskar-dig/
"Är du smartare än Vilgot, 11?",/tv/nyheter/vilgot-11-kan-harma-20-faglar/
Mätningen där Joe Biden krossar Donald Trump,/nyheter/varlden/matningen-dar-joe-biden-krossar-donald-trump/
Maskin får tag i tröjan – blir värre och värre,https://www.expressen.se/tv/nyheter/varlden/traningspasset-gar-sa-fel-pa-sekunder-ny-radsla-upplast
Vann 376 miljoner kronor – går miste om pengarna,/nyheter/varlden/lottovinnare-missade-att-hamta-ut-vinst-pa-376-miljoner/
Fejkade sjukdom – lurade till sig miljoner,/nyheter/sverige/fejkade-sjukdom-lurade-till-sig-miljoner/
Avfyrar granatkastaren under brottningsmatch,/tv/nyheter/varlden/rakar-avfyra-granatkastaren-mitt-under-brottningsmatchen/
Hon pekas ut som Putins älskarinna,/nyheter/varlden/jekaterina-mizulina-pekas-ut--som-putins-nya-alskarinna/
Ulf Kristersson: ”Då är man inte en bra förälder”,/nyheter/sverige/ulf-kristersson-da-ar--man-inte-en-bra-foralder/
Uppgifter i Ungern om Natoavtal med Sverige,/nyheter/varlden/uppgifter-i-ungern-om--natoavtal-med-sverige/
Hundens oväntade drag mitt under fyrverkeriet,/tv/nyheter/varlden/hundens-ovantade-reaktion-bar-ivag-de-smallande-fyrverkerierna/
Efterträdarna: De pekas ut som nästa partiledare,/nyheter/sverige/eftertradarna-de-pekas--ut-som-nasta-partiledare/
”Kan man spara 10 000 på en resa är det ju bra”,/nyheter/sverige/familjerna-som-sparar-in--tusenlappar-pa-fjallresan/
Finska knepen: Maxa elbilen under vintern,https://teknikensvarld.expressen.se/nyheter/konsument/finska-knepen-sa-overlever-elbilen-i-kylan/
Skyttedal lämnar KD – attacken mot Busch,/nyheter/sverige/sara-skyttedal-lamnar-kristdemokraterna-attacken-mot-busch/
Pensionär lurad på 50 miljoner,/nyheter/sverige/jobbar-med-romsk-inkludering-atalas-for-grovt-penningtvattbrott/
Okända hjältarna vid branden på Liseberg,/nyheter/sverige/okanda-hjaltarna-vid-branden--i-oceana-pa-liseberg-/
"Maria, 46, sköts på cykelbanan: ”Varför”",/nyheter/sverige/maria-46-skots-pa--cykelbanan-varfor/
Rysslands hotfulla utspel om Svalbard,/nyheter/varlden/nya-hotfulla-utspelet-fran-ryssland-om-svalbard/
Tysk rymdchef larmar: ”Inget skulle överleva”,/nyheter/varlden/tysk-rymdchef-larmar--inget-skulle-overleva/
Mördades när de försökte frita tillfångatagen familj,/nyheter/varlden/poliser-i-minnesota-mordades-nar-de-forsokte-radda-tillfangatagen-familj/
Israel: FN-anställd släpar in skjuten i bil,/nyheter/varlden/israel-fn-anstalld-slapar-in-skjuten-israel-i-bilen/
Putins drag: Bjuder Hamas till Moskva,/nyheter/varlden/putins-nya-drag-bjuder-in-hamas-till-moskva/
Soldaten: ”Så spränger du en moské”,/tv/nyheter/varlden/israeliska-soldaterna-driver-med-kriget-pa-sociala-medier/
Man död i trapphus: ”Många frågetecken”,/nyheter/sverige/misstankt-mord-i-sodertalje/
"Ana, 40, försvann – svenska vännens oro",https://www.expressen.se/tv/nyheter/sverige/svenska-vannens-oro-jag-ar-helt-forkrossad
Notre-Dame snart färdig fem år efter jätteinfernot,/nyheter/varlden/notre-dame-snart-fardig--fem-ar-efter-jatteinfernot/
Wandts mamma: Sökte astronauter – var för tidigt,/tv/nyheter/varlden/marcus-wandts-mamma-har-en-rymddrakt-hemma/
Välkomstkyssen – eskorterades av Jas,/nyheter/sverige/marcus-wandt-har-landat-i-sverige-kyssen-med-frun/
Åklagaren slår hål på Olof Gustafssons plan,/nyheter/sverige/aklagaren-slar-hal-pa-olof-gustafssons-plan/
Olof Gustafssons nya taktik: Erkänner brott,/nyheter/varlden/olof-gustafssons-nya-taktik-erkanner-brott/
Hittade kryphål – bodde gratis på hotell i fem år,/nyheter/varlden/hittade-kryphal-bodde-gratis-pa-hotell-i-fem-ar/
Vild polisjakt i centrum – pojke vägrade stanna,/tv/nyheter/sverige/vilda-polisjakten-mitt-i-centrum-polisen-doms/
Överfulla fängelser kan öka terrorhotet i Sverige,/nyheter/sverige/risken-med-overfulla-fangelser-okat-terrorhot-/
Livet som vilde: ”Ingen hälsar – man blir paria”,/nyheter/sverige/livet-som-politisk-vilde-ingen--halsar-man-blir-paria/
USA:s vädjan för att stoppa rymdvapnet,/nyheter/varlden/antony-blinkens-vadjan-for-att-stoppa-ryska-rymdvapnet/
Efter brutala kraschen – hittar bebis i baksätet,/tv/nyheter/varlden/dramatiska-videon-raddar-bebis-efter-valdsam-krasch/
"Är du smartare än Vilgot, 11 år?",https://www.expressen.se/tv/nyheter/vilgot-11-kan-harma-20-faglar
Spåret: Inferno i Belgien liknar Oceanabranden,/nyheter/sverige/belgiska-branden-kan-bli-intressant-i-utredningen/
Byggledaren Patrik dog i jättebranden,/nyheter/sverige/byggledaren-patrik-gillholm--dod-i-branden-pa-liseberg/
Lisebergs nya beslut – Oceana ska byggas,/nyheter/sverige/oceana-ska-byggas-upp-igen/
Wandts oväntade utmaning i rymden,/tv/nyheter/sverige/efter-rymdresan-har-atervander-marcus-wandt-till-sverige/
Skönhetsklinikernas bluff – använder ”spökkirurger”,/nyheter/varlden/skonhetsklinikernas-bluff-anvander-spokkirurger/
"Ana, 40, försvann efter infekterad skilsmässa",/nyheter/varlden/ana-40-forsvunnen-efter-att-kameror-saboterades/
Miljardärens försvar: Luktar jante lång väg,/nyheter/sverige/miljardaren-victor-jacobssons-forsvar-luktar-jante-lang-vag/
Trump lanserar skor – efter miljardboten,/nyheter/varlden/trump-lanserar-skor-efter-miljardboten/
Blodigt kadaver hittat utanför Victorias slott,/nyheter/sverige/halvatet-radjurskadaver-utanfor-victorias-slott/
Man dödad av lejon på zoo: ”Gick till attack”,/nyheter/varlden/man-dodad-av-lejon-pa-zoo-gick-till-attack/
Ny kritik mot Berne: ”Bristande omdöme”,/nyheter/sverige/ivo-kritiserar-fredrik-berne-efter--operationer-bristande-omdome/
Svensk i 20-årsåldern död i Grekland – UD bekräftar,/nyheter/sverige/svensk-man-dod-i-grekland/
Grovt sexualbrott utomhus – avspärrat,/nyheter/sverige/polisinsats-i-malmo-omrade-avsparrat/
Trump reagerar starkt på golfbilden: ”Fejknyheter”,/nyheter/varlden/trump-reagerar-starkt-pa--golfbilden-fejknyheter/
Så ska Trump ha råd att betala miljarderna,/nyheter/varlden/sa-kan-donald-trump-betala-sina-miljardboter/
Viktor Orbán: ”Konflikten med Sverige snart löst”,/nyheter/varlden/ungern-kan-godkanna-sverige-nar-parlamentet-oppnar/
El-Haj: ”Är en skam att inte Sverige kritiserar”,/nyheter/sverige/just-nu-el-haj-fran-scen-apartheidregim/
”Jag är här för de barn som dött”,/tv/nyheter/sverige/uppmaningen-till-politikerna-se-barnen-i-gaza/
Ryska rymdvapnet som sätter skräck i hela USA,/nyheter/varlden/ryska-rymdvapnet-som-satter-skrack-i-usa/
