Heading,URL
Märkliga olyckan i svenskparadiset,/tv/nyheter/varlden/mardrommen-i-svenskparadiset-bilen-ramlar-av-farjan/
Snabba beslutet när jordbävningen slår till,/tv/nyheter/varlden/snabba-beslutet-nar-jordbavningen-slar-till/
Glasdörren gick sönder – kvinnan får 370 miljoner,/tv/nyheter/varlden/glasdorren-gick-sonder-kvinnan-far-370-miljoner/
Efter bajsattacken – får inget skadestånd,/tv/nyheter/sverige/efter-bajsattacken-spotify-far-inget-skadestand/
Ilskan efter turisternas framfart: ”Hög med skit”,/tv/nyheter/varlden/ilskan-mot-turister-och-influencers-hog-med-skit/
Mamman gömde kokain i sina barns ryggsäckar,/tv/nyheter/varlden/mamman-gomde-kokain-i-sina-barns-ryggsackar/
Landskapsarkitekten ser rött när tjuven flyr,/tv/nyheter/varlden/landskapsarkitekten-ser-rott-nar-tjuven-flyr/
Ny massiv rysk attack stoppad av Ukraina,/tv/nyheter/varlden/ny-massiv-rysk-attack-stoppad-av-ukraina/
Här avbryts Ulf Kristersson på Studentafton i Lund,/tv/nyheter/sverige/har-avbryts-ulf-kristersson-pa-studentafton-i-lund/
JUST NU: E4 avstängd,/nyheter/sverige/lastbilar-i-krock-e4-avstangd-i-hudiksvall/
JUST NU: Bil och lastbil i krock på E45 – en till sjukhus,/nyheter/sverige/bil-och-lastbil-i-krock-pa-e45-en-till-sjukhus-i-saffle/
Slår tillbaka mot interna kritiken: Jag städade ur,/nyheter/sverige/nooshi-dadgostar-vi-ar-ett-radikalare-parti-i-dag/
Så kan Putin straffa de utpekade terroristerna,/nyheter/varlden/sa-kan-putin-straffa-de--utpekade-terroristerna/
Glasdörr går sönder – hon får 370 miljoner,/tv/nyheter/varlden/glasdorren-gick-sonder-kvinnan-far-370-miljoner/
Miljardärssonen kan gömma förmögenhet,/nyheter/varlden/experter-putinvannens-son--gommer-en-formogenhet/
Ilskan kokar på Kanarieöarna,/nyheter/varlden/kanarieoarna-kokar-av-ilska-vi-har-inget-val/
Kungaadvokatens brev för att rädda sig själv,/nyheter/sverige/kungajuristens-brevvaxling-om-brottsliga-anklagelser/
Kinberg Batra tog in vännen på toppjobb,/nyheter/sverige/kinberg-batra-tog-in-van-jobb-lades-aldrig-ut/
Elefanten dök upp från ingenstans – turist död,https://www.expressen.se/tv/nyheter/varlden/elefanten-dok-upp-fran-ingenstans-en-turist-dod
Testa valkompassen: Vem ska du rösta på?,/nyheter/varlden/valkompass-eu-val-2024-testa-sjalv-vilket-parti-ska-du-rosta-pa-den-9-juni/
Ännu mer snö – risk för nya trafikproblem,/nyheter/sverige/smhi-utokar-snovarning/
Israel öppnar gränsen – efter Joe Bidens hot,/nyheter/varlden/israel-ska-oka-stod-till-gaza-oppnar-overgang/
Myndighet anmäler ”trotsig” anställd,/nyheter/sverige/forsakringskassan-anmaler-trotsig-anstalld/
Strandhäll vädjar till Ulf Kristersson: Sätt stopp,/nyheter/sverige/strandhalls-uppmaning-till-kristersson-satt-stopp/
”Gå inte längre. Stanna” – tecknen från gränsen,/nyheter/varlden/pa-andra-sidan-bron-star-ryssen-och-kikar-pa-oss/
Här kan Putin inleda tredje världskriget,/nyheter/varlden/har-kan-putin-inleda-tredje-varldskriget/
Larmet: Frontlinjen riskerar att kollapsa,/nyheter/varlden/larmet-frontlinjen-riskerar-att-kollapsa/
Sonen i tårar – pappan dog i ryska attacken,/tv/nyheter/varlden/sonens-tarar-pappan-dodades-i-attacken-mot-charkiv/
Skrytövning gick snett framför Kim Jong-Un,/nyheter/varlden/skrytovning-gick-snett-framfor-kim-jong-un/
De tjänade miljarder på våra sjuka husdjur,/nyheter/sverige/riskkapitalister-tjanade--miljarder-pa-sjuka-djur/
Juhas okända änka: ”Det var mitt helvete”,/nyheter/sverige/juha-valjakkalas-okanda--anka-det-var-mitt-helvete/
Sällskapet misstänkt för ännu en springnota,/nyheter/sverige/springnota-pa-40-000-bengt-litade-pa-folk/
Skolskyttens ord i förhör – ångrar sig,/nyheter/varlden/skolskyttens-ord-i--forhor-angrar-sig-/
Filmar när tolvåringen grips efter skoldådet,/tv/nyheter/varlden/minderarig-gripen-efter-skolskjutningen/
Koranbrännaren gripen – ska utvisas till Sverige,/nyheter/sverige/koranbrannaren-salwan-momika-gripen-i-norge/
”Nekas förlängning – Sverige har svikit mig”,/tv/nyheter/sverige/salwan-momika-sverige-har-svikit-mig/
Yxman gripen efter attack mot två bilar,/nyheter/yxman-anfoll-flera-bilar-i-halmstad/
Märklig olycka får alla passagerare att häpna,https://www.expressen.se/tv/nyheter/varlden/mardrommen-i-svenskparadiset-bilen-ramlar-av-farjan
Misstänks för springnota – kan ha begått fler brott,/nyheter/sverige/misstankta-for-springnota-begars-haktade-for-nya-brott/
Trumps dubbelsmäll – nobbas av domstolarna,/nyheter/varlden/donald-trumps-dubbelsmall-i-domstolarna/
Vändningen för Biden – här krossar han Trump,/nyheter/varlden/vandningen-for-biden-krossar-i-pennsylvania/
Klimataktivist gavs jobb med säkerhetsklassning,/nyheter/sverige/klimataktivist-gavs-jobb-med-sakerhetsklassning/
Getter invaderar italiensk ö – bjuds ut för adoption,/nyheter/varlden/getter-invaderar-italiensk-o-bjuds-ut-for-adoption/
Därför ska månen få en egen tidszon,/nyheter/varlden/darfor-ska-manen-fa-en-egen-tidszon-/
Putinvännen under hård press efter terrordådet,/nyheter/varlden/snaran-kring-putinvannen-och-crocusagaren-dras-at/
Putins misstag gjorde massakern möjlig,/nyheter/varlden/putins-odesdigra-misstag--gjorde-massakern-mojlig/
Källor: Spotify planerar att höja sina priser i år,/nyheter/varlden/kallor-spotify-hojer-sina-priser-i-ar/
Efter bajsattacken – får inget skadestånd,/tv/nyheter/sverige/efter-bajsattacken-spotify-far-inget-skadestand/
Svensk kvinna mördad i Norge – man gripen,/nyheter/varlden/svensk-kvinna-mordad-i-norge/
Fel på danskt militärfartyg – riskerade avfyra robot,/nyheter/varlden/robotfel-pa-dansk-fregatt-sjofarten-stangs-ner/
Flyktingmiljonären har begärts häktad,/nyheter/sverige/leif-ivan-karlsson-63-begars-haktad/
Ryska ilskan mot Sverige: ”Likgiltigt”,/nyheter/sverige/ryska-ud-stockholm-visar-fullstandig-likgiltighet/
Jan Emanuel deltog när Skyttedals parti grundades,/nyheter/sverige/jan-emanuel-deltog-nar-skyttedals-parti-grundades/
Jan Emanuel har hittat hem: ”Är white trash”,/nyheter/varlden/pa-gran-canaria-har-jan-emanuel--hittat-hem-jag-ar-white-trash/
Malmöpolisens nya superdrönare testas,/tv/nyheter/sverige/sa-ska-polisen-jaga-kriminella-med-dronare/
Hatet mot ungdomarna i epa: ”De pekar finger”,/nyheter/sverige/unga-vill-kora-fortare-an-30-alla-andra-blir-sa-sura/
De vill att A-traktorer ska få köra snabbare,/nyheter/sverige/partierna-som-vill-hoja-hastigheten-for-epatraktor/
Ättiksfallet: Hör flickans föräldrar försvara sig,/nyheter/sverige/attiksfallet-hor-flickans-foraldrar-forsvara-sig/
Begagnade elbilar fortsätter falla i pris,https://teknikensvarld.expressen.se/nyheter/bilbranschen/begagnade-elbilar-fortsatter-falla-i-pris/
26 personer till sjukhus efter besök på badhus,/nyheter/sverige/badhus-utrymt-tva-till-sjukhus/
Ilskan efter turisternas framfart: ”Hög med skit”,https://www.expressen.se/tv/nyheter/varlden/ilskan-mot-turister-och-influencers-hog-med-skit
Mamman gömde kokain i sina barns ryggsäckar,https://www.expressen.se/tv/nyheter/varlden/mamman-gomde-kokain-i-sina-barns-ryggsackar
Dadgostars uppmaning: ”Ser ut att vara folkmord”,/nyheter/varlden/v-kravet-arresteringsorder-mot-netanyahu/
Uppgifter: AI-verktyg pekar ut Israels mål,/nyheter/varlden/uppgifter-ai-verktyg-pekar-ut-hamas-mal-at-israel/
Kändiskock: ”De visste att det var våra bilar”,/nyheter/varlden/kandiskocken-visste--att-det-var-vara-bilar/
Landskapsarkitekten ser rött när tjuven flyr,https://www.expressen.se/tv/nyheter/varlden/landskapsarkitekten-ser-rott-nar-tjuven-flyr
Sverige: Vi vill inte ha hem Olof Gustafsson,/nyheter/varlden/sveriges-svar-till-spanien-vill--inte-ha-hem-olof-gustafsson/
Trycktes framför lastbil i 100 meter: ”Skiträdd”,/nyheter/sverige/gosta-74-trycktes-framfor-lastbil-i-100-meter-skitradd/
Misstänks ha kört ihjäl pojke: ”Väldigt ledsen”,/nyheter/sverige/misstanks-ha-kort-ihjal-pojke-valdigt-ledsen/
Här avbryts Kristersson – man förs ut skrikande,https://www.expressen.se/tv/nyheter/sverige/har-avbryts-ulf-kristersson-pa-studentafton-i-lund
Bluffartiklar sprids i Expressens namn,/nyheter/sverige/bluffartiklar-sprids-i-expressens-namn-/
