Heading,URL
Listiga svaret på Putin påstående,/tv/nyheter/varlden/tillbaka-kakan-mot-putin-pa-toppmotet/
Här stormar polisen ryska nattklubben,/tv/nyheter/varlden/har-stormar-polisen-gayklubbarna-i-moskva/
Ryska soldaten träffar – sen inses misstaget,/tv/nyheter/varlden/ryska-soldaten-traffar-sen-inses-misstaget/
"Barnbarnet Kai visar
Trumps lyxjet inifrån",/tv/nyheter/varlden/barnbarnet-kai-visar-trumps-lyxjet-inifran/
"Vd:n efter branden på
Skansen: ”1200 grader”",/tv/nyheter/sverige/vdn-efter-branden-pa-skansen-1200-grader/
Trump och Musk rockar loss – Barrons reaktion,/tv/nyheter/varlden/trump-och-musk-rockar-loss-barrons-reaktion/
Putins oro för Trump: ”Inte säker”,/tv/nyheter/varlden/putins-oro-for-trump-inte-saker/
"Nytt jättetåg – svenska
bandvagnar till Ukraina",/tv/nyheter/varlden/nytt-jattetag-svenska-bandvagnar-till-ukraina/
JUST NU: Man död efter brand,/nyheter/sverige/person-hamtad-av-rokdykare/
Putins nya jobb till ökända agenterna,/nyheter/varlden/putins-agenter-som-leder-attacken-mot-vastvarlden/
Drönaren jagar ikapp Kim Jong-uns vapen,/tv/nyheter/varlden/dronaren-jagar-ikapp-kim-jong-uns-vapen/
Förtroendet rasar: ”Hel del skandaler”,/nyheter/sverige/fortroendet-for-dadgostar-rasar-efter-skandalerna-/
Spanska draget mot turisterna – nya lagen,/nyheter/sverige/spanska-draget-mot-turisterna-nya-lagen/
Modell sköt ihjäl sin make i lyxbostaden,/nyheter/varlden/modellen-skot-ihjal-sin-make-i-lyxlagenheten-/
Nya uppgifterna – om Putins hemliga dotter,/nyheter/varlden/uppgifter-putins-hemliga-dotter-jobbar-som-dj/
Trump och Musk öser på – Barrons reaktion,https://www.expressen.se/tv/nyheter/varlden/trump-och-musk-rockar-loss-barrons-reaktion
Här stormar polisen ryska nattklubbar,/tv/nyheter/varlden/har-stormar-polisen-gayklubbarna-i-moskva/
Listiga svaret på Putins påstående,/tv/nyheter/varlden/tillbaka-kakan-mot-putin-pa-toppmotet/
Hotet från Trumps FBI-val: ”Jaga er”,/nyheter/varlden/donald-trump-valjer-kash-patel-som-ny-fbi-chef/
Mammans hårda ord om sin son,/nyheter/varlden/mammans-mejl-om-pete-hegseth-utnyttjat-kvinnor-i-aratal/
Släktingen nomineras till viktig ambassadör,/nyheter/varlden/donald-trump-nominerar-charles-kushner-till-ambassador-i-frankrike/
"Lasse, 64, hittades död i sopbehållare",/nyheter/sverige/lasse-64-dog-i-arbetsplatsolycka-pa-renova-i-goteborg/
Explosion vid fastighet – bombskyddet inkallat,/nyheter/sverige/larm-om-explosion-i-malmo-kd4qk/
Se hur helikopterrånarna flög: ”Tog större risker”,/tv/nyheter/sverige/se-hur-helikopterranarna-flog-over-stockholm-/
Putins nya oro för Trump: ”Inte säker”,/tv/nyheter/varlden/putins-oro-for-trump-inte-saker/
"Nytt jättetåg – svenska
bandvagnar till Ukraina",/tv/nyheter/varlden/nytt-jattetag-svenska-bandvagnar-till-ukraina/
Våldsamt utbrott ombord – blir fastbunden i flygstol,/tv/nyheter/varlden/valdsamt-utbrott-ombord-blir-fastbunden-i-flygstol/
Kristersson blir rejält utskälld på pressträff,/tv/nyheter/sverige/kristersson-blir-rejalt-utskalld-pa-presstraff/
Ukrainska finten i Kursk – lurpassade i flera dagar,/tv/nyheter/varlden/ukrainska-finten-i-kursk-lurpassade-i-flera-dagar/
Bildts attack mot Trump i amerikansk tv,/tv/nyheter/varlden/bildts-attack-mot-trump-i-amerikansk-tv/
Tomtens fallskärm lossnar mitt i luften,/tv/nyheter/varlden/tomtens-fallskarm-lossnar-mitt-i-luften/
Här exploderar bilen – hög rysk militär död,/tv/nyheter/varlden/har-detonerar-bilbomben-hogt-uppsatt-rysk-militar-dodad/
Oron innan SD-kollegan hittades död på hotellet,/nyheter/sverige/aron-emilsson-var-med-pa-resan--nar-lars-wistedt-hittades-dod/
Åkesson: ”Alla andra är dumma i huvudet”,/nyheter/sverige/jimmie-akesson-pa-sds-landsdagar/
Man gripen för grov misshandel av kvinna,/nyheter/sverige/man-gripen-for-grov-misshandel-i-olofstrom-/
Spioner slår till mot Putin i hemlighet,/nyheter/varlden/mi6-brittiska-spioner-genomfor--hemliga-atgarder-mot-putin/
Flera skadade – träffade av mekanisk jättefågel,/nyheter/varlden/mekanisk-jattefagel-har-kraschat-i-en-julparad-i-frankrike/
Grisen rymmer – då tar polisen upp jakten,https://www.expressen.se/tv/nyheter/varlden/vilda-polisjakten-efter-grisen
Blåste morföräldrar på miljonbelopp: ”Sviken”,/nyheter/sverige/misstanken-barnbarn-blaste--sina-morforaldrar-pa-miljoner-/
Pappan: Jag har barn med Elons styvsyster,/nyheter/varlden/musks-pappa-jag-har-barn-med-elons-styvsyster/
Här störtar flygplanet – dalar ner över Aleppo,https://www.expressen.se/tv/nyheter/varlden/har-stortar-flygplanet-ner-over-aleppo
Uppgifter: Aleppo intaget av rebeller,/nyheter/varlden/uppgifter-aleppo-intaget-av-jihadister/
Brevportot chockhöjs: ”Den enda lösningen”,/nyheter/sverige/chockhojning-av-brevportot/
Kinesiska CATL tänker inte rädda Northvolt,https://teknikensvarld.expressen.se/nyheter/bil-och-trafik/elbil-laddhybrid/kinesiska-catl-tanker-inte-investera-i-northvolt
Wold i storbråk med tidning: ”Angivarkryp”,/nyheter/sverige/agnes-wold-i-storbrak-med-tidning-angivarkryp/
"Kait, 40: Min 12-åring får dansk ”bantningsspruta”",/nyheter/varlden/hon-ger-sin-12-ariga-dotter-den-danska-bantningssprutan-ozempic/
Slår tillbaka: Gör ert jobb – så gör vi vårt,/nyheter/varlden/zelenskyj-slar-tillbaka-mot-vast-gor-ert-jobb-sa-gor-vi-vart-/
Ryssarna jublar efter träff – inser misstaget,https://www.expressen.se/tv/nyheter/varlden/ryska-soldaten-traffar-sen-inses-misstaget
Birgitta Ed om ovanliga intresset: ”Ett beroende”,/nyheter/sverige/birgitta-ed-om-ovanliga-intresset-ett-beroende/
Kvinna födde fel barn – förlorar vårdnaden,/nyheter/varlden/kvinna-fodde-fel-barn-nu-forlorar-hon-vardnaden/
Ny lag efter avslöjandet: ”Kan inte luta sig tillbaka”,/nyheter/sverige/gunnar-strommer-hade-kunnat-forhindra-brottlighet/
Myndighetens hjälp till Abdo under flykten,/nyheter/sverige/myndighetens-hjalp-till--ismail-abdo-under-flykten/
Kulturbyggnad började brinna: ”Gnistregn”,/nyheter/sverige/fullt-utvecklad-brand-pa-skansen-/
Vd:n efter branden på Skansen: ”1200 grader”,https://www.expressen.se/tv/nyheter/sverige/vdn-efter-branden-pa-skansen-1200-grader
Barnbarnet Kai visar Trumps lyxjet inifrån,/tv/nyheter/varlden/barnbarnet-kai-visar-trumps-lyxjet-inifran/
Varnade om hotet – då dök bombmännen upp,/nyheter/sverige/mysteriet-vem-bestallde-bomberna-mot-elbit/
SMHI:s nya varning – svartis ger blixthalka,/nyheter/sverige/ny-smhi-varning-for-plotslig-blixthalka-/
Utspelet: Säkrast att inte ha smartphone,/nyheter/sverige/socialministerns-utspel-sakrast-att-barn-inte-har-smartphone-/
Hungerstrejkar – efter inställda lyxkryssningen,/nyheter/varlden/kryssningsfartyg-fick-motorhaveri-passagerare-hungerstrejkar/
EU-toppens sista varning om Putin,/nyheter/varlden/eu-chefens-sista-varning-om-ryssland-vi-har-natt-bristningsgransen/
Öppnar upp för ny fredsuppgörelse,/nyheter/varlden/zelenskyj-oppnar-upp-om-vapenvila-villiga-att-ge-upp-mark/
Epsteins högra hand får inte specialkost,/nyheter/varlden/ghislaine-maxwell-svalter-i-fangelset-inte-fatt-mat-pa-fem-dagar/
Exfrun om PG:s dolda sidor: Kritiserade eliten,/nyheter/sverige/vi-kande-varandra-lange-och-sedan-gifte-vi-oss/
"Vad hände då Molly, 14, dog?",/nyheter/sverige/mollys-hemlighet-sista-festen-som-tar-hennes-liv/
Åsas bil började brinna mitt på E6: ”Livsfarligt”,/tv/nyheter/sverige/asas-bil-borjade-brinna-mitt-pa-e6-livsfarligt/
Namnbytet efter ilskan,/nyheter/sverige/jag-ar-hatad-for-fan-av-halva-sverige/
