Heading,URL
Kuppen mot Trump – på hans egen byggnad,/tv/nyheter/varlden/kuppen-mot-trump-pa-hans-egen-byggnad/
Ny enorm explosion i rysk oljedepå,/tv/nyheter/varlden/ny-enorm-explosion-i-rysk-oljedepa/
Domedagsfisk sägs förutspå katastrofer,/tv/nyheter/varlden/domedagsfisken-sags-forutspa-katastrofer/
"Polisen sköt Arezoo, 31– brottet: Visade sitt hår",/tv/nyheter/varlden/polisen-skot-arezoo-31-brottet-visade-sitt-har/
Vrickade movsen på flygplatsen förbluffar,/tv/nyheter/varlden/vrickade-movsen-pa-flygplatsen-forbluffar/
Mörk rökpelare stiger från ryska vulkanen,/tv/nyheter/varlden/mork-rokpelare-stiger-fran-ryska-vulkanen/
"Svenska Julia, 23, allergisk – mot Texas",/tv/nyheter/svenska-julia-23-blev-allergisk-mot-texas-radet-flytta/
Peter söker sport-tv – får in nordkoreansk propaganda-tv,/tv/nyheter/varlden/peter-soker-sport-tv-far-in-nordkoreansk-propaganda-tv/
JUST NU: Strul i pendeltågstrafiken,/nyheter/sverige/stora-storningar-i-pendeltagstrafiken/
Här brister Biden ut i tårar på scenen,/nyheter/varlden/hyllningarna-till-kamala-harris-framtiden-ar-har/
Donald Trump: Elon Musk kan bli minister,/nyheter/sverige/trump-musk-kan-bli-minister/
Åtta båtar började brinna: ”Kalabalik”,/nyheter/sverige/flera-batar-brinner-i-smabatshamn-i-torslanda/
Listan över hans tortyr: • Hjärntvätt • Aggressiv,/nyheter/krim/foxtrots-knarkgrossist-forat-omar-plagade-ex-flickvannen-/
Avslöjar knepet bakom berget med kantareller,/tv/nyheter/varlden/jakob-och-veronica-hittade-50-kilo-kantareller/
Visade sitt hår – då sköts hon av polisen,https://www.expressen.se/tv/nyheter/varlden/polisen-skot-arezoo-31-brottet-visade-sitt-har
Mammans trafikilska – skjuter mot annan bil,/tv/nyheter/varlden/blir-arg-i-trafiken-skjuter-mot-bil/
Ukrainas fälla slår igen kring ryska trupperna,/nyheter/varlden/ukrainas-falla-stanger-in-de-ryska-trupperna/
Stridsflygen gör kriget farligare för Putin,/nyheter/varlden/stridsflygplanen-som-gor-kriget-farligare-for-putin/
Ny enorm explosion på stor rysk oljedepå,/tv/nyheter/varlden/ny-enorm-explosion-i-rysk-oljedepa/
Miljardären firade stora segern när jakten sjönk,/nyheter/varlden/miljardaren-firade-pa-lyxjakten--nar-tornadon-slog-till/
Här bombar de ryska mål – inför våra ögon,/nyheter/varlden/har-bombar-de-ryska-mal-infor-vara-ogon/
Slår till mot hemligt ryskt gömställe,/tv/nyheter/varlden/har-bombar-de-ryska-mal-infor-vara-ogon/
Så går Lööfs och Löfvens bolag – året efter politiken,/nyheter/sverige/sa-gar-loofs-och-lofvens-bolag-aret-efter-politiken/
”Dubbelgångaren” pekas ut som Palmes mördare,/nyheter/sverige/ai-test-pekar-ut-palmes-mordare-i-ny-bok/
Såg du supermånen över Sverige i natt?,/nyheter/sverige/supermane-over-sverige-har-syns-den-bast/
”Bergets” framtid efter TV4:s paus,/nyheter/laget/bergets-framtid-efter-tv4s-paus/
Rusning efter vaccin mot ny mpox-variant,/nyheter/sverige/stort-tryck-pa-vaccination-mot-nya-mpox-varianten/
"Johan, 47, dog när han tävlade i Norge",/nyheter/sverige/johan-47-dog-i-orienteringstavlingen-i-norge/
Kritiken mot Harris: ”Är nästan osynlig”,/nyheter/varlden/flera-protester-under-demokraternas-konvent/
Kuppen mot Trump – på hans egen byggnad,/tv/nyheter/varlden/kuppen-mot-trump-pa-hans-egen-byggnad/
S-politiker vill förbjuda brudöverlämning i kyrkan,/nyheter/sverige/s-politiker-vill-forbjuda-brudoverlamning-i-kyrkan/
Tropisk storm på väg – hotar sommarvärmen,/nyheter/sverige/rester-fran-stormen-ernesto-pa-vag-mot-sverige/
Israel godtar USA:s fredsplan: ”Avgörande”,/nyheter/varlden/israel-godtar-usas-fredsplan/
Topprepublikanen Santos erkänner brott,/nyheter/varlden/republikanen-santos-erkanner-brott/
Paasikivis nya jobb: ”Varmt om hjärtat”,/nyheter/sverige/paasikivis-nya-jobb-ska-vara-sakerhetsradgivare/
SD-bråk i Sölvesborg – styrelsen hoppar av,/nyheter/sverige/sd-brak-i-solvesborg/
Här fångar surfaren en ”domedagsfisk”,/tv/nyheter/varlden/domedagsfisken-sags-forutspa-katastrofer/
Tuffa tider för elbilar – Volvo satsar på bensin,https://teknikensvarld.expressen.se/nyheter/bil-och-trafik/elbil-laddhybrid/sa-ska-volvo-xc90-fa-leva-nagra-ar-till/
Techmiljardär saknas efter olycka på lyxbåt,/nyheter/varlden/lyxbat-sjonk-utanfor-sicilien-turister-saknas/
Majids mamma gripen i Kurdistan,/nyheter/varlden/rawa-majids-mamma-gripen/
”Kurdiska rävens” hot: Skjuta varenda huvud,/tv/nyheter/hor-kurdiska-ravens-ljudmeddelande-jag-njuter/
Diktatorns nya drag – rustar vid gränsen,/nyheter/varlden/belarus-diktator-rustar-vid-gransen-till-ukraina/
Zelenskyj: Offensivens mål – buffertzon i Kursk,/tv/nyheter/varlden/zelenskyj-om-motoffensiven-buffertzon-i-kursk/
Maktkampen i Putins inre krets: ”Kall blick”,/nyheter/varlden/maktkampen-i-putins-inre-krets-ser-inte-glad-ut-/
Kravet i Liberalerna: Kör över SD om flygskatten,/nyheter/sverige/kravet-i-l-kor-over--sd-om-flygskatten/
Skeppen kolliderar – anklagar varandra,/tv/nyheter/varlden/kinesiskt-och-filippinskt-fartyg-kolliderat-anklagar-varandra-/
Stark oro i Norden efter svenska kriminellas dåd,/nyheter/varlden/stark-oro-i-norden-efter-svenskdaden/
Höga utsläpp från A- traktorer granskas,https://teknikensvarld.expressen.se/nyheter/miljo-och-teknik/misstankt-hoga-utslapp-fran-a-traktorer-ska-granskas/
Mackmyras besked – ansöker om konkurs,/nyheter/sverige/mackmyra-ansoker-om-konkurs/
Vrickade movsen på flygplatsen förbluffar,/tv/nyheter/varlden/vrickade-movsen-pa-flygplatsen-forbluffar/
Koenigsegg med nytt imponerande rekord,https://teknikensvarld.expressen.se/nyheter/bil-och-trafik/koenigsegg-jesko-attack-med-ny-rekordtid/
Märta Stenevi har gift sig: ”Mitt hjärta är ditt”,/nyheter/sverige/marta-stenevi-gifter-sig-storsta-hjartat/
Svensk kvinna mördades – man gripen efter 51 år,/nyheter/varlden/svensk-kvinna-mordades-man-gripen-efter-51-ar/
Glädjen: Mer värme – sommaren inte över,/nyheter/sverige/beskedet-sol-och-varme-aven-nasta-vecka/
Tipsen: Så slipper du jobbångesten,https://www.expressen.se/tv/nyheter/sverige/semestern-slut-tipsen-att-forebygga-jobbangesten/
Sveriges förste tv- meteorolog är död,/nyheter/sverige/forste-tv-meteorologen-fick-krita-pa-systemet/
Covidspridningen ökar – risken inför höstterminen,/nyheter/sverige/okningen-av-coronasmittan-fortsatter/
Larm om giftiga varor från shoppingjättarna,/nyheter/varlden/nya-larm-om-giftiga-varor-pa-shoppingsajterna/
Supermånen syns över Sverige – då ska du titta,/nyheter/sverige/supermanen-ar-har--da-kan-du-fa-se-den/
Trumps plan för att sno rampljuset från Harris,/nyheter/varlden/trumps-plan-for-att-sno-rampljuset-fran-harris/
Sjukhuset slarvade bort en del av hans kropp,/nyheter/varlden/sjukhuset-slarvade-bort-en-del-av-hans-kropp/
Elitens vågade sexlekar,/nyheter/hemliga-poolsexpartyt-pa-herrgarden--kvinnornas-njutning-star-i-centrum-/
”Jag känner en stor ånger”,/nyheter/sverige/sa-lever-johan-af-donner-i-dag/
”Ligger kvar livlös”,/nyheter/sverige/expressen-dok-hamburgerkungen/
Dykaren jagas för sabotaget,/nyheter/varlden/ukrainske-dykaren-volodymyr-zhuravlov-44-efterlyst-for-sprangningen-av-nord-stream/
Bluffmetoden som kändisar använder,/nyheter/sverige/bluffen-med-kandisarnas-laserbehandling-jattetragiskt/
Polisen: Han är ”Ghost”,/nyheter/sverige/polisen-sakra-efter-langa-jakten-han-ar-ghost/
