Heading,URL
Kvinna sprutade eld inne på Ica – brände ner butiken,/tv/nyheter/sverige/kvinna-sprutade-eld-inne-pa-ica-i-vasteras-butiken-brann-ner/
Här slår Ukraina till mot ryska målet,/tv/nyheter/varlden/har-slar-ukraina-till-mot-ryska-malet/
Makalösa fyndet – 2000 år gammal festsal,/tv/nyheter/varlden/makalosa-fyndet-2000-ar-gammal-festsal/
Spansk värmebölja – 25 grader i svenskfavorit,/tv/nyheter/varlden/efter-sno-och-hagel-varmebolja-i-spanien/
Skräckfärden med linbanan – vagnen sprack,/tv/nyheter/varlden/skrackfarden-med-linbanan-vagnen-sprack/
"Christine, 85, attackerades – dödade inkräktaren",/tv/nyheter/varlden/christine-85-attackerades-dodade-inkraktaren-/
"Vittnesmålet inifrån träffade bilen: ""Chock""",/tv/nyheter/varlden/vittnesmalet-inifran-traffade-bilen-chock/
Bilbomb i Moskva – rysk spion skadad,/tv/nyheter/varlden/bilexplosion-i-moskva-rysk-ex-spion-skadad/
Putins hån mot fredskonferensen,/tv/nyheter/varlden/putins-han-mot-fredskonferensen-/
JUST NU: Bidens löfte i natt – efter hämndattacken,/nyheter/varlden/500-dronare-och-robotar-nastan-alla-skots-ner/
Så kan Israel svara mot Irans attack,/nyheter/varlden/experten-sa-kan-israel-svara-mot-irans-attack/
Dramatiska bilderna visar attacken: ”Oro”,/tv/nyheter/varlden/dramatiska-bilderna-visar-attackvagen-oro/
”Vi avbröt. Vi slog ner. Vi kommer att segra”,/nyheter/varlden/direktrapport-oroligheterna-i-mellanostern/
Bedragarnas list – så luras de med bank-ID,/nyheter/sverige/bedragarnas-list-sa-kan-du-luras-med-bank-id/
"Makalöst fyndet – bilderna ""rörde på sig""",/tv/nyheter/varlden/makalosa-fyndet-2000-ar-gammal-festsal/
Spansk värmebölja – 25 grader i svenskfavorit,/tv/nyheter/varlden/efter-sno-och-hagel-varmebolja-i-spanien/
Hovprofilen anklagas i arvsstriden: ”Guldfeber”,/nyheter/sverige/knut-ramel-om-hovprofilen-kirstine-von-blixen-finecke-drabbats-av-guldfeber/
Ilskan mot eldstoppet: ”Fortsätt att bränna”,/nyheter/sverige/sagar-forbudet-mot-loveldning-helt-absurt/
Kaos i rättssalen efter dom: ”Förtjänar att dö!”,https://www.expressen.se/tv/nyheter/varlden/kaos-i-rattssal-efter-morddom-fortjanar-att-do
Sex personer vägrar lämna Ramsays pub,/nyheter/varlden/ockupanter-har-tagit-over-gordon-ramsays-pub-/
Kvinnan sprutar eld mot kunder på Ica,/tv/nyheter/sverige/kvinna-sprutade-eld-inne-pa-ica-i-vasteras-butiken-brann-ner/
Två personer anhållna efter mordet på Mikael,/nyheter/sverige/tva-anhallna-efter-mordet-pa-mikael/
Gängmännen vaktar med laddade vapen,/nyheter/sverige/gangman-star-vakt-med-laddade-vapen/
”Gick alltid fram när det var en misshandel”,/tv/nyheter/sverige/systern-om-mordade-mikael-for-mig-lever-han-fortfarande/
Högskoleprovet – hur många ord klarar du?,/nyheter/sverige/hogskoleprovet-hur--manga-av-orden-kan-du/
Nyblivna mamman Ash dödades i knivattacken,/nyheter/varlden/nyblivna-mamman-ash-38--dodad-i-knivattacken-i-sydney/
Svenskarna flydde dådet: ”Rann blod”,/nyheter/varlden/svenskarna-flydde-knivattacken-i-gallerian-i-sydney/
Här motar hjälten bort knivmannen,/tv/nyheter/varlden/hjalten-i-gallerian-motar-bort-garningsmannen/
Testa valkompassen: Vem ska du rösta på?,/nyheter/varlden/valkompass-eu-val-2024-testa-sjalv-vilket-parti-ska-du-rosta-pa-den-9-juni/
Bröllopsfest urartade i bråk – polis ryckte ut,/nyheter/sverige/storbrak-pa-brollopsfest-man-stickskadad/
Nya hotet mot Putins bro – attackeras ”inom kort”,/nyheter/varlden/nya-hotet-mot-putins-bro-attack-inom-kort/
Här slår Ukraina till mot ryska målet,/tv/nyheter/varlden/har-slar-ukraina-till-mot-ryska-malet/
Officeren: Soldaterna kan knappt röra sig,/nyheter/varlden/estniska-officeren-kriget-i-ukraina-kan-paga-i-decennier/
Tågen mer punktliga i mars efter tuffa vintern,/nyheter/sverige/tagen-mer-punktliga-i-mars/
Bävern gick vilse – då ryckte Jan och Per ut,/nyheter/sverige/jan-och-per-fangade-bavern-i-jakobsberg/
Här dyker gnagaren upp utanför Hemköp,/tv/nyheter/sverige/daniel-sag-en-baver-mitt-i-stan-wow-what/
Tar hem drömvinsten – 101 miljoner kronor,/nyheter/sverige/lottospelare-vann-101-miljoner/
Makalöst fynd i Pompeji – fick bilder att röra på sig,https://www.expressen.se/tv/nyheter/varlden/makalosa-fyndet-2000-ar-gammal-festsal
Trumps hemliga åsikt om Putin och Ukraina,/nyheter/varlden/trumps-hemliga-asikt-om-putin-och-ukraina/
Vagnen sprack – man störtade mot marken,https://www.expressen.se/tv/nyheter/varlden/skrackfarden-med-linbanan-vagnen-sprack
Vargen kom tillbaka – då jagade Tesla bort den,/nyheter/sverige/mikael-och-hunden-tesla-skramde--bort-vargen-efter-hastattacken/
Varnar: Vargar kommer tillbaka efter en attack,/nyheter/sverige/viltexperten-vargarna-atervander-efter-en-attack/
Man med jaktkniv gick till attack – sex döda,/nyheter/varlden/flera-doda-i-valdsdad-i-kopcentrum-i-sydney/
Fyra sköts i Farsta – här grips misstänkta skytten,/tv/nyheter/sverige/har-grips-misstankta-garningsmannen-efter-masskjutningen-i-farsta/
"Israel: Binyamin, 14, har hittats mördad",/nyheter/varlden/faraherden-binyamin-14-mordad-pa-vastbanken/
Här stormar soldaterna det israeliska fartyget,/nyheter/varlden/iran-har-tagit-kontroll-over-israeliskt-skepp/
Irans hämnd: ”Blir svårt att försvara”,/nyheter/varlden/irans-planer-pa-hamnd-vantas-sla-till-mot-israel-med-massiv-attack/
"Här hedras Mikael, 39: ”Värme och omtanke”",/tv/nyheter/sverige/har-hedras-mikael-skots-till-dods-i-skarholmen/
Kvinna överfallen i trapphus – jobbar inom rättsväsendet,/nyheter/sverige/kvinna-overfallen-i-trapphus-i-norrkoping-jobbar-inom-rattsvasendet/
Efter snö och hagel – värmebölja i Spanien,https://www.expressen.se/tv/nyheter/varlden/efter-sno-och-hagel-varmebolja-i-spanien
Nytt krav i dag: Ladda och betala med kort,https://teknikensvarld.expressen.se/nyheter/bilbranschen/i-dag-infors-krav-pa-kortbetalning-vid-laddning/
Vittnesmålet inifrån träffade bilen: ”Chock”,https://www.expressen.se/tv/nyheter/varlden/vittnesmalet-inifran-traffade-bilen-chock
Brittiska planen: Skicka laservapen till Ukraina,/nyheter/varlden/forsvarsminister-grant-shapps-vill-skicka-laservapen-till-ukraina/
Världens bästa badstrand utsedd – ligger i Europa,https://www.expressen.se/allt-om-resor/nyheter/varldens-basta-badstrand-utsedd-ligger-i-europa-
”Jag såg skolbussen – det fattades två barn”,/nyheter/sverige/sorgen-i-faglavik-efter-branden--kommer-ta-lang-tid-for-bygden/
Elva procent överväger att rösta på Folklistan,/nyheter/sverige/elva-procent-overvager-att-rosta-pa-folklistan/
Ministern: Mindre pengar till vissa universitet,/nyheter/sverige/ministern-mindre-pengar-till-vissa-universitet/
Lori och George döda – var äldsta i världen,/nyheter/varlden/varldens-aldsta-siamesiska-tvillingar-har-dott/
"Lisa, 9, riskerar att utvisas till Albanien",/nyheter/sverige/sista-manifestationen-for-utvisningshotade-lisa-9/
Ligan hotade att hänga ut hennes man som pedofil,/nyheter/sverige/ligan-hotade-att-hanga-ut-hennes-man-som-pedofil/
Ny förlust för Trump: ”Det är ditt eget fel”,/nyheter/varlden/trump-nobbas-igen-nu-blir-det-rattegang/
”Tryckte bort kameran och spottade på honom”,/nyheter/sverige/efter-braket-med-israelisk-tv-i-malmo-angrar-inget/
Lärare våldtog elev upprepade gånger,/nyheter/sverige/larare-valdtog-sin-minderariga-elev-doms-till-fangelse/
Rushdie om knivattacken: ”Han kom hårt och lågt”,/nyheter/varlden/salman-rushdie-om-knivattacken-denna-mordiska-gestalt/
Bluffartiklar sprids i Expressens namn,/nyheter/sverige/bluffartiklar-sprids-i-expressens-namn-/
