Heading,URL
Kryssningsfartyget skenar – åker rakt mot lyxyachten,/tv/nyheter/varlden/kryssningsfartyget-skenar-aker-rakt-mot-lyxyachten/
Besökarnas panik när pandorna går till attack,/tv/nyheter/varlden/besokarnas-panik-nar-pandorna-gar-till-attack/
Mammans brutala upptäckt: ”Var fick du tag i den”,/tv/nyheter/varlden/mammans-brutala-upptackt-vart-fick-du-tag-i-den/
Här läser Biden ut talskrivarens uppmaning på promptern,/tv/nyheter/varlden/har-laser-biden-ut-talskrivarens-uppmaning-pa-promptern/
Finska svaret om ryska hotet får Kristersson att skratta,/tv/nyheter/sverige/finska-svaret-om-ryska-hotet-far-kristersson-att-skratta/
Kadyrov uppges vara dödssjuk – tuffa svaret,/tv/nyheter/varlden/uppges-vara-svart-sjuk-kadyrov-svarar-med-video/
Alligator drog mannen mot vattnet,/tv/nyheter/varlden/alligator-drog-mannen-mot-vattnet/
Vagnarna hamnar på fel spår – skenar mot loket,/tv/nyheter/varlden/vagnarna-hamnar-pa-fel-spar-skenar-mot-loket/
Tar stryptag på 93-åriga kvinnan med använd blöja,/tv/nyheter/varlden/tar-stryptag-pa-93-ariga-kvinnan-med-anvand-bloja-/
JUST NU: S vill se kortare arbetstid,/nyheter/sverige/s-lagger-fram-forslag-om-kortare-arbetstid/
JUST NU: Naken man bröt sig in,/nyheter/sverige/larm-om-naken-man-pa-badhus/
Kan tvingas dela cell med sin livvakt,/nyheter/varlden/trump-kan-behova-dela--cell-med-sin-egen-livvakt/
16-åringens ord inifrån cellen: ”Rusta för krig”,/nyheter/sverige/16-aringens-ord-inifran--cellen-rusta-for-krig/
Förödelsen i Gaza: ”Allt sönderbombat”,/nyheter/varlden/hon-hor-bomberna-falla-i-rafah-hur--manga-barn-dog-nu/
Sparkas av Disney direkt efter bilden,/tv/nyheter/varlden/sparkas-av-disney-direkt-efter-bilden/
Hundägarens drag – väcker avsky hos alla,https://www.expressen.se/tv/nyheter/hjartskarande-filmen-hunden-overges-av-sin-agare-i-trafiken
Ryska taktiken – attackerar spåren,/nyheter/varlden/ryska-taktiken-attackerar-jarnvagen-i-ukraina/
Lett-ledaren om Putin: Missbrukande granne,/nyheter/varlden/lett-ledaren-putin-ar-som-en-missbrukande-granne/
Putins hotfulla drag i FN: ”Smutsigt”,/tv/nyheter/varlden/usas-kanga-till-putin-i-karnvapenfragan-vad-doljer-du/
Efter jättesuccén – mordmysteriet tillbaka,/nyheter/laget/efter-jattesuccen-nu-ar-mordmysteriet-tillbaka/
Avskyn efter kvinnans intima tilltag inför alla,https://www.expressen.se/tv/nyheter/varlden/avskyn-efter-kvinnans-intima-tilltag-infor-alla
Bluffartiklar sprids i Expressens namn,/nyheter/sverige/bluffartiklar-sprids-i-expressens-namn-/
Kraftig tornado i drar in – ”katastrofala skador”,https://www.expressen.se/tv/nyheter/kraftig-tornado-i-drar-in-over-usa-varnar-for-katastrofala-skador/
”Elbilsmarknaden är politiskt driven”,https://teknikensvarld.expressen.se/nyheter/bil-och-trafik/elbil-laddhybrid/aston-martin-elbilar-ar-en-hajp/
Testa valkompassen: Vem ska du rösta på?,/nyheter/varlden/valkompass-eu-val-2024-testa-sjalv-vilket-parti-ska-du-rosta-pa-den-9-juni/
Kinberg Batra satte själv vännens lön,/nyheter/sverige/kinberg-batra-satte-sjalv-vannens-lon/
Här är största politiska skandalen på 2000-talet,/nyheter/sverige/pekas-ut-storsta-politiska-skandalen-de-senaste-aren/
Makabra fyndet mitt bland barnfamiljerna,https://www.expressen.se/tv/nyheter/varlden/makabra-fyndet-mitt-bland-barnfamiljerna
Expressen vinner pris på ”medievärldens Oscars”,/nyheter/expressen-vinner-pris-pa-medievarldens-oscars/
Kängan till Kristersson: ”Är ett svaghetstecken”,/nyheter/sverige/hultqvists-kanga-till-kristersson-om-forsvaret/
Taxichaufför våldtog funktionsnedsatt man,/nyheter/sverige/misstanken-taxichauffor-valdtog-funktionsnedsatt-man/
Broman häktad i stor utpressningshärva,/nyheter/sverige/harriette-broman-haktad--i-stor-utpressningsharva/
Larmet: Ryska drönare slår ut USA-stridsvagnar,/nyheter/varlden/kriget-i-ukraina-26-april/
Sophia sparkas från nöjespark efter bilden,https://www.expressen.se/tv/nyheter/varlden/sparkas-av-disney-direkt-efter-bilden
Rysslands offensiv mot Ukrainas svaga punkt,/nyheter/sverige/ryska-dronarattackerna-fordubblats-utnyttjar-ukrainas-vapenbrist/
Utreder måltavlor – efter gripandet vid domstolen,/nyheter/sverige/greps-med-vapen-vid-domstol-begars-haktade/
Modellen bryter ihop – avslöjar allt för polisen,https://www.expressen.se/tv/nyheter/varlden/forklaringen-darfor-bryter-supermodellen-ihop-framfor-polisen
Pappan häktas för mord på sina barn,/nyheter/sverige/pappan-begars-haktad-efter-dubbelmordet/
Tunga sorgen efter morden: ”Är i chock”,/nyheter/sverige/tung-sorg-efter-morden-glada-spralliga-barn/
Magsjukekaos på skola – över 100 elever hemma,/nyheter/sverige/magsjukekaos-pa-skola-i-skutskar/
"Klas, 60, blev anfallen på mötet: ”Sved som satan”",/nyheter/sverige/klas-60-attackerades-i-gubbangen-sved-som-satan/
Hon trotsar talmannen i riksdagen gång på gång,https://www.expressen.se/tv/nyheter/sverige/v-ledamoten-kritiseras-for-palestinasjalen
Ali får inte jobba på Telia – efter fråga om ursprung,/nyheter/sverige/ali-far-inte-jobba-pa-telia-efter-fraga-om-ursprung/
Räddades ur mammans mage – Sabreen nu död,/nyheter/varlden/bebis-som-raddades-ur-mammans-mage-har-dott/
Besökarnas panikskrik – ser vad pandorna gör,https://www.expressen.se/tv/nyheter/varlden/besokarnas-panik-nar-pandorna-gar-till-attack
Döms efter vansinnesfärd – sköt med kpist mot polis,/nyheter/sverige/man-skot-flera-rundor-med-k-pist-mot-poliser/
Jakten på männen: ”De skjuter mot oss”,/nyheter/krim/vansinnesfard-och-automateld-mot-poliser-i-ostersund/
Hotet: Nato-kärnvapen i Polen blir rysk ”måltavla”,/nyheter/varlden/hotet-nato-karnvapen-i-polen-blir-rysk-maltavla/
Inte lika eftertraktad av tjuvarna längre,https://teknikensvarld.expressen.se/nyheter/bil-och-trafik/kraftig-minskning-av-katalysatorstolder/
Flera olyckor på E20 i snöovädret: ”Halt”,/nyheter/sverige/bil-korde-in-i-mittracke-pa-e20/
S-toppens bok sågas: ”Provocerande usel”,/nyheter/sverige/mp-borde-sluta-morka-sin-politik/
Operationer stoppade efter vårdblockaden,/nyheter/sverige/operationer-stoppade-efter-vardforbundets-blockad/
"Emma, 33: ”Vi på golvet skriker av desperation”",/nyheter/sverige/emma-33-tvingas-pendla-nar-sjukhuset-gar-ut-i-blockad/
Ledamot bar palestinasjal i riksdagen – kritiseras nu,/nyheter/sverige/v-ledamoten-kritiseras-for-palestinasjal-i-riksdagen/
Ilskan mot turistpärlan – efter omtvistad regel,https://www.expressen.se/tv/nyheter/varlden/ilskan-mot-turistparlans-drag-forandrar-ingenting
Sista vittnet om mordet på Einár,/nyheter/sverige/sista-vittnet-om-mordnatten-da-einar-dodades/
