Heading,URL
Hemliga vapnet mot Putins stridsfordon,/tv/nyheter/varlden/hemliga-vapnet-mot-putins-stridsfordon/
Mystiskt ”djur” rusar förbi i julhälsningen,/tv/nyheter/varlden/mystiskt-djur-rusar-forbi-i-julhalsningen/
Drönarshow spårar ur – sjuåring allvarligt skadad,/tv/nyheter/varlden/dronarshow-sparar-ur-sjuaring-allvarligt-skadad/
Här forsar lavan fram – myndigheterna varnar,/tv/nyheter/varlden/har-forsar-lavan-fram-myndigheterna-varnar/
Polisens udda drag mitt i knarkrazzian,/tv/nyheter/varlden/udda-draget-under-drograzzian-grinchen-hjalper-till-/
Sprutar gift på maten i livsmedelsbutiken,/tv/nyheter/har-forgiftar-han-maten-i-affaren/
Filmar sprickan – då kollapsar bron,/tv/nyheter/varlden/filmar-sprickan-da-kollapsar-bron/
Putins lösning – på ryska porrkrisen,/tv/nyheter/varlden/putins-losning-pa-ryska-porrkrisen/
JUST NU: Äldre kvinna svårt skadad,/nyheter/sverige/kvinna-allvarligt-skadad-misstankt-mordforsok-i-goteborg/
JUST NU: Långa köer – strul på Arlanda,/nyheter/sverige/tekniska-problem-pa-arlanda/
Svensk expert: Putins kritik är ”sensationell”,/nyheter/varlden/svensk-expert-putins-kritik-ar-sensationell/
Här vaknar vulkanen – lavan sprutar fram,https://www.expressen.se/tv/nyheter/varlden/har-forsar-lavan-fram-myndigheterna-varnar/
Sprutar gift på mat i livsmedelsbutiken,/tv/nyheter/har-forgiftar-han-maten-i-affaren/
Trumps ilska mot Bidens besked: ”Slag i ansiktet”,/nyheter/varlden/donald-trumps-ilska-mot-joe-bidens-drag-ett-slag-i-ansiktet/
Mystiskt ljud avbryter talet: ”Vad i helvete?”,/tv/nyheter/varlden/mystiska-ljudet-avbryter-trump-vad-i-helvete/
Skapade ”skräckens hus” – par får 100 års fängelse,/nyheter/varlden/skapade-skrackens-hus-par-far-100-ars-fangelse/
Känd krögare död – familjens sorg,/nyheter/sverige/stjarnkrogaren-daniel-hoglander-ar-dod/
Ex-presidenten Bill Clinton förd till sjukhus,/nyheter/varlden/bill-clinton-ford-till-sjukhus/
Razzia hos biljätten och anställda – Rolex i beslag,/nyheter/krim/razzia-pa-riddermark-bil-i-orebro-efter-fuskmisstankar/
Gör det sjuka i jakten på tittare,/tv/nyheter/har-forgiftar-han-maten-i-affaren/
Putins lösning – på Rysslands porrkris,/tv/nyheter/varlden/putins-losning-pa-ryska-porrkrisen/
Massiv attack – flera drönare in i höghus,/tv/nyheter/varlden/massiv-attack-flera-dronare-in-i-hoghus/
”Ufo”-formation förbryllar Sydneyborna,/tv/nyheter/varlden/ufo-formation-forbryllar-sydneyborna/
Oväntade succén – 15 miljoner har sett Martins pinne,/tv/nyheter/varlden/ovantade-succen-15-miljoner-har-sett-martins-pinne/
Eldsprut på E18 när kranbil slår i bron,/tv/nyheter/sverige/eldsprutet-pa-e18-nar-kranbilen-slar-i-bron/
Putins nya vapen – burk med konserver,/tv/nyheter/putins-nya-vapen-burk-med-konserver/
Kastar granat in i mataffär – döms,/tv/nyheter/sverige/granaten-kastas-in-i-matbutiken/
SD-ledamotens i talarstolen: ”God segerjul”,/tv/nyheter/sverige/sd-ledamoten-i-talarstolen-god-segerjul/
Hemliga vapnet mot Putins stridsfordon,https://www.expressen.se/tv/nyheter/varlden/hemliga-vapnet-mot-putins-stridsfordon/
Ford skänker bilar och pengar till Trumps fest,https://teknikensvarld.expressen.se/nyheter/bilbranschen/ford-skanker-bilar-och-pengar-till-trumps-fest/?referrer=33
Instabees vd svarar: ”Armlängds avstånd”,/nyheter/sverige/instabee-vd-efter-larmet-armlangds-avstand/
Larmet om Instabox: Stress och ångest,/nyheter/sverige/larmet-inifran-instabox-stress-och-angest-/
Svenskens flykt – bröt sig loss med järnrör,/nyheter/varlden/svenskens-flykt-fran-forvar-pa-cypern-sen-greps-han-igen/
Närmare 100 känguruer skjutna vid en militärbas,/nyheter/varlden/narmare-100-kanguruer-skots-man-atalas/
H&M:s beslut om presentpåsarna,/nyheter/sverige/hochms-beslut-om-presentpasar-mer-premium/
Mystiskt ”djur” rusar förbi i julhälsningen,https://www.expressen.se/tv/nyheter/varlden/mystiskt-djur-rusar-forbi-i-julhalsningen/
Sätter ner foten mot Trump: ”Inte till salu”,/nyheter/varlden/trumps-nya-krav-om-gronland-nodvandighet/
Trump slår tillbaka om Musk: Det händer inte,/nyheter/varlden/donald-trump-slar-tillbaka-om-musk-det-kommer-inte-handa/
Ändrar sig efter ”miljarder visningar”,/tv/nyheter/varlden/trumps-vandning-om-tiktok-/
Juluppvisning gick snett – sjuåring svårt skadad,/nyheter/varlden/juluppvisning-gick-snett-sjuaring-svart-skadad/
Julvarningen – då slår ishalkan till,/nyheter/sverige/dystra-julbeskedet-gratt-vader-i-stort-sett-hela-landet/
Snösmocka mitt i soliga firandet,/tv/nyheter/varlden/vandningen-sno-i-varma-svenskparadiset-/
50 000 år gammal mammutunge hittad,/nyheter/varlden/50-000-ar-gammal-mammutunge-hittad/
Tysklands president: Mörk skugga över julen,/nyheter/varlden/tysklands-president-mork-skugga-over-julen/
Partier vill skrota betyg: ”Inte rättvist”,/nyheter/sverige/aven-moderaterna-vill-skrota-f-betyget/
Bil kraschar in butik – vilt slagsmål uppstår,https://www.expressen.se/tv/nyheter/varlden/bil-kraschar-in-butik-vilt-slagsmal-uppstar/
Polisens udda drag mitt i knarkrazzian,https://www.expressen.se/tv/nyheter/varlden/udda-draget-under-drograzzian-grinchen-hjalper-till-/
Två döms till livstid för restaurangmord,/nyheter/sverige/man-skots-ihjal-pa-restaurang-i-norrkoping-tva-far-livstidsstraff/
Fem döms till fängelse – utpressade affärsman,/nyheter/kuylenstierna-kravdes-pa-100-miljoner-nu-kommer-domen/
Polisens uppmaning: Sprid inte filmerna,/nyheter/sverige/polisens-uppmaning-sprid-inte-filmerna/
Utredning visar: Matt Gaetz köpte sex,/nyheter/varlden/utredning-visar-matt-gaetz-kopte-sex/
Man ville absolut ha kapris – sköt sin vän,/nyheter/sverige/ville-ha-kapris-skot-sin-van/
Fyllde år – våldtogs av kompis mamma,/nyheter/sverige/fyllde-ar-valdtogs-av-kompis-mamma/
Pekas ut: Sveriges sämsta plats att bo,/nyheter/sverige/osthammar-pekas-ut-sveriges--samsta-kommun-att-bo-i/
Mangione förnekar – misstänks för vd-mord,/nyheter/varlden/luigi-mangione-fornekar-brott/
Bil körde in i mitträcke på E16 – totalstopp,/nyheter/sverige/bil-har-kort-in-i-mittracket-pa-e16/
Pojke begärs häktad efter dödsskjutning,/nyheter/sverige/pojke-begars-haktad-efter-dodskjutningen-i-vaxjo/
Mamma döms – fick sin dotter att svälta,/nyheter/sverige/mamma-svalte-sin-dotter-far-fangelse/
Utredning läggs ner mot tidigare V-topp,/nyheter/sverige/utredning-mot-kristofer-lundberg-laggs-ner/
Tre tips: Så maxar du ditt elbilsbatteri,/nyheter/sverige/tre-tips-sa-maxar-du-elbilsbatteriet/
90 främlingar har skrivit sig i Ulla-Lenas stuga,/nyheter/sverige/90-framlingar-har-skrivit-sig-i--ulla-lenas-stuga/
Rånare jagas i Huddinge – hotade butikspersonal,/nyheter/sverige/elektronikbutik-ranad-i-huddinge/
Filmar sprickan – då kollapsar jättebron,https://www.expressen.se/tv/nyheter/varlden/filmar-sprickan-da-kollapsar-bron
Putins hot efter drönarattacken,/nyheter/varlden/putins-ord-efter-dronarattacken-kommer-mota-forstorelse/
Se när drönaren träffar skyskrapan i Kazan,/tv/nyheter/varlden/massiv-attack-flera-dronare-in-i-hoghus/
Sjuka skämtet går för långt – väcker ilska,https://www.expressen.se/tv/nyheter/har-forgiftar-han-maten-i-affaren
"Vad hände då Molly, 14, dog?",/nyheter/sverige/mollys-hemlighet-sista-festen-som-tar-hennes-liv/
Mörkade läckor för regeringen,/nyheter/sverige/las-expressens-avslojanden-om-skandalen-pa-lantmateriet/
Så lite tjänar förarna för Uber och Bolt,/tv/nyheter/sverige/taxislavarna-sa-lite-tjanar-forarna-for-uber-och-bolt/
Namnbytet efter ilskan,/nyheter/sverige/jag-ar-hatad-for-fan-av-halva-sverige/
