Heading,URL
Vild krasch med Teslan – skyller på autopiloten,/tv/nyheter/varlden/galen-krasch-med-teslan-skyller-pa-autopiloten/
Skorpionen dyker upp i Shein-beställningen,/tv/nyheter/varlden/skorpionen-dyker-upp-i-shein-bestallningen-/
Minst sex döda – israelisk attack mot flyktingboende,/tv/nyheter/varlden/minst-sex-doda-israelisk-attack-mot-flyktingboende/
"Lucy, 20, sa upp sig efter en kväll: ”Panik”",/tv/nyheter/varlden/lucy-20-slutar-barnvakta-direkt-efter-skrackkvallen/
Bidens irritation mot svenskättlingen,/tv/nyheter/varlden/bidens-irritation-mot-svenskattlingen-hon-ar-min-chef/
Ger utslag vid skrevet – gör bisarra fyndet,/tv/nyheter/varlden/ger-utslag-vid-skrevet-gor-bisarra-fyndet/
18 besökare vårdas efter skandaloperan,/tv/nyheter/varlden/18-besokare-vardades-efter-skandaloperan/
JUST NU: Varnar för dricksvattnet,/nyheter/sverige/boende-i-ovanaker-och-bollnas-manas-koka-vattnet/
JUST NU: Person påkörd på E18,/nyheter/sverige/person-pakord-e18-avstangd/
JUST NU: Bombgruppen vid polishus – hög smäll,/nyheter/sverige/explosion-nara-polishuset-i-kristianstad/
Sveriges nya taktik: ”Vi behöver äga Östersjön”,/nyheter/sverige/sveriges-nya-taktik-vi-behover-aga-ostersjon/
Topphemliga svenska uppdraget: ”Intensivt”,/tv/nyheter/sverige/hemligheterna-inifran-svenska-ubaten-avslutar-dar/
Nu får marinen hjälp av Natos miniubåt,/nyheter/sverige/nu-far-marinen-hjalp--av-natos-miniubat/
Hittade skorpion i Shein-paket – levande,/nyheter/varlden/sofia-18-hittade-levande-skorpion-i-shein-paketet-/
"Isabella, 2, hittad död i barnvagnen",/nyheter/varlden/isabella-wheildon-2-hittad-dod-i-barnvagnen-misstanken-mot-mamman/
Ger utslag vid skrevet – bisarrt fynd,/tv/nyheter/varlden/ger-utslag-vid-skrevet-gor-bisarra-fyndet/
"Kenzie, 22, födde barn mitt i orkanen",/nyheter/varlden/kenzie-22-fodde-barn-mitt-under-orkanen-milton-i-florida/
Trump hyllar Xi Jinping: Han styr med järnhand,/nyheter/varlden/trump-hyllar-xi-jinping-han-styr-med-jarnhand/
Krisen i klubben efter dödsolyckan,/nyheter/sverige/fallskarmsolycka-i-vasteras/
Dödsolyckan fångades på film,/tv/nyheter/sverige/dodsolyckan-i-vasteras-fangades-pa-film/
Toni Alldén släpps i dag – stökiga förvandlingen,/nyheter/sverige/toni-allden-slapps-i-dag-stokiga-forvandlingen/
Gängledarnas pakt – tar kriget till Sverige,/nyheter/sverige/gangledarnas-pakt-med-iran-sa-tas-kriget-i-mellanostern-till-sverige/
"Amanda, 16, försvann – har hittats efter 19 år",/nyheter/varlden/amanda-16-forsvann-har-hittats-efter-19-ar-/
Finns det något som funkar mot förkylning?,/nyheter/kronikorer/amina-manzoor/hur-svart-ska-det-vara-att-fa-ett-forkylningsvaccin/
Katrina och Jenny dog i frontalkrocken,/nyheter/sverige/katrina-och-jenny-dog-i-frontalkrocken-begravs-tillsammans/
Skräcken i USA: Nu vill de fly till Sverige,/nyheter/varlden/deras-vanner-blev-rasister-nar-trump-vann-valet--skracken-i-usa-nu-vill-de-fly-till-sverige/
Sekten våldtog barn – nu dras Trumpväljare hit,/nyheter/varlden/sekten-valdtog-barn-nu-flockas-trumpvaljare-har/
Stordalens krogkonflikt – strider om jordgubben,/nyheter/varlden/stordalen-i-infekterat-brak-med-norsk-krogare/
Vägen in i krisen – så vände bröllopslyckan,/tv/nyheter/sverige/vagen-in-i-krisen-for-akesson-sa-vande-brollopslyckan/
Försökte mörda sin make 3 gånger – han saknar henne,/nyheter/varlden/forsokte-morda-sin-make-3-ganger-han-saknar-henne/
Vild krasch med Teslan – skyller på autopiloten,https://www.expressen.se/tv/nyheter/varlden/galen-krasch-med-teslan-skyller-pa-autopiloten/
Plötsligt fylls golvet av kryp – flyr i panik,https://www.expressen.se/tv/nyheter/varlden/plotsligt-fylls-golvet-av-kryp-flyr-i-panik-/
Föräldrar åtalas – fotade sina värnpliktiga barn,/nyheter/sverige/foraldrar-atalas-fotade-sina-varnpliktiga-barn/
Sista bilden och orden innan toppolitikerns död,/nyheter/varlden/sista-bilden-och-orden-innan-toppolitikerns-dod/
Polens plan: Ta bort asylrätten tillfälligt,/nyheter/varlden/polens-plan-ta-bort-asylratten-tillfalligt/
Richard Jomshofs ilska mot regeringen,/nyheter/sverige/jomshofs-ilska-mot-regeringen-om-tillbakadragna-motionen/
Blev nästan underkänd – doktorerar nu på Oxford,/nyheter/sverige/eleonora-25-blev-nastan-underkand-pa-fysikprovet-i-gymnasiet-i-dag-doktorerar-hon-pa-oxford-/
Minst sex döda – israelisk attack mot flyktingboende,https://www.expressen.se/tv/nyheter/varlden/minst-sex-doda-israelisk-attack-mot-flyktingboende/
"Hanna, 18, åkte tåg gratis genom Europa",/nyheter/sverige/hanna-18-akte-tag-gratis-genom-europa/
Historiska kyrkan slukas helt av meterhöga lågor,https://www.expressen.se/tv/nyheter/varlden/historiska-kyrkan-i-eldinferno-i-chile/
Niinistö: Vapenbrist hot mot Ukrainastöd,/nyheter/varlden/niinisto-mojligheterna-att-stodja-ukraina-minskar/
Släpptes i förtid – våldtog barn igen,/nyheter/sverige/valdtaktsmannen-slapptes-i-fortid-valdtog-barn-igen/
Konfronteras av Dumpen – två gånger om,/tv/nyheter/sverige/john-johansson-domd-for-21-valdtakter/
"Lucy, 20, sa upp sig efter en kväll: ”Panik”",https://www.expressen.se/tv/nyheter/varlden/lucy-20-slutar-barnvakta-direkt-efter-skrackkvallen
Fyra häktas för kvinnomord,/nyheter/sverige/fyra-begars-haktade-for-kvinnomord-i-eskilstuna/
Norska beslutet – efter svenskdådet,/nyheter/varlden/norge-infor-granskontroller/
Svenska kyrkan: Inget nej till brudöverlämning,/nyheter/sverige/svenska-kyrkan-inget-nej-till-brudoverlamning/
Man hittad död vid fotbollsplan,/nyheter/sverige/person-hittad-utomhus-i-boras-utreder-mordforsok/
Kvinna död – påkörd av buss vid stationen,/nyheter/sverige/kvinna-dod--pakord-av-buss-i-jakobsberg/
Knivhöggs vid matbutik – tonåring misstänks,/nyheter/sverige/pojke-misstanks-for-mordforsok-utanfor-butik/
SD-toppen tonar ner avslöjande: ”Liten sak”,/nyheter/sverige/sd-toppen-gustav-gellerbrant-om-akessons-brollop-liten-sak/
Mamma och dotter överfallna med kniv,/nyheter/sverige/polisinsats-pa-ekero-/
Biden viftar bort svenskättlingen,https://www.expressen.se/tv/nyheter/varlden/bidens-irritation-mot-svenskattlingen-hon-ar-min-chef
Ministerns panik efter Putins krav: ”Tyvärr,https://www.expressen.se/tv/nyheter/varlden/staller-egna-guvernoren-mot-vaggen-tyvarr
Fynd kan lösa 100-årig Mount Everest-gåta,/nyheter/varlden/fyndet-kan-losa-100-ariga-mount-everest-mysteriet/
Hittade tom motorbåt – sökinsats avbruten,/nyheter/sverige/larm-om-personer-overbord/
Dottern mördade sina föräldrar – dolde liken,/nyheter/varlden/dottern-mordade-sina-foraldrar-dolde-liken/
Svaret om lyxlivet: ”Kära någon”,/nyheter/sverige/revisorns-svar-om-bella-nilssons-lyxliv-ah-kara-nagon/
Vägen in i krisen – så vände bröllopslyckan,/tv/nyheter/sverige/vagen-in-i-krisen-for-akesson-sa-vande-brollopslyckan/
”Han ligger kvar livlös i vattnet”,/nyheter/sverige/expressen-dok-hamburgerkungen/
Sexjakten på författarna,/nyheter/sverige/oanstandiga-inviterna-sa-jagas-forfattarna/
Dykaren jagas för sabotaget,/nyheter/varlden/ukrainske-dykaren-volodymyr-zhuravlov-44-efterlyst-for-sprangningen-av-nord-stream/
Miljonlöner på Northvolt,/nyheter/sverige/sa-mycket-tjanar-northvolt-topparna/
