Heading,URL
Kaos ombord – fripassageraren får panik,/tv/nyheter/varlden/kaos-ombord-fripassageraren-far-panik/
Israels i kraftig offensiv – vill hindra rebellerna,/tv/nyheter/varlden/gigantisk-explosion-israel-slar-ut-vapendepa/
Oväntade duellen – sen eskalerar det,/tv/nyheter/varlden/ovantade-duellen-sen-eskalerar-det/
Kvinnan får panik – och flyr mitt i maten,/tv/nyheter/varlden/kvinnan-far-panik-och-flyr-fran-maten/
Udda insatsen – fiskar upp bil ur inomhuspool,/tv/nyheter/varlden/udda-insatsen-fiskar-upp-bil-ur-inomhuspool/
JUST NU: Explosion i Moskva,/nyheter/varlden/uppgifter-rysk-general-dod-i-explosion/
Fyraårige Erik dog efter operationen,/nyheter/sverige/fyraarige-erik-dog-efter-operationen-sista-julen/
Israels i kraftig offensiv – vill hindra rebellerna,https://www.expressen.se/tv/nyheter/varlden/gigantisk-explosion-israel-slar-ut-vapendepa/
"Lisa, 48, har haft sex med flest – på ett dygn",/nyheter/varlden/lisa-sparks-har-haft-sex-med-flest-pa-ett-dygn-morka-sanningen-bakom-rekordet/
Magsjukan på svenska turistön: ”Mardröm”,/nyheter/varlden/magsjukan-pa-svenska--turiston-en-mardrom/
Taxi Stockholm ger upp: ”Åk med ert skitbolag”,/nyheter/sverige/taxi-stockholm-ger-upp-ak-med-ert-skitbolag/
Bolt-chauffören Rashid avslöjar fusket: ”Rädd”,/nyheter/sverige/bolt-foraren-rashid--avslojar-fusket-radd/
Så lite får chaufförerna – medan ägarna blir rika,/nyheter/sverige/uber-tjanar-miljarder-sa-lite-far-forarna/
Flicka pekas ut som skytt i skolskjutning,/nyheter/varlden/skjutning-pa-kristen-skola-i-usa/
Så lever chaufförerna som kör din Uber-taxi,/nyheter/laget/taxiapparna-uber-och-bolt-granskas-tuffa-arbetsvillkor-och-laga-loner/
Hon firade smekmånad i turistparadis – mördades,/nyheter/varlden/hon-firade-smekmanad-i-turistparadis-mordades/
Kaos ombord planet – fripassageraren får panik,https://www.expressen.se/tv/nyheter/varlden/kaos-ombord-fripassageraren-far-panik
Flickornas ord om mordet på Emilia,/nyheter/krim/flickornas-berattelse-om-dagen-nar-emilia-mordades/
20-åriga Valles galna upptäckt på toaletten,/tv/nyheter/sverige/20-ariga-valles-galna-upptackt-pa-toaletten/
Nya skräcklandningen på Heathrows flygplats,/tv/nyheter/varlden/nya-skracklandningen-pa-heathrows-flygplats/
Våldsam krasch med tvillingbebisar i bilen,/tv/nyheter/varlden/valdsam-krasch-med-tvillingbebisar-i-bilen/
Här förolämpar syrier ryska militärkolonnen,/tv/nyheter/varlden/har-forolampar-syrier-ryska-militarkolonnen/
Ryssens fräcka stöld – mitt på ljusa dagen,/tv/nyheter/varlden/ryssens-fracka-stold-tar-julgran-/
Rosa ljusfenomen på himlen förbryllar,/tv/nyheter/varlden/rosa-ljusfenomen-pa-himlen-forbryllar/
Såriga hudtrenden skrämmer följarna,/tv/nyheter/varlden/hudtrenden-skrammer-foljarna-recept-pa-katastrof/
Plötsligt kollapsar ett sexvåningshus i Iran,https://www.expressen.se/tv/nyheter/varlden/plotsligt-kollapsar-ett-sexvaningshuset-i-iran
Anklagelserna mot CNN-stjärnan efter reportaget,/nyheter/varlden/anklagelserna-mot-cnn-stjarnan-efter-omtalat-reportage/
Dödläge i Kattegatt – gåtan för utredarna,/nyheter/sverige/dodlaget-i-kattegatt-efter-kabelbrotten/
Underhållande duell – sen eskalerar det,https://www.expressen.se/tv/nyheter/varlden/ovantade-duellen-sen-eskalerar-det/
Skjutning – man och kvinna hittade skadade,/nyheter/sverige/tva-skadade-i-vaxjo/
Kraftig uppgång för Elon Musks Tesla,/nyheter/varlden/it-bolag-vinnare-pa-usa-borsen/
Kremls hyllning till Trump om vapnen,/nyheter/varlden/kreml-efter-beskedet-om-vapnen-trump-forstar/
Pappans dubbelliv avslöjat – har lett till mångmiljontvist,/nyheter/varlden/pappans-dubbelliv-avslojat-har-lett-till-mangmiljontvist/
Nya detaljer om miljardärens död,/nyheter/varlden/sag-sin-far-storta-150-meter-mot-sin-dod/
Arga debatten i SVT: ”Skyddar pedofiler”,/nyheter/sverige/arga-debatten-i-svt--skyddar-pedofiler/
Udda insatsen – bilen kraschar ner i poolen,https://www.expressen.se/tv/nyheter/varlden/udda-insatsen-fiskar-upp-bil-ur-inomhuspool/
Tsunamivarning efter kraftig jordbävning,/nyheter/varlden/kraftig-jordbavning-i-stilla-havet-tsunamivarning/
Källor: Trump överväger demokrat för topp-post,/nyheter/varlden/kallor-trump-overvager-demokrat-for-topp-post/
Domare vägrar undanröja Trumpdom om porrstjärna,/nyheter/varlden/domare-vagrar-undanroja-trumpdom-om-porrstjarna/
Plan tvingades nödlanda – på grund av 100 grisar,/nyheter/varlden/plan-tvingades-nodlanda-pa-grund-av-100-grisar/
Kvinnan får panik – flyr mitt i maten,https://www.expressen.se/tv/nyheter/varlden/kvinnan-far-panik-och-flyr-fran-maten/
JUST NU: Minst fem döda i skolskjutning,/nyheter/varlden/skjutning-pa-kristen-skola-i-usa/
Sågar ”sinnessjukt stora” satsningen,/nyheter/sverige/satsningen-pa-ny--karnkraft-doms-ut/
Sjöstedt drog S-väljare –hon pekas ut: ”Sänke”,/nyheter/sverige/jonas-sjostedt-lockade-s-valjare-exceptionellt/
Kalendern upprör konsumenter: ”Wtf”,https://www.expressen.se/tv/nyheter/varlden/forvaningen-nar-de-oppnar-luckan-i-populara-adventskalendern
Tio minusgrader kallare än normalt,/nyheter/sverige/ovanligt-kallt-i-norr-supervarmt-i-soder/
Störtade diktatorns ord: ”Flydde inte”,/nyheter/varlden/assads-forsta-ord/
Här förolämpar syrier ryska militärkolonnen,/tv/nyheter/varlden/har-forolampar-syrier-ryska-militarkolonnen/
Höggs med kniv mitt i ett samtal,/nyheter/sverige/kvinna-dod-i-sigtuna/
Här kollapsar Trumps 27-årige rådgivare,https://www.expressen.se/tv/nyheter/varlden/politikern-faller-handlost-av-scen
Sågningen av S lotteri: Brustit,/nyheter/sverige/kritiken-s-har-brustit-i-kontroll-av-lotteriet/
Olaf Scholz faller i förtroendeomröstning,/nyheter/varlden/olaf-scholz-faller/
Rysslands erkänner efter fartygskrock,/nyheter/varlden/ryssland-bekraftar-oljelackage-utanfor-krim/
37 döda av farlig sprit i turiststaden,/nyheter/varlden/37-doda-av-farlig-sprit-i-istanbul/
Bilist har kraschat in i vägg på skola,/nyheter/sverige/bilist-har-kort-in-i-vagg-i-uddevalla/
"Vad hände då Molly, 14, dog?",/nyheter/sverige/mollys-hemlighet-sista-festen-som-tar-hennes-liv/
Mörkade läckor för regeringen,/nyheter/sverige/las-expressens-avslojanden-om-skandalen-pa-lantmateriet/
Så lite tjänar förarna för Uber och Bolt,/tv/nyheter/sverige/taxislavarna-sa-lite-tjanar-forarna-for-uber-och-bolt/
Namnbytet efter ilskan,/nyheter/sverige/jag-ar-hatad-for-fan-av-halva-sverige/
