Heading,URL
Ingen beredd när himlen täcks över nöjesparken,/tv/nyheter/varlden/ingen-beredd-nar-himlen-tacks-pa-nojesparken/
Landningen på vattnet slutar i förfärlig krasch,/tv/nyheter/varlden/landningen-pa-vattnet-slutar-i-forfarlig-krasch/
Tre nyheter i Apples satsning på AI,/tv/ditv/nyheter/tre-nyheter-i-apples-satsning-pa-ai/
Tusentals mystiska maskar ger rysningar,/tv/nyheter/varlden/tusentals-mystiska-maskar-ger-rysningar/
"Annas, 16, syrliga svar efter hånet på nätet",/tv/nyheter/varlden/annas-16-syrliga-svar-efter-hanet-pa-natet/
Nytt mystiskt ryskt fordon vid fronten,/tv/nyheter/varlden/nytt-mystiskt-ryskt-fordon-vid-fronten-jagas-av-dronare/
Putins förvirring på scenen inför världsledarna,/tv/nyheter/varlden/putins-forvirring-pa-scenen-infor-varldsledarna/
Turismilskan sprider sig – har nu nått Menorca,/tv/nyheter/varlden/turismilskan-sprider-sig-har-nu-natt-menorca/
Missen i SVT:s sändning: ”En märklig bild”,/tv/nyheter/sverige/missen-i-svts-sandning-en-marklig-bild/
JUST NU: Fem medvetslösa i husvagn,/nyheter/varlden/fem-hittade-medvetslosa-i-husvagn-i-norge/
JUST NU: Totalstopp för tågen,/nyheter/sverige/elfel-vid-stockholms-centralstation/
Mördarens hotellnatt med sin fångvaktare: ”Jätteledsen över det”,/nyheter/sverige/mordarens-hotellnatt-med-sin-fangvaktare-jatteledsen-over-det/
Lång lämnar riksdagen – orden om rasistsången,/nyheter/sverige/david-lang-lamnar-riksdagen-efter-sangen/
Gina tricot gav löfte om skog: ”Greenwashing”,/nyheter/sverige/ingrosso-och-gina-tricot-lovade-kunderna-skog-det-luktar-greenwashing/
16-åriga Annas syrliga svar efter hånet på nätet,/tv/nyheter/varlden/annas-16-syrliga-svar-efter-hanet-pa-natet/
Svenska spökträdet på kyrkogården chockar,/tv/nyheter/sverige/spoktradet-pa-kyrkogarden-forbryllar/
Folklistans galna fest i natt: ”Inte som andra”,/nyheter/folklistans-galna-fest-i-natt-inte-som-andra/
Så röstade dina grannar – sök själv,/nyheter/sverige/sa-rostade-dina-grannar-i-eu-valet-2024-sok-har-/
”Jag kände: Varför ska jag behöva dö på jobbet?”,/nyheter/sverige/marika-enda-som-overlevde-mattias-flinks-massaker/
Politikerns intima stund – glömmer bort kameran,https://www.expressen.se/tv/nyheter/varlden/pinsamma-stunden-politiker-glommer-bort-kameran-
Societetskvinna dödade två pojkar – får fängelse,/nyheter/varlden/societetskvinna-dodade-tva-pojkar-far-fangelse/
Mosleys sista minuter – innan döden på ön,/nyheter/varlden/mosleys-sista-minuter-innan-doden-pa-on/
Gåtan efter dödsfallet – hur kunde han missas?,/nyheter/varlden/fem-dagars-sokande-anda-missades-michael-mosley/
SD:s historiska tapp – framgångssagan bruten,/nyheter/laget/sds-historiska-tapp-framgangssagan-bruten/
Grova våldschattarna innan brutala mordet,/nyheter/sverige/polisen-misstanker-grova-chattarna-innan-han-mordade-kvinnan/
Turisternas mardröm på stranden: Vad är det där?,https://www.expressen.se/tv/nyheter/varlden/tusentals-mystiska-maskar-ger-rysningar/
Ingen beredd när himlen täcks över nöjesparken,https://www.expressen.se/tv/nyheter/varlden/ingen-beredd-nar-himlen-tacks-pa-nojesparken
Putins soldatblunder – experten: ”Kanonmat”,/tv/nyheter/varlden/joakim-paasikivi-det-tyder-pa-rysk-desperation/
Så många av Wagners soldater dog i Bachmut,/nyheter/varlden/siffrorna-visar-sa-manga-wagner-soldater-dog-i-bachmut/
Misstänkt våldtäkt i Stockholm – en gripen,/nyheter/sverige/misstankt-valdtakt-i-stockholm/
Positivt besked efter förslag om vapenvila,/nyheter/varlden/fn-overens-om-vapenvila-i-gaza/
Här fritas gisslan – stormar lägenhet,/tv/nyheter/varlden/har-fritas-gisslan-stormar-lagenhet/
Åklagare åtalas för läcka om gängmord,/nyheter/sverige/aklagare-atalas-for-att-ha--lackt-hemlig-information-om-mord/
Paasikivi: ”Det tyder på rysk desperation”,https://www.expressen.se/tv/nyheter/varlden/joakim-paasikivi-det-tyder-pa-rysk-desperation/
Experterna om Trumps val: Då är han en dåre,/nyheter/varlden/experterna-om-trumps-val-da-ar-han-en-dare/
Landningen på vattnet slutar i förfärlig krasch,https://www.expressen.se/tv/nyheter/varlden/landningen-pa-vattnet-slutar-i-forfarlig-krasch/
Varg simmade ut till ön – dödade tio får,/nyheter/sverige/varg-simmade-till-o-dodade-tio-far-hemskt/
"Annas, 16, syrliga svar efter hånet på nätet",https://www.expressen.se/tv/nyheter/varlden/annas-16-syrliga-svar-efter-hanet-pa-natet/
Pressar regeringen: Bygg vägar med privata pengar,/nyheter/sverige/ekonomen-ta-in-privata-pengar-till-investeringar/
Studieförbund krävs på bidragspengar,/nyheter/sverige/region-stockholm-kraver-tillbaka-bidrag-fran-ibn-rushd/
I jakt på en silverkula för vikten försvinner förnuftet,/nyheter/kronikorer/amina-manzoor/i-jakt-pa-en-silverkula-for-vikten-forsvinner-fornuftet/
Bildbeviset: Här angreps Rysslands superflygplan,/nyheter/varlden/kriget-i-ukraina-10-juni/
Biljätte satsar 100-tals miljarder på bensinbilar,https://teknikensvarld.expressen.se/nyheter/bilbranschen/volkswagen-satsar-hundratals-miljarder-pa-bensin--och-dieselbilar/
Demonstranter tog sig in – larmet: ”I byggnaden”,/nyheter/sverige/demonstranter-tog-sig-in-i-universitetsbyggnad/
"Jakob, 15, mördades – mobilfilmen bevis",/nyheter/sverige/tonaringar-atalas-for-mordet-pa-jakob-i-orkelljunga/
Alla jublar – sekunden senare utbryter panik,https://www.expressen.se/tv/nyheter/varlden/publiken-jublar-sekunden-senare-utbryter-panik
Plan med Malawis vicepresident försvunnet,/nyheter/varlden/plan-med-malawis-vicepresident-forsvunnet/
Ryskt militärplan kränkte luftrum,/nyheter/varlden/ryskt-militarplan-krankte-luftrum/
Häktas efter mordet på rapparen C.Gambino,/nyheter/sverige/haktas-efter-mordet-pa-cgambino/
Putins lycka i valet: ”Är nog glad i dag”,/nyheter/varlden/sa-bra-gick-eu-valet-for-putin-nog-glad-idag/
Drar ner turistens shorts när de ser vad han gjort,https://www.expressen.se/tv/nyheter/varlden/drar-i-turistens-shorts-nar-hon-inser-vad-han-gjort
Youcefis skärmångest – efter missarna i SVT,/nyheter/sverige/fouad-youcefi-nervos-nastan-hela-kvallen/
Inifrån SD:s valvaka: ”Då hände en grej”,/nyheter/sverige/inifran-sds-valvaka-da-hande-en-grej/
Putins miss på scen inför världsledarna,https://www.expressen.se/tv/nyheter/varlden/putins-forvirring-pa-scenen-infor-varldsledarna
Skräckdag på stranden: ”Herregud! Herregud!”,/tv/nyheter/varlden/tre-hajattacker-skrackdagen-pa-stranden/
Macrons historiska fiasko – upplöser parlamentet,/nyheter/varlden/macrons-historiska-fiasko-upploser-parlamentet/
Sista vittnet om mordet på Einár,/nyheter/sverige/sista-vittnet-om-mordnatten-da-einar-dodades/
