Heading,URL
Här slukas huset av vattenmassorna,/tv/nyheter/varlden/har-slukas-huset-av-vattenmassorna/
Försvarar staden som fångat Putins intresse,/tv/nyheter/varlden/forsvarar-staden-som-fangat-putins-intresse/
Ilskan efter Northvolts skrotade fabriksplan: ”Inte bara skitsnack”,/tv/nyheter/sverige/ilskan-efter-northvolts-skrotade-fabriksplan-inte-bara-skitsnack/
Harrys känslosamma ord om mamma Diana,/tv/nyheter/varlden/hor-prins-harrys-kanslosamma-ord-om-diana/
Tågkrasch i Ryssland – många skadade,/tv/nyheter/varlden/tag-sparade-ur-i-ryssland-manga-skadade/
"Maedin, 19, dog efter passet på Northvolt",/tv/nyheter/sverige/maedin-19-dog-efter-passet-pa-northvolt-/
JUST NU: Fler företag anmälda för gift i smink,/nyheter/sverige/fler-foretag-anmalda-for-gift-i-smink/
Kritikbomb mot Biden: ”Är körd”,/nyheter/varlden/panik-hos-demokrater-efter-bidens-insats-i-debatten/
Domen efter debatten: Trump ljög allra mest,/nyheter/varlden/domen-efter-debatten-trump-ljog-allra-mest/
Biden tappar tråden i debatten,/tv/nyheter/varlden/biden-tappar-traden-i-debatten/
Harris om Bidens insats: Trög start,/nyheter/varlden/vicepresidenten-om-bidens-insats-trog-start/
Trump avbröt Biden över 100 gånger,/tv/nyheter/varlden/trump-avbrot-biden-over-100-ganger/
Varnar för skyfall – ovädret drar in,/nyheter/sverige/varning-for-skyfall-/
Skansen-Jonas: Därför får jag ha lemurer,/tv/nyheter/sverige/overraskningen-pa-promenaden-har-dyker-lemurerna-upp-pa-liso/
Rånarens dråpliga miss,/tv/nyheter/varlden/ranarens-drapliga-miss-hittar-inte-handtaget/
Här gasar båten – rakt mot badgästerna,/tv/nyheter/varlden/baten-gasar-rakt-mot-badgasterna-pa-stranden/
Källor: S allt mer öppna för Vänstern i regering,/nyheter/sverige/okad-oppenhet-inom-s-for-vansterpartiet-i-regering/
Utrop på flygplatsen: ”Annika Strandhäll”,/nyheter/sverige/utropet-pa-flygplatsen--annika-strandhall-/
”Man behöver en örfil ibland”,/nyheter/sverige/se-samtalen-fran-expressen-i-almedalen-torsdag-27-juni/
Putins brutala taktik vid ukrainska fronten,/nyheter/varlden/putins-brutala-taktik--vid-ukrainska-fronten/
Soldaterna larmar: ”Vi är som köttbitar”,/nyheter/varlden/putins-soldater-larmar--vi-ar-som-kottbitar-/
Här skakar Putin hand – tar det aldrig slut?,/tv/nyheter/varlden/putin-utdelar-evighetslangt-handslag/
Här får du grilla – och här är det stopp,/nyheter/laget/det-galler-nar-skarpt-eldningsforbud-rader/
Hedins bakslag – inga pengar för angreppet,/nyheter/sverige/karl-hedin-stamde-staten-efter-angrepp-pa-skog-far-nej-i-domstol/
Familjen sökte upp kvinnan i Norrland,/nyheter/sverige/uppgifter-mordade-kvinnan-i-lessebo-fruktade-for-sitt-liv/
22-åring mördad – vännerna: ”Ängel”,/nyheter/sverige/atervande-fran-liv-med-skyddad--identitet-mordades-i-lessebo/
Sexklubben inifrån: Ett lekland för vuxna,/nyheter/sverige/vuxenklubben-som-ett-lekland-for-vuxna/
"Dominic, 26, hittades död efter fest i Solna",/nyheter/sverige/militaren-dominic-26-hittades-dod-i-stockholm/
V nobbar Pride – för att Donken sponsrar,/nyheter/sverige/v-nobbar-pride-for-att-donken-sponsrar/
Rädslan på Northvolt: ”Många vill inte jobba”,/nyheter/sverige/radslan-pa-northvolt-manga-vill-inte-jobba-inne/
”Oerhört tragiskt att tre personer gått bort”,/nyheter/sverige/oerhort-tragiskt-att-tre-personer-har-gatt-bort/
Ilskan efter Northvolts skrotade fabriksplan,https://www.expressen.se/tv/nyheter/sverige/ilskan-efter-northvolts-skrotade-fabriksplan-inte-bara-skitsnack
Misshandelsdom mot Fredrik Berne står fast,/nyheter/sverige/hd-domen-mot-kirurgen-fredrik-berne-star-fast/
ÖB: Vi som bestämmer om kärnvapen i Sverige,/nyheter/sverige/ob-om-risken-for-karnvapen-vi-bestammer/
Stal kontokort från äldre patienter – får fängelse,/nyheter/sverige/kvinna-stal-kontokort-fran-aldre-patienter-doms-till-fangelse/
Mamman tar pengar från insamlingen: Mat,/nyheter/varlden/mamman-tar-pengar-fran-insamlingen-matkostnad/
Hotfulla meddelandet efter försvinnandet,/nyheter/varlden/hotfulla-meddelandet-om-forsvunne-19-aringen/
Ryska draget inför presidentdebatten,/nyheter/varlden/pro-ryska-konton-sprider-falska-artiklar-infor-debatten-mellan-biden-och-trump/
Skyttedal om framtiden – fiaskot med Folklistan,/nyheter/sverige/skyttedal-om-framtiden-efter-fiaksot-med-folklistan-enda-rimliga/
SD-avhopparen vädjar: ”Måste släppa namnet”,/nyheter/sverige/vadjan-till-jan-emanuel-maste-slappa-namnet/
Kängan från S: ”Blev inte så framgångsrikt”,/nyheter/sverige/jan-emanuel-har-sokt-om-medlemskap-i-s-igen/
Bästa kommunen korad – men här är det sämst,/nyheter/sverige/basta-kommunen-att-bo-i/
Här slukas huset av vattenmassorna,/tv/nyheter/varlden/har-slukas-huset-av-vattenmassorna/
Efter ryska efterlysningen: ”Ses som en förrädare”,/nyheter/sverige/erik-53-de-har-kontakt-med-nummer-ett-i-kreml/
Detaljerna om Åkessons bröllop – KD-topp viger,/nyheter/sverige/detaljerna-om-akessons-brollop-jimmie-satsar/
SVT-chefen skulle mördas – var 53 steg ifrån platsen,/nyheter/sverige/hanna-stjarne-skulle-mordas-var-53-steg-ifran/
Reinfeldt om Trump: ”Argare och farligare”,/nyheter/sverige/reinfeldt-om-trump-argare-och-farligare/
Vi behöver också tänka på värmen som riskfylld,/nyheter/kronikorer/amina-manzoor/vi-behover-ocksa-tanka-pa-varmen-som-riskfylld/
Skansen-Jonas: Därför får jag ha lemurer hemma,https://www.expressen.se/tv/nyheter/sverige/overraskningen-pa-promenaden-har-dyker-lemurerna-upp-pa-liso
Pojkens ord till polisen: ”Äh – bara två år på LVU”,/nyheter/sverige/pojkens-ord-till-polisen-ah-bara-tva-ar-pa-lvu/
Varningen: Ännu fler konkurser kan vänta,https://teknikensvarld.expressen.se/nyheter/bilbranschen/storkonkurs-i-svensk-fordonsindustri-underleverantoren-iac-klarar-inte-skulderna/
Slår till mot knarkubåt utanför Kanarieöarna,/tv/nyheter/varlden/razzia-mot-knarkubat-utanfor-kanarieoarna/
Kvinna gripen för bomb mot israeliskt företag,/nyheter/sverige/kvinna-och-man-gripna-for-bomb-mot-israeliskt-foretag-/
Fästingarna får hjälp av klimatförändringarna,/nyheter/kronikorer/amina-manzoor/fastingarna-far-hjalp-av-klimatforandringarna/
Nya fästingarten kan bära blödarfeber,/nyheter/sverige/bergsfastning-i-sverige-kan-bara-blodarfebervirus/
SL-buss besköts – flera rutor krossades,/nyheter/sverige/buss-beskjuten/
Skräcken när karusellen fastnar – 20 meter upp,https://www.expressen.se/tv/nyheter/varlden/skracken-nar-karusellen-fastnar-20-meter-upp-i-luften
Israels militär beordrar Gazabor: Evakuera nu,/nyheter/varlden/israels-militar-beordrar-gazabor-evakuera-nu/
Riksbanken öppnar för tre sänkningar i år,/nyheter/sverige/riksbanken-presenterar-rantebesked/
9-åriga Hanan: ”De har berövat mig min hud”,/nyheter/varlden/9-ariga-hanan-i-gaza-de-har-berovat-mig-min-hud/
Harrys känslosamma ord om mamma Diana,https://www.expressen.se/tv/nyheter/varlden/hor-prins-harrys-kanslosamma-ord-om-diana
Vädjar till Nato – om lönnmord,/nyheter/varlden/ryskt-skuggparlament-ber-om-stod-for-lonnmord/
Försvarar staden som fångat Putins intresse,/tv/nyheter/varlden/forsvarar-staden-som-fangat-putins-intresse/
Se eldkaoset i fabriken efter batteriexplosionen,https://www.expressen.se/tv/nyheter/varlden/paniken-i-fabriken-efter-explosionen
"Här är sista bilderna på Maedin, 19, i livet",/tv/nyheter/sverige/maedin-19-dog-efter-passet-pa-northvolt-/
19-årige Maedin dog efter Northvolt-pass,/nyheter/sverige/19-arige-maedin-dog-efter-northvolt-jobb-orolig-att-do/
Northvolt mörkade sin sjukskrivna ordförande,/nyheter/sverige/northvolt-har-morkat-sin-ordforandes-sjukskrivning/
Lärare hade sex med elev – kan förlora legitimation,/nyheter/sverige/larare-hade-sex-med-elev-riskerar-bli-av-med-legitimationen/
Tågkrasch i Ryssland – många skadade,/tv/nyheter/varlden/tag-sparade-ur-i-ryssland-manga-skadade/
Putins spionbilar kör runt fritt i Stockholm,/nyheter/sverige/putins-spionbilar-kor-runt-fritt-i-stockholm-avslojas-av-detaljen/
Sista vittnet om mordet på Einár,/nyheter/sverige/sista-vittnet-om-mordnatten-da-einar-dodades/
