Heading,URL
Världens längsta och kortaste kvinna möts,/tv/nyheter/varlden/varldens-langsta-och-kortaste-kvinna-mots/
Putins nya hot mot väst: ”Fundera över det”,/tv/nyheter/varlden/putins-skarpa-hot-mot-vastlanderna-fundera-over-det/
Här träffas staden av massiva ryska vapnet,/tv/nyheter/varlden/har-traffas-staden-av-det-massiva-vapnet/
Här grips misstänkt svensk barn-torped,/tv/nyheter/varlden/har-grips-misstankt-svenskt-torped-barn/
Polisen fick larm från Brandon – sköt honom,/tv/nyheter/varlden/polisen-fick-larm-fran-brandon-skot-honom/
Folktomma gator och plogbilar i skytteltrafik,/tv/nyheter/sverige/folktomma-gator-och-plogbilar-i-skytteltrafik/
"Ringer mitt i pressträffen:
”Prata inte om robotarna”",/tv/nyheter/varlden/ringer-mitt-i-presstraffen-prata-inte-om-robotarna/
"Tusentals Nato-soldater
övar – vid ryska gränsen",/tv/nyheter/varlden/tusentals-soldater-fran-nato-vid-ryska-gransen/
JUST NU: Polisen river tältläger,/nyheter/sverige/polisen-river-palestina-lager-i-goteborg/
JUST NU: SMHI:s nya snövarning,/nyheter/sverige/smhi-varnar-i-skane/
Mörkret: Tusentals utan ström i ovädret,/nyheter/sverige/tusentals-utan-el-i-skelleftea--nar-snoovadret-blir-som-varst/
Här avslöjas högsta chefens osanningar om läckta uppgifter,/nyheter/sverige/har-ar-dokumenten-som-avslojar-generaldirektoren/
Försvarshemligheter läckte ut trots larmen,/nyheter/sverige/chefen-stoppade-inte-lacka-trots-larm-om-forsvarshemligheter/
Förra ÖB slår fast: ”Tredje världskriget har börjat”,/nyheter/varlden/ukrainas-forra-ob-tredje-varldskriget-har-borjat/
Putins nya skarpa hot mot väst i tv-sänt tal,https://www.expressen.se/tv/nyheter/varlden/putins-skarpa-hot-mot-vastlanderna-fundera-over-det
Förlusterna i oktober: 1 500 döda – per dag,/nyheter/varlden/putins-forluster-i-oktober-1-500-soldater--per-dag/
Tusentals brottslingar kan fängslas – till sjöss,/nyheter/sverige/kriminalvarden-utreder-fangelseskepp/
Kaoset på Rusta: ”Sjukaste jag sett”,/nyheter/sverige/kaos-pa-rusta-butiker-i-sverige-alla-vill-ha-dyson-dupe/
Instängd i Putins stora paket till Kim,/tv/nyheter/varlden/instangd-i-putins-paket-till-jong-un/
Föräldrarna går till attack i skolan,/tv/nyheter/varlden/foraldrarna-gar-till-attack-i-skolan/
Så bra är nya tv-serien om helikopterrånet,/nyheter/laget/sa-bra-ar-nya-tv-serien-om-helikopterranet/
Affären blev slutet för Gyllenhammar i Volvo,/nyheter/sverige/pg-gyllenhammars-liv-som-folkkar--bors-vd-stolt-over-mina-misstag/
PG Gyllenhammar är död – blev 89 år,/nyheter/sverige/pg-gyllenhammar-dod/
Ringer mitt i pressträff: ”Prata inte om ...”,/tv/nyheter/varlden/ringer-mitt-i-presstraffen-prata-inte-om-robotarna/
Här grips misstänkt svensk barn-torped,/tv/nyheter/varlden/har-grips-misstankt-svenskt-torped-barn/
Här exploderar bilen – hög rysk militär död,/tv/nyheter/varlden/har-detonerar-bilbomben-hogt-uppsatt-rysk-militar-dodad/
Bröllopsvideon viral – endast fem gäster kom,/tv/nyheter/varlden/brollopsvideon-viral-endast-fem-gaster-kom/
Trumps varning: ”Största hotet mot västvärlden”,/tv/nyheter/varlden/trumps-varning-storsta-hotet-mot-vastvarlden/
Sällsynta kampen – lejon vs noshörning,/tv/nyheter/varlden/sallsynta-kampen-lejon-vs-noshorning-/
Minorna överraskar – kör rakt in i döden,/tv/nyheter/varlden/minorna-overraskar-ryssarna-helt-kor-rakt-in-i-doden-/
Här kämpar Biden för att hålla sig på benen,/tv/nyheter/varlden/bidens-osakra-steg-vacker-halsofragor/
Hög rysk militär sprängd i sin bil,/tv/nyheter/varlden/hog-rysk-militar-sprangd-i-sin-bil/
Musks pappa: Elon skämdes över Trump,/nyheter/varlden/elon-musks-pappa-avslojar-sonens-plan-med-trump/?referrer=29
Cuf-toppar rasar mot varandra efter utspel,/nyheter/sverige/cuf-toppar-rasar-mot-varandra-efter-utspel/
C-ledningen splittrad – Demirok allt mer ensam,/nyheter/sverige/demirok-far-inget-stod-kritiken-mot-gruppledaren/
Trump gav upp – efter desperata samtalen,/nyheter/varlden/samtalet-fran-donald-trump-innan-matt-gaetz-avhopp/
Hon är Trumps nya val efter avhoppet,/nyheter/varlden/trump-nominerar-bondi-till-justitieminister/
Rekordmötet – världens längsta och kortaste ses,https://www.expressen.se/tv/nyheter/varlden/varldens-langsta-och-kortaste-kvinna-mots
"Varnar i turistparadiset – Bianca, 19, död av drink",/nyheter/varlden/19-ariga-turisten-bianca-dod-drack-spetsade-drinkar-i-laos/
Två SJ-tåg evakuerade – fordonsfel upptäckta,/nyheter/sverige/tva-sj-tag-evakueras/
Kristersson och Pehrson rasar: ”De bör utvisas”,/nyheter/sverige/johan-pehrson-rasar-mot-aktivister-liberalernas-kansli-vandaliserat/
Netanyahu pressad – anklagas för ”svek”,/nyheter/varlden/netanyahu-pressad-av-anklagelser-fran-alla-hall/
Vill gripa Netanyahu för krigsförbrytelser,/nyheter/varlden/arresteringsorder-for-netanyahu/
Ryska ilskan: Direkt involverade i kriget,/nyheter/varlden/rysk-ilska-mot-storbritannien/
Områdena som drabbas hårdare av snökanoner,/nyheter/sverige/gavle-och-skelleftea-extra-utsatta-for-snokanoner/
Folktomma gator och plogbilar i skytteltrafik,/tv/nyheter/sverige/folktomma-gator-och-plogbilar-i-skytteltrafik/
Bidens nya drag innan Trump blir president,/nyheter/varlden/biden-vill-skriva-av-skuld-pa-50-miljarder/
Kristersson om Putins robot: ”Vill skrämmas”,/nyheter/varlden/ryssland-har-avfyrat-interkontinental-robot/
Brandon larmade – blev själv skjuten av polisen,https://www.expressen.se/tv/nyheter/varlden/polisen-fick-larm-fran-brandon-skot-honom
Transkvinnan jagades – slogs ner vid mack,/tv/nyheter/har-attackeras-transkvinnan/
S kräver ökad säkerhet i julhandeln: ”Larmbågar”,/nyheter/sverige/socialdemokraterna-kraver-okad-sakerhet-i-julhandeln/
Jakten på svar efter olösta mordet på Einár,/nyheter/sverige/jakten-pa-svar-efter--olosta-mordet-pa-einar/
Här slår Volvo de tyska märkena på fingrarna,https://teknikensvarld.expressen.se/nyheter/bilbranschen/volvo-saljer-fler-elbilar-an-audi-och-mercedes-i-hela-varlden/
Tusentals Nato-soldater övar – vid ryska gränsen,/tv/nyheter/varlden/tusentals-soldater-fran-nato-vid-ryska-gransen/
Det betyder dödsfallet för de populära fetmamedlen,/nyheter/kronikorer/amina-manzoor/det-betyder-dodsfallet-for-de-populara-fetmamedlen/
Tony Blairs högra hand John Prescot är död,/nyheter/varlden/blairs-vice-premiarminister-john-prescott-dod-/
Mykoplasma fortsätter att sprida sig i hela Sverige,/nyheter/sverige/mykoplasma-fortsatter-att-sprida-sig-i-hela-sverige/
UD varnar för sprit efter dödsfall i Laos,/nyheter/sverige/ud-varnar-for-sprit-i-laos/
Här exploderar bilen – hög rysk militär död,/tv/nyheter/varlden/har-detonerar-bilbomben-hogt-uppsatt-rysk-militar-dodad/
Advokaten Zinar Budak har släppts ur häktet,/nyheter/sverige/advokaten-zinar-budak-har-slappts-ur-haktet/
Isländsk vulkan har vaknat – lavafloden,https://www.expressen.se/tv/nyheter/varlden/islandsk-vulkan-har-vaknat-lavafloden
Demirok slår tillbaka: Vill skapa turbulens,/nyheter/sverige/demirok-slar-tillbaka-vill-skapa-turbulens/
Hon pekas ut – leder ”kupp” mot Demirok,/nyheter/sverige/muharrem-demirok-samlar-stod-thand-ringqvist-pekas-ut-for-kuppforsok/
Fångvaktare riskerar straff efter trekanten,/nyheter/sverige/fangvaktarna-riskerar-straff-efter-trekanten/
"Vad hände då Molly, 14, dog?",/nyheter/sverige/mollys-hemlighet-sista-festen-som-tar-hennes-liv/
Här grips misstänkt svensk barn-torped,/tv/nyheter/varlden/har-grips-misstankt-svenskt-torped-barn/
Namnbytet efter ilskan,/nyheter/sverige/jag-ar-hatad-for-fan-av-halva-sverige/
