Heading,URL
Stoppar okontrollerade färden – tonåring hyllas,/tv/nyheter/varlden/stoppar-okontrollerade-farden-tonaring-hyllas/
Eldinferno härjar i semesterparadiset,/tv/nyheter/varlden/eldinferno-harjar-i-semesterparadiset/
Jättebrand i Ryssland efter drönarattack,/tv/nyheter/varlden/jattebrand-i-ryssland-efter-dronarattack/
Här bryter bilarna sig ur megaköerna,/tv/nyheter/sverige/har-bryter-bilarna-sig-ur-megakoerna/
Stort terrorhot mot OS i Paris,/tv/nyheter/varlden/omfattande-terrorhot-mot-os-i-paris/
Glassbil går under – slukas av havet,/tv/nyheter/varlden/glassbil-gar-under-slukas-av-havet/
Unika fyndet – miljoner år gammalt,/tv/nyheter/varlden/unika-fyndet-miljoner-ar-gammalt/
Cattis skuldsatt efter hög veterinärkostnad,/tv/nyheter/sverige/lanade-100-000-kronor-for-att-radda-bellman/
Fem döda efter kraftig tornado,/tv/nyheter/varlden/fem-doda-efter-kraftig-tornado/
JUST NU: Barn ofredat på camping,/nyheter/sverige/man-misstanks-ha-ofredat-barn-pa-camping/
Tonåring död efter skjutning – jakt på skytten,/nyheter/sverige/larm-om-skottlossning-i-sodra-stockholm/
Se bilderna från platsen – polisen söker spår,/tv/nyheter/sverige/misstankt-skottlossning-i-stockholm/
Tinderman tas för våldtäkt – hängandes upp och ner,https://www.expressen.se/tv/nyheter/varlden/tindermannen-hanger-upp-och-ned-da-grips-han-av-polis/
Oväntade färdmedlet – prins William slår till,/tv/nyheter/varlden/ovantade-fardmedlet-prins-william-slar-till/
Chocknotan – två drinkar och en pasta,/nyheter/varlden/chocknotan-pa-grekiska-krogen-for-tva-drinkar/
Haj går till blodig attack – panik uppstår,https://www.expressen.se/tv/nyheter/varlden/haj-gar-till-blodig-attack-panik-uppstar-pa-stranden
Amerikanen hittad på fjället – efter 22 år,/nyheter/varlden/amerikanen-hittad-pa-fjallet-efter-22-ar/
Dystra sommarbeskedet: Värmen kommer inte igen,/nyheter/sverige/instabilt-vader-resten-av-sommaren-inte-som-i-maj/
Vädervarningen: Skyfall och åska,/nyheter/sverige/smhi-varnar-for-skyfall-hagel-och-kraftig-aska/
"Sexfester, stridspiloter & mördarens okända änka",/nyheter/sverige/har-ar-nagra-av-arets-basta-reportage-pa-expressen/
”Gemenskapen inom EU är ganska illa ute”,/nyheter/laget/gemenskapen-inom--eu-ar-ganska-illa-ute/
”När Frank hade sex med mig gjorde han mig illa”,/nyheter/sverige/nar-frank-hade-sex-med-mig-gjorde-han-mig-illa/
Våldtäktsmannen blev avslöjad – av filmerna,/nyheter/sverige/frank-sazo-videla-37-drogade-och-filmade-valdtakter/
Polisens viktiga lärdom – efter Nytorgsmannen,/nyheter/sverige/polisens-viktiga-lardom-efter-nytorgsmannen/
Man skjuten i Åkersberga – till sjukhus i helikopter,/nyheter/sverige/man-skjuten-i-akersberga/
Överlevde dödsbrand – har nu hittats döda,/nyheter/sverige/overlevde-brand-mamma-och-barn-har-hittats-doda/
Markering mot Putin – Nato-minor i Östersjön,/nyheter/sverige/nato-kan-minera-ostersjon-markering-mot-ryssland/
Natos nya förslag: Dela upp Sverige,/nyheter/varlden/gotland-och-fastlandet-hamnar-i-olika-natodelar/
Slogs ihjäl efter rykte – ingen döms för mord,/nyheter/sverige/slogs-ihjal-efter-snapchat-rykte--ingen-doms-for-mord/
Svaret efter kaoset: ”Kan bara beklaga”,/nyheter/sverige/trafikverkets-svar-efter-kaoset-pa-e4-beklagar/
Var på dödståget – här åker de igen,/tv/nyheter/lova-att-du-haller-mig-hart-i-handen/
Här åker paret igen – ett år efter olyckan,/nyheter/sverige/har-aker-karin-och-mikael-berg--och-dalbana-igen-efter-jetline-olyckan/
Överlevde mirakulöst olyckan på Gröna Lund,/nyheter/karin-overlevde-olyckan-i-jetline-pa-grona-lund/
Snusbrist i Norge – köper i Sverige,/nyheter/varlden/snusbrist-i-norge-vi-beklagar/
Nu inleds rättegången – Baldwin sköt kollega,https://www.expressen.se/tv/nyheter/varlden/nu-inleds-rattegangen-baldwin-skot-kollega
Se när Europas nya jätteraket lyfter,https://www.expressen.se/tv/nyheter/varlden/har-skjuts-europeiska-raketen-upp
Mäktiga filmen: Nya jätteraketen lyfter,/tv/nyheter/varlden/har-skjuts-europeiska-raketen-upp/
Iran kräver att flykting i Sverige ska utlämnas,/nyheter/sverige/iran-kraver-att-flykting-i-sverige-ska-utlamnas/
Stoppar okontrollerade färden – tonåring hyllas,https://www.expressen.se/tv/nyheter/varlden/stoppar-okontrollerade-farden-tonaring-hyllas
Svaret efter Nourys uttalande: ”Nonsens”,/nyheter/varlden/hamid-noury-jag-torterades-naken-i-sverige/
Ytterligare barn dött i branden – fyra döda,/nyheter/sverige/annu-ett-barn-dott-i-karlskrona/
Försvunna ormen saknas fortfarande: ”Den lever”,/nyheter/sverige/tre-meter-ormen-saknas-fortfarande-den-lever/
Eldinferno härjar i semesterparadiset,https://www.expressen.se/tv/nyheter/varlden/eldinferno-harjar-i-semesterparadiset
Hon berättar om kaoset: ”Vi ser att han sitter fast”,/nyheter/sverige/min-syster-skriker-pa-sin-man-men-han-sitter-fast/
Kraschade i 400 km/h – klev ur bilen oskadd,https://teknikensvarld.expressen.se/nyheter/ovrigt/kraschade-i-400-kmh-klev-ur-bilen-oskadd/
Stranden tvingas stänga – bajsvatten i paradiset,/nyheter/varlden/populara-stranden-stangd-efter-fororeningar-av-bajsvatten/
Jordbävning på Rhodos – resebolagets varning,/nyheter/varlden/jordbavning-pa-rhodos/
Skadade barnet har förhörts: ”Hemskt”,/nyheter/sverige/efter-mordet-barnet-har-kunnat-forhoras/
Ströp sin mamma till döds – får rättspsykiatrisk vård,/nyheter/sverige/strop-sin-mamma-till-dods-far-rattspsykiatrisk-vard/
Bolagens egna larm om flygen i sommar,/nyheter/sverige/flygbolagens-larm-mitt-i-sommarsemestern/
Bilderna visar: roboten slår ner i barnsjukhuset,/nyheter/varlden/ogonblicket-innan-sen-slog-roboten-mot-barnsjukhuset/
Jättebrand i Ryssland efter drönarattack,https://www.expressen.se/tv/nyheter/varlden/jattebrand-i-ryssland-efter-dronarattack/
Turisternas skräck på väg till svenskparadiset,/nyheter/varlden/skracken-inifran-kryssningsfartyget-/
Regeringen vill skärpa anhöriginvandringen,/nyheter/varlden/regeringen-vill-skarpa-anhoriginvandringen/
Det ska bli dyrare att parkera din bil,https://teknikensvarld.expressen.se/nyheter/bil-och-trafik/dyrare-att-parkera-i-stockholm-nar-app-tas-bort/
Läkaren: Bidens ansikte har kostat mest: ”Ser det”,/nyheter/varlden/lakarens-dom-sa-mycket-har-bidens-plastikoperationer-kostat/
Parkinsonexpert har besökt Vita huset,/nyheter/varlden/parkinsonexperter-har-besokt-vita-huset-atta-ganger/
Sprakande elkablar efter tropisk storm,https://www.expressen.se/tv/nyheter/varlden/fyra-doda-i-tropiska-stormen/
Talar nu ut om adelns miljardbråk: ”Brutalt”,/nyheter/sverige/okanda-detaljerna-inifran-adelns-miljardbrak/
Arbetet på E4 stoppas efter enorma köerna,/nyheter/sverige/flera-timmars-bilkoer-pa-e4-vid-norrkoping/
Här bryter bilarna sig ur megaköerna,/tv/nyheter/sverige/har-bryter-bilarna-sig-ur-megakoerna/
Koenigsegg nära passera 500 km/h,https://teknikensvarld.expressen.se/nyheter/bil-och-trafik/koenigsegg-jesko-absolut-pa-vag-over-500-kmh/
Sista vittnet om mordet på Einár,/nyheter/sverige/sista-vittnet-om-mordnatten-da-einar-dodades/
