Heading,URL
Hon vädjar om hjälp – kungavaktens iskyla,/tv/nyheter/varlden/turist-narmar-sig-vakten-far-angra-sig-direkt/
Scenen kollapsar under kampanjtalet – flera döda,/tv/nyheter/varlden/scenen-kollapsar-under-kampanjtalet-fyra-doda/
Öppnar hissdörren – skräcken står utanför,/tv/nyheter/varlden/tonarstjejen-oppnar-hissdorr-skracken-vantar-utanfor/
Politikernas bråk urartar – anklagas för ”kannibalattack”,/tv/nyheter/varlden/politikernas-brak-urartar-anklagas-for-kannibalattack/
Hotet mot Sverige i rysk tv: ”Lära en läxa”,/tv/nyheter/varlden/hotet-mot-sverige-i-rysk-tv-lara-en-laxa/
Bin anföll Theas hus: ”Som en skräckfilm”,/tv/nyheter/sverige/bin-anfoll-theas-hus-som-en-skrackfilm/
JUST NU: Stopp för tågen i Malmö,/nyheter/sverige/problem-i-skanska-tagtrafiken/
JUST NU: Inbrottsförsök på myndighet,/nyheter/sverige/inbrottsforsok-pa-myndighet/
JUST NU: Två kvinnor döda i krock med buss,/nyheter/sverige/buss-och-bil-i-frontalkrock-utanfor-hudiksvall-/
Kvinnan avslöjad efter 18 år på häktet: ”Haft lojalitet hos kriminella”,/nyheter/sverige/kvinnan-avslojad-efter-18-ar-pa-haktet-haft-lojalitet-hos-kriminella/
Vädjan i sökandet efter krogkollapsen,/nyheter/varlden/fyra-doda-efter-takkollaps-pa-mallorca/
Förödelsen på gatan efter kollapsen,/tv/nyheter/varlden/forodelsen-efter-kollapsen-myndighetens-lofte/
Vaktens attack mot SR- reportern: ”Chockad”,https://www.expressen.se/tv/nyheter/sverige/har-knuffar-vakten-omkull-srs-reporter
Turisten vädjar om hjälp – vaktens iskyla,https://www.expressen.se/tv/nyheter/varlden/turist-narmar-sig-vakten-far-angra-sig-direkt
Udda hjälpmedlet för att stoppa elden,/tv/nyheter/varlden/absurt-hjalpmedel-for-att-fa-stopp-pa-elden/
Beteendena i trafiken som får oss att se rött,https://teknikensvarld.expressen.se/nyheter/bil-och-trafik/beteenden-i-trafiken-som-far-oss-att-se-rott/
Bakom kulisserna – här hånas politikerna i SVT,/nyheter/sverige/bakom-kulisserna-pa-herr-talman--har-hanas-politikerna-i-svt/
Lastbilsolycka på E4 – enorma trafikköer,/nyheter/sverige/lastbil-i-olycka-pa-e4-i-solna/
Här siktar ryska flottan in sig – på Natoplanet,https://www.expressen.se/tv/nyheter/varlden/har-siktar-ryska-flottan-in-sig-pa-natoplanet-
Ukrainska larmet: Putins förbjudna taktik,/tv/nyheter/varlden/ukrainska-larmet-putins-forbjudna-taktik/
Testa valkompassen: Vem ska du rösta på?,/nyheter/varlden/valkompass-eu-val-2024-testa-sjalv-vilket-parti-ska-du-rosta-pa-den-9-juni/
Prischock för studenter – tusenlappar dyrare,/nyheter/laget/prischock-for-studenter-tusenlappar-dyrare/
Golflagets fasa efter flygbolagets blunder,https://www.expressen.se/tv/nyheter/varlden/golflagets-fasa-efter-flygbolagets-blunder
Frun köpte fel tv-spel – det ledde till Roberts död,/nyheter/varlden/frun-kopte-fel-tv-spel-det-ledde-till-roberts-dod/
Kristersson och Ed säljer – lyxen inne,/nyheter/sverige/ulf-kristersson-och-birgitta-ed-saljer-huset/
Kändismäklaren om villan: ”Ett mervärde”,/nyheter/sverige/kandismaklaren-om-statsministerhuset-ett-mervarde/
Trump: ”Putin kommer att göra detta för mig”,/nyheter/varlden/trump-putin-kommer-att-gora-detta-for-mig/
Bilder visar: Ökad kärnvapenaktivitet,/nyheter/varlden/satellitbilderna-visar-okad-karnvapenaktivitet/
Kriminalvårdarens ord om sexet med fången,/nyheter/sverige/kriminalvardarens-tva-inlasta-karlekar-han-vill-ha-seriost/
Tidigare Metro-ägaren döms till fängelsestraff,/nyheter/varlden/foretagsledaren-christen-ager-hanssen-doms-till-fangelse/
Barn tog souvenir från strand – fick miljonböter,/nyheter/varlden/barn-tog-souvenir-fran-strand-fick-miljonboter/
Försvaret backar om ÖB:s Gotlands-larm,/nyheter/sverige/forsvaret-dementerar-obs-uttalanden-ur-sitt-sammanhang/
Proffsätaren lägger av: ”Är inte hungrig längre”,/nyheter/varlden/proffsataren-lagger-av-ar-inte-hungrig-langre/
Intern oro i KD inför rysarval: ”Fel konflikt”,/nyheter/varlden/intern-oro-i-kd-infor--rysarval-fel-konflikt/
Sköterska stal från patienter – åtalas,/nyheter/sverige/skoterska-stal-fran--patienter-atalas/
Kina om Taiwan: Övar för ”maktövertagande”,/nyheter/varlden/kina-om-taiwan-ovar-for-maktovertagande/
Ukrainska fångar har släppts – för att kriga,/nyheter/varlden/kriget-i-ukraina-23-maj/
Sex döda efter Putins ”extremt brutala” attack,/tv/nyheter/varlden/sex-doda-efter-putins-attack-mot-charkiv/
Mannen hatas efter draget vid målsnöret,https://www.expressen.se/tv/nyheter/varlden/hatet-mot-mannen-efter-draget-vid-mallinjen
Ungdomarnas dom efter strumphånet,https://www.expressen.se/tv/nyheter/sverige/gen-z-vandningen-efter-hanet-mot-stilen/
Sköt sin kumpan – och kontraktmördade gängman,/nyheter/sverige/skot-sin-kumpan-och-kontraktmordade-gangman/
Kina slår järnring runt Taiwan: Straffas,/tv/nyheter/varlden/kina-slar-militar-ring-runt-taiwan-straff-/
Avhopp på festival – när Kristersson deltar,/nyheter/sverige/avhopp-pa-bokfestival-i-rinkeby-nar-kristersson-deltar/
Studenterna: ”Det är jättemycket pengar”,/tv/nyheter/sverige/studenterna-det-ar-jattemycket-pengar/
Sommarbakslag efter sydeuropeiska hettan,/nyheter/sverige/efter-sydeuropeiska-hogtrycket-nu-vander-det/
Prognosen: Så varmt blir det till sommaren,/nyheter/sverige/langtidsprognosen-sa-varmt-blir-det-sommaren-2024/
Pappan om stödet efter dödsolyckan,/nyheter/sverige/pappan-om-stodet-i-sorgen-vi-ar-overvaldigade/
S: SD skapar kaos – kan gynna ryssarna,/nyheter/sverige/hultqvist-s-om-trollkonton-paverkar-sakerhetslaget/
TV4 polisanmäler hot efter avslöjande,/nyheter/sverige/efter-troll-avslojandet-tv4-polisanmaler-hot/
Nio döda i Mexiko – scen kollapsade,https://www.expressen.se/tv/nyheter/varlden/scenen-kollapsar-under-kampanjtalet-fyra-doda
Sista vittnet om mordet på Einár,/nyheter/sverige/sista-vittnet-om-mordnatten-da-einar-dodades/
