Heading,URL
Oväntade succén – 15 miljoner har sett Martins pinne,/tv/nyheter/varlden/ovantade-succen-15-miljoner-har-sett-martins-pinne/
Drakdrönaren spyr eld över ryska gömstället,/tv/nyheter/varlden/drakdronaren-spyr-eld-over-ryska-gomstallet/
Massiv attack - flera drönare in i höghus,/tv/nyheter/varlden/massiv-attack-flera-dronare-in-i-hoghus/
Kronprinsess-familjens julhälsning från Skansen,/tv/nyheter/sverige/kronprinsess-familjens-julhalsning-fran-skansen/
"Kims soldater skickas fram som kanonmat: ""Självmordsattacker”",/tv/nyheter/varlden/kims-soldater-skickas-fram-som-kanonmat-sjalvmordsattacker/
Putins lösning – på ryska porrkrisen,/tv/nyheter/varlden/putins-losning-pa-ryska-porrkrisen/
Fångad på film: politiker bryter egna lagen,/tv/nyheter/varlden/fangad-pa-film-politiker-bryter-egna-lagen/
Här grips han efter attacken: ”Händerna på ryggen!”,/tv/nyheter/har-grips-han-efter-attacken-handerna-pa-ryggen-/
Lyxyacht med gym och jacuzzi i lågor,/tv/nyheter/varlden/lyxyacht-med-gym-och-jacuzzi-i-lagor/
JUST NU: USA sköt ned eget stridsplan,/nyheter/varlden/usa-skot-ned-eget-stridsplan/
Striderna intensifieras: ”Race mot avgrunden”,/nyheter/sverige/paasikivi-da--tar-kriget-slut/
"Viktoria, 29, döms till 21 års fängelse",/nyheter/varlden/viktoria-29-fangslas-i-ryssland-far-21-ar/
Här skickas Kims soldater fram som kanonmat i Kursk,/tv/nyheter/varlden/kims-soldater-skickas-fram-som-kanonmat-sjalvmordsattacker/
Paret höll sina fyra döttrar som sexslavar,/nyheter/varlden/paret-holl-sina-fyra--dottrar-som-sexslavar/
Röken sprider sig längs gatorna: ”Som en bomb”,/nyheter/sverige/misstankt-explosion-pa-ostermalm/
”Stor smäll – alla var uppskakade”,/tv/nyheter/sverige/stor-insats-pa-ostermalm-misstankt-explosion/
Rebecca hittades död på hotellet i Thailand,/nyheter/varlden/rebecca-hittades-dod--pa-hotellet-i-bangkok/
Starka reaktioner på nya drycken,/nyheter/varlden/alskar-du-majonnas-nu-kan--du-dricka-det-med-sugror/
Lyxyacht med gym och jacuzzi i lågor,/tv/nyheter/varlden/lyxyacht-med-gym-och-jacuzzi-i-lagor/
"André, 9, dödades på julmarknaden",/nyheter/varlden/andre-9-dog-i-attacken-mot-julmarknaden/
”Människor kom rusande i panik”,/tv/nyheter/varlden/manniskor-kom-rusande-i-panik-/
Adelns hemliga koder: Gör aldrig nånsin detta,/nyheter/sverige/adelns-hemliga-koder-gor-aldrig-nagonsin-detta/
Efter 36 dagar i rätten – Leif Ivan firar jul i Florida,/nyheter/sverige/tar-paus-fran-rattegangarna-firar-jul-i-florida/
Martins pinne – en av de bästa i världen,https://www.expressen.se/tv/nyheter/varlden/ovantade-succen-15-miljoner-har-sett-martins-pinne
Politikern bryter egna lagen – fångad på film,https://www.expressen.se/tv/nyheter/varlden/fangad-pa-film-politiker-bryter-egna-lagen
Putins lösning – på Rysslands porrkris,/tv/nyheter/varlden/putins-losning-pa-ryska-porrkrisen/
Eldsprut på E18 när kranbil slår i bron,/tv/nyheter/sverige/eldsprutet-pa-e18-nar-kranbilen-slar-i-bron/
Putins nya vapen – burk med konserver,/tv/nyheter/putins-nya-vapen-burk-med-konserver/
Kastar granat in i mataffär – döms,/tv/nyheter/sverige/granaten-kastas-in-i-matbutiken/
SD-ledamotens i talarstolen: ”God segerjul”,/tv/nyheter/sverige/sd-ledamoten-i-talarstolen-god-segerjul/
Brinnande man kommer springandes ur bajamaja,/tv/nyheter/varlden/brinnande-man-kommer-springandes-ur-bajamaja/
Flyr sekunder efter mordet – fastnar på bild,/tv/nyheter/sverige/har-flyr-skytten-efter-mordet-i-fittja/
Sexanmälan avslöjade pengarna till gängman,/nyheter/sverige/sexanmalan-avslojade-pengarna-till-gangman/
Pernillas man Bengan dödad av chokladhjul,/nyheter/sverige/pernillas-man-bengan-dodades-av-chokladhjulet-pa-kiviks-marknad/
”Monstret” utreds för 33 år gammalt mord,/nyheter/varlden/monstret-fran-avignon-misstanks-for-mord-/
15-årig pojke gripen efter mordet i Växjö,/nyheter/sverige/15-aring-gripen/
Mordfilmen visades – på skolavslutning,/nyheter/sverige/mordfilmen-visades-pa-skolavslutning-i-koping/
Massiv attack - flera drönare in i höghus,/tv/nyheter/varlden/massiv-attack-flera-dronare-in-i-hoghus/
Snögränsen avgör – här blir julen vit,/nyheter/sverige/meteorologen-har-blir-det-en-vit-jul/
SMHI varnar för halka i jultrafiken,/nyheter/sverige/smhi-varnar-for-sno-och-ishalka/
Julfilmen – Victoria på Skansen med familjen,https://www.expressen.se/tv/nyheter/sverige/kronprinsess-familjens-julhalsning-fran-skansen
Insatsstyrkan inkallad efter larm om hotfull man,/nyheter/sverige/insatsstyrkan-kallades-in-efter-larm-om-hotfull-man/
Misstänkta mördaren kidnappade gängrival,/nyheter/sverige/var-pa-rymmen-fran-hvb-hem-misstanks-for-flera-valdsdad/
Mjölk ger ökad risk för sjukdomar hos kvinnor,/nyheter/sverige/mjolk-ger-okad-risk-for-sjukdomar-hos-kvinnor/
Hårda slaget mot Putin som kan påverka kriget,/nyheter/varlden/harda-slaget-mot-putin-som-kan-paverka-kriget/
Ryska gömstället avslöjas – spyr eld,/tv/nyheter/varlden/drakdronaren-spyr-eld-over-ryska-gomstallet/
Planen: ”Vi rustar för att undvika krig”,/nyheter/sverige/carl-oskar-bohlin-da-har-du-ingen-ratt-att-bli-krankt/
Rapparen stod på gängets dödslista,/nyheter/krim/rapparen-gaboro-mordad-stod-pa-gangets-dodslista/
Filmen sprids – efter mordet på rapparen,/tv/nyheter/sverige/filmen-sprids-efter-mordet-pa-rapparen/
Polisbilen fick sladd – fyra skadade i krock,/nyheter/sverige/polisbil-i-krock-i-stockholm/
Utrikesministerns kritik mot Kina: ”Allvarligt”,/nyheter/sverige/kinesiska-fartyget-yi-peng-3-ror-pa-sig/
Busch nära avgå efter avslöjandet: ”Rädd”,/nyheter/sverige/busch-nara-avga-efter-avslojandet-blev-radd/
Putins lösning – på Rysslands porrkris,https://www.expressen.se/tv/nyheter/varlden/putins-losning-pa-ryska-porrkrisen
Kvinna våldtagen under vapenhot – tre gripna,/nyheter/sverige/tre-man-gripna-efter-valdtakt-i-stockholm/
Nu kommer ljuset – vintersolståndet är här,/nyheter/sverige/nu-kommer-ljuset-vintersolstandet-ar-har/
Chattpaniken efter mordet på Mikael,/nyheter/krim/chattpaniken-efter-mordet-pa-mikael-skicka-alla-du-kan/
Toppstrategen: Ett hot som skulle oroa Putin,/nyheter/sverige/toppstrategen-dov-s-zakheim--usa-bor-bunkra-vapen-i-sverige/
Trumps nya krav på Natoländerna,/nyheter/varlden/kallor-nara-trump-nato-ska-lagga-mer-pa-forsvar/
Putin mot väggen: Svagare än Trump,/tv/nyheter/varlden/putins-reaktion-pa-kritiken-i-direktsandning-du-har-misslyckats/
Rapparen Gaboro mördad i p-garage,/nyheter/sverige/polisens-jakt-i-natt-en-god-uppfattning-om-varfor/
Kristersson: Inflationen är äntligen besegrad,/nyheter/sverige/kristersson-inflationen-ar-antligen-besegrad/
Frank dog på sin sista arbetsdag,/nyheter/varlden/frank-dog-nar-han-firade-sin-pension-med-kolleger/
Två män bröt sig in på Försvarsmaktens område,/nyheter/sverige/tva-man-brot-sig-in-pa-forsvarsmaktens-omrade-i-karlskrona/
Röda dagar 2025 – så maxar du ledigheten,/nyheter/roda-dagar-2025--sa-maxar-du-ledigheten-/
Arrestvakt skrev och raggade på misstänkt,/nyheter/sverige/arrestvakt-skrev-och-raggade-pa-misstankt/
"Vad hände då Molly, 14, dog?",/nyheter/sverige/mollys-hemlighet-sista-festen-som-tar-hennes-liv/
Mörkade läckor för regeringen,/nyheter/sverige/las-expressens-avslojanden-om-skandalen-pa-lantmateriet/
Så lite tjänar förarna för Uber och Bolt,/tv/nyheter/sverige/taxislavarna-sa-lite-tjanar-forarna-for-uber-och-bolt/
Namnbytet efter ilskan,/nyheter/sverige/jag-ar-hatad-for-fan-av-halva-sverige/
