Heading,URL
Nya AI-prylen som ska ersätta din telefon,/tv/nyheter/varlden/nya-ai-prylen-som-ska-ersatta-din-telefon/
Sarahs skräckhopp – bryter båda benen,/tv/nyheter/varlden/sarahs-skrackdyk-bryter-bada-benen/
Extremt ovanliga havsdjuret visar sig igen,/tv/nyheter/varlden/extremt-ovanliga-havsdjuret-visar-sig-igen/
Nya videon från enorma branden i Ryssland,/tv/nyheter/varlden/nya-videon-fran-enorma-branden-i-ryssland/
Cheezus! Får utbrott när han ser innehållet,/tv/nyheter/varlden/koper-overraskningspase-kunde-aldrig-ana-innehallet/
Polishelikopterns ödesdigra miss framför alla,/tv/nyheter/varlden/polishelikoptern-kraschar-mitt-pa-gatan-/
Paniken i attraktionen när de ser över axeln,/tv/nyheter/varlden/aker-karusell-i-spokstaden-gor-kusliga-upptackten/
JUST NU: Pojke mördad – två pojkar gripna,/nyheter/sverige/pojke-mordad-tva-minderariga-gripna/
Sarahs skräckhopp – bryter båda benen,/tv/nyheter/varlden/sarahs-skrackdyk-bryter-bada-benen/
Ensam på gymmet – missar livsfaran,/tv/nyheter/varlden/traningen-pa-gymmet-forvandlas-till-en-mardrom/
Varningen om Sverige går med i insatsen,/nyheter/varlden/experten-varnar-det-kan-handa-om-sverige-gar-med-i-roda-havs-insatsen/
Utsände svenskens oro efter attackerna,/nyheter/varlden/svenske-diplomatens-oro-efter-attackerna-i-jemen/
Borstar bort ”hårstrå” – inser rysliga sanningen,https://www.expressen.se/tv/nyheter/varlden/tror-hon-borstar-bort-harstra-sanningen-ar-en-helt-annan
Orden från Putins dotter upprör: ”Chockerande”,/nyheter/varlden/orden-fran-putins-dotter-uppror-chockerande/
Hamas nekar till dådplaner: ”Lögn”,/nyheter/varlden/israel-hamasattack-mot-ambassad-i-sverige-stoppad/
”Förvånar mig inte att de siktade mot Sverige”,/nyheter/varlden/expert-hamas-kan-ha-forandrats/
Körkort för automat kan bli ny standard,https://teknikensvarld.expressen.se/nyheter/bil-och-trafik/korkort-for-automat-kan-bli-standard/
Pojkarna skulle bomba Bandidos – allt gick fel,/nyheter/sverige/pojkarna-skulle-bomba-bandidos-allt-gick-fel/
”Benzema” filmades när han sköts ihjäl,/nyheter/sverige/mustafa-benzema-aljiburi--filmades-nar-han-skots-ihjal/
Blodiga gängkriget efter mordet på ”Benzema”,/nyheter/sa-fortsatter-gangkriget-efter-mordet-pa-benzema/
Kinakritiker går mot seger i ”ödesvalet”,/nyheter/varlden/styrande-parti-mot-seger-i-taiwans-presidentval/
Skjuter upp rymdraket – från ett fartyg till havs,https://www.expressen.se/tv/nyheter/varlden/skjuter-upp-rymdraket-fran-ett-fartyg-till-havs/
Elviras vintersuccé – 13 miljoner visningar,https://www.expressen.se/tv/nyheter/sverige/elviras-vintervideo-har-over-13-miljoner-visningar-eskalerade/
Extremvädret stoppar Trump: ”Det värsta”,/nyheter/varlden/extremvadret-stoppar-trump-det-varsta/
”Maffians vapensmed” gjorde 3D-vapen i köket,/nyheter/sverige/maffians-vapensmed--gjorde-3d-vapen-i-koket/
"Leonard, 20, hyllas efter kaoset på E22",/nyheter/sverige/leo-20-raddade-frusna-pa-e22-mamma-var-orolig/
Krockade med kvinna som halsade vodka,/nyheter/sverige/kvinnan-halsade-vodka-korde-rakt-in-i-therese/
Krögaren efter fräcka springnotan: ”Lurade”,/nyheter/sverige/sallskapet-som-tog-springnotan-slipper-betala/
Sänker rysk robot med ”omöjligt skott”,/tv/nyheter/varlden/sanker-rysk-robot-med-omojligt-skott/
Experter om Putin: Saknar krigsstrategi,/nyheter/varlden/experterna-om-putin--saknade-krigsstrategi/
Ryssland kalla drag – ska stärka armén,/nyheter/ryska-draget-stanger-av-varmen-i-fangelserna/
Nya teknikprylen som ska ersätta din telefon,https://www.expressen.se/tv/nyheter/varlden/nya-ai-prylen-som-ska-ersatta-din-telefon/
Extremt ovanliga djuret visar sig igen,https://www.expressen.se/tv/nyheter/varlden/extremt-ovanliga-havsdjuret-visar-sig-igen/
Nytt vulkanlarm – boende evakueras,/nyheter/varlden/nytt-vulkanlarm-boende-evakueras/
Mördades inför familjen – sen kom sanningen fram,/nyheter/varlden/mordades-infor-familjen-sen-kom-sanningen-fram/
"Sökinsatsen efter Ilias, 15, växer i Linköping",/nyheter/sverige/sokinsatsen-efter-ilias-15-vaxer-/
Pontus fick fel vaccin mot covid-19 – dog,/nyheter/sverige/pontus-dog-efter-felaktig-vaccinering-mot-covid-19/
Utforskar nya villan – avtäcker vidriga gåtan,https://www.expressen.se/tv/nyheter/varlden/skrackfyndet-nar-paret-flyttat-in-i-nya-huset-
SMHI varnar för snöfall – kan leda till trafikproblem,/nyheter/sverige/smhi-varnar-for-snofall-kan-leda-till-trafikproblem/
Man i 50-årsåldern sköts med jaktvapen inomhus,/nyheter/sverige/man-i-50-arsaldern-skots-med-jaktvapen-inomhus/
Dödligt giftig orm i treåringens byrålåda,/nyheter/varlden/dodligt-giftig-orm-i-trearingens-byralada/
En död i brand – misstänkt mord,/nyheter/sverige/en-dod-i-villabrand-misstankt-mord/
Gängledarens desperata vädjan – till presidenten,https://www.expressen.se/tv/nyheter/varlden/gangledarens-desperata-vadjan-till-presidenten/
Philip var bara 29 när han fick stroke,/nyheter/philip-var-bara-29-nar-han-fick-stroke/
Djalalis fru: ”Sverige måste sluta slingra sig”,/nyheter/sverige/djalalis-fru-sverige-maste-sluta-slingra-sig/
Engelska skolans vd slutar efter granskning,/nyheter/sverige/engelska-skolans-vd-slutar-efter-granskning/
Köldsmocka kopplar nytt grepp om landet,/nyheter/sverige/da-kommer-kylan-tillbaka/
Finska knepen: Maxa elbilen under vintern,https://teknikensvarld.expressen.se/nyheter/konsument/finska-knepen-sa-overlever-elbilen-i-kylan/
Cheezus! Får utbrott när han ser innehållet,https://www.expressen.se/tv/nyheter/varlden/koper-overraskningspase-kunde-aldrig-ana-innehallet
Orden inifrån insatsen på E22: ”Totalt kaos”,/nyheter/sverige/interna-orden-om-arbetet-pa-e22-totalt-kaos/
S-toppen: En miljon fler migranter per år,/nyheter/sverige/s-toppen-en-miljon-fler-migranter-per-ar/
Svantesson om bankernas utdelningar: ”Är orimligt”,/nyheter/sverige/svantesson-om-bankernas-utdelningar-ar-orimligt/
"Ilias, 15, hade 250 meter hem – är nu försvunnen",/nyheter/sverige/pojke-forsvunnen-i-linkoping/
Coop: Medlemsuppgifter kan ha läckt efter attack,/nyheter/sverige/coop-varmland-medlemsuppgifter-kan-ha-slappts/
Massivt ryskt anfall med Kinzjal-robotar,/nyheter/varlden/massiva-ryska-luftanfall-i-ukraina/
Man död – hittades vid elsparkcykel,/nyheter/sverige/svart-skadad-man-hittad-i-vattenfyllt-dike-i-halmstad/
Mannen ser inte bilen – slungas upp i luften,https://www.expressen.se/tv/nyheter/varlden/mannen-ser-inte-bilen-slungas-upp-i-luften/
