Heading,URL
"Här exploderar husbilen: ""Ny nivå av adrenalin""",/tv/nyheter/varlden/har-exploderar-husbilen-ny-niva-av-adrenalin-/
Hittade sin fru – halvt uppäten av pytonorm,/tv/nyheter/siriati-30-hittades-i-gigantiska-pytonormens-mage/
Pojkarnas skratt – när de misshandlar mannen,/tv/nyheter/ganget-misshandlar-mannen-filmar-och-skrattar/
Här promenerar renen runt i butiken: ”Tappade hakan”,/tv/nyheter/sverige/har-promenerar-renen-runt-i-butiken-tappade-hakan/
Putin och Erdogan mot nytt monsteravtal: ”100 miljarder dollar”,/tv/nyheter/putin-och-erdogan-mot-nytt-monsteravtal-100-miljarder-dollar/
Rysk deepfake-kupp mot Zelenskyjs fru,/tv/nyheter/rysk-deepfake-kupp-mot-zelenskyjs-fru/
Norska ministern fick pris – visade brösten,/tv/nyheter/varlden/har-visar-norska-kulturministern-brosten-pa-scen/
Vädjan efter dödliga attacken: ”Rysk terror”,/tv/nyheter/varlden/fem-doda-i-attack-mot-ukrainskt-kopcentrum/
JUST NU: Polis utreder dödsfall,/nyheter/sverige/en-hittad-dod-i-kristianstads-kommun-oklara-omstandigheter/
Labours kross i natt – Sunak avgår i dag,/nyheter/varlden/utmanaren-gar-mot-storseger-mot-sunak/
Släpper sitt manus – tappar tråden helt,https://www.expressen.se/tv/nyheter/biden-tappar-traden-delarna-i-talet-som-forvirrar/
Frejas myggpanik på fjället,https://www.expressen.se/tv/nyheter/sverige/frejas-myggpanik-pa-fjallet-helt-galet
Hittade sin fru – halvt uppäten av orm,/tv/nyheter/siriati-30-hittades-i-gigantiska-pytonormens-mage/
"Utspelet: ""Kommer aldrig tillbaka""",/tv/nyheter/stjarnans-utspel-efter-kaoset-kommer-aldrig-tillbaka/
En död – skjutning i bostadsområde,/nyheter/sverige/skottlossning-i-goteborg-v7sv5/
Bryter sig in och tänder på skolan,/tv/nyheter/tonarskillarna-branner-ner-byggnaden-javla-fittskola/
Tuffa regnprognosen – men hit kommer solen,/nyheter/sverige/bistra-prognosen-blott-och-blasigt/
Desperata föräldrar luras – sponsras av advokater,/nyheter/sverige/desperata-foraldrar-luras-hatet--sponsras-av-svenska-advokater/
Pojkarnas skratt – när de misshandlar mannen,/tv/nyheter/ganget-misshandlar-mannen-filmar-och-skrattar/
Därför är högerpolitik ute i Storbritannien,/nyheter/laget/darfor-ar-hogerpolitik-ute-i-storbritannien/
Ryssland intog kullar – staden ligger i ruiner,/nyheter/varlden/ryska-framgangen-tagit-kontroll-over-viktiga-kullar/
Putin om Trumps plan för fred: ”Helt seriöst”,/nyheter/varlden/putin-om-trumps-plan-tar-det-helt-seriost/
Krigssommar kan bli mardröm för Ryssland,/nyheter/varlden/putins-krigssommar-kan-bli--en-mardrom-for-ryssland/
"Sexfester, stridspiloter & mördarens okända änka",/nyheter/sverige/har-ar-nagra-av-arets-basta-reportage-pa-expressen/
Volvo-ägare lämnar tillbaka sina bilar,https://teknikensvarld.expressen.se/nyheter/bil-och-trafik/elbil-laddhybrid/volvo-ex30-agare-lamnar-tillbaka-sina-bilar/
Renen tar sin chans – följer efter kunden,https://www.expressen.se/tv/nyheter/sverige/har-promenerar-renen-runt-i-butiken-tappade-hakan/
Kvinnans pengaregn till kända gängtoppar,/nyheter/sverige/kriminalvardarens-pengaregn-till-gangtopparna/
Trumps nya taktik efter debatten: Är ovanligt tyst,/nyheter/varlden/trumps-nya-taktik-efter-debatten-ar-ovanligt-tyst/
"Svenska Zozan, 43, fängslades i Turkiet",/nyheter/varlden/svenska-zozan-43-fangslades-i-turkiet/
”Önskar inte min värsta fiende det här”,/tv/nyheter/varlden/svenska-zozan-greps-i-turkiet-hor-henne-beratta/
Krispartiet kallade in Boris – hånas,/nyheter/varlden/historisk-valforlust-for-styrande-partiet-i-england-/
Slottets personal drog upp son och död pappa,/nyheter/sverige/slottets-personal-drog-upp-pappa-och-son-ur-vattnet/
Två hundar släpades efter bilen – båda dog,/nyheter/sverige/hundar-drogs-bakom-bil-avled/
Orbán till Moskva för möte med Putin,/nyheter/varlden/orban-till-moskva-for-mote-med-putin/
Man i 60-årsåldern hittad död på Rhodos,/nyheter/sverige/dod-svensk-pa-rhodos-var-en-man-i-60-arsaldern/
EU-beslut: Dyrare Kina-bilar i morgon,https://teknikensvarld.expressen.se/nyheter/bilbranschen/eus-importtullar-for-kina-bilar-startar-i-morgon/
"Här exploderar husbilen: ""Ny nivå av adrenalin""",/tv/nyheter/varlden/har-exploderar-husbilen-ny-niva-av-adrenalin-/
Spanska semesterkravet: En flykting för varje turist,/nyheter/varlden/spanska-semesterkravet-en-flykting-for-varje-turist/
Rånarens blunder – går på helt fel person,https://www.expressen.se/tv/nyheter/forsoker-rana-restaurangbesokaren-det-skulle-han-inte-ha-gjort/
Nya uppgifterna: ”Han lämnade stugan vid liv”,/nyheter/varlden/britten-om-forsvunne-jay-han-lamnade-levande/
Biden erkänner efter fiaskot: ”Klantade mig”,/nyheter/varlden/biden-erkanner-jag-klantade-mig/
Bidens team tvingas kommentera hälsan,/nyheter/varlden/joe-bidens-81-senaste-lakarbesok-i-februari/
Draget i krisen – tar hjälp av skandalsonen,/nyheter/varlden/joe-bidens-drag-i-krisen-tar-hjalp-av-skandalsonen/
"Jekaterina, 32, jagas av Putin",/nyheter/varlden/jekaterina-32-efterlyst-lever-pa-flykt-fran-putin/
Svaret efter sonens mystiska brännskada,/nyheter/sverige/svaret-efter-mystiska-brannskadan-pa-sonen-/
Stjärnans raseri i Norge: ”Kommer aldrig tillbaka”,https://www.expressen.se/tv/nyheter/stjarnans-utspel-efter-kaoset-kommer-aldrig-tillbaka/
Marianne blev biten av huggorm: ”Jätteäckligt”,/nyheter/sverige/marianne-66-biten-av-orm--i-fot-och-finger-jatteackligt/
"Rune, 72, nära döden efter getingsticket",/nyheter/sverige/rune-72-nara-doden-fick-getingstick-i-huvudet/
Bildt: Då kan det bli fred i Ukraina,/nyheter/sverige/carl-bildt-om-fred-i-ukraina-vagen-dit-dessvarre-lang-/
Brand i tältläger – två allvarligt skadade,/nyheter/sverige/brand-utbrot-pa-taltlager-i-molndal-/
Attackerade Fredriksen – minns inget av händelsen,/nyheter/varlden/ska-ha-stulit-alkohol-sen-attackerat-mette-frederiksen/
Läkaren stampade ihjäl huggormen: ”Gick fort”,/nyheter/sverige/huggorm-pa-besok-pa-bvc-stampades-ihjal-/
Vädjan efter dödliga attacken: ”Rysk terror”,https://www.expressen.se/tv/nyheter/varlden/fem-doda-i-attack-mot-ukrainskt-kopcentrum
Svensk hittad död i hotellrum på Rhodos,/nyheter/sverige/svensk-hittad-dod-pa-hotellrum-pa-rhodos-/
Brandkårens varning till turisterna: ”Oroliga”,/nyheter/varlden/brandkarens-varning--till-turisterna-pa-kos-bor-vara-oroliga/
Ammunitionsförråd tar eld i skogsbrand,/tv/nyheter/branderna-som-harjar-grekland/
Beskedet: Det låg bakom hissraset,/nyheter/sverige/rapporten-saknade-skruvforband-bakom-hissraset-i-sundbyberg/
Förklaringen – så gick hissolyckan till,/tv/nyheter/forklaringen-sa-gick-hissolyckan-till/
"”Jag hörde ett knäpp, sen rasade hissen”",/nyheter/sverige/erik-31-jag-horde-ett-knapp-sen-rasade-hissen/
Sista vittnet om mordet på Einár,/nyheter/sverige/sista-vittnet-om-mordnatten-da-einar-dodades/
