Heading,URL
Nya siffror: Ozonhålet minskar – kan försvinna,/tv/nyheter/varlden/ozonhalet-minskar-da-forsvinner-det/
Kameramannens kupp – avslöjar Trumps lögn,/tv/nyheter/varlden/kameramannens-kupp-avslojar-trumps-logn/
Kemisten: Så gör du popcorn på rätt sätt,/tv/nyheter/sverige/kemisten-sa-gor-du-popcorn-pa-ratt-satt/
Här tar iranskan av kläderna – i protest,/tv/nyheter/varlden/har-tar-iranskan-av-kladerna-i-protest/
Trumps förvirring – spanar efter mystiska sektkvinnor,/tv/nyheter/varlden/trumps-forvirring-spanar-efter-mystiska-sektkvinnor/
Biden kom med panda – som tog av huvudet,/tv/nyheter/varlden/biden-kom-med-panda-som-tog-av-huvudet/
”Kunderna” visar sig vara brutal rånarliga,/tv/nyheter/varlden/kunderna-visar-sig-vara-brutal-ranarliga/
Efter dissen – ny typ av prinsesstårta i USA,/tv/nyheter/sverige/efter-dissen-ny-typ-av-prinsesstarta-i-usa/
Saras chockmöte mitt i Varberg: ”Overkligt”,/tv/nyheter/sverige/saras-chockmote-mitt-i-varberg-overkligt/
JUST NU: Explosion i Saltsjöbaden,/nyheter/sverige/explosion-i-saltsjobaden/
JUST NU: Brand – två till sjukhus,/nyheter/sverige/tva-till-sjukhus-efter-brand/
Varningen: Blir ännu värre den här gången,/nyheter/varlden/donald-trumps-plan-ar-tydlig-gora-som-2020/
Trump stämmer stat – domarens svar,/nyheter/varlden/trump-stammer-georgia-for-att-de-tar-emot-roster/
Förvirringen – letar efter sektkvinnorna,https://www.expressen.se/tv/nyheter/varlden/trumps-forvirring-spanar-efter-mystiska-sektkvinnor
S öppnar för flera oväntade allianser,/nyheter/sverige/socialdemokrater-oppnar-for-allians-med-busch/
Svenska baren med på världstopplistan,/nyheter/sverige/svenska-baren-roda-huset--med-pa-varldstopplistan/
Förfallet i New York: ”Har inte ens skor”,/nyheter/varlden/forfallet-i-new-york-folk-har-inte-ens-skor/
Svenskbyn väljer alltid ”rätt” president,/nyheter/varlden/finns-svaret-om-trump-i-svenska-kottbullarna/
Sekten våldtog barn – drar till sig väljare,/nyheter/varlden/sekten-valdtog-barn-nu-flockas-trumpvaljare-har/
”Det var krig – jag har sett Kamala i strid”,/nyheter/varlden/det-var-krig-och-jag-har-sett-kamala-i-strid/
Kameramannens kupp – avslöjar Trumps lögn,/tv/nyheter/varlden/kameramannens-kupp-avslojar-trumps-logn/
Kemisten: Så gör du popcorn på rätt sätt,https://www.expressen.se/tv/nyheter/sverige/kemisten-sa-gor-du-popcorn-pa-ratt-satt
”Det är Bidens fel att Harris inte går bättre”,/nyheter/laget/joe-bidens-fel-att--harris-inte-gar-battre/
Mamman sköts ihjäl: ”Det har gått för långt”,/nyheter/sverige/sorgen-efter-mordade-mamman-i-akalla/
Här markerar Jas och F-18 mot Putin,/tv/nyheter/sverige/har-markerar-jas-och-f18-mot-putin/
Bidens märkliga drag – börjar plötsligt jogga,/tv/nyheter/varlden/bidens-markliga-drag-borjar-plotsligt-jogga/
Monster-bilder: Ormens gap – största som mätts,/tv/nyheter/varlden/monster-bilder-ormens-gap-storsta-som-matts/
Här är ”pingisrummet” där Mbappé festade,/tv/nyheter/sverige/har-ar-pingisrummet-dar-mbappe-festade/
Här tappar S-politikern humöret: ”Helvetes jävlar”,/tv/nyheter/sverige/har-tappar-ordforande-humoret-helvetes-javlar/
Hamasledarens sista sekunder i livet,/tv/nyheter/varlden/videon-visar-hamasledarens-yahaya-sinwars-sista-sekunder-i-livet-/
Valde Europa – sittande presidenten vann valet,/nyheter/varlden/vandning-i-moldaviskt-odesval/
Upptäckten i svenska byn – släkt med Walz,/nyheter/sverige/svenska-byn-dar-en-av-tre-ar-slakt-med-tim-walz-/
Putins nya hot: Så vill han förändra världen,/nyheter/varlden/putins-nya-hot-sa-vill-han-forandra-varlden/
"Sparhets bland unga – Wilma, 22, om kritiken",/nyheter/sverige/sparhetsen-bland-unga-wilma-22-om-kritiken/
Man gripen för dubbla sexuella ofredanden,/nyheter/sverige/man-gripen-for-dubbla-sexuella-ofredanden/
Ser du profilens val-drag i SVT?,/nyheter/sverige/hemliga-detaljen-i-val-profilens-kladval/
"Vincent, 27, lider av okända ätstörningen",/nyheter/sverige/vincent-27-lider-av-okanda-atstorningen-blev-extremt-isolerad/
Nya siffror: Ozonhålet minskar – kan försvinna,https://www.expressen.se/tv/nyheter/varlden/ozonhalet-minskar-da-forsvinner-det
Trafikverket varnar efter olyckskavalkad,/nyheter/sverige/trafikverket-exakt-likadant-varje-ar/
Vintern får vänta – nu blir det varmare,/nyheter/sverige/vintern-far-vanta-varmare-vader-pa-ingang/
Tuffa odds: Så länge kan Nordkorea kriga,/nyheter/varlden/nordkorea-kan-tacka-ryska-kottkvarnen-i-en-vecka/
Zelenskyj: Det kan stoppa Nordkorea,/nyheter/varlden/zelenskyj-lat-oss-sla-sla-mot-nordkoreanerna-i-ryssland/
Gör prao hos pappa – under missiltest,/tv/nyheter/varlden/pappa-tar-med-dottern-pa-jobbet-missiltest/
Fem lögner inför valet – påståenden och rykten,/nyheter/varlden/usa-valet-de-fem-storsta--lognerna-hittills-i-valrorelsen/
Sonens tack efter stora sökinsatsen: ”Otroligt”,/nyheter/sverige/sonens-tack-efter-stora-sokinsatsen-otroligt/
Prylar från Northvolt säljs på auktion: ”Bara början”,/nyheter/sverige/prylar-fran-northvolt-saljs--pa-auktion-bara-borjan/
Rasande folkmassa attackerade kungen,/tv/nyheter/varlden/folkmassa-kastade-lera-pa-kung-felipe/
Efter dissen – ny typ av prinsesstårta i USA,https://www.expressen.se/tv/nyheter/sverige/efter-dissen-ny-typ-av-prinsesstarta-i-usa
Här tar iranskan av kläderna – i protest,/tv/nyheter/varlden/har-tar-iranskan-av-kladerna-i-protest/
Nordkoreansk spion lurade biltillverkare,https://teknikensvarld.expressen.se/nyheter/bilbranschen/nordkoreansk-spion-lurade-fisker-pa-pengar/
”Kunderna” visar sig vara brutal rånarliga,/tv/nyheter/varlden/kunderna-visar-sig-vara-brutal-ranarliga/
Polis attackerad under festkväll – hämndaktion,/nyheter/sverige/misstanken-polis-attackerad-pa-festkvall-hamndaktion/
Damm från romarriket stoppade regnfloden,/nyheter/varlden/2000-ar-gammal-damm-holl-regnkaoset-borta/
Så snabbt blir lugna gatan till en strid flod,https://www.expressen.se/tv/nyheter/varlden/fran-lugn-gata-till-kaos-pa-30-min
Holger körde ny BMW – rakt in i dödsregnet,/nyheter/sverige/holger-83-raddades-mirakulost-fran-vaderkaoset/
Åskådare har dött efter match i Umeå,/nyheter/sverige/en-dod-efter-sjukdomsfall-pa-laktare-i-umea-/
50 barn dödade på 48 timmar i Gaza,/nyheter/varlden/50-barn-dodade-i-gaza-pa-48-timmar/
Förvåningen under stora sökinsatsen,/nyheter/sverige/missing-people-om-sokandet--efter-per-inge-och-margareta/
Margareta och Per Inge döda – polisens teori,/nyheter/sverige/tva-personer-hittade-doda-i-skogen/
Städerna förändras efter Putins lockbete,/nyheter/varlden/ryska-stader-forandrade-av-putins-lockbete/
Biden kom med panda – som tog av huvudet,/tv/nyheter/varlden/biden-kom-med-panda-som-tog-av-huvudet/
Harris chockledning i Trumps säkra delstat,/nyheter/varlden/kamala-harris-chockledning-i-delstaten-trump-agt/
Palestinier tvingades klä av sig inför soldater,/nyheter/varlden/palestinier-tvingades-kla-av-sig-infor-israeliska-soldater/
Saras chockmöte mitt i Varberg: ”Overkligt”,https://www.expressen.se/tv/nyheter/sverige/saras-chockmote-mitt-i-varberg-overkligt
Man till sjukhus efter misshandel i Kalmar,/nyheter/sverige/man-till-sjukhus-efter-misshandel/
"Vad hände då Molly, 14, dog?",/nyheter/sverige/mollys-hemlighet-sista-festen-som-tar-hennes-liv/
Svaret om lyxlivet: ”Kära någon”,/nyheter/sverige/revisorns-svar-om-bella-nilssons-lyxliv-ah-kara-nagon/
Sexjakten på författarna,/nyheter/sverige/oanstandiga-inviterna-sa-jagas-forfattarna/
Dykaren jagas för sabotaget,/nyheter/varlden/ukrainske-dykaren-volodymyr-zhuravlov-44-efterlyst-for-sprangningen-av-nord-stream/
Miljonlöner på Northvolt,/nyheter/sverige/sa-mycket-tjanar-northvolt-topparna/
