Heading,URL
Båten kraschar in i bron – krossas helt,/tv/nyheter/varlden/baten-kraschar-in-i-bron-krossas-helt/
Detaljen som saknas på Reinfeldt-statyn,/tv/nyheter/sverige/kristerssons-han-mot-carl-bildt/
Barnens utbrott mot Trump – ilskna orden,/tv/nyheter/varlden/barnens-vadjan-till-trump-ar-radda/
Rymlingarna sprider skräck över hela stan,/tv/nyheter/varlden/tjurruset-rymlingarna-jagas-over-hela-stan/
Mystiskt ljud från taket – gigantiska bakben,/tv/nyheter/varlden/mystiskt-ljud-fran-taket-gigantiska-bakben/
Dödsolycka i Brasilien – då dansar influencern i direktsändning,/tv/nyheter/varlden/dodsolycka-i-brasilien-da-dansar-influencern-i-direktsandning/
Hotfulla ryska simuleringen: 850 000 döda i London,/tv/nyheter/varlden/hotfulla-ryska-simuleringen-850-000-doda-i-london/
”Folk är oroliga över en markoffensiv”,/tv/nyheter/varlden/folk-ar-oroliga-over-en-markoffensiv/
JUST NU: Fortsatta israeliska attacker mot Libanon,/nyheter/varlden/flyglarm-over-israel-/
Zelenskyj stressad: Vill ha ja från Biden,/nyheter/varlden/zelenskyjs-onskan-gront-ljus-fran-usa/
”Jag hinner säga: Ta det lugnt. Hon säger: Chilla”,/nyheter/sverige/mollys-hemlighet-sista-festen-som-tar-hennes-liv/
June blev Mollys sista kärlek: ”Hon stack ut”,/nyheter/sverige/mollys-hemlighet-sista-karleken-hon-stack-ut/
Kvinna sålde bullar – döms till fängelse,/nyheter/sverige/kvinna-i-65-arsaldern-salde-bullar-far-fangelse-/
Timon får inte göra lumpen – har mild adhd,/nyheter/sverige/timon-18-far-inte-gora-lumpen-har-mild-adhd/
Detaljen som saknas på Reinfeldt-statyn,https://www.expressen.se/tv/nyheter/sverige/kristerssons-han-mot-carl-bildt/
Hizbollah-topp död efter Israels attack,/nyheter/varlden/en-av-hizbollahs-hogsta-befalhavare-har-dodats/
Frisör blir attackerad – tar fram samurajsvärd,/tv/nyheter/sverige/frisor-blir-attackerad-tar-fram-samurajsvard/
P3:s lista väcker ilska: ”Vad är det för något?”,/nyheter/laget/p3s-topp-300-lista-vacker-ilska-robyn-etta-vad-ar-det-for-nagonting/
”Den svarta svanen” finns även i Sverige,/nyheter/sverige/den-svarta-svanen--finns-aven-i-sverige-/
Miljardären bakom Northvolt – kritiken,/nyheter/sverige/kritiken-mot-northvolt-agaren-harald-mix/
Så mycket tjänar Northvolt-topparna,/nyheter/sverige/sa-mycket-tjanar-northvolt-topparna/
Åtta gripna i stort tillslag – misstänkt penningtvätt,/nyheter/sverige/atta-personer-gripna-misstankt-penningtvatt/
Diktatorns syster: USA hotar med kärnvapen,/nyheter/varlden/diktatorns-syster-usa-hotar-med-karnvapen/
Trebarnspappa dödad med vodkaflaska på svensexa,/nyheter/varlden/trebarnspappa-dodad-med-vodkaflaska-pa-svensexa/
Skott mot villa i natt – skador på fasaden,/nyheter/sverige/skottlossning-sodertalje-/
Mannen med 1 000 barn slår tillbaka: ”Inget unikt”,/nyheter/varlden/mannen-med-1-000-barn-slar-tillbaka-inget-unikt/
Avrättad för mord – trots att offrets familj var emot det,/nyheter/varlden/avrattad-for-mord-trots-att-offrets-familj-var-emot-det/
Mätning: Vänstern tappar till Socialdemokraterna,/nyheter/sverige/matning-vanstern-tappar-till-socialdemokraterna/
Man allvarligt skadad – misstänkt mordbrand,/nyheter/sverige/brand-i-fritidshus/
Flicka försvann i skog – räddad med värmekamera,/nyheter/varlden/forsvann-i-skog-pa-natten-raddades-med-varmekamera/
Mannen tände eld på kvinnas hår: ”Uttråkad”,/nyheter/sverige/man-misstanks-ha-eldat-kvinnors-har-i-tunnelbanan/
Båten kraschar in i bron – krossas helt,https://www.expressen.se/tv/nyheter/varlden/baten-kraschar-in-i-bron-krossas-helt/
"Skamlösa rånet – man stjäl bord från Liam, 11",https://www.expressen.se/tv/nyheter/varlden/skamlosa-ranet-man-stjal-bord-fran-liam-11/
Ministern: Svenska gäng ligger bakom brott på Island,/nyheter/varlden/ministern-svenska-gang-ligger-bakom-brott-pa-island/
Svenska Eva bor mitt i raketregnet,/nyheter/varlden/svenska-eva-chiel-lever-mitt-i-hizbollahs-raketregn/
Nya missilanfall mot Beiruts förorter,/nyheter/sverige/raketer-mot-israel-nya-attacker-i-libanon/
”Mannen hörde inte missilen – kände vågen”,/tv/nyheter/varlden/expressens-reporter-i-libanon-kriget-bara-eskalerar-/
”Satan-2” kan ha sprängts i Ryssland,/nyheter/varlden/bilder-uppges-visa-satan-2-kan-ha-sprangts-i-ryssland/
Zelenskyj: Kriget kan ta slut under nästa år,/nyheter/varlden/kriget-i-ukraina-24-september/
Han åtalas för att ha försökt mörda Trump,/nyheter/varlden/atalas-for-att-ha-forsokt-morda-donald-trump/
Mystiska ”zebrastenen” på Mars förbryllar Nasa,/nyheter/varlden/mystiska-zebrastenen-pa-mars-forbryllar-nasa/
USA skickar stödpaket – värt miljarder,/nyheter/varlden/usa-skickar-stodpaket-till-ukraina-vart-38-miljarder-/
Oron på Island – för svenska gäng,/nyheter/varlden/larmet-fran-island-gangkriminella-fran-sverige/
Expressens magasin och podd kan få Tidskriftspriset,/nyheter/sverige/nyforlost-gladjeyra-och-karlekstrubbel/
Barnens utbrott mot Trump – ilskna orden,https://www.expressen.se/tv/nyheter/varlden/barnens-vadjan-till-trump-ar-radda
Kräver mediernas bilder från upploppet på nytt,/nyheter/sverige/aklagarens-nya-krav-om-mediernas-bilder-fran-upploppet/
Rymlingarna sprider skräck över hela stan,https://www.expressen.se/tv/nyheter/varlden/tjurruset-rymlingarna-jagas-over-hela-stan/
Åkessons krav splittrar KD – varnar för avhopp,/nyheter/sverige/akessons-krav-splittrar-kd-varningen-till-ebba-busch/
Svenskfödd mördare utvisas till Gambia,/nyheter/sverige/svenskfodd-gangmordare-utvisas-till-gambia-for-gott/
Anställd på Gröna Lund fick frozen yoghurt över sig,/nyheter/sverige/anstalld-pa-grona-lund-fick-frozen-yoghurt-over-sig/
Norska Vipps plan – nobbas av Swish,/nyheter/sverige/norska-vipps-plan-en-enda-app-i-hela-norden/
Säsongens första snö – vintervitt på gatorna,/nyheter/sverige/sasongens-forsta-sno-vintervitt-i-kiruna/
Interna planen i L – draghjälp från USA,/nyheter/sverige/liberalerna-sa-ska-johan-pehrson-bli-sveriges-tim-walz/
Nya vändningen om fartygskaoset,/nyheter/varlden/nya-vandningen-om-fartygskaoset/
Expert: Skicka tillbaka fartyget till Ryssland,/nyheter/varlden/expert-skicka-tillbaka-fartyget-till-ryssland/
Make ringde polisen för att dölja mordet,/nyheter/sverige/mannen-larmade-om-drunkning-misstanks-ha-mordat-frun/
Kusliga kommentaren i Mosleys sista program,/nyheter/varlden/kusliga-kommentaren-i-michael-mosleys-sista-program/
Mångmiljonär när han dog: ”Galna pengar”,/nyheter/varlden/vi-salde-miljoner-ex-och-tjanade-galna-pengar/
Grips mitt i penisingrepp – mörk sanning avslöjas,https://www.expressen.se/tv/nyheter/varlden/greps-mitt-i-penisforstoring-morka-sanningen-avslojas
”Han ligger kvar livlös i vattnet”,/nyheter/sverige/expressen-dok-hamburgerkungen/
Dykaren jagas för sabotaget,/nyheter/varlden/ukrainske-dykaren-volodymyr-zhuravlov-44-efterlyst-for-sprangningen-av-nord-stream/
Grannens arga lapp: ”Döda varandra tyst”,/nyheter/krim/foxtrots-knarkgrossist-forat-omar-plagade-ex-flickvannen-/
