Heading,URL
Asteroiden lyser upp hela himlen: ”Potentiellt farlig”,/tv/nyheter/asteroiden-lyser-upp-hela-himlen-potentiellt-farlig/
Här ger ryska soldaterna upp – överlämnar sig,/tv/nyheter/varlden/har-overlamnar-ryska-soldater-sig-till-ukraina/
Lastbil fastnar på spåret – då kommer tåget,/tv/nyheter/lastbil-fastnar-pa-sparet-da-kommer-taget-/
Putins bakslag – nya ”superroboten” totalsågas,/tv/nyheter/varlden/putins-bakslag-nya-superroboten-totalsagas/
Här räddas elefantungen – kämpar för sitt liv,/tv/nyheter/har-raddas-elefantungen-kampar-for-sitt-liv-/
Här kryllar av björnar – mitt i staden,/tv/nyheter/varlden/staden-dar-bjornar-vandrar-runt-bland-manniskor/
Fräcka kuppen: Gräver upp bankomaten,/tv/nyheter/varlden/fracka-kuppen-graver-upp-bankomaten-och-aker-ivag-med-den/
Förvirringen på scen – Jill Biden får rycka in,/tv/nyheter/varlden/forvirringen-pa-scen-jill-biden-far-rycka-in/
JUST NU: Matpriser på väg upp,/nyheter/sverige/varningen-matpriserna-kan-vara-pa-vag-upp/
JUST NU: Skjuter upp resa,/nyheter/varlden/kristersson-skjuter-upp-resa-till-sydkorea/
Demirok anklagas: ”Smutsiga metoder”,/nyheter/sverige/demirok-anklagas-smutsiga-metoder/
Märkliga parmiddagen innan styckmordsfallet,/nyheter/sverige/markliga-parmiddagen-innan-styckmordsfallet/
Rökning minskar – men e-ciggen hotar,/nyheter/laget/historisk-brittisk-tobakslag--forbud-mot-forsaljning-till-personer-fodda-2009-och-senare/
Trump: Gör Kanada till ny delstat i USA,/nyheter/varlden/trumps-forslag-om--kanada-51-staten/
Kravet: ”Lägg ner – en politiska teater”,/nyheter/varlden/donald-trumps-krav-lagg-ner-stormy-fallet/
Himlen lyses upp: ”Potentiellt farlig”,https://www.expressen.se/tv/nyheter/asteroiden-lyser-upp-hela-himlen-potentiellt-farlig
Här testskjuter Putin roboten i Medelhavet,/tv/nyheter/har-testskjuter-putinroboten-i-medelhavet/
Här kryllar det av björnar mitt i staden,/tv/nyheter/varlden/staden-dar-bjornar-vandrar-runt-bland-manniskor/
Reagerar i panik – på monstret under huven,/tv/nyheter/reagerar-i-panik-pa-monstret-under-huven/
Vännens sorg efter dödsolyckan: ”Inte rätt”,/nyheter/sverige/minnesstund-for-doda-familjen-pa-e22-inte-latt/?referrer=21
Galna jättebygget ska stoppa Putins armé,/tv/nyheter/varlden/galna-jattebygget-ska-stoppa-putins-arme/
Kim Jong-Un bjöd ryska gästerna – på krigsshow,/tv/nyheter/varlden/kim-jong-un-bjod-ryska-gasterna-pa-krigsshow-/
Listiga svaret på Putins kaxiga påstående,/tv/nyheter/varlden/tillbaka-kakan-mot-putin-pa-toppmotet/
Här stormar polisen ryska nattklubben,/tv/nyheter/varlden/har-stormar-polisen-gayklubbarna-i-moskva/
Flygplanet tvingas avbryta landningen – i sista sekund,/tv/nyheter/varlden/flygplanet-tvingas-avbryta-landningen-i-sista-sekund/
"Nytt jättetåg – svenska
bandvagnar till Ukraina",/tv/nyheter/varlden/nytt-jattetag-svenska-bandvagnar-till-ukraina/
Våldsamt utbrott ombord – blir fastbunden i flygstol,/tv/nyheter/varlden/valdsamt-utbrott-ombord-blir-fastbunden-i-flygstol/
Kristersson blir rejält utskälld på pressträff,/tv/nyheter/sverige/kristersson-blir-rejalt-utskalld-pa-presstraff/
Ås Sivborg medger: ”Går alltid att vara efterklok”,/nyheter/sverige/generaldirektor-slar-ifran-sig/
Ministern: Behöver gå till botten med det här,/nyheter/sverige/ministern-efter-motet-vi-behover-ga-till-botten-med-detta/
Vägrar svara – säger inte ett ord,https://www.expressen.se/tv/nyheter/har-vagrar-susanne-as-sivborg-att-svara-pa-fragor-
Dolde skandalen för regeringen,/nyheter/sverige/har-avslojas-hon-chefen-for-lantmateriet-morkade-for-regeringen/
Kaos i Sydkorea – krigslagar utlyst,/nyheter/varlden/sydkorea-krigslagar-mot-kommuniststyrkor/
USA larmade – svensk häktad för barnvåldtäkt,/nyheter/sverige/svensk-man-gripen-pa-order-av-usa/
Natochefen: Låt inte Xi och Putin göra high five,/nyheter/varlden/varningen-till-trump-ett-allvarligt-hot/
Arlas svar – efter bojkotten av mjölk,/nyheter/sverige/darfor-bojkottas-arla-i-storbritannien/
Pampen säljer extrem samling Formel 1-bilar,https://teknikensvarld.expressen.se/nyheter/motorsport/bernie-ecclestone-saljer-extrem-samling-f1-bilar/
Norska kravet på Nato – för att undvika krig,/nyheter/varlden/putin-skjuter-upp-rysslands-alternativa-os/
Kvinnans instruktioner för övergreppen på barn,/nyheter/sverige/ung-kvinna-doms-instruerade-man-hur-han-skulle-bega-overgrepp-mot-barn/
Man knivhuggen i Trelleborg: ”Letar spår”,/nyheter/sverige/man-knivhuggen-i-trelleborg/
Civilförsvarsministern ändrar sig efter kritiken,/nyheter/sverige/civilforsvarsministerns-svar-pa-kritiken-regeringen-har-inte-pastatt/
Svensk man föll ur båt på Atlanten: ”Chockade”,/nyheter/varlden/svensk-man-forsvunnen/
Brand i hiss i centrala Norrköping – rök sprids,/nyheter/sverige/brand-i-hiss-pa-femte-vaningen/
"Ebba, 25, lånade ut bilen – säljs av Kronofogden",/nyheter/sverige/ebba-25-lanade-ut-bilen-saljs-av-kronofogden/
Här ger ryska soldaterna upp – och överlämnar sig,https://www.expressen.se/tv/nyheter/varlden/har-overlamnar-ryska-soldater-sig-till-ukraina
Nya ljudbanden som ändrade SVT:s plan,/nyheter/sverige/darfor-klipps-svt-dokumentaren-om-styckmordet-pa-catrine-da-costa-in-i-det-sista/
Expert efter ministerns utspel: Gynnar Kreml,/nyheter/sverige/krigsvetaren-risker-med-att-dra-for-tidigare-slutsatser-om-sabotage/
Ministern slår tillbaka: Kom från svensk polis,/nyheter/sverige/uppgifter-kabelbrott-pa-ledning-mellan-sverige-och-finland/
Ljög om skärgårdshus – fick kollega att ta sms-lån,/nyheter/sverige/polisen-misstanker-ljog-om-skargardshus-fick-kollega-att-ta-sms-lan/
Så drev mamman och dottern bordeller ihop,/nyheter/krim/sa-drev-mamman-och-dottern-bordell-ihop/
Danska lagen: Förbud mot utländska flaggor,/nyheter/varlden/utlandska-flaggor-forbjuds-i-danmark/
Putins skräck: Moskvas elit attackeras av drönare,/nyheter/varlden/putins-skrack-omfattande--dronarattacker-mot-moskva/
”Känns helt overkligt att de låg kvar i bilen”,/nyheter/sverige/teorin-darfor-missades--doda-barnen-pa-e22-overkligt/
Bärgare hittade två barn döda: ”Tagen”,/nyheter/sverige/tva-barn-och-en-kvinna-doda-efter-krasch-pa-e22-i-kristianstads-kommun/
Lastbil fastnar på spåret – då kommer jättetåget,https://www.expressen.se/tv/nyheter/lastbil-fastnar-pa-sparet-da-kommer-taget-
Elefantungen kämpar för sitt liv – fast i brunn,https://www.expressen.se/tv/nyheter/har-raddas-elefantungen-kampar-for-sitt-liv-
Ordern till soldaterna innan Trump tar över,/nyheter/varlden/ordern-till-ukrainas-soldater-i-kursk-innan-trump-svars-in/
”De förflyttar sina styrkor i hemlighet”,/nyheter/varlden/ukraina-ryssland-forbereder-ny-offensiv/
Putins nya skrytrobot sågas: ”Fyrverkeri”,https://www.expressen.se/tv/nyheter/varlden/putins-bakslag-nya-superroboten-totalsagas
”Var så full – försökte dansa med stripporna”,/nyheter/varlden/pete-hegseth-tvingades-bort-anklagelser-om-fylla-och-sex/
Allierade bryter med Joe Biden: Utnyttjar makten,/nyheter/varlden/allierade-bryter-med-joe-biden-efter-benadningen-av-hunter/
Pojken fångas på bild: ”Avrätta nån”,/nyheter/sverige/tog-taxi-till-centrum-for-morduppdrag/
Larm från bagerijätten: Död fågel bland bröden,/nyheter/sverige/larmet-fran-bake-my-day-dod-fagel-bland-broden-/
"Vad hände då Molly, 14, dog?",/nyheter/sverige/mollys-hemlighet-sista-festen-som-tar-hennes-liv/
Se hur helikopterrånarna flög: ”Tog större risker”,/tv/nyheter/sverige/se-hur-helikopterranarna-flog-over-stockholm-/
Namnbytet efter ilskan,/nyheter/sverige/jag-ar-hatad-for-fan-av-halva-sverige/
