Heading,URL
Putins krigsfartyg avslöjas av stridsdrönaren,/tv/nyheter/varlden/putins-krigsfartyg-avslojas-av-stridsdronaren/
Israeliska stridsfordonet kör ner ”I love Gaza”-skylten,/tv/nyheter/varlden/israeliska-stridsfordonet-kor-ner-i-love-gaza-skylten-/
Dumpar snusket – kan böta halv miljon,/tv/nyheter/varlden/ungdomar-riskerar-fangelse-efter-smutsiga-agerandet-/
Svensk kvinna skadas – trädet faller över bilar,/tv/nyheter/varlden/svensk-kvinna-skadas-tradet-faller-pa-bilarna/
Hör på Kim Jong-Uns bisarra ”Abba-sång”,/tv/nyheter/varlden/kim-jong-uns-lat-har-blivit-viral-jamfors-med-abba/
Hemlighet upptäcktes i jordens inre,/tv/nyheter/varlden/nya-detaljen-om-jordens-gomda-planet/
Turisten tar bild – allting havererar,/tv/nyheter/varlden/mannen-friar-da-gar-allt-helt-snett/
JUST NU: SMHI varnar för snö,/nyheter/sverige/smhi-varnar-for-sno-6qkdy/
Fångarna flyttade in hos kriminalvårdare,/nyheter/sverige/kriminalvardarna-flyttade-ihop-med-ex-fangar-storkar/
Efter granskningen – vill se lag om förräderi,/nyheter/sverige/efter-granskningen--muf--vill-se-ny-lag-om-forraderi/
Avklädda bilderna till fången: ”Puss”,/nyheter/sverige/kriminalvardarens-avkladda-bilder-till-fange-puss-babe/
Fejkpandor väcker förvirring på zoo,/nyheter/varlden/fejkpandor-vacker-forvirring-pa-zoo-i-kina-/
Vill ha ett nytt barn – för att amma maken,/tv/nyheter/varlden/vill-fa-nytt-barn-for-att-kunna-amma-maken/
Oro när fågelinfluensa sprids till nya djurarter,/nyheter/kronikorer/amina-manzoor/fagelinfluensa-i-nya-kontexter-oroar-forskare/
USA stoppade leverans till Israel – oron för Rafah,/nyheter/varlden/usa-stoppade-bombleverans-till-israel/
Israeliska fordonet kör ner ”I love Gaza”-skylt,/tv/nyheter/varlden/israeliska-stridsfordonet-kor-ner-i-love-gaza-skylten-/
Kallar Trumps son ”mest intressanta 18-åringen”,/nyheter/varlden/kallar-trumps-son-mest-intressanta-18-aringen/
Här jagar tullen guld och knark på Arlanda,/nyheter/sverige/tullens-jakt-pa-guld-och-narkotika-pa-arlanda-inget-forvanar-mig-langre/
Tunga ansvaret för ”Putins attackhund”,/nyheter/varlden/kadyrovs-styrkor-bar-den-storsta-bordan-i-ukraina/
Putins krigsfartyg avslöjas av drönaren,/tv/nyheter/varlden/putins-krigsfartyg-avslojas-av-stridsdronaren/
Kritiken mot Putin: Tjuv och mördare,/nyheter/varlden/navalnaja-om-putin-en-lognare-en-tjuv-och-en-mordare/
Spionage på svenska universitet avslöjat,/nyheter/irans-spionage-pa-svenska-universitet-avslojat-naivitet/
Ryska taigafästingen sprider sig i Sverige,/nyheter/laget/ryska-taigafastingen-sprider-sig-i-sverige/
Experterna: Då märks en sänkning i plånboken,/nyheter/sverige/experterna-da-marks-en-sankning-i-planboken/
Kaos på Heathrow: ”Apokalyptisk känsla”,/nyheter/varlden/kaos-pa-heathrow-alla-gater-stangda/
Testa valkompassen: Vem ska du rösta på?,/nyheter/varlden/valkompass-eu-val-2024-testa-sjalv-vilket-parti-ska-du-rosta-pa-den-9-juni/
Löfvens styrelsekollega bakom ryska operationen,/nyheter/varlden/stefan-lofvens-styrelsekollega-skapade-rysk-paverkansoperation/
Daniel infiltrerade SD – ville avslöja ”trollfabrik”,/nyheter/sverige/daniel-infiltrerade-sverigedemokraterna-for-att-avsloja-trollfabrik/
SD:s hemliga partner: ”Kommer bli problem”,/nyheter/sverige/sa-forsoker-sd-dolja-samarbetet-med-riks/
Putin prisade pedofil efter jobbet i Ukraina,/nyheter/varlden/kriget-i-ukraina-7-maj/
Putins varning till Iran: ”Katastrofalt för alla”,/nyheter/varlden/putins-varning-till-iran-en-viktig-dronarpartner/
Svensk kvinna skadas – trädet faller över bilar,https://www.expressen.se/tv/nyheter/varlden/svensk-kvinna-skadas-tradet-faller-pa-bilarna/
Stormy Daniels vittnar: Jag smiskade Trump,/nyheter/varlden/stormy-daniels-vittnar-i-trump-rattegangen/
Bilderna inifrån Frederiks och Marys lyxiga skepp,/nyheter/sverige/har-ar-kung-frederiks-och-marys-lyxiga-skepp/
LKAB om sabotage- hotet: Banan sårbar,/nyheter/sverige/lkab-om-sabotage--hotet-banan-sarbar/
Man död i bostad i Malmö – polisen utreder mord,/nyheter/sverige/man-dod-i-bostad-i-malmo-/
Brand vid lägenhet – misstänkt mordbrand,/nyheter/sverige/brand-vid-lagenhet-misstankt-mordbrand/
Kvinna var täppt i näsan – gjorde skräckupptäckt,/nyheter/varlden/kvinna-var-tappt-i-nasan-gjorde-skrackupptackt/
Dumpar snusket – kan böta halv miljon,https://www.expressen.se/tv/nyheter/varlden/ungdomar-riskerar-fangelse-efter-smutsiga-agerandet-
Kraftig radhusbrand i Burlöv – utrymdes,/nyheter/sverige/radhus-brinner-i-burlov-kritiskt/
Efter 193 år – nu släpper anrika klubben in kvinnor,/nyheter/varlden/efter-193-ar-nu-slapper-anrika-klubben-in-kvinnor/
Tinderbedragare döms till fängelse och skadestånd,/nyheter/sverige/tinderbedragare-doms-till-fangelse-och-skadestand/
Snart är schweiziska armékniven inte en kniv,/nyheter/varlden/snart-ar-schweiziska-armekniven-inte-en-kniv/
Vänsterns inriktning får intern kritik: ”Högersväng”,/nyheter/sverige/vansterns-inledning-far-intern-kritik-hogersvang/
"V-politiker: ”Vill inte låta ryssvänlig, men”",/nyheter/sverige/v-politiker-vill-inte-lata-ryssvanlig-men-/
”Vansinnigt” med Eurovision i Malmö,/nyheter/varlden/teodorescu-vansinnigt-med-eurovision-i-malmo/
Usel stämning mellan partierna – inför valet,/nyheter/sverige/usel-stamning-mellan-partierna-infor-valet/
Beslaget i Norska tullen: Miljontals svenska kronor,/nyheter/varlden/norsk-tull-tog-42-miljoner-svenska-kronor-i-beslag/
Hör på Kim Jong-Uns bisarra ”Abba-sång”,https://www.expressen.se/tv/nyheter/varlden/kim-jong-uns-lat-har-blivit-viral-jamfors-med-abba/
Svensk kvinna skadad i Malaysia,/nyheter/varlden/svensk-kvinna-skadad-i-olycka-i-malaysia/
Ingen haveriutredning efter olyckan på färjan,/nyheter/sverige/ingen-utredning-av-farjeolyckan/
Räddningstjänstens bilder inifrån branden,/nyheter/sverige/raddningstjanstens-egna-bilder-fran-oceanabranden/
Flera förda till sjukhus efter olycka i Malmö,/nyheter/sverige/flera-till-sjukhus-efter-olycka/
Bil beskjuten i Tyresö söder om Stockholm,/nyheter/sverige/larm-om-skjutning-i-tyreso/
Vittnen: Har hört höga smällar,/tv/nyheter/sverige/bil-beskjuten-i-tyreso-soder-om-stockholm/
Sköts ihjäl på gatan – oron: ”Känner skräck”,/nyheter/sverige/radslan-pa-sodermalm-efter-dodsskjutningen/
Man i 20-årsåldern gripen nära mordet,/nyheter/sverige/flera-gripna-efter-dodsskjutning/
Gör slut med killen – då avslöjas hemlighen,https://www.expressen.se/tv/nyheter/varlden/avslojar-killens-hemlighet-lurades-av-alla
"Blerona, 17, brändes av frityrolja på Max",/nyheter/sverige/blerona-17-brandes--av-frityrolja-pa-max/
Turisten ska ta bild – ingen kollar på henne,https://www.expressen.se/tv/nyheter/varlden/mannen-friar-da-gar-allt-helt-snett
Jordens hemlighet avslöjas av månen,https://www.expressen.se/tv/nyheter/varlden/nya-detaljen-om-jordens-gomda-planet
Kan bli en av världens dyraste bilar i helgen,https://teknikensvarld.expressen.se/nyheter/bil-och-trafik/mclaren-f1-med-extremt-fa-mil-saljs/
Äldre par fast i skogen – hittade ut dagen efter,/nyheter/sverige/raddningsinsats-i-nackareservatet/
Person allvarligt skadad efter brand i lägenhet,/nyheter/sverige/lagenhet-brinner-i-orebro/
Ingen fotboja i sommar för Ernstberger,/nyheter/sverige/ingen-fotboja-i-sommar-for-ernstberger-/
"Kaisa, 23, hade brasa på tv:n – då kom brandkåren",/nyheter/sverige/myste-framfor-digital-brasa-fick-besok-av-brandman/
Israel: Har kontroll över gränsövergång,/nyheter/varlden/israel-har-tagit-kontroll-over-gransovergang/
Sista vittnet om mordet på Einár,/nyheter/sverige/sista-vittnet-om-mordnatten-da-einar-dodades/
