Heading,URL
Kaoset i FN – när Netanyahu talar,/tv/nyheter/varlden/har-lamnar-fn-delegaterna-nar-netanyahu-intar-scenen/
Isbjörnar har tagit över ryska basen,/tv/nyheter/varlden/isbjornar-har-tagit-over-rysk-forskningsstation/
Svimmar i SVT:s Morgonstudion ”Vi får avbryta!,/tv/nyheter/svimmar-i-svts-morgonstudion/
"Här hamnar Emelie, 28, öga mot öga med rovdjuren",/tv/nyheter/gulligt-varre-tre-lodjursungar-dok-upp-pa-svampturen-/
Försvinner helt i skogen – med superkamouflage,/tv/nyheter/forsvinner-helt-i-skogen-med-superkamouflage/
Zelenskyjs svar – på kungens gest,/tv/nyheter/sverige/kungens-ord-till-zelenskyj-fortfarande-stark/
Gigantiskt slukhål sväljer hela gatan,/tv/nyheter/gigantiskt-slukhal-svaljer-hela-gatan/
JUST NU: Mycket stökig natt,/nyheter/sverige/mycket-stokig-natt-i-orebro/
JUST NU: Plan nära att krocka,/nyheter/varlden/plan-nara-att-krocka-i-nice-allvarlig-incident/
JUST NU: Insats trappas upp – flicka saknas,/nyheter/varlden/svensk-familj-i-allvarlig-batolycka-i-lofoten-i-norge/
Båtbolaget: ”Ska inte kunna ske”,/nyheter/varlden/svensk-familj-i-olycka-i-norge-batforetagets-vd-oforklarigt/
Här kämpar de för att rädda överlevande,/tv/nyheter/varlden/svensk-familj-i-allvarlig-batolycka-i-norge/
Wollters otrohetslista: Kvinnornas egna ord,/nyheter/sverige/har-ar-christopher-wollters-otrohetslista-kvinnornas-egna-ord/
Kraftig båtbrand mitt i Stockholm,/tv/nyheter/sverige/batbrand-i-centrala-stockholm/
Vittnet: ”Gud det brinner ju”,/nyheter/sverige/fullt-utvecklad-brand-pa-bat-vid-kungsholms-strand-i-stockholm/
"”Fanns inget ben kvar, allt var sönderskjutet”",/nyheter/sverige/fanns-inget-ben-kvar--allt-var-sonderskjutet/
Mystiska rösten i TV4:s sändning,https://www.expressen.se/tv/nyheter/sverige/mystiska-rosten-i-tv4s-sandning
Åt ”jättegod” pasta – fick åka till akuten,/nyheter/sverige/nellie-21-at-jattegod-pasta-fick-aka-till-akuten-i-helsingborg/
Advokaten om Borg: ”Byggde på en lögn”,/nyheter/sverige/peter-danowsky-allt-byggde-pa-en-logn/
Sågningen: ”Jag tror inte på sexmissbruk”,/nyheter/sverige/ann-heberlein-om-boken-jag-tror-inte-pa-sexmissbruk/
Epsteins ord om Musk: ”Kommer det att ske?”,/nyheter/varlden/elon-musk-med-i-epsteins-dokument-planerade-resa-till-on/
USA planerar att slå till inne i Venezuela,/nyheter/varlden/uppgifter-usa-planerar-for-att-sla-till-inne-i-venezuela/
Paret Trumps yviga gester väcker frågor,https://www.expressen.se/tv/nyheter/varlden/hetsiga-diskussionen-mellan-donald-trump-och-melania
Om Jonna tar bort penisen är det hejdå,/nyheter/sverige/jenny-hittade-en-kartong-med-kvinnoklader-i-garderoben/
Bloggarens olämpliga drag – grips av polis,/tv/nyheter/varlden/bloggare-i-thailand-gripen-for-sex-i-trafiken/
Sjödrönaren fintar Rysslands försvar,/tv/nyheter/varlden/ukrainas-sjodronare-slar-till-mot-ryska-oljehamnen/
Båtbrand i centrala Stockholm,/tv/nyheter/sverige/batbrand-i-centrala-stockholm/
Här kämpar de för att rädda överlevande,/tv/nyheter/varlden/svensk-familj-i-allvarlig-batolycka-i-norge/
Isbjörnar har tagit över ryska basen,/tv/nyheter/varlden/isbjornar-har-tagit-over-rysk-forskningsstation/
Trump: ”Ryssland har knappt tagit någon mark”,/tv/nyheter/varlden/trump-ryssland-har-knappt-tagit-nagon-mark/
Paret Trumps yviga gester väcker frågor,/tv/nyheter/varlden/hetsiga-diskussionen-mellan-donald-trump-och-melania/
Mystiska rösten i TV4:s sändning,/tv/nyheter/sverige/mystiska-rosten-i-tv4s-sandning/
Kaoset i FN – när Netanyahu talar,/tv/nyheter/varlden/har-lamnar-fn-delegaterna-nar-netanyahu-intar-scenen/
Fem unga nazister – de är i nya våldsrörelsen,/nyheter/sverige/fem-unga-nazister-de-ar--tongivande-i-nya-valdsrorelsen/
Ovanliga familjen: Hon har 45 syskon – minst,/nyheter/varlden/29-aringen-har-45-syskon-berattar-om-ovanliga-familjen/
Ny handgranat hittad efter explosion vid port,/nyheter/krim/explosion-vid-trapphus-i-malmo-boende-inryms/
Putins skarpa svar till Nato: ”En eskalering”,/nyheter/varlden/ryska-svaret-efter-natos-anklagelse-allvarlig-eskalering/
Trumps sågning av Putin: ”Besviken”,/tv/nyheter/varlden/trump-ryssland-har-knappt-tagit-nagon-mark/
Isbjörnar har tagit över ryska basen,https://www.expressen.se/tv/nyheter/varlden/isbjornar-har-tagit-over-rysk-forskningsstation
Trump om Gaza: Jag tror att vi har en deal,/nyheter/varlden/trump-om-gaza-tror-vi-har-en-deal/
Netanyahu i FN: Högtalare i Gaza,/nyheter/varlden/netanyahu-i-fn-har-satt-hogtalare-runt-gaza/
Chockgranat briserade på övning – statist dog,/nyheter/sverige/uppgifter-explosion-vid-polisovningen-en-man-dog/
Larm om fynd i påse – var en lösvagina,/nyheter/sverige/misstankt-farligt-foremal-i-kristianstad-var-losvagina/
Ilskan mot Centern – efter nobben: ”Skäms”,/nyheter/politik/ida-gabrielsson-sagar-centerpartiets-position-skams/
Kritiken efter besöket i Sverige: ”Är teater”,/nyheter/politik/dousa-m-unrwa-spelar-teater/
Stor insats efter fynd i påse – var helt ofarligt,https://www.expressen.se/nyheter/expressen-direkt/?post=b5cb8df4-9994-4a5f-abd4-75e04b7f75e8
Våldtog och filmade sin sovande hustru,/nyheter/krim/man-doms-valdtog-och-filmade-sin-sovande-fru/
Rudolfs kroppsrekord – över en meter långt,https://www.expressen.se/tv/nyheter/rudolfs-nya-varldsrekord-over-en-meter-langt
Uppehållstillstånd ska kunna dras in,/nyheter/politik/utredare-uppehallstillstand-kan-rivas-upp/
Trump sågar Israels planer: ”Tillåter inte”,/nyheter/varlden/trump-om-vastbanken-kommer-inte-tillata-det/
Tonårsmördarna sköt ihjäl fel offer,/nyheter/krim/tonarsmordarna-skot-ihjal-fel-offer-pa-fel-adress-hovratten-sanker-straffet/
Avslöjades efter år – döms för 19 våldtäkter,/nyheter/sverige/roland-holmstedt-77-valdtog-flicka-19-ganger/
Här hamnar Emelie öga mot öga med rovdjuren,https://www.expressen.se/tv/nyheter/gulligt-varre-tre-lodjursungar-dok-upp-pa-svampturen-
Tiktokare drog in pengar till IS,/nyheter/krim/dom-mot-misstankt-tiktok-terrorbrott-/
Rysslands nya besked bakom stängda dörrar,/nyheter/varlden/kalla-rysslands-krankningar-ar--ett-svar-pa-natos-ukrainastod/
Då kan Sverige svara på Putins ”nålstick”,/nyheter/varlden/experten-da-kan-sverige-behova-agera-mot-ryssland/
Svensk forskare sågar Trump: ”Blir chockad”,/nyheter/sverige/svenska-forskaren-sagar-trump-skambelagger-mammor-/
Kontakta redaktionen direkt,/nyheter/har-du-ett-nyhetstips-eller-bilder/
Spa-snusket: Musbajs och mögel,/nyheter/sverige/snusket-pa-svenska-spa-anlaggningar/
Försvinner helt i skogen – med superkamouflage,/tv/nyheter/forsvinner-helt-i-skogen-med-superkamouflage/
