Heading,URL
Trumps ultimatum – för att hjälpa brandoffren,/tv/nyheter/varlden/trumps-ultimatum-for-att-hjalpa-brandoffren-/
Enormt ryskt raffinaderi träffat – igen,/tv/nyheter/varlden/enormt-ryskt-raffinaderi-traffat-igen/
Diktatorns hund markerar i vallokalen,/tv/nyheter/varlden/diktatorn-ska-rosta-da-gor-hunden-det-forbjudna/
Nya namnutspel: ”Mexiko förtjusta”,/tv/nyheter/trumps-nya-namnutspel-mexikanerna-fortjusta/
Skräckovädret – här träffar blixten planet,/tv/nyheter/varlden/vatten-forsar-in-i-tunnelbanan-kaotiska-scener-/
Tjejerna dansar – därför riskerar de spöstraff,/tv/nyheter/varlden/tjejerna-dansar-darfor-riskerar-de-spostraff/
Här spränger mörkklädd person huset i Enskede,/tv/nyheter/sverige/har-spranger-morkkladd-person-huset-i-fororten/
Skrapar bilen med bebis – polis utreder,/tv/nyheter/varlden/skrapar-bilen-med-bebis-polis-utreder/
Trumps speciella hälsning i mötet med ”hat-guvernören”,/tv/nyheter/varlden/trumps-mote-med-hat-guvernoren/
JUST NU: Kvinna svårt skadad,/nyheter/sverige/kvinna-svart-skadad-/
JUST NU: Bomb- attack mot sovrum – man gripen i natt,/nyheter/sverige/explosion-i-bro-en-skadad/
Trump utropar seger – handelskrig avblåst,/nyheter/varlden/trumps-nya-attack-/
”Massvillfarelsen sker mitt framför våra ögon”,/nyheter/varlden/donald-trump-ljuger-igen-massvillfarelse/
Trumps ultimatum för att hjälpa brandoffren,/tv/nyheter/varlden/trumps-ultimatum-for-att-hjalpa-brandoffren-/
Ministerns fräcka låtar – okända spellistorna,/nyheter/sverige/politikernas-okanda-spellistor-pa-spotify/
Hon stod på dödslista: ”Det känns så mörkt”,/nyheter/varlden/hon-stod-pa-irans-dodslista-kanns-morkt/
Sverige har bordat misstänkta fartyget,/nyheter/sverige/fartyg-tagen-i-beslag/
Paasikivi: Ryssarna som gynnas mest,/nyheter/sverige/paasikivi-ryssarna--som-gynnas-mest/
Här är Natos flaggskepp – ska vakta Östersjön,/tv/nyheter/varlden/har-ar-natos-jattefartyg-ska-vakta-ostersjon/
Konflikten: Vem tog den ikoniska bilden?,/nyheter/varlden/konflikt-om-ikoniskt-foto-fran-vietnamkriget/
Dansar på film – hotas med hårt straff,/tv/nyheter/varlden/tjejerna-dansar-darfor-riskerar-de-spostraff/
Tänder på – plötsligt exploderar macken,/tv/nyheter/varlden/tander-eld-pa-ryska-bensinstationen-filmas/
Skandalerna kring Musk – så påverkar de Tesla,/nyheter/laget/skandalerna-kring-musk-sa-paverkar-de-tesla/
Nya namnutspelet: ”Mexiko förtjusta!”,/tv/nyheter/trumps-nya-namnutspel-mexikanerna-fortjusta/
Ryska flyget lyfter inte – dundrar ut i skogen,/tv/nyheter/varlden/passagerna-kliver-ur-i-skogen-efter-kraschen/
Experten om Barrons ord till Joe Biden,/tv/nyheter/varlden/experten-om-barrons-ord-till-joe-biden/
Musks raketskrot föll på Elenas fest,/tv/nyheter/varlden/musks-raketskrot-foll-pa-elenas-fest/
Trumps krig mot flyktingar vid gränsen,/tv/nyheter/varlden/trumps-krig-mot-flyktingar-vid-gransen/
Mamman fängslade 11-åring – i källaren,/tv/nyheter/varlden/mamman-fangslade-11-aring-i-kallaren/
Fastnar i lift i timmar – ersättningen: En lunch,/tv/nyheter/sverige/oskar-19-fastnar-i-idre-lift-i-tva-timmar/
Största snackisarna från presidentinstallationen,/tv/nyheter/varlden/storsta-snackisarna-under-presidentinstallationen/
Politikerns attack efter filmbråket: ”Elitistisk”,/nyheter/sverige/kritiken-mot-ostlund-branschen-ar-elitistisk/
Hon hyllades för sitt mod – familjen föll samman,/nyheter/varlden/gisele-pelicot-hyllades-men-familjen-foll-samman/
Vågade draget – med den klassiska pastan,/nyheter/varlden/forskarnas-vagade-drag-med-klassiska-pastan/
Ryska framsteg – men fastnade i en ”eldficka”,/nyheter/varlden/ryssland-gor-framsteg-i-ukraina-fast-i-eldficka/
Detaljen som hyllas på svenska stridsfordonet,/tv/nyheter/varlden/skjuter-med-svenska-stridsfordonet-kanonen-hyllas/
"Emma, 23, slår larm om Estrids rakhyvlar",/nyheter/sverige/emma-23-om-estrids-nya-rakhyvlar-kandes-som-knivar/
Diktatorn ska rösta – då kissar hunden,https://www.expressen.se/tv/nyheter/varlden/diktatorn-ska-rosta-da-gor-hunden-det-forbjudna
”Europas sista diktator” väntas vinna – igen,/nyheter/varlden/europas-sista-diktator-vantas-befasta-makten-i-belarus/
Port sprängd – man jagas efter explosion,/nyheter/sverige/explosionslarm/
Frontalkrock – bilist körde i fel riktning,/nyheter/sverige/frontalkrock-pa-e22/
Rebeller hävdar kontroll över nyckelstaden Goma,/nyheter/varlden/rebeller-havdar-kontroll-over-goma/
Skottlossning mot dörr – flera kontrollerade,/nyheter/sverige/skott-mot-dorr-ptmrb/
Handgranatshot mot känt influencerpar,/nyheter/sverige/misstanken-hotet-mot-kanda-influencer-paret-handgranatattack/
Förklaringen bakom bomblarmet: Kläder,/nyheter/sverige/ikea-parkering-avsparrad/
Missen: Ökade priset med 14 000 procent,/nyheter/sverige/microsoft-okade-priset-med-14-000-procent-pudlar-vi-ber-om-ursakt/
Varningen: Donald Trump skämtar inte,/nyheter/varlden/carl-bildt-donald-trump-skamtar-inte-om-gronland/
Jan Guillou: Elon Musk heilade inte,/nyheter/sverige/jan-guillou-om-elon-musk-heilade-inte/
Här sprängs dörren – fångades på film,https://www.expressen.se/tv/nyheter/sverige/har-spranger-morkkladd-person-huset-i-fororten
Pojke gripen efter nattens explosion,/nyheter/sverige/explosion-vid-flerfamiljshus-i-enskededalen/
Turist dödad av elefant – räddade sitt barnbarn,/nyheter/varlden/turist-dodad-av-elefant-i-sydafrika/
Unga tjejerna riskerar spöstraff – för dansen,https://www.expressen.se/tv/nyheter/varlden/tjejerna-dansar-darfor-riskerar-de-spostraff
Skräckovädret – här träffar blixten planet,/tv/nyheter/varlden/vatten-forsar-in-i-tunnelbanan-kaotiska-scener-/
"SMHI varnar – risk för snörök, blåst och halka",/nyheter/sverige/smhi-varnar-for-sno-och-halka-/
Nya förslaget: Så kan Trump behålla makten,/nyheter/varlden/forslaget-for-trump-kan-behalla-makten/
Skulle ta studenten – dog i frontalkrock,/nyheter/sverige/18-ariga-kvinnan-skulle-ta--studenten-dog-i-olyckan/
Panik efter USA:s beslut – vädjar nu,/nyheter/varlden/marco-rubios-fryser-bistand-diplomater-vadjar-om-undantag-for-ukraina/
Avslöjades av hustruns bilder på lyxsemestern,/nyheter/varlden/avslojades-av-hustruns-bilder-pa-lyxsemestern/
Israel anklagar Hamas för att bryta vapenvilan,/nyheter/varlden/israel-anklagar-hamas-for-att-bryta-vapenvilan/
Man hittad död i fjällen – misstänkt olycksfall,/nyheter/sverige/man-hittad-dod-i-fjallen/
Paret gömde elva barn – ihop med älskarinnan,/nyheter/sverige/foraldrar-och-alskarinna--ska-ha-isolerat-elva-barn/
Hotet efter CIA:s nya covidbesked: Pesten,/nyheter/varlden/cias-besked-om-coronapandemin/
Skott avlossade mot företag – stor insats,/nyheter/sverige/skottlossning-i-hammarbyhamnen/
Hon har levt i 61 dagar – med njure från en gris,/nyheter/varlden/towana-53-har-levt-i-61-dagar-med-en-grisnjure/
Ung man påkörd av kvinna vid snabbmatsrestaurang,/nyheter/sverige/person-pakord-i-mora/
Grov misshandel vid simhall – tre gripna,/nyheter/sverige/tre-gripna-efter-grov-misshandel-vid-simhall/
Uber tjänar miljarder – så lite får förarna,/nyheter/sverige/uber-tjanar-miljarder-sa-lite-far-forarna/
Plötsligt faller planet – räddad av snilleblixt,/tv/nyheter/sverige/har-faller-hakans-flygplan-mayday-mayday/
Våldtogs av Kapten klänning,/nyheter/sverige/sanna-35-valdtogs-av-kapten-klanning/
Mörkade läckor för regeringen,/nyheter/sverige/las-expressens-avslojanden-om-skandalen-pa-lantmateriet/
Sexanmälan avslöjade pengarna till gängman,/nyheter/sverige/sexanmalan-avslojade-pengarna-till-gangman/
"Vad hände då Molly, 14, dog?",/nyheter/sverige/mollys-hemlighet-sista-festen-som-tar-hennes-liv/
