Heading,URL
Extra bagage-avgift bakom vilt slagsmål,/tv/nyheter/varlden/extra-bagage-avgift-bakom-vilt-slagsmal/
Här dras planet med i orkanen,/tv/nyheter/varlden/har-dras-planet-med-i-orkanen-/
Nya svenska ubåten – med ”egen hjärna”,/tv/nyheter/sverige/nya-svenska-ubaten-med-egen-hjarna/
Rattfull pensionär kör rakt ut i havet – kampen,/tv/nyheter/varlden/rattfull-pensionar-kor-rakt-ut-i-havet-kampen/
Pappan fångad på film – efter år i vildmarken,/tv/nyheter/varlden/pappan-fangad-pa-film-efter-ar-i-vildmarken/
Stridsflyg har kraschat i Polen,/tv/nyheter/varlden/stridsflyg-har-kraschat-i-polen/
Visar upp vapen och skrattar: ”Fan ta barnen”,/tv/nyheter/varlden/robin-westman-visar-upp-vapen-och-ber-om-ursakt-timmar-fore-dadet/
Youtuberns vågade drag – slutar i tragedi,/tv/nyheter/varlden/youtuberns-vagade-drag-slutar-i-tragedi/
JUST NU: Kvinna gripen,https://www.expressen.se/nyheter/expressen-direkt/?post=511ad29a-fda2-43f2-9b8b-df15b9a94b85
JUST NU: Våldtäkt – man gripen,https://www.expressen.se/nyheter/expressen-direkt/?post=5dfe97e6-d79f-4152-8fea-6d0b0e72c0a0
Rivalens hån mot Trump: ”Inte hört”,/nyheter/varlden/gavin-newsom-hanar-donald-trump-igen/
Se när guvernören härmar Donald Trump,/tv/nyheter/varlden/se-nar-guvernoren-harmar-donald-trump/
Tullarna olagliga – Trumps raseri,/nyheter/varlden/donald-trumps-tullar-ar-olagliga-presidenten-rasande-forstor-usa/
"Oliver, 3 misstänks ha förts bort till Ryssland",/nyheter/varlden/oliver-pugh-3-forsvunnen-misstankt-kidnappning-i-marbella/
Här drar orkanen med sig passagerarplanet,/tv/nyheter/varlden/har-dras-planet-med-i-orkanen-/
Liseberg skrotar klassiker efter 60 år,https://www.expressen.se/nyheter/expressen-direkt/?post=4491c625-b8b1-466c-b6bf-688cc617dab5
Här är hela åtalet mot norska ”bonusprinsen”,/nyheter/kungligt/las-hela-atalet-mot-marius-borg-hoiby-alla-punkter/
Bybornas kamp med enorma skräck-ormen,https://www.expressen.se/tv/nyheter/varlden/bybornas-kamp-med-gigantiska-ormen
"Mohsen Asghari, 26, våldtog brevbärare",/nyheter/sverige/mohsen-asghari-26-valdtog-brevbararen/
Hans mamma kom aldrig mer hem igen,/nyheter/sverige/hans-mamma-kom-aldrig-mer-hem-igen/
Vilt slagsmål bryter ut – över bagage-avgift,/tv/nyheter/varlden/extra-bagage-avgift-bakom-vilt-slagsmal/
Pappan fångad på film – efter år i vildmarken,/tv/nyheter/varlden/pappan-fangad-pa-film-efter-ar-i-vildmarken/
Se när guvernören härmar Donald Trump,/tv/nyheter/varlden/se-nar-guvernoren-harmar-donald-trump/
Bybornas kamp med gigantiska ormen,/tv/nyheter/varlden/bybornas-kamp-med-gigantiska-ormen/
Här dras planet med i orkanen,/tv/nyheter/varlden/har-dras-planet-med-i-orkanen-/
Här slår Ukraina ut ryska robotskeppet,/tv/nyheter/varlden/har-slar-ukraina-ut-putins-robotskepp/
Illegal djurpark upptäckt – exotiska djur till salu,/tv/nyheter/varlden/illegal-djurpark-upptackt-exotiska-djur-till-salu/
Nya svenska ubåten – med ”egen hjärna”,/tv/nyheter/sverige/nya-svenska-ubaten-med-egen-hjarna/
Extra bagage-avgift bakom vilt slagsmål,/tv/nyheter/varlden/extra-bagage-avgift-bakom-vilt-slagsmal/
Koranbrännarens pappa: ”Jag såg tre skott i hans panna”,/tv/nyheter/koranbrannarens-pappa-jag-sag-tre-skott-i-hans-panna/
Koranbrännarens pappa om spåren i lägenheten,/nyheter/sverige/koranbrannaren-salwan-momikas-pappa-polisen-har-sakrat-fingeravtryck/
Se videon inifrån Momikas lägenhet,/tv/nyheter/se-video-inifran-salwan-momikas-lagenhet/
Andersson: Onödigt med en säkerhetsrådgivare,/nyheter/politik/magdalena-andersson-onodigt-med-en-sakerhetsradgivare/
Fårhuvud hittat utanför företag – misstänkt hot,/nyheter/sverige/farhuvud-hittat-utanfor-foretag-i-malmo/
Exotiska djur till salu – värda hundratusentals,https://www.expressen.se/tv/nyheter/varlden/illegal-djurpark-upptackt-exotiska-djur-till-salu
Skarpt föremål hittat vid villa – stor avspärrning,https://www.expressen.se/nyheter/expressen-direkt/?post=09a8c12b-7f78-42d1-b241-b7dd829be46e
Harper och Fletcher mördades i skoldådet,/nyheter/varlden/harper-10-och-fletcher-8-dodades-i-skoldadet/
Delgado Varas seglar till Gaza efter uteslutningen,/nyheter/varlden/delgado-varas-seglar-till-gaza-efter-uteslutningen/
Kvarlevor av gisslan återförda till Israel,/nyheter/varlden/kvarlevor-av-gisslan-aterforda-till-israel-/
Totalsågas för sina insatser på mötena,/nyheter/varlden/han-ska-losa-trumps-fred-sagas-rejalt/
Otäck trend på svenska flygplan: ”Inte trevligt”,/nyheter/sverige/fler-brak-pa-svenska-flyg-myndigheten-larmar-/
Flygbolaget tvingas ersätta resenärerna,/nyheter/varlden/flygbolaget-tvingas-betala-ersattning-till-alla-ombord/
Källor: Vill sätta in kinesiska styrkor,/nyheter/varlden/kallor-trump-foreslar-kinesiska-trupper-i-ukraina/
Texas agerar mot abortpiller: Stämningar,/nyheter/varlden/texas-agerar-mot-abortpiller-stamningar/
Dömda mördaren försvann spårlöst,/nyheter/sverige/domda-mordaren-abdifatah-yahye--omar-efterlyst-internationellt/
Regeringen indragen – efter TV4:s besked,/nyheter/politik/s-kallar-ministern-till-utskott-efter-tv4-beskedet/
Vi andas in tiotusentals mikroplaster – varje dag,/nyheter/varlden/studie-vi-andas-in-68000-mikroplastpartiklar-om-dagen/
Nya svenska ubåten – med ”egen hjärna”,/tv/nyheter/sverige/nya-svenska-ubaten-med-egen-hjarna/
Skelettet pulveriserat – nu stäms Elon Musk,/nyheter/varlden/skelettet-pulvriserades-nu-stams-elon-musk/
Volvos nya superhybrid kommer nu till Sverige,https://teknikensvarld.expressen.se/nyheter/bil-och-trafik/elbil-laddhybrid/nya-volvo-xc70-kommer-till-europa-sverige/
Trumps slag mot Harris – innan stora bokturnén,/nyheter/varlden/trump-stoppar-kamala-harris-livvaktsskydd/
Trump om tv-kanalen: Värre än kriminella,/tv/nyheter/varlden/trumps-attack-mot-tv-kanalen-varre-an-kriminella-gang/
Flerbilskrock på E4 – orsakade kökaos,/nyheter/sverige/jattekoer-pa-e4-efter-krock/
Fångvaktare klarar inte närkamp – kan sparkas,/nyheter/sverige/fangvaktare-klarar-inte-narkamp-kan-sparkas/
Busch om Kirunas nya flytt: ”Positivt”,/nyheter/sverige/busch-om-kiruna-positivt-att-lkab-satsar/
Nya galna tricket i solstols-kriget,https://www.expressen.se/tv/nyheter/varlden/solstolskriget-sparar-ur-pa-teneriffa-sover-vid-poolen
Skolanställd utsatte 15 flickor för sexbrott,/nyheter/sverige/skolanstalld-atalas-for-sexbrott-mot-barn-/
Det kan stoppa Putin: ”Ogenomtränglig skit”,/nyheter/varlden/nato-strategin-vatmarker-ska-stoppa-ryssland/
Vreden mot turisten – efter ”elefant-ölen”,https://www.expressen.se/tv/nyheter/varlden/har-haller-turisten-ol-i-elefantens-snabel
Vreden efter Putins senaste jätteattack,/nyheter/varlden/dodssiffran-stiger-efter-nattens-attack-mot-kiev/
Ryska robotorna träffar brittiskt konsulat,/tv/nyheter/varlden/har-traffar-robotarna-centrala-kiev/
Exklusivt: Vi tittar på Teslas nya modell,https://teknikensvarld.expressen.se/nyheter/bil-och-trafik/elbil-laddhybrid/nya-tesla-model-y-performance-officiell/
Husbil krockade med bil – äldre man död,/nyheter/sverige/aldre-man-dod-i-frontalkrock-utanfor-are/
Fem personer dog – nu åtalas tre personer,/nyheter/sverige/tre-atalas-efter-hissolyckan-i-sundbyberg-fem-dog-/
Kontakta redaktionen direkt,/nyheter/har-du-ett-nyhetstips-eller-bilder/
Spa-snusket: Musbajs och mögel,/nyheter/sverige/snusket-pa-svenska-spa-anlaggningar/
Vandrade på fjället – springer på en björn,/tv/nyheter/sverige/robinsondeltagens-mote-med-en-bjorn-pa-sallsjofjallet/
