Heading,URL
Stad under vatten – larmet från Italien,/tv/nyheter/varlden/stad-under-vatten-larmet-fran-italien/
Nato-land evakuerar efter ryska attacken,/tv/nyheter/varlden/nato-land-evakuerar-efter-ryska-attacken/
Stoppar rullstolen – då avslöjas bluffen,/tv/nyheter/varlden/stoppar-rullstolen-da-avslojas-bluffen/
Skräms på gatan – blir nedsparkad,/tv/nyheter/varlden/skrams-pa-gatan-blir-nedsparkad/
Här dränks den spanska staden,/tv/nyheter/varlden/har-dranks-den-spanska-staden/
Brand i centrala Moskva,/tv/nyheter/varlden/brand-i-centrala-moskva/
Strömlöst i ryskockuperade staden,/tv/nyheter/varlden/stromlost-i-ryssland/
Här räddas ryska soldaterna – av gris,/tv/nyheter/varlden/har-raddas-ryska-soldaterna-av-gris-/
JUST NU: Stopp på E6,https://www.expressen.se/nyheter/expressen-direkt/?post=4423ebbd-0029-4f93-b8b1-a58df6c34421
JUST NU: Brott mot utlänningslagen,https://www.expressen.se/nyheter/expressen-direkt/?post=5639dae5-5a85-4f6d-8ef5-821778e17559
JUST NU: Dubbla smällar mot Putin,https://www.expressen.se/tv/nyheter/varlden/dubbla-smallar-mot-putin
JUST NU: Anrika restaurangen i lågor: ”Smäll”,/nyheter/sverige/brand-pa-anrika-restaurangen-villa-godthem-pa-djurgarden-i-stockholm/
”De är inte rädda för Trump längre”,/nyheter/varlden/de-ar-inte-radda-for-trump-langre/
Kravet: Använd piskan mot Putin,/nyheter/varlden/stubb-dags-att--trump-anvander--piskan-mot-putin/
Brittisk polis jagar Trump-influencerpar,/nyheter/varlden/trump-influencerpar-jagas-av-brittisk-polis/
”Greken” fjärrstyrde svenska barnsoldater,/nyheter/sverige/misstanken-sa-fjarrstyrde-greken--barnsoldater-fran-mexiko/
Här sprängs granaten – kastas in i matbutik,/tv/nyheter/har-kastas-en-handgranat-in-i-mataffaren/
"Turistparadiset: Sex, droger och korruption",/nyheter/sverige/i-grekens-fotspar-gangledaren-lyxliv-i-mexiko/
”Grekens” lyxliv: Kärleken gravid,/nyheter/sverige/grekens-lyxliv-i-paradiset--med-hemliga-kompanjonen/
Larmet från Italien – staden under vatten,/tv/nyheter/varlden/stad-under-vatten-larmet-fran-italien/
Deras död skakar ett helt land,/nyheter/varlden/de-fem-ungdomarnas-dod-skakar-hela-irland/
Nato-land evakuerar efter ryska attacken,/tv/nyheter/varlden/nato-land-evakuerar-efter-ryska-attacken/
Tiktok-profilen död – blev 21 år,/nyheter/varlden/tiktok-profil-dod-blev-21-ar/
Uteserveringar blir förbjudna i turistmål,/nyheter/varlden/turistfavoriten-florens-forbjuder-uteserveringar/
Varnar: Kan vara krigsförberedelse,/nyheter/varlden/polens-general-sabotaget-kan-vara-en-krigsforberedelse/
Polsk järnväg sprängd – i kontakt med Nato,/nyheter/varlden/natos-besked-efter-explosionen-i-polen/
Sören skadades i busskraschen,/nyheter/sverige/soren-78-skadades-i-bussolyckan-i-stockholm/
Tre kvinnor döda: ”Sorgens dag”,/nyheter/sverige/kvinna-pa-aklagarmyndigheten-bland-de-doda/
Avslöjas i rullstol – kastar öl på vakten,/tv/nyheter/varlden/stoppar-rullstolen-da-avslojas-bluffen/
Ryska soldater räddas av gris,/tv/nyheter/varlden/har-raddas-ryska-soldaterna-av-gris-/
Dubbla smällar mot Putin,/tv/nyheter/varlden/dubbla-smallar-mot-putin/
Här kastas en handgranat in i mataffären,/tv/nyheter/har-kastas-en-handgranat-in-i-mataffaren/
Köpcenter i lågor efter drönarattack,/tv/nyheter/varlden/kopcenter-i-lagor-efter-dronarattack/
Trumps nya besked om Maduro: ”Redo”,/tv/nyheter/varlden/trumps-nya-besked-om-maduro-redo/
Stad under vatten – larmet från Italien,/tv/nyheter/varlden/stad-under-vatten-larmet-fran-italien/
"Ras vid gruva –
minst 32 döda",https://www.expressen.se/tv/nyheter/varlden/ras-vid-gruva-minst-32-doda-
Ras vid gruva – minst 32 döda,/tv/nyheter/varlden/ras-vid-gruva-minst-32-doda-/
Nato-land evakuerar efter ryska attacken,/tv/nyheter/varlden/nato-land-evakuerar-efter-ryska-attacken/
"Tilda, 22, nära att dö av ätstörningen",/nyheter/sverige/tilda-22-var-nara-att-do-av-atstorningen/
Presidentens attack mot Expressens avslöjande,/nyheter/sverige/colombianska-presidenten-gustavo-petro-till-attack-mot-expressens-avslojande/
Lever lyxliv i Sverige – utreds för bedrägeri,/nyheter/sverige/lever-lyxliv-i-sverige-nu-utreds-presidenthustrun-veronica-alcocer-for-bedrageri-och-penningtvatt/
Nya teorin om familjens död under semestern,/nyheter/varlden/nya-teorin-om-familjens-dod-under-semestern/
Putins drag för att stärka krigskassan,/nyheter/varlden/putins-drag-for-att-starka-krigskassan/
Missen – då rycker ryska trupper fram,/nyheter/varlden/ukraina-skickade-trupper-norrut-ryssland-tog-byar-i-sodern/
Snösmocka drar in över landet: ”Kraftigare inslag”,/nyheter/sverige/snosmocka-drar-in-over-landet-kraftigare-inslag/
Drönarattack mot köpcenter,https://www.expressen.se/tv/nyheter/varlden/kopcenter-i-lagor-efter-dronarattack
"Unika bilden: Lodjur, rådjur och älg – ihop",/nyheter/sverige/unika-bilden-lodjur-radjur-och-alg-ihop/
Tio dagar som skakat Trump: ”Varit brutala”,/nyheter/varlden/tio-dagar-som-skakat-president-trump-brutala/
Piken mot Trump: ”Han har panik”,/nyheter/varlden/piken-mot-trump-han-har-panik/
Slaget mot turisterna – kan bli dyrare i London,/nyheter/varlden/londonresan-kan-bli-dyrare-vanta-infora-turistskatt/
Trump ger tummen upp – kan straffa Putin,/nyheter/varlden/trump-ger-tummen-upp/
Ras vid gruva – minst 32 döda,https://www.expressen.se/tv/nyheter/varlden/ras-vid-gruva-minst-32-doda-
SD-topp gjorde affär med terrorutpekad,/nyheter/sverige/sd-toppen-gjorde-affar-med-terrorutpekad-i-hemlighet/
Pekas ut som terrorist – lever lyxliv i Sverige,/nyheter/sverige/han-pekas-ut-som-terrorist-lever-lyxliv-i-sverige/
Hårda S-kravet: Sparka ministern,/nyheter/politik/s-krav-pa-kristersson-sparka-britz/
"Emin Duale, 18, döms till fängelse i Danmark",/nyheter/krim/emin-duale-18-doms-till-sju-ars-fangelse-i-danmark/
Brinnande hus i centrala Moskva,https://www.expressen.se/tv/nyheter/varlden/brand-i-centrala-moskva
Nya uppgifterna om olycksbussen,/nyheter/sverige/olycksbussen-hade-teknisk-hastighetsgrans-kunde-inte-kora-snabbt/
V:s nya regeringskrav: Då kommer vi rösta nej,/nyheter/politik/vansterpartiets-regeringskrav-da-rostar-vi-nej/
Kaoset i Spanien – larmar boende,https://www.expressen.se/tv/nyheter/varlden/har-dranks-den-spanska-staden
Tar strid mot SD: ”Det skadar oss”,/nyheter/politik/l-toppen-tar-strid-mot-sd-linjen-skadar-oss/
TV4 Nyheterna fälls av Granskningsnämnden,/nyheter/sverige/tv4-nyheterna-falls-av-granskningsnamnden/
Kontakta redaktionen direkt,/nyheter/har-du-ett-nyhetstips-eller-bilder/
Svårt att hänga med?,/nyheter/fraga-getingen-/
Spa-snusket: Musbajs och mögel,/nyheter/sverige/snusket-pa-svenska-spa-anlaggningar/
Flyr polisen – kör rakt mot lastbilen,/tv/nyheter/sverige/farliga-vansinnesfarden-genom-flen-/
