Heading,URL
Ryska tabben: Antidrönarplagg hade motsatt effekt,/tv/nyheter/varlden/ryska-tabben-antidronarplagg-hade-motsatt-effekt/
Galna bråket i butiken – om billiga varan,/tv/nyheter/varlden/galna-braket-i-butiken-om-billiga-varan-/
Landningen går helt fel – framhjulen borta,/tv/nyheter/varlden/landningen-gar-helt-fel-framhjulen-borta/
Här gasar bilen in i segerparaden,/tv/nyheter/varlden/har-gasar-bilen-in-i-segerparaden/
Kremls ultimatum till Ukraina: ”Slöseri”,/tv/nyheter/varlden/kremls-ultimatum-till-ukraina-sloseri/
Protesten på kanarieöarna: ”Turister simmar i bajs”,/tv/nyheter/protesten-pa-kanarieoarna-turister-simmar-i-bajs/
Bränner penis-kuddar på Dollarstore – döms,/tv/nyheter/branner-penis-kuddar-pa-dollarstore-doms/
"Trumps rasande attack: ""Vad fan har hänt med Putin""",/tv/nyheter/varlden/trumps-rasande-attack-vad-fan-har-hant-med-putin/
Här brinner ryska katedralen,/tv/nyheter/varlden/har-brinner-ryska-katedralen/
JUST NU: Skottlossning – en till sjukhus,/nyheter/krim/en-person-skjuten-i-grastorp-man-gripen-under-natten/
Här hugger han tag efter frågan om Hells Angels,/nyheter/sverige/bruno-bergstrom-sd-hugger-mikrofonen-efter-hells-angels-fragan/
Poserar i Hells Angels- tröja – tar inte avstånd,/nyheter/sverige/lennart-anderberg-sd-svarar-om-hells-angels-bilden/
"Erik Vessby, SD, avgår efter avslöjandet",/nyheter/sverige/erik-vessby-sd-tog-hjalp-av-hells-angels-slutade-i-mord/
Ukraina får fria tyglar – alla gränser tas bort,/nyheter/varlden/ukraina-far-fria-tyglar-far-anvanda-robotar-som-de-vill/
Ryska målet: Skapa ”buffertzon” i Ukraina,/nyheter/varlden/ryska-malet-skapa-buffertzon-i-ukraina/
Kremls ultimatum till Ukraina: ”Slöseri”,/tv/nyheter/varlden/kremls-ultimatum-till-ukraina-sloseri/
Galna bråket – om billiga varan,/tv/nyheter/varlden/galna-braket-i-butiken-om-billiga-varan-/
Bränner penis-kuddar på Dollarstore – döms,/tv/nyheter/branner-penis-kuddar-pa-dollarstore-doms/
Fick veta att hon var singel i tidning,/nyheter/varlden/miljardar-fick-veta-att-hon-var-singel-i-tidning/
Macrons svar om knuffen i ansiktet,https://www.expressen.se/tv/nyheter/varlden/macrons-svar-om-hustruns-knuff
Här gasar bilen in i segerparaden,/tv/nyheter/varlden/har-gasar-bilen-in-i-segerparaden/
"Är du villig att äta 7,5 knäckemackor per dag?",/nyheter/kronikorer/amina-manzoor/nastan-alla-behover-ata--mer-fullkorn-men-hur/
Gåtan efter slaget på Macron i flyget,/tv/nyheter/varlden/birgitte-macrons-slag-mot-maken-vacker-fragor-/
Kamouflage-detaljen som fäller ryssarna,/tv/nyheter/varlden/ryska-tabben-antidronarplagg-hade-motsatt-effekt/
"Trumps rasande attack: ""Vad fan har hänt med Putin""",/tv/nyheter/varlden/trumps-rasande-attack-vad-fan-har-hant-med-putin/
Putins mardröm – krigståget slås ut,/tv/nyheter/varlden/putins-mardrom-krigstaget-slas-ut/
Pinsamma upptäckten mitt i nakenbadet,/tv/nyheter/varlden/pinsamma-upptackten-mitt-i-nakenbadet/
Vägran efter ministerns ord: ”Borde skämmas”,/tv/nyheter/sverige/vagran-efter-ministerns-ord-borde-skammas/
Putin avslöjas av egna soldaterna: ”Döda alla”,/tv/nyheter/varlden/putin-avslojas-av-egna-soldaterna-doda-alla/
Trump benådar sheriff – efter stor mutskandal,/nyheter/varlden/trump-benadar-sheriffen-scott-jenkins-var-domd-till-tio-ars-fangelse/
Turister ställer in – efter kuslig slump,/nyheter/varlden/turister-staller-in-resor-till-japan-efter-mangaprofetia/
Bluffade könssjukdom – blev ändå våldtagen,/nyheter/krim/soheil-almasys-offer-berattar-helt-paralyserad/
Alice hängde ut våldtäktsmannen,/nyheter/sverige/valdtaktsmannen-soheil--almasy-ville-salja-alice-14/
Systerns reaktion på mördarens förklaring,/nyheter/sverige/mikaels-syster-reagerar-pa--mordarens-forklaring-logner/
Avslöjar detaljer om elitnätverket,/nyheter/sverige/detaljerna-inifran-bilderberggruppen/
Knarkmysteriet: Gömde spelkulor i kokainkakor,/nyheter/krim/knarkmysteriet-gomde--spelkulor-i-kokainkakor/
Kristinas treåriga son plötsligt försvunnen,/nyheter/sverige/kristinas-treariga-son-forsvann-i-fem-timmar/
Jättestrul i t-banan väntar i sju veckor,/nyheter/sverige/reducerad-och-installd-trafik-pa-gron-linje-i-sommar/
Superhetta i Spanien – kan bli över 40 grader,/nyheter/varlden/superhetta-i-spanien-kan-bli-over-40-grader/
Adolphe om rasismen efter bilden: ”Extremt”,/nyheter/adolphe-sylva-utsattes-for-rasism-och-hat-efter-reklamen-for-sia-glass/
Hon låstes in och våldtogs i timmar,/nyheter/sverige/hon-valdtogs-av-sitt-ex-inte--saker-att-jag-skulle-overleva/
Här lossnar hjulen under landningen,https://www.expressen.se/tv/nyheter/varlden/landningen-gar-helt-fel-framhjulen-borta
S får flera miljoner i böter: ”Allvarligt”,/nyheter/sverige/socialdemokraternas-svar-om-lotteriboterna-allvarligt/
"Nazisten Vera Oredsson, 97, döms för NMR-inlägg",/nyheter/krim/nazisten-vera-oredsson-97-doms-for-nmr-inlagg/
Stopp i trafiken på E20 – lastbilar i frontalkrock,/nyheter/sverige/en-till-sjukhus-efter-lastbilsolycka-pa-e20/
Ryska tabben – får helt motsatt effekt,/nyheter/varlden/ryska-tabben-antidronarplagg--hade-motsatt-effekt/
Hundratals sexköpare fast under hockey-VM,/nyheter/sverige/hundratals-sexkopare-fast-under-hockey-vm/
Bordar båten – hittar mångmiljard-gömma,https://www.expressen.se/tv/nyheter/varlden/ett-ton-kokain-beslagtags-pa-bat-
Putins plan – efter slaget om Kursk,/nyheter/varlden/slaget-om-kursk-ar-over-nu-flyttar-ryssland-trupp/
"Martine, 39, ströps – misstänkt död i häktet",/nyheter/krim/martine-39-strops-ihjal-misstankt-hittad-dod-i-haktet-/
Bränner penis-kuddar på Dollarstore – döms,https://www.expressen.se/tv/nyheter/branner-penis-kuddar-pa-dollarstore-doms
Liga lurade äldre på miljoner – fyra döms,/nyheter/krim/bedragarnatverket-lurade-pensionarer-pa-miljoner/
Ny forskning: Därför ska du sluta snooza,/nyheter/sverige/ny-forskning-sluta-snooza/
Regeringen ska utreda ny modell för ”Sverigehuset”,/nyheter/sverige/regeringen-vill-utreda-ett-typgodkannande-av-smahus/
Natoländernas knep – för att runda Trump,/nyheter/varlden/natolandernas-knep-for-att-kringga-trump/
Trumps Putinvändning: ”Han har blivit GALEN!”,/nyheter/varlden/trump-om-putin-blivit-fullstandigt-galen/
”Vad fan har hänt med Putin?”,/tv/nyheter/varlden/trumps-rasande-attack-vad-fan-har-hant-med-putin/
Farlig parasit sprids – kan drabba människor,/nyheter/sverige/ravsjukan-etablerad-myndighetens-rad-/
Turisten torterades av kryptochef för bitcoins,/nyheter/varlden/kryptochef-misstanks-ha-torterat-turist-i-veckor-/
De står bakom den hemliga bokningen,/nyheter/sverige/nya-uppgifter-om-hemliga-bokningen-pa-grand-hotel/
Vessby avgår efter kontakt med gängen,/nyheter/erik-vessby-avgar-efter-kontakterna-med-gangen/
Här är de 30 som styr Hells Angels,/nyheter/sverige/har-avslojas-mannen--som-styr-hells-angels/
Avslöjar mörk hemlighet – efter 28 år,/tv/nyheter/varlden/avslojar-mork-hemlighet-efter-28-ar/
Helvetet med doktor Berne,/nyheter/sverige/asa-vesterlund-om-skracklivet-med-doktor-fredrik-berne/
”Jag är svartlistad från allt”,/nyheter/sverige/patrik-sjoberg-jag-ar-svartlistad-fran-alla-uppdrag/
Wilma såg sambon mördas,/nyheter/krim/linus-bergh-mordades-i-nya-mc-lokalen-flickvannen-wilma-sag-allt/
De 30 som styr Hells Angels,/nyheter/sverige/har-avslojas-mannen--som-styr-hells-angels/
Vägrar ta emot 500 miljoner,/nyheter/sverige/nya-budet-i-arvsstriden-500-miljoner-och-ett-slott/
Våldtogs av Kapten klänning,/nyheter/sverige/sanna-35-valdtogs-av-kapten-klanning/
Mörkade läckor för regeringen,/nyheter/sverige/las-expressens-avslojanden-om-skandalen-pa-lantmateriet/
