Heading,URL
Bidens pik mot Trump – får hela kyrkan att skratta,/tv/nyheter/varlden/bidens-pik-mot-trump-far-hela-kyrkan-att-skratta/
Turistens livsfarliga tabbe med mobilen,/tv/nyheter/varlden/turistens-misstag-nar-taget-drar-forbi/
Satt fast i rusningstrafik – pojkvännens genidrag,/tv/nyheter/varlden/satt-fast-i-rusningstrafik-pojkvannens-genidrag-/
Trumps maktdrag – megaplanet flyttas,/tv/nyheter/varlden/trumps-maktdrag-megaplanet-flyttas/
Påvens oväntade drag – för favoritlaget,/tv/nyheter/varlden/pavens-ovantade-drag-for-favoritlaget/
Kvinna i Falköping vill heta Fitta – stoppas,/tv/nyheter/sverige/kvinna-i-falkoping-vill-heta-fitta-stoppas/
Tvingas fly lågorna – evakueras vid turistort,/tv/nyheter/varlden/skogsbrand-i-populara-turistmalet-manniskor-evakueras/
Paniken i firandet när stången välter,/tv/nyheter/sverige/har-faller-midsommarstangen-i-rattvik/
Tystnaden efter alkohol-frågan: ”Vill inte gå in på detaljer”,/tv/nyheter/sverige/tystnaden-efter-alkohol-fragan-vill-inte-ga-in-pa-detaljer/
JUST NU: Man gripen för våldtäkt,https://www.expressen.se/nyheter/expressen-direkt/?post=77e986c8-fa2d-45c5-ad7a-9ceedee8849f
JUST NU: Pojke död – två saknas,/nyheter/sverige/pojke-dod-och-tva-saknas-efter-batolycka-i-solleftea-/
Iran hotar med terrordåd i USA,/nyheter/varlden/iran-hotar-med--terrordad-i-usa-trumps-svar/
”Putins hjärna”: Trump har startat världskrig,/nyheter/varlden/putins-hjarna-trump-har--startat-tredje-varldskriget/
JUST NU: Ayatollans ord,/nyheter/varlden/direktrapport-konflikten-mellan-israel-och-iran/
Experten: Det är värsta scenariot nu,/nyheter/varlden/expertens-oro-attacken-kan-driva-iran-mot-mer-karnvapen/
Iran spärrar av sundet – Europa får ta smällen,https://www.expressen.se/tv/nyheter/varlden/iran-sparrar-av-sundet-europa-far-ta-smallen/
Ministern varnar för Putins nya krigsplan,/nyheter/ministern-varnar-for--putins-nya-krigsplan/
Filmar under kjolen – det får han ångra,https://www.expressen.se/tv/nyheter/varlden/gor-det-forbjudna-avslojas-av-askadare
Kvinnans ”present” på barnkalas väcker debatt,/nyheter/varlden/kvinnans-present-pa-barnkalas-vacker-debatt/
Snusket på svenska spa-anläggningarna,/nyheter/sverige/snusket-pa-svenska-spa-anlaggningar/
Inifrån Ellery: Mögel musbajs och flugor,/nyheter/sverige/inspektionerna-avslojar-spasnusket-pa-ellery-beach-house/
Expressen ger dig fri läsning i oroliga tider,/nyheter/sverige/expressen-erbjuder-fri-lasning-hall-dig-uppdaterad-i-turbulenta-tider/
Skräckupptäckten på hotellet: ”En mardröm”,/nyheter/sverige/skrackupptackten-pa-hotellet-en-mardrom/
Turistens livsfarliga tabbe med mobilen,/tv/nyheter/varlden/turistens-misstag-nar-taget-drar-forbi/
Dödssjuk på hotell på Kreta – nödlarm på ön,/nyheter/varlden/dodssjuk-pa-hotell-pa--kreta-nodlarm-pa-on/
Polisens intima stund på turistön,/tv/nyheter/varlden/polisens-intima-stund-pa-turiston-/
Tvingas fly elden – turistort evakueras,https://www.expressen.se/tv/nyheter/varlden/skogsbrand-i-populara-turistmalet-manniskor-evakueras
Pappan grips direkt – otänkbara avslöjas,/tv/nyheter/varlden/pappan-grips-direkt-otankbara-avslojas/
Gör det förbjudna – avslöjas av åskådare,/tv/nyheter/varlden/gor-det-forbjudna-avslojas-av-askadare/
Iran spärrar av sundet – Europa får ta smällen,/tv/nyheter/varlden/iran-sparrar-av-sundet-europa-far-ta-smallen/
Bidens pik mot Trump – får hela kyrkan att skratta,/tv/nyheter/varlden/bidens-pik-mot-trump-far-hela-kyrkan-att-skratta/
Turistens livsfarliga tabbe med mobilen,/tv/nyheter/varlden/turistens-misstag-nar-taget-drar-forbi/
Kvinnans sanslösa attack på flygplanet,/tv/nyheter/varlden/kvinnans-sanslosa-attack-pa-flygplanet/
Satt fast i rusningstrafik – pojkvännens genidrag,/tv/nyheter/varlden/satt-fast-i-rusningstrafik-pojkvannens-genidrag-/
Hotar Trump – iskalla orden: ”Han har ...”,/tv/nyheter/varlden/hotar-trump-orden-om-roda-traden/
JUST NU: USA om bombattacken,/tv/nyheter/varlden/just-nu-usa-om-bombattacken/
Allvarliga brister på Ellery beach club på Lidingö,/tv/nyheter/sverige/allvarliga-brister-pa-ellery-beach-club-pa-lidingo/
Föll 60 meter mot sin död: ”Djupt sorgsen”,/nyheter/varlden/foll-60-meter-mot-sin--dod-djupt-sorgsen/
Han åt 150 ägg på fem dagar – expert varnar,/nyheter/varlden/han-at-150-agg-pa-fem--dagar-expert-varnar/
Hon skickade nakenbilder på sig själv till en 14-åring,/nyheter/varlden/hon-skickade-nakenbilder--pa-sig-sjalv-till-en-14-aring/
En egen ”baby” är mer status än cash,/nyheter/kronikorer/en-egen-baby-ar--mer-status-an-cash/
Hånet mot Iran: ”Inte särskilt bra”,/nyheter/varlden/jd-vances-han-mot-iran-inte-sarskilt-bra-pa-krig/
Lasses skylt stoppas: ”Häpnadsväckande”,/nyheter/sverige/blir-av-med-personliga-skylten-efter-30-ar/
Halina tillbaka i Sverige – satt fängslad i Belarus,/nyheter/sverige/svenska-halina-har-landat-pa-arlanda-slappt-fran-belarus/
Kvinnans sanslösa attack på flygplanet,https://www.expressen.se/tv/nyheter/varlden/kvinnans-sanslosa-attack-pa-flygplanet/
Bidens pik mot Trump – får hela kyrkan att skratta,https://www.expressen.se/tv/nyheter/varlden/bidens-pik-mot-trump-far-hela-kyrkan-att-skratta/
Kunde inte hålla sig – gesten till favoritlaget,https://www.expressen.se/tv/nyheter/varlden/pavens-ovantade-drag-for-favoritlaget/
Uppgifter: Iran pressar Rawa Majid till nya dåd,/nyheter/sverige/uppgift-iran-pressar-rawa-majid-om-nya-dad-i-sverige-/
Turistens livsfarliga tabbe med mobilen,https://www.expressen.se/tv/nyheter/varlden/turistens-misstag-nar-taget-drar-forbi/
Intagen glömdes på toalett – bröt sig ut,/nyheter/sverige/glomdes-pa-haktets-toalett-brot-sig-ut-efter-en-timme/
Fem skadade av monsterfisk i sjö,/nyheter/varlden/fem-skadade-av--monsterfisk-i-sjo-/
Emils mobil föll i havet – hittades två år senare,/nyheter/sverige/emils-mobil-foll-i-havet-hittades-tva-ar-senare/
Satt fast i rusningstrafik – pojkvännens genidrag,https://www.expressen.se/tv/nyheter/varlden/satt-fast-i-rusningstrafik-pojkvannens-genidrag-/
Vattenbombar brand – dramatiska kampen,https://www.expressen.se/tv/nyheter/sverige/helikoptrar-vattenbombar-skogsbrand-
Tårarna i ”Sommar” – orden om kärleken,/nyheter/sverige/floderus-tarar-i-sommar-i-p1-berattar-om-karleken/
Vance gick mot Trump om Iran,/nyheter/varlden/nya-sprickan-vance-gar-mot-trump-om-iran/
Hyllar USA:s attack från skyddsrummen,/nyheter/varlden/israeler-i-skyddsrum-hyllar-usas-attack/
Hoffmaestro firar 20 år som grupp,/tv/nyheter/hoffmaestro-firar-20-ar-som-grupp/
Planen: Ville ta hem kvinnas huvud i påse,/nyheter/sverige/praoelev-ville-ta-hem-kvinnas-huvud-i-pase/
Trumps bluffdrag – inför enorma attacken,/nyheter/varlden/sa-planerades-den-amerikanska-attacken/
Irans svar – ”största roboten hittills”,/nyheter/varlden/iran-avfyrat-storsta-roboten-hittills/
Första bilderna efter Trumps bomber,/nyheter/varlden/bilder-fore-och-efter/
Larmet i Europa för ”dödsvärme”,/nyheter/vader/dodsvarme-drabbar-storbritannien-men-regnigt-i-sverige/
Detaljen som avslöjade Trumps plan,https://www.expressen.se/tv/nyheter/varlden/detaljen-som-avslojade-trumps-plan
Brand rasar nära turistorten,/nyheter/varlden/skogsbrand-rasar-i-kroatien/
Turistens panikdrag på ikoniska platsen,https://www.expressen.se/tv/nyheter/varlden/plotsligt-kor-bilen-ned-pa-ikoniska-platsen
”Hög risk att de riktar terror mot Europa”,/nyheter/varlden/experten-det-hander-efter-usas-attack-mot-iran/
Helvetet med doktor Berne,/nyheter/sverige/asa-vesterlund-om-skracklivet-med-doktor-fredrik-berne/
”Jag är svartlistad från allt”,/nyheter/sverige/patrik-sjoberg-jag-ar-svartlistad-fran-alla-uppdrag/
Oväntade tjuven – mitt i villaområdet,/tv/nyheter/sverige/ovantade-tjuven-utanfor-huset-horde-en-duns/
