Heading,URL
Svenska turistfavoriter dränkta i massiva regn,/tv/nyheter/varlden/svenska-turistfavoriter-drankta-i-massiva-regn/
Musk delar ut miljoner – huvudbonaden väcker frågor,/tv/nyheter/varlden/musk-delar-ut-miljoner-huvudbonaden-vacker-fragor-/
Trump: Häxjakten förstörde kärleken,/tv/nyheter/trumps-reaktion-pa-tigers-avslojande-om-sonens-ex/
Trumps diss mot Musk – fyrdubbla felsägningen,/tv/nyheter/varlden/trumps-diss-mot-musk-fyrdubbla-felsagningen/
Säljer Teslan efter Musks hämnd,/tv/nyheter/varlden/saljer-teslan-efter-musks-hamnd-/
Attackerar med hundmat – sabbar gym i Göteborg,/tv/nyheter/sverige/attackerar-med-hundmat-sabbar-gym-i-goteborg/
Stubbs hyllning av Trump: Den ende,/tv/nyheter/varlden/stubbs-hyllning-av-trump-han-ar-den-ende/
JUST NU: Tar fram pris för Grönland,/nyheter/varlden/uppgifter-usa-skissar-pa-deal-for-att-overta-on/
JUST NU: Trumps och Musks stora bakslag – förlorar,/nyheter/varlden/donald-trumps-stora-bakslag-i-valet-i-wisconsin/
Galna rekordet – i protest mot Trump,/nyheter/varlden/senatorn-cory-booker-slog-rekord-langsta-talet-nagonsin/
Ungdomar allvarligt skadade efter olycka,/nyheter/sverige/fem-personer-inblandade-i-bilolycka/
Attackeras om Trump – svarar med mamma-hån,https://www.expressen.se/tv/nyheter/varlden/konfronteras-om-trump-hanar-hans-mamma
Trumps jobbiga miss – säger fel fyra gånger,/tv/nyheter/varlden/trumps-diss-mot-musk-fyrdubbla-felsagningen/
Trump: Häxjakten förstörde kärleken,/tv/nyheter/trumps-reaktion-pa-tigers-avslojande-om-sonens-ex/
Ministern om Gaza: Vill inte kalla det folkmord,/nyheter/sverige/malmer-stenergard-inte-politiker-som-avgor-om-det-ar-folkmord/
Elev frias för våldtäkt inne på skoltoaletten,/nyheter/sverige/elev-frias-for-valdtakt-pa-skoltoalett/
Bisarra vändningen – liket var en sexdocka,https://www.expressen.se/tv/nyheter/varlden/mordutredningens-bisarra-vandning-liket-var-en-sexdocka
Startar ny stiftelse – vill hjälpa Medins fru,/nyheter/sverige/esayas-isaak-vill-hjalpa-joakim-medins-fru-genom-ny-stiftelse-/
Kristersson har inte pratat med Erdogan,/nyheter/sverige/ulf-kristersson-har-inte-pratat-med-erdogan-om-joakim-medin/
Gravida frun: ”Dagarna är helt fruktansvärda”,https://www.expressen.se/tv/nyheter/sverige/joakim-medins-fru-fruktansvarda-dagar
Svenska turistfavoriter dränkta i massiva regn,/tv/nyheter/varlden/svenska-turistfavoriter-drankta-i-massiva-regn/
Tvingas sälja Teslan efter Musks hämnd,/tv/nyheter/varlden/saljer-teslan-efter-musks-hamnd-/
Skräcksynen i Alperna – snömolnet slukar allt,/tv/nyheter/varlden/skracksynen-i-alperna-snomolnet-slukar-allt/
Zelenskyjs frustration med Trump: ”Trodde att vi ...”,/tv/nyheter/varlden/zelenskyjs-frustration-med-trump-trodde-att-vi-/
Andreas äckliga upptäckt i kakorna,/tv/nyheter/varlden/andreas-ackliga-upptackt-i-kakorna/
JD Vance trippelattack mot Danmark: Inte bra,/tv/nyheter/varlden/vance-nya-attack-mot-danmark-inget-bra-jobb/
Politikernas säl-skap – flydde från polisen,/tv/nyheter/sverige/salen-dyker-upp-utanfor-riksdagen/
Udda draget mot Erdogan mitt i protesten,/tv/nyheter/varlden/udda-draget-mot-erdogan-mitt-i-protesten/
Telefonsamtalet blev en jackpott för Putin,/nyheter/varlden/telefonsamtalet-blev-en-jackpott-for-putin-/
Putins rädsla – för egna soldaterna,/tv/nyheter/varlden/avslojar-putins-radsla-for-egna-soldaterna/
Mannens ilska – slår sönder allt på gymmet,https://www.expressen.se/tv/nyheter/sverige/attackerar-med-hundmat-sabbar-gym-i-goteborg
Varmare planet – hårt slag mot din plånbok,/nyheter/varlden/ny-studie-vi-blir-fattigare-nar-jorden-blir-varmare/
Bilarna kolliderar – kör rakt in i bensinpumpen,/tv/nyheter/varlden/bilarna-kolliderar-kraschar-in-i-bensinmacken/
Norge rustar upp gamla bunkrar från Kalla kriget,/nyheter/varlden/norge-rustar-upp-gamla-kalla-kriget-bunkrar/
Ericsson viker sig för Trump – MP:s ilska,/nyheter/sverige/mp-ilskan-efter-ericssons-besked-obehaglig-utveckling/
Nya finska beskedet – trotsar vapenförbudet,/nyheter/varlden/finlands-besked-vill-tillata-kontroversiell-mina/
Stubbs hyllning av Trump: Är den ende,/tv/nyheter/varlden/stubbs-hyllning-av-trump-han-ar-den-ende/
Nya L-ministern: SD har förändrats,/nyheter/sverige/nya-l-ministern-nina-larsson-sd-har-forandrats/
Pehrson duckar om flykten från Liberalerna,/nyheter/sverige/ny-jamstalldhetsminister-presenteras/
Skarpa varningen i svenskparadiset,/nyheter/varlden/varnar-for-storm-pa-kanarieoarna/
Toppens nya miss – med privata mejlen,/nyheter/varlden/waltz-i-nytt-blasvader/
Larmet: Utbrottet kan hålla på i 400 år,/tv/nyheter/varlden/har-far-vulkanen-ett-utbrott-pa-island/
Lavan flödar ur marken på Island,/nyheter/varlden/lava-flodar-ur-marken-efter-vulkanutbrott-pa-island/
Kvinna stickskadad vid företag – stor polisinsats,/nyheter/sverige/just-nu-kvinna-stickskadad-pa--en-arbetsplats-/
Han ligger bakom aprilkuppen på Max,/nyheter/sverige/tesla-kupp-mot-hamburgerkedjan-max/
Superdag väntar – sol i nästan hela Sverige,/nyheter/sverige/snart-vander-det-galler-att-njuta-nu/
Bytte KD till SD – på grund av antisemitism,/nyheter/sverige/charlie-weimers-sd-pa-historiskt-mote-i-israel/
Full lastbilsförare kör rakt mot männen,/tv/nyheter/varlden/lyckas-precis-undkomma-lastbil-hoppar-undan-i-sista-sekunden/
"Annica, 59, vinnare i nya avtalet – inte nöjd",/nyheter/sverige/annica-andersson-om-laglonesatsningen-kommer-aldrig-ikapp/
Flygplan saknas i Norge: Helikoptrar söker i vattnet,/nyheter/sverige/mindre-flygplan-saknas-i-norge/
Trump: Då kan Elon Musk lämna Doge,/nyheter/varlden/trump-da-kan-elon-musk-lamna-doge/
Nya Teslan lockar inte svenska köpare,https://teknikensvarld.expressen.se/nyheter/bilbranschen/nya-model-y-lyckades-inte-lyfta-tesla/
Epsteins offer i olycka: ”Fyra dagar att leva”,/nyheter/varlden/virginia-giuffre-i-olycka-fyra-dagar-att-leva/
Bryter tystnaden efter avhoppet: ”Turbulent”,/nyheter/sverige/muharrem-demirok-efter-avgangen-forst-nu-inser-jag/
Fruns oro – paret väntar första barnet,/nyheter/sverige/fangslade-journalistens-fru-gravid/
Förslag: Misskötsamhet kan leda till utvisning,/nyheter/sverige/forslag-misskotsamhet-kan-leda-till-utvisning/
Högskoleprovet 2025 – så förbereder du dig,/nyheter/sverige/allt-om-hogskoleprovet-2025-expertens-sista-minuten-tips/
Stubbs hyllning av Trump: Är den ende,https://www.expressen.se/tv/nyheter/varlden/stubbs-hyllning-av-trump-han-ar-den-ende
Löfven vill inte stödja Facebook – lämnar,/nyheter/sverige/stefan-lofven-vill-inte-stodja-facebook-lamnar/
Svenska turistfavoriter dränkta i massiva regn,https://www.expressen.se/tv/nyheter/varlden/svenska-turistfavoriter-drankta-i-massiva-regn
Kaoset vid storbanken – Greta Thunberg utkastad,https://www.expressen.se/nyheter/expressen-direkt/?post=629fea61-4007-4d5e-8a73-0a607f79dfeb
GW och Pehrson ryker ihop i SVT: ”Orättvis”,/tv/nyheter/sverige/har-ryker-gw-och-pehrson-ihop-i-svt-orattvis/
Polischefen sparkades efter att sonen rånats,/nyheter/krim/polischefen-fick-sparken--efter-att-sonen-ranades-av-gangkillar/
Vägrar ta emot 500 miljoner och ett slott,/nyheter/sverige/nya-budet-i-arvsstriden-500-miljoner-och-ett-slott/
Våldtogs av Kapten klänning,/nyheter/sverige/sanna-35-valdtogs-av-kapten-klanning/
Uber tjänar miljarder – så lite får förarna,/nyheter/sverige/uber-tjanar-miljarder-sa-lite-far-forarna/
Mörkade läckor för regeringen,/nyheter/sverige/las-expressens-avslojanden-om-skandalen-pa-lantmateriet/
