Heading,URL
Rusning till ”likblomman”,/tv/nyheter/varlden/rusning-till-likblomman/
Planet skulle lyfta – slukas av lågorna,/tv/nyheter/varlden/planet-skulle-lyfta-slukas-av-lagorna/
Här kolliderar ryska atomisbrytaren,/tv/nyheter/varlden/har-kolliderar-atomisbrytaren-med-ett-fraktfartyg/
Här slås giftrekordet av 3:e dödligaste ormen,/tv/nyheter/varlden/har-slas-giftrekordet-av-3e-dodligaste-ormen/
Putin låter soldater anfalla i golfbilar,/tv/nyheter/varlden/putin-later-soldater-anfalla-i-golfbilar/
Flygpersonal tejpar igen kvinnas mun,/tv/nyheter/flygpersonal-tejpar-igen-kvinnas-mun-/
Här flyr kvinnan från polisen – i rullstol,/tv/nyheter/varlden/har-flyr-kvinnan-fran-polisen-i-rullstol/
Svenska specialvagnen jagas ikapp av rysk drönare,/tv/nyheter/varlden/svenska-specialvagnen-jagas-ikapp-av-rysk-dronare/
JUST NU: Man svårt knivskadad,/nyheter/sverige/man-allvarligt-knivskadad-i-lund-en-gripen/
SD:s nya maktdrag: ”Alla kort på bordet”,/nyheter/sverige/lindberg-sd-vi-har-inget-behov-att-vara-finborgare/
JUST NU: Attack mot lägenhetshus,/nyheter/sverige/explosion-vid-hus-i-upplands-bro/
Alla 32 sprängningar senaste 28 dagarna,/nyheter/sverige/30-sprangningar-pa-28-dagar/
Domare stoppar Trumps paus: ”För stor skada”,/nyheter/varlden/domare-stoppar-donald-trumps-bidragspaus/
Grönlands hårda besked till USA,/nyheter/varlden/gronland-nobbar-donald-trump-vill-hellre-tillhora-danmark/
Vansinniga rekordet – hetta efter snöovädret,/nyheter/varlden/rekordvarmt-i-spanien-varmebolja-efter-snoovadret/
Dystert rekord – mer än en sprängning om dagen,/nyheter/laget/dystert-rekord-mer-an-en-sprangning-om-dagen/
Aktivister stoppar stjärnan på scenen,https://www.expressen.se/tv/nyheter/varlden/aktivister-stoppar-stjarnan-pa-scenen
Atomisbrytaren kör rakt in i fraktfartyget,/tv/nyheter/varlden/har-kolliderar-atomisbrytaren-med-ett-fraktfartyg/
Två kvinnor sköts ihjäl i artistens villa,/nyheter/sverige/tva-skots-ihjal-i-panetoz-stjarnan--pa-modou-badjies-villa-i-tullinge/
Miljardgåvan till Ukrainas försvar,/nyheter/varlden/israels-miljardgava-till-ukrainska--forsvaret-levererades-av-usa/
Teorierna om Melania Trumps nya porträtt,/nyheter/varlden/melania-trumps-portratt-jamfors-med-tv-karaktar/
Här slås giftrekordet av 3:e dödligaste ormen,/tv/nyheter/varlden/har-slas-giftrekordet-av-3e-dodligaste-ormen/
Svenska specialvagnen jagas vid Kursk-gränsen,/tv/nyheter/varlden/svenska-specialvagnen-jagas-ikapp-av-rysk-dronare/
Enormt ryskt raffinaderi träffat – igen,/tv/nyheter/varlden/enormt-ryskt-raffinaderi-traffat-igen/
Nya namnutspel: ”Mexiko förtjusta”,/tv/nyheter/trumps-nya-namnutspel-mexikanerna-fortjusta/
Experten om Barrons ord till Joe Biden,/tv/nyheter/varlden/experten-om-barrons-ord-till-joe-biden/
Musks raketskrot föll på Elenas fest,/tv/nyheter/varlden/musks-raketskrot-foll-pa-elenas-fest/
Trumps krig mot flyktingar vid gränsen,/tv/nyheter/varlden/trumps-krig-mot-flyktingar-vid-gransen/
Mamman fängslade 11-åring – i källaren,/tv/nyheter/varlden/mamman-fangslade-11-aring-i-kallaren/
Mordgåtan löst – efter nästan 50 år,/nyheter/varlden/mordgatan-pa-hawaii-lost-efter-nastan-50-ar/
Dödsskjutning vid järnvägsstationen,/nyheter/sverige/larm-om-skottlossning-rpnza/
Rusning till likblomma: ”Det luktar död råtta”,https://www.expressen.se/tv/nyheter/varlden/rusning-till-likblomman
Håller nytt krismöte: ”Inhemsk terrorism”,/nyheter/sverige/kristersson-inhemsk-terrorism/
Ny explosion – port i bostadshus sprängd,/nyheter/sverige/larm-om-explosion-kima3/
Detta vet vi om nya bombvågen,/nyheter/sverige/krimrummet-sveriges-nya-bombvag-detta-vet-vi/
Flyget skulle lyfta – slukas av lågorna,https://www.expressen.se/tv/nyheter/varlden/planet-skulle-lyfta-slukas-av-lagorna
Bryter tystnaden efter buropen: ”Förvånad”,/nyheter/sverige/parisa-liljestrand-forvanad-att-det-blev-san-kontrovers/
Här blir ministern utbuad på scenen,/tv/nyheter/sverige/har-mots-parisa-liljestrand-av-burop/
Bo Ohlssons vd död – stängde plötsligt,/nyheter/sverige/bo-ohlssons-vd-ar-dod/
Vice försvarsministern i Ukraina får sparken,/nyheter/varlden/ukrainas-vice-forsvarsminister-sparkas/
Fasonerna – därför tejpar flygvärdarna hennes mun,/tv/nyheter/flygpersonal-tejpar-igen-kvinnas-mun-/
Katten Findus kidnappad – kommunens mysterium,/nyheter/sverige/katten-findus-kidnappad-i-dals-ed-kommunens-stora-mysterium/
Ilskan växer i Serbien – blockerar väg i ett dygn,https://www.expressen.se/tv/nyheter/varlden/studentprotesterna-i-serbien-eskalerar-
S-kravet: Visitationszon i hela södra Stockholm,/nyheter/sverige/s-kraver-rekordstor-visitationszon/
Utredning: Straffåldern kan sänkas till 14 år,/nyheter/sverige/justitieministern-mottar-utredning/
Två pojkar gripna – hade rymt från HVB,/nyheter/sverige/explosion-i-sodra-stockholm-mlojp/
Här får du inte tanka utan hjälm på huvet,https://teknikensvarld.expressen.se/nyheter/ovrigt/motorcyklister-utan-hjalm-far-inte-tanka-bensin/
Han skulle döda kvinna – möttes av ett tv-team,/nyheter/sverige/han-skulle-doda-kvinna-mottes-av-norska-tv-2/
Här går han i fällan: ”Du kom för att döda Janne”,/tv/nyheter/sverige/har-konfronteras-steinar-wangen-av-journalisterna/
Misstänkta föremål sprängda av polisen,/nyheter/sverige/larm-om-foremal-pa-cykelbana-i-blasut/
Här spränger polisen föremålet,/tv/nyheter/sverige/har-forbereds-sprangningen/
S JO-anmäler: ”Då är det en skandal”,/nyheter/sverige/socialdemokraterna-jo-anmaler-regeringskansliet/
Natoinsats mot ryskt plan över Östersjön,/nyheter/sverige/nato-markerade-mot-ryskt--plan-over-sodra-ostersjon/
Rödljuskörning vanligast bland elsparkcyklister,https://teknikensvarld.expressen.se/nyheter/bil-och-trafik/rodljuskorning-vanligast-bland-elsparkcyklister/
Här slås giftrekordet av 3:e dödligaste ormen,https://www.expressen.se/tv/nyheter/varlden/har-slas-giftrekordet-av-3e-dodligaste-ormen
Friande domen står fast för Expressen,/nyheter/sverige/-friande-domen-star--fast-for-expressen-/
36 blev kräksjuka på restaurang: ”Vet inte”,/nyheter/sverige/36-personer-fick-vinterkraksjuka-pa-popular-restaurang/
”Hela samhället måste kraftsamla”,/nyheter/sverige/polisen-i-nya-valdsvagen-samhallet-maste-kraftsamla/
Öppnar för att skicka trupper till Grönland,/nyheter/varlden/oppnar-for-att-skicka-trupper-till-gronland/
”Isdamen” sätter nu stopp för Elon Musk,/nyheter/varlden/isdamen-stoppar-musk-fran-vita-huset/
Benådades av Trump – dog fem dagar senare,/nyheter/varlden/matthew-huttle-benadades-av-donald-trump-dog-fem-dagar-senare/
Felaktiga operationer hade kunnat stoppas,/nyheter/sverige/felaktiga-operationer-hade-kunnat-stoppas/
Putin låter soldater anfalla – i golfbilar,https://www.expressen.se/tv/nyheter/varlden/putin-later-soldater-anfalla-i-golfbilar
Förslaget: Sänk skatten för riskkapitalisterna,/nyheter/sverige/forslaget-sank-skatten-for-riskkapitalister-/
Omdömet kritiseras: ”Kompisrekrytering”,/nyheter/sverige/kritik-mot-kompisrekryteringar-kristerssons-omdome-ifragasatts/
Cyklist död efter olycka – bilförare misstänkt,/nyheter/sverige/90-arig-cyklist-dod-efter-smitningsolycka-i-horby/
Kustbevakningen kvar ombord på Vezhen,/nyheter/sverige/kustbevakningen-fortsatt-ombord-pa-vezhen/
Volvos nya elbil rullar snart ut på vägarna,https://teknikensvarld.expressen.se/nyheter/bil-och-trafik/elbil-laddhybrid/da-har-volvo-ex30-cross-country-varldspremiar/
Grevens enorma arv i infekterade tvisten,/nyheter/sverige/greve-trolle-wachtmeisters-enorma-arv-i-infekterade-tvisten/
Nu tvingas Silvias vän bort från drömslottet,/nyheter/sverige/vandningen-i-miljardtvisten-adelsparet-maste-lamna-arups-slott/
Olycka: Två vuxna och ett barn förda till sjukhus,/nyheter/sverige/trafikolycka-utanfor-ystad-tre-till-sjukhus/
Larm: Försöker ramma den ryska ambassaden,https://www.expressen.se/tv/nyheter/larm-forsoker-ramma-den-ryska-ambassaden
Man togs av polis vid Rysslands ambassad,/nyheter/sverige/polisinsats-vid-ryska-ambassaden/
Uber tjänar miljarder – så lite får förarna,/nyheter/sverige/uber-tjanar-miljarder-sa-lite-far-forarna/
Plötsligt faller planet – räddad av snilleblixt,/tv/nyheter/sverige/har-faller-hakans-flygplan-mayday-mayday/
Våldtogs av Kapten klänning,/nyheter/sverige/sanna-35-valdtogs-av-kapten-klanning/
Mörkade läckor för regeringen,/nyheter/sverige/las-expressens-avslojanden-om-skandalen-pa-lantmateriet/
Sexanmälan avslöjade pengarna till gängman,/nyheter/sverige/sexanmalan-avslojade-pengarna-till-gangman/
"Vad hände då Molly, 14, dog?",/nyheter/sverige/mollys-hemlighet-sista-festen-som-tar-hennes-liv/
