Heading,URL
Vances portas – nekas besök: ”Nej”,/tv/nyheter/varlden/gronlanningarnas-iskalla-installning-till-vance--portas-fran-butik/
Demonstrationerna mot Hamas växer,/tv/nyheter/varlden/demonstrationerna-mot-hamas-vaxer/
Stor förödelse efter kraftiga skalvet,/tv/nyheter/varlden/stor-forodelse-efter-kraftiga-skalvet/
Udda draget mot Erdogan mitt i protesten,/tv/nyheter/varlden/udda-draget-mot-erdogan-mitt-i-protesten/
Misstänkte gärningsmannen flyr – efter mordförsöket,/tv/nyheter/sverige/misstankte-garningsmannen-flyr-efter-mordforsoket/
Trumps snuskmiss får alla att reagera,/tv/nyheter/varlden/trumps-nya-smeknamn-fertilitetspresidenten/
JUST NU: Skott mot lägenheter,/nyheter/sverige/skott-mot-lagenheter-i-burlov/
JUST NU: Över 1 000 döda,https://www.expressen.se/nyheter/expressen-direkt/?post=3dc346d5-fc9f-40aa-ab16-8e7dd54ca8d1
JUST NU: Söker bland buskarna – person skjuten,/nyheter/sverige/person-skjuten-i-goteborg/
Bottenrekord för Trump i kärnfrågan,/nyheter/varlden/bottenrekord-for-trump-om-hans-karnfraga/
Utspelet: ”Då kastar de Trump i fängelse”,/nyheter/varlden/vilda-utspelet-da-kastar--de-trump-i-fangelse/
Bisarra viktkravet – hånar guvernören,https://www.expressen.se/tv/nyheter/varlden/kennedy-jrs-hanar-guvernoren-pa-scenen
Politikernas säl-skap – flydde från polisen,/tv/nyheter/sverige/salen-dyker-upp-utanfor-riksdagen/
Turkiets anklagelser mot Joakim Medin,/nyheter/varlden/joakim-medin-anklagas-ha-forolampat-erdogan/
Sista kontakten med frun – sen greps han,/nyheter/sverige/svenska-journalisten-joakim-medin-frihetsberovad-i-turkiet/
Andreas vidriga upptäckt i kakorna,https://www.expressen.se/tv/nyheter/varlden/andreas-ackliga-upptackt-i-kakorna
Han skulle gå i pension – dog sista dagen på jobbet,/nyheter/varlden/han-skulle-ga-i-pension-dog-sista-dagen-pa-jobbet/
Varningen i värmen: Aprilvädret slår till,/nyheter/sverige/varningen-i-varvarmen-aprilvadret-slar-till/
Ledamotens känga: Utvisa Melania Trump,/tv/nyheter/varlden/ledamotens-kanga-utvisa-melania-trump/
"Här lämnar Bernie Sanders intervjun: ""Nonsens""",/tv/nyheter/varlden/har-lamnar-bernie-sanders-intervjun-nonsens/
Ryska elitens hem brinner upp i Moskva,/tv/nyheter/varlden/ryska-elitens-hem-brinner-upp-i-moskva/
Musks lek vid matbordet – impar inte på Trump,/tv/nyheter/varlden/musks-lek-vid-matbordet-vantar-pa-trumps-reaktion/
Dödsstörtar inför publiken på flygshow,/tv/nyheter/varlden/flygkrasch-i-sydafrika-en-dod/
Trumps förvåning om astronauterna: ”Jag betalar”,/tv/nyheter/varlden/trumps-forvaning-om-astronauterna-jag-betalar/
Här nekar Trump – Vita husets bortförklaring,/tv/nyheter/varlden/har-nekar-trump-vita-husets-bortforklaring/
Polisen hittar Hackman – hör förfärande ljudet,/tv/nyheter/varlden/polisen-hittar-hackman-hor-forfarande-ljudet/
Danska svaret efter JD Vances kritik,/nyheter/varlden/danska-svaret--efter-jd-vance-kritik-orattvis/
Nya hemliga försöket om Vances frus besök,/nyheter/varlden/nya-hemliga-forsoket-om-vances-frus-besok/
Vance: Danmark har misslyckats,/nyheter/varlden/jd-vance-talar-under-besoket-pa-gronland/
Hör Vance trippelattack mot Danmark: Inte bra,/tv/nyheter/varlden/vance-nya-attack-mot-danmark-inget-bra-jobb/
Ledarens desperata rop på hjälp: ”Vem som helst”,/nyheter/varlden/ledarens-rop-pa-hjalp-efter-jordbavningen-i-myanmar/
Stor förödelse efter kraftiga skalvet,/tv/nyheter/varlden/stor-forodelse-efter-kraftiga-skalvet/
Dejtade Andrew Tate: ”Fruktade jag skulle dö”,/nyheter/varlden/dejtade-andrew-tate-fruktade-jag-skulle-do/
Topphemliga dokument hittade – mitt på gatan,/nyheter/varlden/fyndet-pa-gatan-topphemliga-militara-dokument/
Hanif Balis kritik mot regeringen: Skärp er,/nyheter/sverige/hanif-balis-kritik-mot-mats-perssons-aktiekop/
Dog på flyg hem från turistparadis,/nyheter/varlden/dog-pa-flyg-hem--fran-turistparadis/
Besökte maken i fängelset – då mördade han henne,/nyheter/varlden/besokte-maken-i-fangelset-da-mordade-han-henne/
Brutala mordet – efter kusliga frågan till läraren,/nyheter/varlden/brutala-mordet-efter--kusliga-fragan-till-lararen/
Hade just fått körkort – körde i 188 km/h,/nyheter/varlden/hade-just-fatt-korkort-korde-i-188-kmh/
Väljarnas dom om chattfiaskot,/nyheter/varlden/trumpvaljarnas-dom-de-bor-avga-for-chattfiaskot/
Ska avrättas – hävdar att han är för fet för det,/nyheter/varlden/ska-avrattas-havdar--att-han-ar-for-fet-for-det/
Flera fastklämda i krock – fem förda till sjukhus,/nyheter/sverige/kraftig-kollision-fem-inblandade/
Teorin: Sverige inför euro – i år,/nyheter/sverige/pm-nilsson-sverige-infor-euro-under-2025/
Madeleines svar om satsningen för barn,/nyheter/sverige/fragorna-till-madeleine-efter-kritiken-ser-inga-problem/
Demonstrationerna mot Hamas växer,https://www.expressen.se/tv/nyheter/varlden/demonstrationerna-mot-hamas-vaxer/
Ovanliga synen i Gaza – hundratals deltar,/tv/nyheter/varlden/ovanliga-synen-haller-hamas-protest-i-gaza-/
Mördaren sköt mot polis – blev skjuten,/nyheter/sverige/mordaren-tobias-jardeberg-skot-mot-polis-blev-sjalv-skjuten/
Oväntade synen – i protesterna i Turkiet,https://www.expressen.se/tv/nyheter/varlden/ovantade-synen-pikachu-flyr-polisen-/
Udda draget mot Erdogan i protesten,https://www.expressen.se/tv/nyheter/varlden/udda-draget-mot-erdogan-mitt-i-protesten/
Politikernas säl-skap – flydde från polisen,https://www.expressen.se/tv/nyheter/sverige/salen-dyker-upp-utanfor-riksdagen/
Bil har kraschat in i mäklarkontor,/nyheter/sverige/bil-har-kraschat--in-i-maklarkontor/
Nu släpps laddhybriden som många väntat på,https://teknikensvarld.expressen.se/nyheter/bil-och-trafik/elbil-laddhybrid/nya-audi-a5-avant-finns-nu-som-laddhybrid/
Terrorsvensk har häktats,/nyheter/sverige/terrorsvensk--har-haktats/
Israel uppmanar Beirutborna: Fly,/nyheter/varlden/israel-anfaller-libanon-beirutbor-uppmanas-fly/
Tandläkare åtalas efter Expressens granskning,/nyheter/sverige/tandlakare-atalas-efter-expressens-granskning/
Trumps nya drag – propagandavideo,https://www.expressen.se/tv/nyheter/varlden/trumps-propagandavideo-om-gronland/
Zelenskyjs irritation – kängan till Trump,https://www.expressen.se/tv/nyheter/varlden/zelenskyjs-frustration-med-trump-trodde-att-vi-
Polischefen sparkades efter att sonen rånats,/nyheter/krim/polischefen-fick-sparken--efter-att-sonen-ranades-av-gangkillar/
Vägrar ta emot 500 miljoner och ett slott,/nyheter/sverige/nya-budet-i-arvsstriden-500-miljoner-och-ett-slott/
Våldtogs av Kapten klänning,/nyheter/sverige/sanna-35-valdtogs-av-kapten-klanning/
Uber tjänar miljarder – så lite får förarna,/nyheter/sverige/uber-tjanar-miljarder-sa-lite-far-forarna/
Mörkade läckor för regeringen,/nyheter/sverige/las-expressens-avslojanden-om-skandalen-pa-lantmateriet/
