Heading,URL
Ny attack mot rysk oljedepå – gigantisk brand,/tv/nyheter/varlden/ny-attack-mot-rysk-oljedepa-gigantisk-brand/
Dansade innan jobbet – fick sparken,/tv/nyheter/varlden/flygvardinnan-jag-fick-sparken-efter-twerken/
Putins maktlek med Lavrov på toppmötet,/tv/nyheter/varlden/putins-forodmjukande-lek-med-lavrov-pa-toppmotet/
Stor haj siktad i badsjö – beteendet som skrämmer,/tv/nyheter/varlden/stor-haj-siktad-i-badsjo-beteendet-som-skrammer/
Scholz varning om Musk,/tv/nyheter/varlden/scholz-varning-om-musk-/
Musks skrytraket regnar ner – i eld,/tv/nyheter/varlden/musks-skrytraket-regnar-ner-i-eld/
Kläms mellan bussarna i farten – mirakelbilderna,/tv/nyheter/klams-mellan-tva-bussar-overlever-mirakulost-/
Fenomenet fångas på film – fartygen svävar,/tv/nyheter/varlden/fenomenet-fangas-pa-film-fartygen-svavar-/
JUST NU: Man kastade glas på kvinna,/nyheter/sverige/man-kastade-glas-pa-kvinna-pa-bar-i-malmo/
JUST NU: Explosion i villaområde,/nyheter/sverige/explosion-i-villaomrade-i-vasteras/
JUST NU: Kraftig smäll i natt – två personer skadade,/nyheter/sverige/explosion-i-johanneshov-i-sodra-stockholm/
Kaoset: ”Rasar träd – på löpande band”,/nyheter/sverige/stormkaos-och-stromavbrott--rasar-trad-pa-lopande-band/
Hon dansade innan jobbet – fick sparken,/tv/nyheter/varlden/flygvardinnan-jag-fick-sparken-efter-twerken/
Haj siktad i badsjö – beteendet skrämmer,/tv/nyheter/varlden/stor-haj-siktad-i-badsjo-beteendet-som-skrammer/
Misstanken: Drogade dottern för pengar,/nyheter/varlden/drogade-sitt-barn-drog-in-stora-pengar/
Frias från våldtäkt efter DNA-fynd på kondomer,/nyheter/sverige/kvinnors-dna-pa-kondompaket-man-frias-for-valdtakt/
Ny ukrainsk attack mot rysk oljedepå,https://www.expressen.se/tv/nyheter/varlden/ny-attack-mot-rysk-oljedepa-gigantisk-brand
Experten om fred: ”Det kan gå mycket snabbt”,/nyheter/varlden/da-kan-fredssamtal-inledas-med-putin/
Stora störningar över Gotland – i 60 dagar,/nyheter/sverige/omfattande-storningar-over-gotland-i-60-dagar/
Sverige punktmarkerar den ryska skuggflottan,/nyheter/sverige/sa-ska-putins-skuggflotta-punktmarkeras-i-ostersjon/
Här är Natos flaggskepp – ska vakta Östersjön,/tv/nyheter/varlden/har-ar-natos-jattefartyg-ska-vakta-ostersjon/
Putins förödmjukande lek med Lavrov på toppmötet,/tv/nyheter/varlden/putins-forodmjukande-lek-med-lavrov-pa-toppmotet/
Paasikivis känga mot Kim Jong-un,/tv/nyheter/varlden/paasikivis-kanga-mot-kim-jong-un/
Spektakulära bilderna – jättearmen fångar raketen,/tv/nyheter/varlden/spektakulara-bilderna-jattearmen-fangar-raketen/
Ebba Busch hyllas efter tal i USA,/tv/nyheter/ebba-busch-hyllas-efter-tal-i-usa-/
Obehagliga fyndet i taket – 70 kilo skräck,/tv/nyheter/varlden/obehagliga-fyndet-i-taket-70-kilo-skrack/
Paasikivi om Trumps galna idé: ”Hotar allierade”,/tv/nyheter/varlden/paasikivi-om-trumps-galna-ide-hotar-allierade/
Tatuerar 9-åring – får kritik: ”Absurt”,/tv/nyheter/tatuerar-9-aringen-far-kritik--absurt/
Nya lyxfyndet i Pompeji: ”Århundradets upptäckt”,/nyheter/varlden/nya-fyndet-i-pompeji-lyxigt-privat-badhus/
Bil körde in i stolpe – två pojkar frihetsberövades,/nyheter/sverige/bil-korde-in-i-stolpe-tva-pojkar-frihetsberovade/
Nu krävs tillstånd för propplösande medel,/nyheter/sverige/nu-kravs-tillstand-for-propplosande-medel/
Hon förgiftade rivalens get: ”Gillar inte fuskare”,/nyheter/varlden/aubrey-17-atalad-forgiftade-rivalens-get/
Man skadad av tillhygge – är allvarligt skadad,/nyheter/sverige/en-till-sjukhus-skadad-med-tillhygge/
Bluffade till sig miljoner från Försäkringskassan,/nyheter/krim/hells-angels-pappa-och-ex-fru-doms-for-assistansbedragerier/
Orkan slår mot Norge – se reporterns kamp,https://www.expressen.se/tv/nyheter/varlden/reporterns-kamp-orkanvindar-slar-mot-norge
DN raderar artikel efter Expressens granskning,/nyheter/sverige/dn-raderar-artikel-efter-expressens-granskning/
Tre ungdomar dog – nu åtalas vännen,/nyheter/sverige/tre-ungdomar-dog-i-krock-foraren-atalas-/
Tvåbarnsmammans ord om mordkvällen,/nyheter/krim/ako-37-hittades-dod-i-vaska-kvinnans-forsvar-i-ratten-/
Man drog machete mot polis – frikänns,/nyheter/sverige/man-bevapnade-sig-med-machete-mot-polis-frias/
Panten höjs: ”Kan inte hamstra och bli jätterik”,/nyheter/sverige/det-har-galler-for-att-fa-ut-nya-panten/
Tiktok-förbud i USA – godkänns av HD,/nyheter/varlden/usas-hd-godkanner-tiktok-forbud/
Scholz mötte Kristersson – varnade för Elon Musk,https://www.expressen.se/tv/nyheter/varlden/scholz-varning-om-musk-
Anhörigas oro – då kan de döda gisslan,/nyheter/varlden/anhoriga-till-gisslan-litar-inte-pa-netanyahu/
Säkerhetskabinettet godkänner vapenvila,/nyheter/varlden/sakerhetskabinettet-i-israel-haller-mote-om-vapenvila-/
Familjens stund för PG – därför saknas änkan,/nyheter/sverige/ankans-ord-om-pg-infor-minnesgudstjansten/
Hon får prestigejobbet i MP efter skandalfesten,/nyheter/sverige/katarina-luhr-tar-over-klimatfragorna-efter-soderberg/
KD öppnar för SD i framtida regering,/nyheter/sverige/kd-oppnar-for-sd-i-regering/
"Alma, 2, åt ett hundben – fick ”varulvssyndrom”",/nyheter/sverige/alma-2-at-ett-hundben-fick-varulvssyndrom/
”Varulvssyndrom” – det tros ligga bakom,/nyheter/sverige/tuggben-tros-orsaka-varulvssyndrom-hos-hundar-/
Aktivist överklagar friande domen mot Expressen,/nyheter/sverige/aktivist-overklagar-friande-domen-mot-expressen/
"18-åringen döms för mordet på Maja, 17",/nyheter/sverige/faststaller-morddom-efter-mordet-pa-maja/
Nya svenska hotellet – ett av världens hetaste,https://alltomresor.expressen.se/nyheter/nya-svenska-hotellet-en-av-varldens-hetaste-2025/
Kläms mellan bussarna i farten – mirakelfilmen,https://www.expressen.se/tv/nyheter/klams-mellan-tva-bussar-overlever-mirakulost-
Så slipper du börja året med ett misslyckande,/nyheter/kronikorer/amina-manzoor/sa-slipper-du-borja-aret-med-ett-misslyckande/
Fenomenet fångas på film – fartygen svävar,/tv/nyheter/varlden/fenomenet-fangas-pa-film-fartygen-svavar-/
Polisens film inifrån dolda knarktunneln,https://www.expressen.se/tv/nyheter/varlden/se-bilderna-inifran-dolda-knarktunneln-
Storbråk om kedjan – S-toppen: ”Valfrihet”,/nyheter/sverige/socialdemokraterna-forsvarar-brod-och-salt-efter-m-dissen/
Svenskarnas tydliga favorit i fjol – en elbil,https://teknikensvarld.expressen.se/nyheter/bilbranschen/mest-salda-bilarna-2024-till-svenska-privatkopare/
Frågorna efter skoldådet: ”Ingen hotbild mot elev”,/nyheter/sverige/fortfarande-oklart-efter-skoldadet-i-upplands-vasby--/
Varnar: Farligare än någonsin för Trump,/nyheter/varlden/stort-sakerhetspadrag-nar-trump-blir-ny-president-i-usa/
Ung pojke våldtogs – kvinna åtalas nu,/nyheter/sverige/kvinna-atalas-for-valdtakt-av-barn/
Expertens dom – kan da Costa-fallet lösas?,/nyheter/sverige/beskedet-om-da-costa-fallet-dna-expertens-dom/
Dadgostar slår tillbaka mot Busch: ”Märkligt”,/nyheter/sverige/dadgostar-slar-tillbaka-mot-busch-markligt/
Ryska missen – får jättefartyget att välta,https://www.expressen.se/tv/nyheter/varlden/ryska-missen-far-jattefartyget-att-valta
Uber tjänar miljarder – så lite får förarna,/nyheter/sverige/uber-tjanar-miljarder-sa-lite-far-forarna/
Buschs passionerade tal väcker jubel i USA,/tv/nyheter/ebba-busch-hyllas-efter-tal-i-usa-/
Våldtogs av Kapten klänning,/nyheter/sverige/sanna-35-valdtogs-av-kapten-klanning/
Mörkade läckor för regeringen,/nyheter/sverige/las-expressens-avslojanden-om-skandalen-pa-lantmateriet/
Sexanmälan avslöjade pengarna till gängman,/nyheter/sverige/sexanmalan-avslojade-pengarna-till-gangman/
"Vad hände då Molly, 14, dog?",/nyheter/sverige/mollys-hemlighet-sista-festen-som-tar-hennes-liv/
