Heading,URL
Planet kraschar – två döda,/tv/nyheter/varlden/planet-kraschar-tva-doda/
Här urartar mammornas bråk på leklandet,/tv/nyheter/varlden/har-urartar-mammornas-brak-pa-leklandet/
Pinsamma missen under skönhetstävlingen,/tv/nyheter/varlden/pinsamma-missen-under-skonhetstavlingen/
Ger 12 000 kronor till kyrkan – förnedras av pastorn,/tv/nyheter/varlden/ger-12-000-kronor-till-kyrkan-fornedras-av-pastorn/
Trumps överraskning – skisser på Nato-mötet,/tv/nyheter/varlden/trump-avslojar-sa-blir-nya-balsalen/
Bussens miss – plöjer in på innergård,/tv/nyheter/sverige/har-kor-bussen-fel-fastnar-pa-innergard/
Rånar kiosken inför kunderna: ”Våga inte”,/tv/nyheter/sverige/har-ranar-mannen-butiken-samtidigt-som-kunder-kommer-in/
Astronaut visar Jas för Zelenskyj,/tv/nyheter/sverige/har-testar-zelenskyj-jas-gripen-/
JUST NU: Sverige skickar luftvärn,https://www.expressen.se/nyheter/expressen-direkt/?post=a7ec1caf-6717-47ab-856c-45ff466a560a
JUST NU: Storbråk,https://www.expressen.se/nyheter/expressen-direkt/?post=6104ad90-e8d3-4de4-b8a4-33ee61e385f8
JUST NU: Trump arg på reklam,https://www.expressen.se/nyheter/expressen-direkt/?post=e2e968e9-2ae3-4069-935f-a359681da8a9
Ö-mysteriet: Döda kroppar spolas upp,/nyheter/varlden/mysteriet-pa-trinidad-uppspolade-kroppar-pa-stranden/
Sluga knepet i rätten – stämmer Melania,/nyheter/varlden/forfattaren-michael-wolff-stammer-melania-trump/
Trump avslöjar: Så blir nya Vita huset,/tv/nyheter/varlden/trump-avslojar-sa-blir-nya-balsalen/
Marcus blev utskälld efter besök på buffé,/nyheter/sverige/marcus-at-fyra-pannbiffar-pa-buffe-blev-utskalld/
Kusliga känslan – sen klev han i ryska fällan,/nyheter/varlden/spionkurirens-sista-resa-slutade-i-katastrof/
Ryska spioneriet: ”Inte turistbilder”,/tv/nyheter/har-ror-sig-ryska-spioner-inte-turistbilder/
"Tom, 28, bad om lön – då fick han sparken",/nyheter/varlden/tom-boyd-28-bad-om-lon-fick-sparken/
Vild biljakt i Västerås – se vansinnesfärden,/tv/nyheter/sverige/vilda-biljakten-i-vasteras-se-vansinnesfarden/
”Ofarliga” hajen dödade dykaren,/nyheter/varlden/forskare-ofarliga-hajen-dodade-dykaren/
Polisen: Då kan busen vara olagliga,/nyheter/sverige/polisens-vadjan-infor-halloween-bus-kan-vara-olagliga/
Rånar kiosk i Boden – kunder strömmar in,https://www.expressen.se/tv/nyheter/sverige/har-ranar-mannen-butiken-samtidigt-som-kunder-kommer-in
Här kraschar planet – slukas i ett eldmoln,/tv/nyheter/varlden/planet-kraschar-tva-doda/
Mamma-slagsmål på lekland urartar,/tv/nyheter/varlden/har-urartar-mammornas-brak-pa-leklandet/
Bussen kör helt fel – fastnar på innergård,/tv/nyheter/sverige/har-kor-bussen-fel-fastnar-pa-innergard/
Vilda biljakten i Västerås – se vansinnesfärden,/tv/nyheter/sverige/vilda-biljakten-i-vasteras-se-vansinnesfarden/
Här rör sig ryska spioner: ”Inte turistbilder”,/tv/nyheter/har-ror-sig-ryska-spioner-inte-turistbilder/
Här urartar mammornas bråk på leklandet,/tv/nyheter/varlden/har-urartar-mammornas-brak-pa-leklandet/
Planet kraschar – två döda,/tv/nyheter/varlden/planet-kraschar-tva-doda/
Trumps order – här krossas båten i Karibien,/tv/nyheter/varlden/har-krossar-trump-baten-i-karibien-/
Pinsamma missen under skönhetstävlingen,/tv/nyheter/varlden/pinsamma-missen-under-skonhetstavlingen/
Här går Sverige upp och möter ryska bombplanet,/tv/nyheter/sverige/har-gar-sverige-upp-och-moter-ryska-bombplanet/
Trumps överraskning – skisser på Nato-mötet,/tv/nyheter/varlden/trump-avslojar-sa-blir-nya-balsalen/
Vädersmocka hotar: Snöområden drar in,/nyheter/vader/nu-kommer-hostrusket-med-regn-kyla-och-sno/
Bästa vinterdäcken för dig och din bil,https://teknikensvarld.expressen.se/nyheter/konsument/stort-test-basta-vinterdacken-for-dig-och-din-bil/
"Svarar Josephine, 28: ”Så ska det inte gå till”",/nyheter/politik/britz-svar-om-josephine-28-ska-inte-ga-till-sa/
Putin svarar Trump: ”Fientlig handling”,/nyheter/varlden/putins-svar-till-trump-fh3ye/
Svenska robotar i Putins spionnät,/nyheter/varlden/svenska-robotar-i-putins-spionnat/
Putins soldater ger upp inför nya vapen,/tv/nyheter/varlden/putins-soldater-ger-upp-infor-ukrainas-nya-vapen/
Hjälpte Trump tjäna miljarder – benådas,/nyheter/varlden/trump-benadar-kryptokungen-changpeng-zhao/
Maskerade elever till våldsam attack,/nyheter/sverige/elever-pa-lundsberg-atalas-for--misshandel-efter-rap-battle/
Här sprängs båten – efter Trumps order,/tv/nyheter/varlden/har-krossar-trump-baten-i-karibien-/
Oklarhet kring 2 000 frysta ryska miljarder,/nyheter/sverige/eu-overens/
Anklagar regeringen – man ”höll på att dö”,/nyheter/politik/v-toppens-medicinkritik-mot-regeringen-holl-pa-att-do/
Här är Putins nya hot: ”Flygande Tjernobyl”,/nyheter/varlden/ryssarnas-nya-hot-fran-norra--ishavet-flygande-tjernobyl/
Gröna Lund: Då blir du utkastad från parken,/nyheter/sverige/grona-lund-da-blir-du-utkastad-fran-parken-listan-pa-overtradelser/
Pinsamma missen i skönhetstävlingen,/tv/nyheter/varlden/pinsamma-missen-under-skonhetstavlingen/
Chockades av enorm vattenläcka: ”Otroligt”,/nyheter/sverige/gigantisk-vattenlacka-i--norrkoping-otroligt/
Poya Shafie gripen på Arlanda: ”Morddirigent”,/nyheter/krim/rawa-majids-morddirigent-poya-shafie-gripen-pa-arlanda-/
Rysk jättebombare flög utanför Sverige,/tv/nyheter/sverige/har-gar-sverige-upp-och-moter-ryska-bombplanet/
Fyra oljejättar i Kina slutar köpa rysk olja,/nyheter/varlden/kinesiska-oljejattar-slutar-kopa-rysk-olja/
Hånas av pastorn för stora gåvan till kyrkan,https://www.expressen.se/tv/nyheter/varlden/ger-12-000-kronor-till-kyrkan-fornedras-av-pastorn
Regnet lamslår svensk-favoriten,/tv/nyheter/varlden/regnet-lamslar-svenska-favoriten-/
Smockan mot Putin: ”Längre ner på knä”,/nyheter/varlden/paasikivi-om-sanktionerna-hart-slag-mot-rysk-ekonomi/
Här testar Putin sin kärnvapen-arsenal,/tv/nyheter/har-testskjuter-putin-sin-karnvapenrobot/
M-ilskan efter dissen från S: ”Hon förlorar”,/nyheter/politik/bohlin-till-attack-mot-s-hon-forlorar/
S kan peka ut SD: ”M helt irrelevanta”,/nyheter/politik/s-ledningen-diskuterar-akesson-eller-kristersson/
Lundsbergs-elever stormade sovrum,/nyheter/sverige/elever-atalas-for-misshandel-pa-lundsberg/
Min man är så äcklig – han nyser i handen,/nyheter/sverige/min-man-hostar-och-nyser-sig-i-handen/
Därför låter hon 500 myggor sticka armen,https://www.expressen.se/tv/nyheter/varlden/allas-mardrom-500-myggor-festar-loss-pa-armen-
Vill ha åldersgräns på sociala medier,/nyheter/politik/s-vill-se-15-arsgrans-och-och-id-krav-pa-sociala-medier/
"Lola, 12, mördades – pappan dog av sorg",/nyheter/varlden/lola-daviet-12-mordades-pappan-dog-av-sorg/
Så kan Ukraina betala för svenska Jasplanen,/nyheter/sverige/pal-jonson-planen-kan-kopas-med-ryska-medel/
Här visar astronauten upp Jas för Zelenskyj,/tv/nyheter/sverige/har-testar-zelenskyj-jas-gripen-/
Trumps hårda slag mot Putins pengar,/nyheter/varlden/usa-infor-nya-omfattande-sanktioner-mot-ryssland/
Putins soldater ger upp för Ukrainas nya vapen,https://www.expressen.se/tv/nyheter/varlden/putins-soldater-ger-upp-infor-ukrainas-nya-vapen
Kontakta redaktionen direkt,/nyheter/har-du-ett-nyhetstips-eller-bilder/
Snusket på Stureplanskrogarna,/nyheter/sverige/stureplanskrogar-inifran-rattspillning-i-torrforrad/
Spa-snusket: Musbajs och mögel,/nyheter/sverige/snusket-pa-svenska-spa-anlaggningar/
Rysk jättebombare flög utanför Sverige,/tv/nyheter/sverige/har-gar-sverige-upp-och-moter-ryska-bombplanet/
