Heading,URL
Hundratals tvingas evakuera ut i snön,/tv/nyheter/varlden/hundratals-tvingas-evakuera-ut-i-snon/
Oväntat dyra straffet – för kontroversiella pizzan,/tv/nyheter/varlden/straffet-for-ananas-pa-pizzan-1-300-kr/
Eldtornado skapas i eldhärjade området,/tv/nyheter/varlden/eldtornado-skapas-i-eldharjade-omradet/
Jean-Marie Le Pen förs till sista vilan,/tv/nyheter/varlden/jean-marie-le-pen-fors-till-sista-vilan-/
Tates galna mål: Bli premiärminister,/tv/nyheter/varlden/tates-galna-mal-bli-premiarminister/
Chocken – gigantiskt blad faller mot bilarna,/tv/nyheter/varlden/forvirringen-gigantiskt-blad-faller-mot-bilarna/
29 insnöade på pub – i fem dagar,/tv/nyheter/varlden/29-insnoade-pa-pub-i-fem-dagar/
Norska draget – när bilen är täckt av snö,/tv/nyheter/varlden/filmar-udda-upptackten-i-snosmockan-/
Svenska Hanna: ”Fick panik – skrek och grät”,/tv/nyheter/sverige/svenska-hanna-fick-panik-skrek-och-grat/
JUST NU: 30 000 ska mönstra,/nyheter/sverige/fler-kallas-till-monstring/
JUST NU: Avslöjad av spår i snön,/nyheter/sverige/grovt-brott-i-uddevalla-en-gripen/
Zelenskyjs skarpa känga till grannen: ”Skumma planer”,/nyheter/varlden/zelenskyjs-skarpa-kanga-till-grannen-skumma-planer/
Experten dömer ut Trumps taktik: ”Nej”,/tv/nyheter/varlden/paasikivi-sa-skulle-jag-coacha-trump-/
Hundratals tvingas evakuera ut i snön,/tv/nyheter/varlden/hundratals-tvingas-evakuera-ut-i-snon/
Skulle tvingas in i svenska hamnen,/nyheter/sverige/kinesiska-fartyget-skulle-bordas-och-foras-till-goteborgs-hamn/
Sheila försvann – dök upp vid liv 52 år senare,/nyheter/varlden/sheila-forsvann-dok-upp-vid-liv-52-ar-senare/
Därför kan Musk och Trump ”sluta i krasch,/nyheter/varlden/vanskapen-kan-sluta-i-en-krasch/
Nödhjälpen mitt i fattigaste månaden,/nyheter/laget/januari-ar-arets-tuffaste-manad-sa-klarar-du-den/
"Kailey, 23, förgiftad – av nyårsgåvan",/nyheter/varlden/23-arig-tvabarnsmamma-forgiftad-av-nyarsgavan/
Fredricas oväntade bakning på flyget,/tv/nyheter/varlden/bakar-kaka-ombord-pa-flyget-far-kritik/
Föll 152 meter mot sin död på populär turistort,/nyheter/varlden/foll-152-meter-mot-sin-dod-pa-popular-turistort/
Teorin: Så startade katastrofbränderna,/nyheter/varlden/teorin-jattebranden-i-los-angeles-startad-av-fyrverkerier/
Buss i lågor nära Bromma flygplats,/nyheter/sverige/buss-brinner-i-vastra-stockholm/?referrer=26
Chocken – vad är det som faller mot bilen?,/tv/nyheter/varlden/forvirringen-gigantiskt-blad-faller-mot-bilarna/
Sigge Eklunds egna bilder på brandinfernot,/tv/nyheter/sverige/sigge-eklunds-kamp-for-att-hitta-nytt-hus-hundratals-i-ko/
Oväntat dyra straffet – för kontroversiella pizzan,/tv/nyheter/varlden/straffet-for-ananas-pa-pizzan-1-300-kr/
Svenska Hanna: ”Fick panik – skrek och grät”,/tv/nyheter/sverige/svenska-hanna-fick-panik-skrek-och-grat/
Jean-Marie Le Pen förs till sista vilan,/tv/nyheter/varlden/jean-marie-le-pen-fors-till-sista-vilan-/
Chocken – gigantiskt blad faller mot bilarna,/tv/nyheter/varlden/forvirringen-gigantiskt-blad-faller-mot-bilarna/
Fredricas oväntade bakning på flyget,/tv/nyheter/varlden/bakar-kaka-ombord-pa-flyget-far-kritik/
Turister flyr i panik – enorm istapp faller,/tv/nyheter/varlden/turister-flyr-i-panik-enorm-istapp-faller/
Politiker får tårta i ansiktet – hämnas,/tv/nyheter/varlden/tyska-politikern-blev-tartad-mitt-under-kampanjmotet-/
Frank hittade kidnappade dottern – efter 26 dagar,/nyheter/varlden/frank-65-hittade-sin-kidnappade-14-ariga-dotter-efter-26-dagar/
Anderssons hårda pik mot Kristersson,/nyheter/sverige/magdalena-anderssons-pik-mot-ulf-kristersson/
Svenskt fartyg till stor Natoinsats,/nyheter/sverige/skarpt-overvakning-i-ostersjon-flygovervakas/
Kristersson: Är inte riktig fred i Sverige,/nyheter/sverige/kristersson-inleder-folk-och-forsvar/
Inför förbud – mot att bli sjuk,/nyheter/varlden/italienska-byn-belcastro-infor-forbud-mot-att-vara-sjuk/
Detaljerna om Musks uppdrag – för Trump,/nyheter/varlden/detaljerna-sa-ska-elon-musk-arbeta-for-donald-trump/
Bannons ord om Musk: ”Riktigt ond”,/nyheter/sverige/bannons-ord-om--musk-riktigt-ond/
Svenska ”taxin” sätter skräck i ryska soldater,/nyheter/varlden/svenska-taxin-arryska-soldaternas-skrack-/
”Ukrainas Falun” är Putins måltavla,/nyheter/varlden/de-lever-i-spokstaden--som-putin-desperat-vill-ha/
Riskerar att sparkas efter 29 år som polis,/nyheter/sverige/polismannen-mats-lindstrom-doms-kan-fa-sparken/
En gripen efter lägenhetsbrand,/nyheter/sverige/en-gripen-efter-lagenhetsbrand-i-vastervik/
Kabintryck föll hastigt – 12 000 meter upp i luften,/nyheter/varlden/kabintryck-foll-hastigt-12-000-meter-upp-i-luften/
"Lediga polisen Rosie, 45, hjälpte till vid krock – dog",/nyheter/varlden/lediga-polisen-rosie-45-hjalpte-till-vid-krock-dog/
Längre tid i Sverige – lägre risk att våldta,/nyheter/langre-tid-i-sverige-lagre-risk-att-valdta/
Frias för våldtäkter på förrymda flickor,/nyheter/sverige/flickorna-rymde-fran--hvb-hem-valdtogs/
Soldaternas taktik är avslöjad – agerar bete,/nyheter/varlden/dagbok-fran-nordkoreansk--soldat-avslojar-dronartaktik/
Sjukskriven drev företag – kvinnan krävs på 150 000,/nyheter/sverige/sjukskriven-drev-foretag-kvinnan-kravs-pa-150000/
Dödssiffran stiger för Kalifornienbränderna,/nyheter/varlden/dodssiffran-stiger-for-kalifornienbranderna/
Landerholm uppläxad av Kristersson: ”Lärdom”,/nyheter/sverige/landerholm-upplaxad-av-kristersson-lardom/
Chocken – gigantiskt blad faller mot bilarna,https://www.expressen.se/tv/nyheter/varlden/forvirringen-gigantiskt-blad-faller-mot-bilarna/
Straffet för ananas på pizzan: 1 300 kr,https://www.expressen.se/tv/nyheter/varlden/straffet-for-ananas-pa-pizzan-1-300-kr/
Jean-Marie Le Pen förs till sista vilan,https://www.expressen.se/tv/nyheter/varlden/jean-marie-le-pen-fors-till-sista-vilan-/
19-åring spred mans onanifilmer – döms,/nyheter/sverige/19-aring-spred-mans-onanifilmer-till-anhoriga-doms/
29 insnöade på pub – i fem dagar,https://www.expressen.se/tv/nyheter/varlden/29-insnoade-pa-pub-i-fem-dagar/
Han räddade strandsatta efter Gudrun: ”Sämre idag”,/nyheter/sverige/han-raddade-strandsatta-efter-gudrun-samre-idag/
Gudrun förändrade Haralds liv: ”Vi grät”,/nyheter/sverige/gudrun-forandrade-harald-salls-liv-vi-grat/
Klubben i krismöte efter svåra olyckan,/nyheter/sverige/ibk-lund-i-krismote-efter-bussolyckan-i-nykoping/
Två döda i krock – ung man gripen,/nyheter/sverige/tva-doda-i-frontalkrock-i-orebro/
Modell attackeras av något otäckt i vattnet,https://www.expressen.se/tv/nyheter/varlden/man-attackeras-av-nagot-otackt-i-vattnet
Öppnade eld mot ytterdörr till bostad,/nyheter/sverige/skott-mot-bostad-i-jarfalla/
Flygplan tvingades landa i Danmark,/nyheter/sverige/andrepiloten-forkyld-tvingades-landa/
Dödstalet stiger i brandinfernot i LA,/nyheter/varlden/dodstalet-stiger-i-kalifornien/
Turister flyr i panik – enorm istapp faller,https://www.expressen.se/tv/nyheter/varlden/turister-flyr-i-panik-enorm-istapp-faller/
Från strandparadis – till stor förödelse,https://www.expressen.se/tv/nyheter/varlden/se-bilderna-fore-och-efter-branderna/
Visar upp fångar från Nordkorea,/nyheter/varlden/zelenskyj-visar-upp-krigsfangar-fran-nordkorea/
"Boris Johnson: Du är en jävla idiot, Putin",/nyheter/varlden/boris-johnson-du-ar-en-javla-idiot-putin/
Högvakt spetsades av sin egen bajonett,/nyheter/sverige/hogvakt-spetsades-av-sin-egen-bajonett/
Sista bilden på systrarna – sedan försvann båda,/nyheter/varlden/sista-bilden-pa-systrarna-sedan-forsvann-bada/
Vanvårdade sonen – tjänade miljoner,/nyheter/krim/hells-angels-pappa-atalas--misstanks-ha-tjanat-miljoner-pa-vanvard/
Uber tjänar miljarder – så lite får förarna,/nyheter/sverige/uber-tjanar-miljarder-sa-lite-far-forarna/
Växeln nedringd – alla vill höra Ing-Maris röst,/tv/nyheter/sverige/olandsk-telefonsvarare-nedringd-tack-vare-81-ariga-ing-mari/
Våldtogs av Kapten klänning,/nyheter/sverige/sanna-35-valdtogs-av-kapten-klanning/
Mörkade läckor för regeringen,/nyheter/sverige/las-expressens-avslojanden-om-skandalen-pa-lantmateriet/
Sexanmälan avslöjade pengarna till gängman,/nyheter/sverige/sexanmalan-avslojade-pengarna-till-gangman/
"Vad hände då Molly, 14, dog?",/nyheter/sverige/mollys-hemlighet-sista-festen-som-tar-hennes-liv/
