Heading,URL
Försvinner helt i skogen – med superkamouflage,/tv/nyheter/forsvinner-helt-i-skogen-med-superkamouflage/
Zelenskyjs svar – på kungens gest,/tv/nyheter/sverige/kungens-ord-till-zelenskyj-fortfarande-stark/
Gigantiskt slukhål sväljer hela gatan,/tv/nyheter/gigantiskt-slukhal-svaljer-hela-gatan/
Presidenten avslöjas – smusslar med snus,/tv/nyheter/presidenten-avslojas-smusslar-med-snus/
Bråkar på planet – tejpas fast av flygvärdinnan,/tv/nyheter/varlden/brakar-pa-planet-tejpas-fast-av-flygvardinnan/
Trump om klimat-krisen: ”Största bluffen någonsin”,/tv/nyheter/-trump-om-klimat-krisen-storsta-bluffen-nagonsin/
Andersson (S) om snus: ”Kasta inte”,/tv/nyheter/sverige/andersson-s-om-snus-kasta-inte/
Tjuven jagas – gör livsfarlig manöver,/tv/nyheter/varlden/tjuven-jagas-gor-livsfarlig-manover/
Rysslands nya besked bakom stängda dörrar,/nyheter/varlden/kalla-rysslands-krankningar-ar--ett-svar-pa-natos-ukrainastod/
Då kan Sverige svara på Putins ”nålstick”,/nyheter/varlden/experten-da-kan-sverige-behova-agera-mot-ryssland/
Kuppen mot Thunbergs båt – spelade Abba-låtar,/nyheter/varlden/kuppen-mot-thunbergs-bat-spelade-abba-latar/
Man död – polisen övade i ”spökstad”,/nyheter/sverige/olycka-pa-markstridsskolan-en-allvarligt-skadad/
Bloggarens olämpliga drag – grips av polis,/tv/nyheter/varlden/bloggare-i-thailand-gripen-for-sex-i-trafiken/
Försvinner helt i skogen – med superkamouflage,https://www.expressen.se/tv/nyheter/forsvinner-helt-i-skogen-med-superkamouflage
Om Jonna tar bort penisen är det hejdå,/nyheter/sverige/jenny-hittade-en-kartong-med-kvinnoklader-i-garderoben/
Sjödrönaren fintar Rysslands försvar,/tv/nyheter/varlden/ukrainas-sjodronare-slar-till-mot-ryska-oljehamnen/
Tyfon-tsunamin slår in i lyxhotellet,/tv/nyheter/varlden/tyfon-tsunamin-slar-in-over-lyxhotellet/
Svimmar i SVT:s Morgonstudion,/tv/nyheter/svimmar-i-svts-morgonstudion/
Trumps ord om Erdogan – när han sitter bredvid,/tv/nyheter/varlden/trumps-ord-om-erdogan-nar-han-sitter-bredvid/
Bloggare i Thailand gripen för sex i trafiken,/tv/nyheter/varlden/bloggare-i-thailand-gripen-for-sex-i-trafiken/
Försvinner helt i skogen – med superkamouflage,/tv/nyheter/forsvinner-helt-i-skogen-med-superkamouflage/
Få Sverige på recept – läkarens svar på PR-tricket,/tv/nyheter/fa-sverige-pa-recept-lakarens-svar-pa-pr-tricket/
Zelenskyjs svar – på kungens gest,/tv/nyheter/sverige/kungens-ord-till-zelenskyj-fortfarande-stark/
Vance efter ICE-attacken: ”Dra åt helvete”,/tv/nyheter/varlden/vance-efter-ice-attacken-dra-at-helvete/
Sjuksköterskor säger upp sig i stor protest,/nyheter/sverige/sjukskoterskor-sager-upp-sig-i-protest-/
”Alla” toppmilitärer till mystiska mötet,/nyheter/varlden/usas-toppmilitarer-kallas-till-mote-utan-forklaring/
Orden om Erdogan – när han sitter bredvid,https://www.expressen.se/tv/nyheter/varlden/trumps-ord-om-erdogan-nar-han-sitter-bredvid
Deprimerade dricker mer läsk – vad beror det på?,/nyheter/varlden/att-sluta-dricka-lask-lar-inte-bota-en-depression/
Gigantiska fyndet mitt på Atlanten: Tio ton kokain,/nyheter/varlden/fynd-pa-fiskebat-tio-ton-kokain/
Officiellt: James Comey åtalad,https://www.expressen.se/nyheter/expressen-direkt/?post=0b062319-e0ec-4c1c-968e-03deb17c527d
Grovt brott på Rosengård,https://www.expressen.se/nyheter/expressen-direkt/?post=08ad79c3-bced-4be4-891b-44917d46685f
Stänger luftrum – igen,https://www.expressen.se/nyheter/expressen-direkt/?post=5db6fb1a-2e8d-401d-b72d-6c6ecb6ebe41
Inbrottstjuvarnas klantiga misstag: ”Typiskt b-tjuvar”,/nyheter/varlden/inbrottstjuvarnas-klantiga-misstag-hanas-typiskt-b-tjuvar/
Putins fartyg ligger gömt utanför Danmarks kust,/nyheter/varlden/danska-myndigheter-efter-dronarlarmen-hybridkrigforing/
Dawits Isaaks döttrars förslag med L: ”Akut”,/nyheter/politik/dawit-isaaks-dottrars-forslag-med-l-akut/
Anklagar Bokmässan: Folkmordspropaganda,/nyheter/sverige/kulturprofiler-anklagar-bokmassan-for-folkmordspropaganda/
En gripen i Säpo-insats – misstänkt för grova brott,/nyheter/sverige/en-gripen-i-sapo-insats/
Stegruds känga – efter S krav om pojkvännen,/nyheter/politik/stegruds-kanga-till-s-efter-kravet-om-pojkvannen/
Vance om dådet: ”Dra åt helvete”,/tv/nyheter/varlden/vance-efter-ice-attacken-dra-at-helvete/
Mikaels oro efter mordet: Det kan drabba även oss,/nyheter/sverige/chaufforen-mikaels-oro-kan-drabba-aven-oss/
Brittisk läkare: Öppen för att ordinera Sverigebesök,https://www.expressen.se/tv/nyheter/fa-sverige-pa-recept-lakarens-svar-pa-pr-tricket
Expressen kan prisas för hemliga sexfesterna,/nyheter/sverige/expressens-kan-prisas-for-elitens-hemliga-sexfester/
Turist hyrde hus – är nu spårlöst försvunnen,/nyheter/sverige/tysk-turist-hyrde-hus-har-forsvunnit/
Uppgifter: Ryska stridsflyg vid USA,/nyheter/varlden/uppgifter-ryska-stridsflyg-vid-alaska/
Ukrainas nya succé – slår ut Putins plan,/tv/nyheter/varlden/ukrainas-drapslag-mot-putin-pa-halvon/
Jan Emanuel nobbad – avslöjade hemlig plan,/nyheter/politik/jan-emanuel-nobbades-av-medborgerlig-samling/
Svensken tillbaka i Irans skräckfängelse,/nyheter/varlden/forsvunne-svensken-ahmadreza-djalali-tillbaka-i-irans-skrackfangelse/
Joakim Medin varnade journalister för griplista,/nyheter/sverige/joakim-medin-varnade-svenska-journalister/
Medins rättegång i Turkiet skjuts upp,/nyheter/sverige/joakim-medins-rattegang-skjuts-upp-till-nasta-ar/
Oron: ”Vi är inte ute på andra sidan än”,/nyheter/sverige/familjen-medin-om-tiden-efter-fangelset-/
Två frias för dödsvållande efter dubbelmordet i Piteå,/nyheter/sverige/chania-lundgren-och-emanuel-mathisen-frias-for-grovt-vallande-till-annans-dod-/
80-tal hjärtsjuka barn friskförklarades felaktigt,/nyheter/sverige/80-tal-hjartsjuka-barn-friskforklarades-felaktigt/
Pedagog sexofredade barn – slipper fängelse,/nyheter/sverige/pedagog-sexofredade-barn-slipper-fangelse/
Hemliga vapnet ska tvinga Putin till bordet,/nyheter/varlden/zelenskyj-hemliga-vapnet-ska-tvinga-putin-till-bordet/
Rakade Hitlermustasch i hemtjänsten – anmäls,/nyheter/sverige/hemtjanstpersonal-rakade-hitlermustasch-pa-brukare/
Trippelsmäll mot L – Mohamssons oro,/nyheter/politik/trippelsmallen-mot-l-simona-mohamssons-oro/
Rysk besättning pekas ut efter drönarintrången,/nyheter/sverige/fartyg-med-rysk-besattning-nara-tva-dronarincidenter/
Danmark kan dra in Nato efter drönarna,/nyheter/varlden/danmark-kan-aktivera-nato-efter-dronarna/
Så lyxiga är årets dyraste kalendrar,https://www.expressen.se/tv/nyheter/sverige/lyx-faktorn-pa-arets-dyraste-skonhetskalendrar
S svänger om utländska fängelser: ”Nödvändigt”,/nyheter/sverige/s-om-fangelseplatser-i-estland/
Hotet mot Trump från partiet: ”Över gränsen”,/nyheter/varlden/hotet-mot-donald-trump-fran-partitoppen/
Här dyker Biden-hånet upp på Trumps vägg,https://www.expressen.se/tv/nyheter/trumps-nya-pakostade-satt-att-smada-biden-
Kontakta redaktionen direkt,/nyheter/har-du-ett-nyhetstips-eller-bilder/
Spa-snusket: Musbajs och mögel,/nyheter/sverige/snusket-pa-svenska-spa-anlaggningar/
Konfronteras av Dumpen – då snor han telefonen,/tv/nyheter/sverige/konfronteras-av-dumpen-da-snor-han-telefonen/
