Heading,URL
Sliter tag i Emma – då rusar killarna fram,/tv/nyheter/sverige/har-sliter-han-tag-i-emma-da-rusar-killarna-fram-slapp-henne/
Så mycket vill MP höja bensinpriserna,/tv/nyheter/sverige/sa-mycket-vill-mp-hoja-bensinpriserna/
Hånet mot Sverige i rysk stats-tv,/tv/nyheter/varlden/hanet-mot-sverige-i-rysk-stats-tv/
Här flaggar Trump för nytt namnbyte på kartan,/tv/nyheter/varlden/har-flaggar-trump-for-nytt-namnbyte-pa-kartan/
Mardrömmen när blixten slår ner i huset,/tv/nyheter/varlden/mardrommen-nar-blixten-slar-ner-i-huset/
Artist sätter eld på sig – sen inser han problemet,/tv/nyheter/varlden/artist-satter-eld-pa-sig-sen-inser-han-problemet/
Mc-föraren gör gest – bilistens vansinniga svar,/tv/nyheter/varlden/mc-foraren-gor-gest-bilistens-vansinniga-svar/
Faller ihop – mitt under pressträffen,/tv/nyheter/varlden/faller-ihop-mitt-under-presstraffen/
JUST NU: Problem i tågtrafiken,https://www.expressen.se/nyheter/expressen-direkt/?post=67899582-cc68-4166-86fc-f87e75b50948
JUST NU: Slutar efter bildfrågor: ”Är allvarligt”,/nyheter/sverige/tobias-thyberg-stoppas-som-sakerhetsradgivare/
JD Vances skarpa varning till Putin,/nyheter/varlden/vance-varnar-putin--da-drar-vi-oss-ur/
Kusliga orden om Sverige i rysk tv,/tv/nyheter/varlden/hanet-mot-sverige-i-rysk-stats-tv/
I telefonsamtal med Trump och Zelenskyj,https://www.expressen.se/nyheter/expressen-direkt/?post=df6db432-8c0e-4ab5-a422-674f6f14c037
Erkänner: Hade sex med vänners hundar,/nyheter/sverige/kvinna-hade-sex-med-vanners-hundar--i-flera-ar/
Trumps udda svar får alla att gapskratta,/tv/nyheter/varlden/trumps-svar-pa-udda-erbjudandet/
Janne Anderssons sorg efter treåriga Alicias död,/nyheter/sverige/alicia-3-saknas-i-janne-anderssons-fotbollslag/
Joakims egen regplåt stoppas: ”Stötande”,/nyheter/sverige/vill-ha-woke-motorcykel-transportstyrelsen-sager-nej/
Tvättbjörnens fynd – får polisen att skratta,/tv/nyheter/varlden/tvattbjornens-fynd-far-polisen-skratta/
Kvinna får över en miljon för att flytta,/nyheter/sverige/kvinna-far-125-miljoner-for-att-flytta-fran-hyresratt/
Trump flaggar för nytt namnbyte på kartan,/tv/nyheter/varlden/har-flaggar-trump-for-nytt-namnbyte-pa-kartan/
”Stort mysterium” kring Jades död,/nyheter/varlden/stort-mysterium-kring-dod-fallskarmshoppare-hittade-brev/
Åsa om skräcklivet med Berne: ”Terror”,/nyheter/sverige/asa-vesterlund-om-skracklivet-med-doktor-fredrik-berne/
”Jag sov när det hände – vet inte vad de gjort”,/nyheter/sverige/operationen-hos-doktor-fredrik--berne-forstorde-linneas-liv/
Tänder eld på sig – sen inser han problemet,/tv/nyheter/varlden/artist-satter-eld-pa-sig-sen-inser-han-problemet/
Frågan får Trumps minister att stamma,/tv/nyheter/varlden/fragan-som-far-trumps-minister-att-stamma/
Stjäl lyxyachten – missar att de jagas,/tv/nyheter/varlden/stjal-lyxyachten-missar-kustbevakningen-helt/
Mc-föraren gör gest – bilistens vansinniga svar,/tv/nyheter/varlden/mc-foraren-gor-gest-bilistens-vansinniga-svar/
Faller ihop – mitt under pressträffen,/tv/nyheter/varlden/faller-ihop-mitt-under-presstraffen/
Chocken – attackerar med en ”karatespark”,/tv/nyheter/sverige/chocken-attackerar-med-en-karatespark/
Turiststaden översvämmad – stängde ner allt,/tv/nyheter/varlden/turiststaden-oversvammad-stangde-ner-allt/
Trumps känga till Putin: ”Dum”,/tv/nyheter/varlden/trumps-kanga-till-putin-dum/
Miljardvinner på lotto – grips dagar senare,/tv/nyheter/varlden/miljardvinner-pa-lotto-grips-dagar-senare/
Teorin: Kan ha valts på grund av Trump,/nyheter/varlden/teorin-kan-ha-valts-till-pave-pa-grund-av-trump/
Jag är chockad – det hör inte till reglerna,/nyheter/kronikorer/joel-halldorf/jag-ar-chockad-det-hor-inte-till-reglerna/
Bloms förvåning: ”Litar på den helige Anden”,/nyheter/varlden/trumps-reaktion-pa-forsta-amerikanska-paven/
Påvens kamp med känslorna,/tv/nyheter/varlden/har-framtrader-nya-paven/
Vidriga fynden avslöjade – men nu kan han gå fri,/nyheter/varlden/vidriga-fynden-hos-misstankta-mordaren/
Sliter tag i Emma – då rusar killarna fram,https://www.expressen.se/tv/nyheter/sverige/har-sliter-han-tag-i-emma-da-rusar-killarna-fram-slapp-henne
Kungens ord efter Islands statsbesök,/nyheter/sverige/kungens-ord-efter-islands-statsbesok/
Konflikten slår mot Instagram,/nyheter/varlden/meta-blockerar-muslimskt-nyhetskonto-i-indien/
Hotet mot ambassaden: ”Får seriösa problem”,/nyheter/sverige/svaret-till-usas-ambassad-kan-stanga-avlopp/
Efter skandalen: Ny miss med försvarshemligheter,/nyheter/sverige/ny-incident-med-forsvarshemligheter-pa-lantmateriet/
Avslöjandena som tvingade bort GD:n,/nyheter/sverige/las-expressens-avslojanden-om-skandalen-pa-lantmateriet/
Folkfest – men påven kan bli en tråkmåns,/nyheter/kronikorer/joel-halldorf/drinkar-och-folkfest-men-paven-kan-bli-en-trakmans/
Dolda ritualerna vid konklaven,/tv/nyheter/varlden/dolda-ritualerna-vid-konklaven/
Så mycket vill MP höja bensinpriserna,https://www.expressen.se/tv/nyheter/sverige/sa-mycket-vill-mp-hoja-bensinpriserna
Alla svenska namn på årets Coca-Cola-flaskor,/nyheter/sverige/alla-svenska-namn-pa-arets-coca-cola-flaskor/
Magisk syn på himlen – ett färgglatt fenomen,/tv/nyheter/varlden/magisk-syn-pa-himlen-ett-fargglatt-fenomen/
Hon tar strid efter körkortsskandalen,/nyheter/sverige/tar-strid-mot-korkortsskandalen-tusentals-drabbade-av-transportstyrelsens-praxis/
"Linn, 28, blev av med jobbet efter peth-test",/nyheter/sverige/linn-fick-indraget-korkort-efter-peth-test/
Putins 734 övertramp på bara en halv dag,/nyheter/varlden/ukraina-ryssland-bryter-sin-egen-vapenvila/
Putins nya trubbel efter Litauens drag,/nyheter/varlden/litauen-kan-placera-landminor-intill-ryssland/
Evighetsvandringen – när Xi möter Putin,/tv/nyheter/varlden/langa-marschen-till-slut-mots-xi-och-putin/
Ger bort sin förmögenhet – 1 000 miljarder kronor,/nyheter/varlden/bill-gates-ger-bort-resten-av-sin-formogenhet-/
Tidigare S-toppen åtalas för försök till våldtäkt,/nyheter/sverige/s-kommunalradet-claes-nordmark-atalas-for-forsok-till-valdtakt/
MP-toppens drag – får mer i fallskärm,/nyheter/sverige/anton-fendert-stannar-i-region-stockholm-far-storre-fallskarm/
C-toppen åtalas för sexbrott mot barn,/nyheter/sverige/gustav-hemming-atalas-for-sexuellt-ofredande-mot-barn/
Stjäl bil med barn i – trots mammans kamp,https://www.expressen.se/tv/nyheter/varlden/mammans-kamp-nar-biltjuven-kor-
Försvann i tågtunneln – här dyker han upp,/tv/nyheter/sverige/forsvann-i-tagtunneln-har-dyker-han-upp/
Ännu en nominering — jämförs med Sabuni,/nyheter/sverige/flera-forbund-nominerar-pourmokhtari-jamfors-med-sabuni/
Utrikesministern: ”Vi har talat om Medin”,/nyheter/sverige/maria-malmer-stenergard-har-diskuterat-joakim-medin/
Ber Teslan köra till ställe han aldrig besökt – hånet,https://www.expressen.se/tv/nyheter/varlden/ber-teslan-kora-till-stalle-han-aldrig-varit-hanet
Trump flaggar för nytt namnbyte på kartan,https://www.expressen.se/tv/nyheter/varlden/har-flaggar-trump-for-nytt-namnbyte-pa-kartan
Forssell: Utvisningar vid brott sexdubblas,/nyheter/sverige/ministern-utvisningarna-ska-sexdubblas/
Putins skryt – kan öppna för attacker,/nyheter/varlden/oro-i-moskva-infor-putins-stora-firande/
Reporterns chock – springer in i en vägg,https://www.expressen.se/tv/nyheter/sverige/en-manad-kvar-viktigaste-passet
De 30 som styr Hells Angels,/nyheter/sverige/har-avslojas-mannen--som-styr-hells-angels/
Polischefen sparkades efter att sonen rånats,/nyheter/krim/polischefen-fick-sparken--efter-att-sonen-ranades-av-gangkillar/
Vägrar ta emot 500 miljoner och ett slott,/nyheter/sverige/nya-budet-i-arvsstriden-500-miljoner-och-ett-slott/
Våldtogs av Kapten klänning,/nyheter/sverige/sanna-35-valdtogs-av-kapten-klanning/
Uber tjänar miljarder – så lite får förarna,/nyheter/sverige/uber-tjanar-miljarder-sa-lite-far-forarna/
Mörkade läckor för regeringen,/nyheter/sverige/las-expressens-avslojanden-om-skandalen-pa-lantmateriet/
