Heading,URL
Trumps ord får Melania att skratta,/tv/nyheter/varlden/trumps-ord-far-melania-att-skratta/
Plötslig brand på flyg – lågor slår upp,/tv/nyheter/varlden/plotslig-brand-pa-flyg-lagor-slar-upp/
Skistar erbjuder pengar – Martin får inget,/tv/nyheter/sverige/skistar-erbjuder-aterbetalning-men-inte-till-martin/
Hegseths ilska efter nya skandalen: Bluffmakare,/tv/nyheter/varlden/hegseths-ilska-efter-nya-skadalen-bluffmakare/
Mystiska armen i floden mot Putin,/tv/nyheter/varlden/mystiska-armen-i-floden-mot-putin/
Påvens ord till Vance – timmar före döden,/tv/nyheter/pavens-ord-till-vance-timmar-fore-doden/
Här skjuts ”Trump” – sen eldas han upp,/tv/nyheter/varlden/har-skjuts-trump-sen-eldas-han-upp/
Jättemiss i USA-tv – Ukraina rasar,/tv/nyheter/varlden/ukrainsk-ilska-efter-pinsamma-missen--i-fox-livesandning/
Därför fylls gatan av ”KKK-dräkter”,/tv/nyheter/varlden/darfor-fylls-sevilla-av-kkk-liknande-drakter-/
JUST NU: Sabotage – stopp för tågen,https://www.expressen.se/nyheter/expressen-direkt/?post=63701c23-4d24-4d37-bf0a-31c56a127ae6
JUST NU: Omfattande rysk attack,https://www.expressen.se/nyheter/expressen-direkt/?post=57a5a365-12e1-4848-b7d6-9e41f198ae7e
Trump tar strid – men partiet kokar: ”Amatör”,/nyheter/varlden/trump-stottar-hegseth-men-partiet-skakar-han-ar-en-amator/
Musk vill sluta – trött på ”vänsterattacker”,/nyheter/varlden/musk-forbereder-sig-pa-att-sluta-trott-pa-vansterns-attacker/
Trumps ord efter nya Hegseth-avslöjandet,/tv/nyheter/trumps-ord-efter-nya-hegseth-avslojandet/
Tonåringarnas resa slutade i en mardröm,/nyheter/varlden/tyska-tonaringarna-greps-och-utvisades-nar-de-kom-till-hawaii/
Barnen överrumplas av haj – simmare saknas,/tv/nyheter/varlden/hajen-overrumplar-barnen-simmare-saknas/
”White lotus”: Sant och falskt i serien,/nyheter/varlden/sant-och-falskt-i-white-lotus/
Gästernas ilska – på ”White lotus”-hotellet,/nyheter/varlden/har-ar-white-lotus-hotellet-alla-pratar-om/
Hon vill korta arbetstiden med tio timmar i veckan,/nyheter/sverige/elfva-barrio-vill-korta-arbetstiden-med-tio-timmar-i-veckan/
”Barbie”-forskarens jakt på aliens,https://www.expressen.se/tv/nyheter/varlden/barbie-forskarens-stod-i-nasas-alien-jakt
Därför fylls gatorna av ”KKK-dräkter”,/tv/nyheter/varlden/darfor-fylls-sevilla-av-kkk-liknande-drakter-/
Mystiska armen i floden – mot Putin,/tv/nyheter/varlden/mystiska-armen-i-floden-mot-putin/
Meghans häftiga reaktion på djuren,/tv/nyheter/varlden/meghan-markle-far-en-sotchock/
Skistar erbjuder pengar – men Martin får inget,/tv/nyheter/sverige/skistar-erbjuder-aterbetalning-men-inte-till-martin/
Här skjuts ”Trump” – sen eldas han upp,/tv/nyheter/varlden/har-skjuts-trump-sen-eldas-han-upp/
Hittar 18 år gammal flaskpost – löftet i brevet,/tv/nyheter/varlden/hittar-18-ar-gammal-flaskpost-loftet-i-brevet/
Klättrar upp för isen – då bryts glaciären,/tv/nyheter/varlden/klattrar-upp-for-isen-da-bryts-glaciaren/
Filmar själv – när hajen attackerar,/tv/nyheter/varlden/filmar-sjalv-nar-hajen-attackerar/
Börjar sjunga – då tystnar Trump,/tv/nyheter/varlden/ovantade-tilltaget-tystar-trump/
Filmen visar – här störtar plötsligt helikoptern,/tv/nyheter/varlden/filmen-visar-har-stortar-plotsligt-helikoptern/
Trumps skryt efter hälsokontrollen,/tv/nyheter/varlden/trumps-hanfulla-diss-efter-halsokontrollen/
Påvens kropp lever vidare – i tre dagar,/nyheter/varlden/pave-franciskus-balsameras-ska-visas-upp-i-tre-dagar/
Påvens sista önskan avslöjad i testamente,/nyheter/varlden/pavens-sista-onskan-offentliggjord/
Svensken pekas ut: Kan bli nästa påve,/nyheter/varlden/de-kan-bli-ny-pave-arborelius-pekas-ut/
De håller Putin vid liv – agerar i kulisserna,/nyheter/varlden/presidentens-man-sa-halls-putin-vid-liv/
Jublar efter Trumps beslut om Ukraina,/nyheter/varlden/kremls-gladje-efter-trumps-ukrainabeslut-eypf2/
Jättemiss i USA-tv – nu rasar Ukraina,/tv/nyheter/varlden/ukrainsk-ilska-efter-pinsamma-missen--i-fox-livesandning/
Norges drottning inlagd på sjukhus,https://www.expressen.se/nyheter/expressen-direkt/?post=ad4cabeb-69c2-442c-a97b-2ccacb5ac34c
Adrian vann miljarder – flyttar till mamma,/nyheter/varlden/miljardvinnaren-adrian-bayford-lamnar-palatset-flyttar-in-hos-mamma/
Harvards nya motdrag – stämmer Trump,/nyheter/varlden/harvarduniversitetet-stammer-trump-forsoker-ta-kontroll-/
"Svenska Jennipher, 24, har fjärrkontroll till hjärnan",/nyheter/sverige/jennipher-24-har-en--fjarrkontroll-till-hjarnan/
Köer i snigelfart på E4: ”Går i 13 km/h”,/nyheter/sverige/langa-koer-i-snigelfart-pa-e4/
"Gabrielle, 25, är historisk: Först att klara armétävling",/nyheter/varlden/gabrielle-white-25-historisk-forsta-kvinna-att-klara-armens-stenharda-tavling/
Skickade giftigt påskägg till exet – ung pojke dog,/nyheter/varlden/35-aring-forsokte-morda-exets-familj-med-forgiftat-paskagg/
Skidgäster får pengarna tillbaka efter snöfiaskot,/nyheter/sverige/snobrist-i-fjallen-gaster-far-pengarna-tillbaka/
Vännens diss: Totalt kaos – måste avgå,/nyheter/varlden/hegseths-tidigare-medarbetare-och-van-totalt-kaos-kan-inte-sitta-kvar/
Delade krigsplan med fru och bror,/nyheter/varlden/pete-hegseth-lackte-uppgifter-i-ny-chatt/
Trumps nya planer för enorma kärnkraftverket,/nyheter/varlden/trumps-planer-for-ockuperade-karnkraftverket/
Polis uppsagd – efter tilltaget mot kvinnan,https://www.expressen.se/tv/nyheter/polis-uppsagd-efter-tilltaget-mot-kvinnan
Våldsam motattack efter nya skandalen,https://www.expressen.se/tv/nyheter/varlden/hegseths-ilska-efter-nya-skadalen-bluffmakare
Här skjuts ”Trump” – sen eldas han upp,https://www.expressen.se/tv/nyheter/varlden/har-skjuts-trump-sen-eldas-han-upp
Experten: Därför kan Kanada gå med i EU,/nyheter/varlden/manga-kanadensare-oppna-for-att-ga-med-i-eu/
Elever fick p-böter på över 200 000 kronor,/nyheter/sverige/parkeringskaos-vid-danderyds-gymnasium/
Påven mötte Vance – timmar före döden,/tv/nyheter/pavens-ord-till-vance-timmar-fore-doden/
Ordningsvakt livshotande skadad efter krogbråk,https://www.expressen.se/nyheter/expressen-direkt/?post=222f5475-95ab-4a5c-98d0-b797a7d7c77a
Stina Oscarson är död – blev 49,/nyheter/sverige/stina-oscarson-dod-dtpka/
De 30 som styr Hells Angels,/nyheter/sverige/har-avslojas-mannen--som-styr-hells-angels/
Polischefen sparkades efter att sonen rånats,/nyheter/krim/polischefen-fick-sparken--efter-att-sonen-ranades-av-gangkillar/
Vägrar ta emot 500 miljoner och ett slott,/nyheter/sverige/nya-budet-i-arvsstriden-500-miljoner-och-ett-slott/
Våldtogs av Kapten klänning,/nyheter/sverige/sanna-35-valdtogs-av-kapten-klanning/
Uber tjänar miljarder – så lite får förarna,/nyheter/sverige/uber-tjanar-miljarder-sa-lite-far-forarna/
Mörkade läckor för regeringen,/nyheter/sverige/las-expressens-avslojanden-om-skandalen-pa-lantmateriet/
