Heading,URL
Tyfon-tsunamin slår in över lyxhotellet,/tv/nyheter/varlden/tyfon-tsunamin-slar-in-over-lyxhotellet/
Gigantiskt slukhål sväljer hela gatan,/tv/nyheter/gigantiskt-slukhal-svaljer-hela-gatan/
Presidenten avslöjas – smusslar med snus,/tv/nyheter/presidenten-avslojas-smusslar-med-snus/
Bråkar på planet – tejpas fast av flygvärdinnan,/tv/nyheter/varlden/brakar-pa-planet-tejpas-fast-av-flygvardinnan/
Trump om klimat-krisen: ”Största bluffen någonsin”,/tv/nyheter/-trump-om-klimat-krisen-storsta-bluffen-nagonsin/
Andersson (S) om snus: ”Kasta inte”,/tv/nyheter/sverige/andersson-s-om-snus-kasta-inte/
Tjuven jagas – gör livsfarlig manöver,/tv/nyheter/varlden/tjuven-jagas-gor-livsfarlig-manover/
Ryskt hot mot Danmark: Måste förstöra dem,/tv/nyheter/varlden/hotet-mot-danmark-maste-forstora-dem/
S kravbrev till talmannen – efter besöket,/nyheter/politik/socialdemokraterna-oka-sakerheten-i-riksdagen-efter-nick-alinias-besok/
Flera drönarintrång – flygbas stängdes,/nyheter/varlden/uppgifter-nytt-dronarlarm-i-danskt-luftrum/
Expert: Nästan helt omöjligt att stoppa,/nyheter/sverige/expert-nastan-helt-omojligt-att-stoppa-dronarna/
Kaos i Thailand – hela gatan slukas,/tv/nyheter/gigantiskt-slukhal-svaljer-hela-gatan/
Här festar Victoria och Daniel loss,https://www.expressen.se/tv/nyheter/kungligt/har-festar-kronprinsessparet-pa-nattklubben
Svensken svårt sjuk i amerikanskt fängelse,/nyheter/sverige/olof-k-gustafsson-svart-sjuk-i-amerikanskt-fangelse/
Ny dinosaurie hittad: ”En bisarr upptäckt”,/nyheter/varlden/ny-dinosaurie-hittad-en-bisarr-upptackt/
Trumps hånfulla hyllning till Biden,/nyheter/varlden/donald-trump-hanar-biden-i-hyllningen/
Varningen inför helgen: Putin vill ta över landet,/nyheter/varlden/moldavien-ryssland-forsoker-ta-over-landet/
Ryska militärplan flög lågt över tysk fregatt,/nyheter/varlden/ryska-plan-flog-lagt-over-tysk-fregatt-under-natoovning/
Sjödrönaren fintar Rysslands försvar,/tv/nyheter/varlden/ukrainas-sjodronare-slar-till-mot-ryska-oljehamnen/
Militäroperationen som ska skrämma Ryssland,/nyheter/sverige/polska-fallskarmsjagare-pa-gotland-inte-ovning/
Försvarets last regnar ner över svenska ön,/tv/nyheter/sverige/har-slapps-fallskarmsjagarna-over-gotland/
Tyfon-tsunamin slår in i lyxhotellet,/tv/nyheter/varlden/tyfon-tsunamin-slar-in-over-lyxhotellet/
SVT:s haveri i rutan: ”Tror jag blir galen!”,/tv/nyheter/kvp/haveriet-i-svts-sandning-jag-blir-galen/
Tyfon-tsunamin slår in över lyxhotellet,/tv/nyheter/varlden/tyfon-tsunamin-slar-in-over-lyxhotellet/
Sjödrönaren fintar Rysslands försvar,/tv/nyheter/varlden/ukrainas-sjodronare-slar-till-mot-ryska-oljehamnen/
Gigantiskt slukhål sväljer hela gatan,/tv/nyheter/gigantiskt-slukhal-svaljer-hela-gatan/
Här släpps försvarsmateriel över Gotland,/tv/nyheter/sverige/har-slapps-fallskarmsjagarna-over-gotland/
Presidenten avslöjas – smusslar med snus,/tv/nyheter/presidenten-avslojas-smusslar-med-snus/
Här hedras ambulanssjukvårdaren med tyst minut,/tv/nyheter/sverige/har-hedras-ambulanssjukvardaren-med-tyst-minut/
Här festar kronprinsessparet på nattklubben,/tv/nyheter/kungligt/har-festar-kronprinsessparet-pa-nattklubben/
Andersson öppnar för Åkesson i SVT,/nyheter/politik/magdalena-andersson-oppnar-for--jimmie-akesson-i-svt-och-tv4/
Går till motattack: ”Trump är rasist”,/nyheter/varlden/londons-borgmastare-gar-till-attack-mot-trump-rasist/
Köldchock – men solsken på väg: ”Sommarvärme”,/nyheter/vader/koldchock-i-smaland-men-solsken-pa-vag/
Matbutik anklagades för risplagiat – förbjuds sälja,/nyheter/sverige/matbutik-anklagad-for-risplagiat-forbjuds-salja/
Vändning på Bokmässan – Gazarubriker togs bort,/nyheter/sverige/bokmassan-vander-tar-bort-kritiserade-rubriker/
Krasch vid McDonald's – två personer till sjukhus,/nyheter/sverige/olycka-vid-mcdonalds-i-uppsala/
Jobbade på distans i Egypten – fick sparken,/nyheter/varlden/jobbade-pa-distans-i-egypten--fick-sparken/
Trumps sändebud: Genombrott är nära,/nyheter/varlden/usas-sandebud-genombrott-om-gaza-nara/
Vd åtalad – tog hem prostituerad kvinna,/nyheter/krim/vd-atalad-tog-hem-prostituerad-kvinna/
Zelenskyj: Var Gud som räddade Trump,/nyheter/varlden/zelenskyjs-tal-i-fn-gud-raddade-trump-/
Man misstänks för mord – lägenhet avspärrad,https://www.expressen.se/nyheter/expressen-direkt/?post=24ad215b-500d-4423-93d3-568bd17067ff
Anders Ygeman: Jag är absolut inte petad,/nyheter/politik/anders-ygeman-absolut-inte-petad-missforstand/
Så ska S möblera om i partitoppen,/nyheter/politik/s-presenterar-storre-forandringar-i-partiet/
Oron: ”Vi är inte ute på andra sidan än”,/nyheter/sverige/familjen-medin-om-tiden-efter-fangelset-/
Åtalas för terrorbrott: ”Ber om att bli dömd”,/nyheter/sverige/rattegangen-mot-joakim-medin-i-turkiet-inleds/
Christer och Lennart dog i flygkraschen,/nyheter/sverige/christer-dahlgren-och-lennart-hakansson-dog-i-flygkraschen/
Ilskan mot M – efter u-svängen: Hyckleri,/nyheter/politik/moderaterna-svanger-vill-sanka-skatten-pa-reparationer-hyckleri/
Rånades på kläder – två gripna efter grovt brott,https://www.expressen.se/nyheter/expressen-direkt/?post=c48a489d-0f17-4ee3-a485-a847e531ba3d
Fartyg pekas ut efter mystiska drönarlarmet,/nyheter/varlden/efter-dronarna-over-kastrup-fartyg-pekas-ut/
"Influencern Zuza, 14, död – kämpade mot cancer",/nyheter/varlden/influencern-zuza-14-dod-kampade-mot-cancer-i-nastan-hela-sitt-liv/
Regnskräcken vid ikoniska turistmålet,https://www.expressen.se/tv/nyheter/varlden/regnskracken-vid-ikoniska-turistmalet
Fick 625 000 kronor av misstag – köpte smycken,/nyheter/sverige/fick-en-dryg-halv-miljon-av-misstag-kopte-klockor-och-guldsmycken/
Orden om Ryssland: Dvärg med kärnvapen,/nyheter/sverige/kristersson-ryssland-en-dvarg-med-karnvapen/
Rysslands svar till Trump: ”Finns inte”,/nyheter/varlden/rysslands-svar-till-trump-finns-inga-pappersbjornar/
Trumps klimat-utspel: ”Störst bluff någonsin”,/tv/nyheter/-trump-om-klimat-krisen-storsta-bluffen-nagonsin/
Statyn vid kongressen ”firar” Trump och Epstein,/nyheter/varlden/staty-pa-trump-och-epstein-dok-upp-vid-kapitolium/
Minst en död efter skott vid ICE-kontor,/nyheter/varlden/flera-doda-i-skjutning-i-dallas/
Enormt nätverk avslöjat vid toppmöte: ”Spionage”,/nyheter/varlden/enormt-natverk-avslojat-infor-fn-toppmotet/
Därför tejpas kvinnan fast av flygvärdinnan,https://www.expressen.se/tv/nyheter/varlden/brakar-pa-planet-tejpas-fast-av-flygvardinnan
Ministern: Jag har landets svåraste jobb,/nyheter/politik/romina-pourmokhtari-har-sveriges-svaraste-jobb/
Larmet från Östersjön: Mycket farlig situation,/nyheter/varlden/larmet-i-ost-situationen-ar-mycket-farlig/
Hotar Danmark i ryska tv-kanalen,/tv/nyheter/varlden/attacken-pa-danmark-legitim-mal/
Hemtjänstpersonalen rakade Hitlermustasch,/nyheter/sverige/hemtjanstpersonal-anmald-vardtagare-fick-hitlermustasch-/
Tyst minut för mördade ambulanssjukvårdare,/nyheter/sverige/tyst-minut-for-mordade-ambulanssjukskoterskan/
David Berntsen Lundin rymde – straffet skärps,/nyheter/krim/aklagarens-ilska-far--bara-inte-handa-7mnad/
Kontakta redaktionen direkt,/nyheter/har-du-ett-nyhetstips-eller-bilder/
Spa-snusket: Musbajs och mögel,/nyheter/sverige/snusket-pa-svenska-spa-anlaggningar/
Konfronteras av Dumpen – då snor han telefonen,/tv/nyheter/sverige/konfronteras-av-dumpen-da-snor-han-telefonen/
