Heading,URL
Misslyckas med kupp – försöker råna poliser,/tv/nyheter/varlden/misslyckas-med-kupp-forsoker-rana-poliser-/
Smugglarna jagas av tullen – sätter eld på kokainbåten,/tv/nyheter/smugglarna-jagas-av-tullen-satter-eld-pa-kokainbaten/
Kramkalas mellan Kim Jong-Un och Lavrov,/tv/nyheter/varlden/kramkalas-mellan-kim-jong-un-och-lavrov/
"Trump gör honnör
– då buar publiken",/tv/nyheter/varlden/trump-gor-honnor-da-buar-publiken/
Livsfarligt oväder – haglet öser ner,/tv/nyheter/varlden/har-oser-livsfarliga-haglet-ner-fran-skyn/
Här slår extremvädret mot spanska turistmagneterna,/tv/nyheter/varlden/har-slar-extremvadret-mot-spanska-turistmagneterna/
Knuffas ner på spåret – se udda reaktionen,/tv/nyheter/varlden/knuffas-ner-pa-sparet-se-udda-reaktionen/
9-åring skadas när asfalt sprutas iväg,/tv/nyheter/varlden/9-aring-skadas-nar-asfalt-sprutas-ivag/
JUST NU: Död i drunkningsolycka,https://www.expressen.se/nyheter/expressen-direkt/?post=8375c80c-923b-43f4-a83f-0dad7c8fd270
Trump vänder om Ryssland – skickar robotar,/nyheter/varlden/trump-kommer-skicka-patriotrobotar-till-ukraina/
"Gaia, 24, ihjälkörd: ”En förstörd familj”",/nyheter/varlden/familjen-i-sorg-efter-gaia-costas-dod-forstorda/
"Jennie, 24, dödades med ett skott i pannan",/nyheter/sverige/jennie-24-dodades-med-ett-skott-i-pannan/
Här dödas officeren av ryska agenterna,/tv/nyheter/varlden/har-skjuts-officeren-ihjal-av-rysk-agent/
Grannen om morddramat: ”Är helt ofattbart”,/tv/nyheter/varlden/grannens-chock-efter-morddramat-ofattbart/
Emma bröt nacken på Teneriffa,/nyheter/varlden/emma-brot-nacken-pa-hotellet-i-teneriffa/
Märkliga flygturen – säger bara stopp,https://www.expressen.se/tv/nyheter/varlden/marklig-slut-pa-flygtur-stannar-plotsligt-upp
Misslyckas med kupp – försöker råna poliser,/tv/nyheter/varlden/misslyckas-med-kupp-forsoker-rana-poliser-/
Räddar hunden ur brinnande husvagn,/tv/nyheter/varlden/hund-raddas-ur-elden-se-modiga-insatsen/
"Trump gör honnör
– då buar publiken",/tv/nyheter/varlden/trump-gor-honnor-da-buar-publiken/
Märklig slut på flygtur – stannar plötsligt upp,/tv/nyheter/varlden/marklig-slut-pa-flygtur-stannar-plotsligt-upp/
Här skjuts officeren ihjäl av rysk agent,/tv/nyheter/varlden/har-skjuts-officeren-ihjal-av-rysk-agent/
Se enorma rökmolnet efter kraschen i England,/tv/nyheter/varlden/valdsam-flygkrasch-i-storbritannien/
Misslyckas med kupp – försöker råna poliser,/tv/nyheter/varlden/misslyckas-med-kupp-forsoker-rana-poliser-/
9-åring skadas när asfalt sprutas iväg,/tv/nyheter/varlden/9-aring-skadas-nar-asfalt-sprutas-ivag/
Smugglarna jagas av tullen – sätter eld på kokainbåten,/tv/nyheter/smugglarna-jagas-av-tullen-satter-eld-pa-kokainbaten/
Kramkalas mellan Kim Jong-Un och Lavrov,/tv/nyheter/varlden/kramkalas-mellan-kim-jong-un-och-lavrov/
800 SJ-passagerare strandade: ”Kaotiskt”,/nyheter/sverige/800-sj-passagerare-strandade-kaotiskt/
Jättebrand – rök syntes på flera kilometers håll,https://www.expressen.se/nyheter/expressen-direkt/?post=b53713e4-5eb4-474c-8117-26c9dd899f8a
Kan bli rekordvarmt och tropiska nätter,/nyheter/vader/fint-semestervader-nasta--vecka-sol-och-varme/
Hatade djuret sprids med dina badkläder,/nyheter/sverige/hatade-djuret-sprids--med-dina-badklader/
Trump gör honnör – då buar publiken,https://www.expressen.se/tv/nyheter/varlden/trump-gor-honnor-da-buar-publiken
Nära vänner berättar: Trump har förändrats,/nyheter/varlden/mordforsoket-forandrade-trump-religiosa-kanslor/
Elaine skulle springa över 16 mil – dog,/nyheter/varlden/elaine-skulle-springa-over-16-mil-foll-ihop-och-dog/
Bildts förslag sågas: ”Måste besinna sig”,/nyheter/sverige/carl-bildts-forslag-sagas-maste-besinna-sig-/
Slår tillbaka mot myten om kvinnor,/nyheter/sverige/spracker-myten-om-kvinnor-som-inte-foder-barn/
Flyttade till Sardinien för att leta efter sonen,/nyheter/varlden/christina-flyttade-till-sardinien-for-att-leta-forsvunna-sonen/
Så var grevens sista år på slottet,/nyheter/sverige/sa-var-grevens-sista-ar-pa-slottet-trolle-ljungby/
Tre träffade av blixten i samma stad i Florida,/nyheter/varlden/tre-traffade-av-blixten-pa-samma-plats-i-florida/
Tio dödades i Gaza när de köade för vatten,/nyheter/varlden/tio-dodades-i-gaza-nar-de-koade-for-vatten/
Flygkrasch: ”Aldrig sett nåt liknande”,/nyheter/varlden/flygkrasch-utanfor-london-stora-rokmoln/
VIDEO: Enormt rökmoln efter kraschen i England,/tv/nyheter/varlden/valdsam-flygkrasch-i-storbritannien/
Försvunna flickan har hittats oskadd,/nyheter/sverige/forsvunna-flickan-har-hittats-kqfkb/
13 ovanliga museer för sommarutflykten,/nyheter/sverige/13-ovanliga-museer-som-forgyller-din-sommar/
Stoppad från drömresa – Tor fick lämna planet,/nyheter/sverige/tor-17-missade-festival--efter-flygbolagets-besked/
Försöker råna poliser – då går allting snett,https://www.expressen.se/tv/nyheter/varlden/misslyckas-med-kupp-forsoker-rana-poliser-
Förlänger varning om kraftigt skyfall,/nyheter/vader/smhi-utokar-varningen-om-skyfall-igen/
Flera hus i brand efter blixtkaoset,/nyheter/sverige/stort-blixtovader-i-gavle-tre-hus-i-brand/
SMHI: Det betyder regnprocent i apparna,/tv/nyheter/vad-betyder-regnprocenten-i-vaderapparna/
Mobbad för diagnosen: ”Som en fiende i mig”,/nyheter/sverige/emma-23-blev-mobbad-for-sin-tourettes-var-som-en-fiende-i-mig/
Vaknade av jättesmäll: ”Något fruktansvärt”,/nyheter/sverige/micael-42-ryckte-ut-nar-grannhuset-fattade-eld/
Dousas drag efter Trumps nya tullhot,/nyheter/varlden/sa-vill-dousa-tackla-trumps-tullar-sla-maximalt-hart/
Rekordmånga svenskar ska plugga i sommar,/nyheter/sverige/rekordmanga-har-sokt-sommarkurser/
9-åring skadas när asfalten skjuts i väg,https://www.expressen.se/tv/nyheter/varlden/9-aring-skadas-nar-asfalt-sprutas-ivag
Bästa fyndet på Gekås: ”Väldigt nöjd med det”,/nyheter/sverige/sa-var-budgeten-pa-gekas-och-sa-gick-det/
Stort kaos i kassan på Gekås: ”Bara spring”,/nyheter/sverige/maries-kaos-i-kassan-pa-gekas-i-ullared-bara-spring/
Prins Daniel om barnen – innan Parneviks vändning,/nyheter/kungligt/prins-daniel-om-barnen-innan-parneviks-vandning/
Bonde död i Trumps razzia – föll från tak,/nyheter/varlden/en-dod-efter-trumprazzia-foll-fran-tak/
Trump sågas av de egna – slår tillbaka,/nyheter/varlden/interna-epstein-kritiken-mot-trumps-minister/
Minst 40 döda i nya israeliska attacker,/nyheter/varlden/minst-40-doda-i-nya-israeliska-attacker/
Tidigare chefens kritik: ”Olyckligt”,/nyheter/sverige/forre-sapochefen-klas-friberg-de-drar-lardom-av-skandalen/
Skarpa varningen: Sluta kissa i havet,/nyheter/sverige/expertens-varning-sluta-kissa-i-havet/
Smugglare jagas av tullen – sätter eld på kokainbåten,/tv/nyheter/smugglarna-jagas-av-tullen-satter-eld-pa-kokainbaten/
Nordkoreanska diktatorn möts av varmt kramkalas,/tv/nyheter/varlden/kramkalas-mellan-kim-jong-un-och-lavrov/
"Grannen sköt mot ”Johan”, 55: ”Panik”",/nyheter/sverige/grannen-skot-mot-johan-55-ren-panik/
Experten: Då kan din granne bli farlig,/nyheter/sverige/experten-da-kan-din-granne-bli-farlig/
Man död i natt – blev påkörd av en polisbil,/nyheter/sverige/man-dod-efter-trafikolycka-i-fagersta-pakord-av-polis-/
Trump i ny attack mot reporter: ”Mycket ond”,/tv/nyheter/varlden/trump-i-ny-attack-mot-reporter-mycket-ond/
Wagnertoppen flydde från Putin – till Finland,/nyheter/varlden/rysk-wagnersoldat-soker-asyl-i-finland/
Väldigt stökig festnatt – mat och flaskor kastades,/nyheter/sverige/stokig-festkvall-i-landet-flera-fall-av-misshandel/
Gisèle Pelicot får fransk hedersutmärkelse,/nyheter/varlden/gisele-pelicot-far-fransk-hedersutmarkelse/
Putins träningsråd – bryter ut i skratt,https://www.expressen.se/tv/nyheter/varlden/putins-traningsrad-bryter-ut-i-skratt/
Spa-snusket: Musbajs och mögel,/nyheter/sverige/snusket-pa-svenska-spa-anlaggningar/
Helvetet med doktor Berne,/nyheter/sverige/asa-vesterlund-om-skracklivet-med-doktor-fredrik-berne/
”Jag är svartlistad från allt”,/nyheter/sverige/patrik-sjoberg-jag-ar-svartlistad-fran-alla-uppdrag/
Paniken i firandet när stången välter,/tv/nyheter/sverige/har-faller-midsommarstangen-i-rattvik/
