Heading,URL
Här stjäl tjuvarna lyx för miljoner i Malmö,/tv/nyheter/sverige/har-stjal-tjuvarna-vaskor-for-45-miljoner-kronor/
Slår ut Putins supervapen – värt 400 miljoner,/tv/nyheter/varlden/slar-ut-putins-supervapen-vart-400-miljoner/
Scania-buss i lågor – minst 25 döda,/tv/nyheter/varlden/scaniabussen-blir-ett-eldhav-/
Putins sarkastiska toa-hämnd på EU,/tv/nyheter/varlden/putins-toalettskamt-till-eu/
Planet kraschar – två döda,/tv/nyheter/varlden/planet-kraschar-tva-doda/
Här urartar mammornas bråk på leklandet,/tv/nyheter/varlden/har-urartar-mammornas-brak-pa-leklandet/
Pinsamma missen under skönhetstävlingen,/tv/nyheter/varlden/pinsamma-missen-under-skonhetstavlingen/
Ger 12 000 kronor till kyrkan – förnedras av pastorn,/tv/nyheter/varlden/ger-12-000-kronor-till-kyrkan-fornedras-av-pastorn/
JUST NU: Kvinna gripen efter hotellfest,https://www.expressen.se/nyheter/expressen-direkt/?post=daee481b-db97-4f03-8e7b-72fd770eda27
JUST NU: Allvarlig olycka,https://www.expressen.se/nyheter/expressen-direkt/?post=deb413c5-8bc5-4cdc-b8c9-acccb5a24935
JUST NU: Grov våldtäkt i park,/nyheter/sverige/misstankt-grov-valdtakt-i-pildammsparken-i-malmo-/
Bastionen kan falla: ”Är bortom kritiskt”,/nyheter/varlden/viktiga-pokrovsk-riskerar-att-falla-bortom-kritiskt/
Ryska ilskan: Tror inte på det själva,/nyheter/varlden/ryska-ilskan-tror-inte-pa-det-sjalva/
Putins sarkastiska toa-hämnd på EU,/tv/nyheter/varlden/putins-toalettskamt-till-eu/
Lyfts i storm – sen sker det ”overkliga”,/tv/nyheter/varlden/har-forsvinner-surfaren-rakt-upp-i-himlen/
Ung man död efter skott – flera personer gripna,/nyheter/sverige/uppgifter-tva-personer-skjutna-i-sodertalje/
"Ava, 23, död efter bisarra olyckan",/nyheter/varlden/ava-23-dod-i-bisarr-olycka-traffade-henne-i-huvudet/
Kvinna hölls fånge i garage – i fem år,/nyheter/varlden/kvinna-inlast-i-fem-ar-i-garage-lyckades-fly/
"Tom, 28, bad om lön – då fick han sparken",/nyheter/varlden/tom-boyd-28-bad-om-lon-fick-sparken/
Ivan är årets polishund: ”Ger sig aldrig”,/nyheter/krim/ivan-ar-arets-polishund-har-forhindrat-mord/
Nytt världsrekord: 283 mil på en tank,https://teknikensvarld.expressen.se/nyheter/bil-och-trafik/varldsrekord-i-snalkorning-283-mil-pa-en-tank/
Rundar fronten – träffar mål efter mål,/tv/nyheter/varlden/slar-ut-putins-supervapen-vart-400-miljoner/
Buss med tonåringar i krasch – man död,/nyheter/sverige/allvarlig-olycka-vid-hestra-buss-och-bil-i-frontalkrock/
Scania-buss i lågor – minst 25 döda,/tv/nyheter/varlden/scaniabussen-blir-ett-eldhav-/
Iskylan när lastbilen kommer sladdande,/tv/nyheter/varlden/fotgangarens-iskyla-nar-lastbilen-kraschar/
Här försvinner surfaren – rakt upp i himlen,/tv/nyheter/varlden/har-forsvinner-surfaren-rakt-upp-i-himlen/
Slår ut Putins supervapen – värt 400 miljoner,/tv/nyheter/varlden/slar-ut-putins-supervapen-vart-400-miljoner/
Planet kraschar – två döda,/tv/nyheter/varlden/planet-kraschar-tva-doda/
Här stjäl tjuvarna lyx för miljoner i Malmö,/tv/nyheter/sverige/har-stjal-tjuvarna-vaskor-for-45-miljoner-kronor/
Flyktbilens galna manövrar i jakten,/tv/nyheter/sverige/vilda-biljakten-i-vasteras-se-vansinnesfarden/
Scania-buss i lågor – minst 25 döda,/tv/nyheter/varlden/scaniabussen-blir-ett-eldhav-/
Gängtoppen har gripits på Arlanda,/nyheter/sverige/gangtoppen-ranjdar-karwan-gripen-pa-arlanda/
Aftonbladets Gaza- reporter hyllar terror,/nyheter/sverige/aftonbladets-gaza-reporter-muhammad--al-masry-hyllar-terror-far-fortsatta/
”Gyllene flotta” ska sätta skräck i Kina,/nyheter/varlden/donald-trump-ska-skapa-en-ny-gyllene-flotta/
"Lola, 12, mördades – kvinna döms till livstid",/nyheter/varlden/kvinna-doms-till-livstid-for-mordet-pa-12-ariga-lola/
SD-toppen rasar: ”Det är horribelt”,/nyheter/politik/sd-kraver-battre-koll-fullstandigt-horribelt/
Då vill Trump träffa Kim: ”Han vet att jag ska dit”,/nyheter/varlden/trump-vill-traffa-kim-under-asienresan/
Svantessons svar: Då kan Sverige få euron,/nyheter/politik/elisabeth-svantesson-m-sa-lang-tid-kan-det-ta-att-infora-euron/
Nya bilderna visar Trumps förstörelse,/nyheter/varlden/trump-har-jamnat-vita-husets-ostra-flygel-med-marken/
Trumps överraskning – skisser på Nato-mötet,/tv/nyheter/varlden/trump-avslojar-sa-blir-nya-balsalen/
Därför kan du vara hjärtfrisk trots fetma,/nyheter/varlden/darfor-kan-vissa-vara-hjartfriska-trots-fetma/
Känslosamma orden om Birgittas livsbeslut,/nyheter/kungligt/dotterns-kanslosamma-ord-om-prinsessan-birgittas-livsbeslut/
Marcus blev utskälld efter besök på buffé,/nyheter/sverige/marcus-at-fyra-pannbiffar-pa-buffe-blev-utskalld/
Här kraschar planet – slukas i ett eldmoln,/tv/nyheter/varlden/planet-kraschar-tva-doda/
Föräldrarna har släppts,/nyheter/sverige/pojke-i-forskolealder-dod-foraldrarna-anhallna/
SMHI varnar för snö – risk för trafikproblem,/nyheter/vader/smhi-varnar-for-sno/
Putins sarkastiska toa-hämnd på EU,https://www.expressen.se/tv/nyheter/varlden/putins-toalettskamt-till-eu
Flyktbilens galna tvärsvängar i jakten,/tv/nyheter/sverige/vilda-biljakten-i-vasteras-se-vansinnesfarden/
Rättegång mot nazister flyttas av säkerhetsskäl,/nyheter/krim/rattegang-mot-nazister-flyttas-av-sakerhetsskal/
Kusliga känslan – sen klev han i ryska fällan,/nyheter/varlden/spionkurirens-sista-resa-slutade-i-katastrof/
Ryska spioneriet: ”Inte turistbilder”,/tv/nyheter/har-ror-sig-ryska-spioner-inte-turistbilder/
Estonia används för ryskt spionage,/nyheter/varlden/misstanken-ryssland-kan-anvanda-estonia-for-att-spionera/
Skickade tusentals sms till elev – förlorar jobbet,/nyheter/sverige/olampliga-chattar-med-elever-allt-fler-larare-forlorar-legitimationen/
EU-toppens schema – lunchar med kungen,/nyheter/kungligt/eus-von-der-leyen-hos-kungen/
Ö-mysteriet: Döda kroppar spolas upp,/nyheter/varlden/mysteriet-pa-trinidad-uppspolade-kroppar-pa-stranden/
Lastbil sladdar – då gör fotgängaren det iskalla,https://www.expressen.se/tv/nyheter/varlden/fotgangarens-iskyla-nar-lastbilen-kraschar
Genombrott efter tio år – anhörig häktad för mord,/nyheter/krim/genombrott-efter-tio-ar-anhorig-gripen-igen/
Nytt fängelsestraff på obestämd tid,/nyheter/politik/regeringen-nya-straffet-sakerhetsforvaring-infors-i-var/
Restaurangen brinner ner – två personer gripna,https://www.expressen.se/nyheter/expressen-direkt/?post=562411b4-37cc-4c99-9ae4-2a7032030b05
Vädersmocka hotar: Snöområden drar in,/nyheter/vader/nu-kommer-hostrusket-med-regn-kyla-och-sno/
Bästa vinterdäcken för dig och din bil,https://teknikensvarld.expressen.se/nyheter/konsument/stort-test-basta-vinterdacken-for-dig-och-din-bil/
Storbråk mitt på Avenyn – 20 personer inblandade,https://www.expressen.se/nyheter/expressen-direkt/?post=6104ad90-e8d3-4de4-b8a4-33ee61e385f8
Kontakta redaktionen direkt,/nyheter/har-du-ett-nyhetstips-eller-bilder/
Snusket på Stureplanskrogarna,/nyheter/sverige/stureplanskrogar-inifran-rattspillning-i-torrforrad/
Spa-snusket: Musbajs och mögel,/nyheter/sverige/snusket-pa-svenska-spa-anlaggningar/
Rysk jättebombare flög utanför Sverige,/tv/nyheter/sverige/har-gar-sverige-upp-och-moter-ryska-bombplanet/
