Heading,URL
Bilderna från Carters begravning väcker frågor,/tv/nyheter/varlden/bilderna-fran-carters-begravning-vacker-fragor/
Här fintar rådjuret vargen,/tv/nyheter/sverige/vargens-forvirring-grundluras-av-radjuret/
Kusliga bilderna visar: Så fort sprider sig elden,/tv/nyheter/varlden/kusliga-bilderna-visar-sa-fort-sprider-sig-elden/
Mexikos svar till Trump: Byt namn på USA,/tv/nyheter/mexikos-svar-till-trump-byt-namn-pa-usa/
Trafikbråket spårar ur – börjar spotta,/tv/nyheter/sverige/trafikbraket-sparar-ur-borjar-spotta/
Polisbilen kraschar under jakt i centrala Stockholm,/tv/nyheter/sverige/polisbilen-kraschar-under-jakt-i-centrala-stockholm/
Fast i huset – omringade av eldinfernot,/tv/nyheter/varlden/fast-i-huset-omringade-av-eldinfernot/
Rekordstora giftspindeln inlämnad för att mjölkas,/tv/nyheter/varlden/rekordstora-giftspindeln-inlamnad-for-att-mjolkas/
Storbrand på rysk oljedepå: ”Nödläge”,/tv/nyheter/varlden/rysk-militar-oljedepa-i-lagor-/
JUST NU: Explosion vid port,/nyheter/sverige/explosion-i-stockholm-8empc/
JUST NU: Man gripen – ny brand hotar lyxområde,/nyheter/varlden/ny-brand-i-los-angeles-i-stjarnfyllda-hidden-hills/
Se obehagliga bilderna på plats,https://www.expressen.se/tv/nyheter/varlden/varnar-kan-bli-varre-vindar-igen
Ozempic-staden står för halva Danmarks tillväxt,/nyheter/sverige/ozempic-staden-kalundborg-star-for-halva-danmarks-tillvaxt/
Knepet på Grönland: ”Är djupt osmakligt”,/nyheter/varlden/trump-jrs-besok-pa-gronland-ifragasatts-djupt-osmakligt/
Danska beskedet till Trump: ”Förberedda”,/nyheter/varlden/danska-partiledare-i-krismote/
Trumps ”grönlänning”: Vi utnyttjas – köp oss,/tv/nyheter/varlden/trumps-gronlanning-kop-oss-kop-gronland/
Mellanstadieelever fick ”runkläxa”,/nyheter/sverige/skolskoterska-atalas-for-sexovergrepp-mot-barn/
Rekordstora dödsspindeln ska mjölkas,/tv/nyheter/varlden/rekordstora-giftspindeln-inlamnad-for-att-mjolkas/
Här dyker ”Ikea” upp i nordkoreansk galleria,/nyheter/sverige/har-dyker-ikea-upp-i-nordkorea/
Kvinnan går till attack på bussar i Linköping,https://www.expressen.se/tv/nyheter/sverige/kvinnan-attackerar-pa-bussar-i-linkoping
Märkliga incidenten på ryska flygplatsen,https://www.expressen.se/tv/nyheter/varlden/markliga-incidenten-pa-ryska-flygplatsen
Bakom kulisserna på nya storsatsningen,/nyheter/laget/bianca-ingrosso-tillbaka-med-nya-pratshowen-bianca-by-night/
Här nobbas Trump under begravningen,/tv/nyheter/varlden/kyliga-markeringen-mot-trump-mitt-under-begravningen/
Bilderna från Carters begravning förbryllar,https://www.expressen.se/tv/nyheter/varlden/bilderna-fran-carters-begravning-vacker-fragor
Mexikos svar – på Trumps namnbyte,/tv/nyheter/mexikos-svar-till-trump-byt-namn-pa-usa/
Cyklistens påpekande får bilisten att se rött,/tv/nyheter/sverige/trafikbraket-sparar-ur-borjar-spotta/
Vattnet river med sig allt i islams heliga stad,/tv/nyheter/varlden/vattnet-river-med-sig-allt-i-/
Här avfyrar Nordkorea årets första robot,/tv/nyheter/varlden/har-avfyrar-nordkorea-arets-forsta-robot-/
Kvinnan nekas alkohol – börjar slåss på flyget,/tv/nyheter/varlden/kvinnan-nekas-alkohol-borjar-slass-pa-flyget/
Kökaoset i fjällen – elbilarna på rad,/tv/nyheter/sverige/kokaos-i-fjallen-lang-vantan-for-att-ladda-bilen/
Växeln nedringd – alla vill höra Ing-Maris röst,/tv/nyheter/sverige/olandsk-telefonsvarare-nedringd-tack-vare-81-ariga-ing-mari/
Mathias äckliga fynd bakom elcentralen,/tv/nyheter/sverige/ackliga-upptackten-bakom-elskapet-/
Turistbussen tappar kontrollen i svenskparadiset,/tv/nyheter/varlden/turistbuss-i-pattaya-kraschar-in-i-betongen/
Larmet vid fronten: Glidbomb på ingång,/nyheter/varlden/uppdraget-skjuta-ner-putins-kamikazedronare/
”Vi släpper inte förbi något”,/tv/nyheter/varlden/filmerna-fran-krigszonen-forsvarar-med-kulsprutor/
"Globalt värmerekord – 1,5 grader passerat",/nyheter/varlden/varmerekord-for-nastan-hela-klotet/
Lavinvarningar i svenska fjällen,/nyheter/sverige/lavinlaget-farligt-i-delar-av-fjallvarlden/
Elon Musk plan: Avsätta Starmer innan nästa val,/nyheter/varlden/elon-musk-plan-avsatta-starmer-innan-nasta-val/
Kastade död gris på moské: ”Markerar”,/nyheter/sverige/kastade-dod-gris-pa-moske-markerar/
Mitt i brandinfernot: Försäkringskris i LA,/nyheter/varlden/forsakringskris-i-los-angeles-mitt-i-brandinfernot/
Miljardären anklagas för våldtäkt – av sin syster,/nyheter/varlden/sam-altman-anklagas-for-sexuella--overgrepp-av-sin-egen-syster/
Nya spritkrav i M pressar ministern,/nyheter/sverige/interna-m-kravet-mer-modern-alkoholpolitik/
Trumps val för Sverige – stoppades i senaten,/nyheter/varlden/donald-trumps-val-till-ambassador-i-sverige/
Intagen ville lyssna på Gaboro – fick nej,/nyheter/sverige/intagen-ville-lyssna-pa-gaboro-nekades/
Sexualbrottslingen slapp behandling: ”Inte startklar”,/nyheter/sverige/sexforbrytaren-slapp-behandling-inte-startklar/
Varningen till Danmark: ”Trump menar allvar”,/nyheter/varlden/varningen-till-danmark-trump-menar-allvar/
Stödet till Danmark – går emot Trump,/nyheter/sverige/kristerssons-stod-till-danmark/
Skolläkarens klinik för omskärelser stänger,/nyheter/sverige/skollakarens-klinik-for-omskarelser-i-goteborg-stanger/
Stor insats – inkastat föremål på restaurang,/nyheter/sverige/stor-polisinsats/
Svensk man gripen av specialpolis i Albanien,/nyheter/sverige/svensk-man-gripen-av-specialpolis-i-albanien/
Kremls hemliga plan – när kriget är över,/nyheter/varlden/kremls-hemliga-plan-inforliva-belarus-i-ryssland/
Här är Eagle S ankare – bärgat från havsbotten,/nyheter/sverige/har-ar-eagle-s-ankare/
Kusliga bilderna: Så fort sprider sig elden,/tv/nyheter/varlden/kusliga-bilderna-visar-sa-fort-sprider-sig-elden/
Försökte rädda sitt hem – dog i lågorna,/nyheter/varlden/victor-66-dog-i-eldinfernot-i-los-angeles/
Kjell-Olof Feldt är död – ex-ministern blev 93,/nyheter/sverige/kjell-olof-feldt-dod/
Polisen kraschar bilar under jakt Södermalm,/tv/nyheter/sverige/polisbilen-kraschar-under-jakt-i-centrala-stockholm/
Putin om bråket kring Grönland: ”Följer noga”,/nyheter/varlden/kreml-om-gronland-dramatisk-utveckling/
Gängledaren får gå efter SD-bröllopet,/nyheter/gangledare-tvingades-ga--efter-akessons-brollop-/
Varnar: Mc-gängen ökar i Sverige,/nyheter/sverige/ny-rapport-de-kriminella-mc-gangen-okar-i-sverige/
Han mördade sin fru med svärd – döms nu,/nyheter/sverige/37-aring-dodade-sin-fru-med-svard-doms-till-livstids-fangelse-/
Orange varning – risk för kraftigt snöfall och blåst,/nyheter/sverige/orange-snovarning-pa-gotland/
Svenska vapnet skjuter prick på ryska styrkorna,/nyheter/varlden/svenska-stridsvagnen-skjuter-prick-pa-ryska-styrkor-/
Så har de byggt om svenska stridsvagnen,/tv/nyheter/varlden/sa-har-de-byggt-om-svenska-stridsvagnen/
Polisen varnar: ”Mycket farlig” medicin stulen,/nyheter/sverige/veterinarnarkotika-stulet-polisen-varnar-livsfara/
"Tommy, 57, fick första bilden på ryska ubåten",/nyheter/sverige/tommy-57-motte-ryska-krigsubaten/
Paasikivis teori om de ryska fartygen,/nyheter/sverige/paasikivi-ryska-fartygen-i-kattegatt-trolig-markering/
Greps på Arlanda – åtalas för terrorbrott,/nyheter/sverige/22-aring-atalas-for-terrorbrott/
Häktas för Ica Maxi-dåd,/nyheter/sverige/26-aring-begars-haktad-for-mordet-pa-ica-maxi-/
Person träffad av stol – kastades från skola,/nyheter/sverige/stol-kastades-fran-skola-traffade-person/
Meta slutar faktagranska – men fortsätter i EU,/nyheter/varlden/meta-slutar-faktagranska-drojer-i-eu/
SMHI:s nya varning: Snön på väg tillbaka,/nyheter/sverige/smhi-snovarnar-8frkv/
Gravida Noras rädsla för exet innan mordet,/nyheter/sverige/vannen-berattar-gravida-nora-radd-for-sitt-ex-fore-mordet/
Försvarsmakten köper in Leopard 2: ”Avgörande”,/nyheter/sverige/sverige-koper-tyska-stridsvagnar/
Uber tjänar miljarder – så lite får förarna,/nyheter/sverige/uber-tjanar-miljarder-sa-lite-far-forarna/
Växeln nedringd – alla vill höra Ing-Maris röst,/tv/nyheter/sverige/olandsk-telefonsvarare-nedringd-tack-vare-81-ariga-ing-mari/
Våldtogs av Kapten klänning,/nyheter/sverige/sanna-35-valdtogs-av-kapten-klanning/
Mörkade läckor för regeringen,/nyheter/sverige/las-expressens-avslojanden-om-skandalen-pa-lantmateriet/
Sexanmälan avslöjade pengarna till gängman,/nyheter/sverige/sexanmalan-avslojade-pengarna-till-gangman/
"Vad hände då Molly, 14, dog?",/nyheter/sverige/mollys-hemlighet-sista-festen-som-tar-hennes-liv/
