Heading,URL
Mystiska ljusklotet flyger över Moskva,/tv/nyheter/varlden/mystiska-ljusklotet-flyger-over-moskva/
Här fångas snuskiga inbrottet av kameran,/tv/nyheter/varlden/bryter-sig-in-gor-det-snuskiga/
Influencern skrämmer kvinnor på tunnelbanan,/tv/nyheter/varlden/influencern-skrammer-kvinnor-pa-tunnelbanan-/
Trumps syrliga passning till Putin,/tv/nyheter/varlden/trumps-syrliga-passning-till-putin/
Elbilen exploderar i lågor – flyr för sina liv,/tv/nyheter/varlden/elbilen-exploderar-i-lagor-flyr-for-sina-liv-/
Kraftig brand utanför Moskva,/tv/nyheter/varlden/kraftig-brand-utanfor-moskva/
Missen – tror flygvärdinnan kapar planet,/tv/nyheter/varlden/pilotens-miss-tror-flygvardinna-ska-kapa-planet/
Krabbkaos på Julön – hela ön färgas röd,/tv/nyheter/varlden/krabbkaos-pa-julon-hela-on-fargas-rod-/
Här får Trump feeling,/tv/nyheter/varlden/har-far-trump-feeling/
JUST NU: Nödläge utlyst i Ryssland,https://www.expressen.se/tv/nyheter/varlden/nodlage-utlyst-i-ryssland
Oron om Trumps hälsa – efter bild,/nyheter/varlden/ny-oro-om-trumps-halsa-efter-hans-avslojande-och-barnbarnets-bild/
Joe Biden varnar för Trump: ”Mörka dagar”,/nyheter/varlden/joe-bidens-varning-ar-morka-dagar/
S-kängan: Tidö har panik – ingen politik,/nyheter/politik/s-toppen-darfor-backade-vi-om-hyresratter/
Här finns Sveriges bästa äldreomsorg,/nyheter/sverige/det-ar-sveriges-basta-hemtjanst-och-sarskilt-boende/
"Salma, 36, återvandrar – på grund av Prideflaggan",/nyheter/varlden/salma-36-atervandrar-pa-grund-av-prideflaggan/
Elon Musks ord om mordet på svenskan,/nyheter/varlden/elon-musks-ord-om-mordet-pa-svenska-zaida-catalan/
Karen ville gå ner i vikt – nu är hon död,/nyheter/varlden/karen-ville-ga-ner-i--vikt-nu-ar-hon-dod/
Snuskiga inbrottet fångas av kameran,/tv/nyheter/varlden/bryter-sig-in-gor-det-snuskiga/
30-åringens bebis förbluffade läkarna,/nyheter/varlden/30-aringens-jattebebis-forbluffade-lakarna-bilderna-fran-forlossningen/
Regnsmocka närmar sig: ”Då brakar det på”,/nyheter/vader/sa-blir-hostlovsvadret-brakar-pa/
Mystiska ljusklotet flyger över Moskva,/tv/nyheter/varlden/mystiska-ljusklotet-flyger-over-moskva/
Grips efter larm från tunnelbanan,/tv/nyheter/varlden/influencern-skrammer-kvinnor-pa-tunnelbanan-/
Nödläge utlyst i Ryssland,/tv/nyheter/varlden/nodlage-utlyst-i-ryssland/
Här flyger planet in i stormens öga,/tv/nyheter/varlden/har-flyger-planet-in-i-stormens-oga/
Rysk damm förstörd i ukrainsk attack,/tv/nyheter/varlden/rysk-damm-forstord-i-ukrainsk-attack/
Streamerns panik när skalvet slår till,/tv/nyheter/varlden/streamerns-panik-nar-skalvet-slar-till/
Här kör Expressen genom ett kolsvart Stockholm,/tv/nyheter/varlden/har-kor-expressen-genom-ett-kolsvart-stockholm/
Mystiska ljusklotet flyger över Moskva,/tv/nyheter/varlden/mystiska-ljusklotet-flyger-over-moskva/
Efter USA:s tips – slår till i svenskparadiset,/tv/nyheter/varlden/efter-usas-tips-slar-till-i-svenskparadiset/
"Olle, 82, såg sin skjutna vän på gården",/tv/nyheter/sverige/olle-82-sag-sin-skjutna-van-pa-garden-/
Här fångas snuskiga inbrottet av kameran,/tv/nyheter/varlden/bryter-sig-in-gor-det-snuskiga/
Putin fruktar kupp – anklagar miljardär,/nyheter/varlden/putin-fruktar-kupp-anklagar-miljardaren/
”Putins guddotter” uppges fly Ryssland,/nyheter/varlden/uppgifter-nu-flyr-putins--guddotter-fran-ryssland/
Landets ledare: Minister ”gravid – med 83 barn”,/nyheter/varlden/landets-ledare-minister--gravid-med-83-barn/
Hotfulla lappen vid mördade kroppen,/nyheter/varlden/hotfulla-lappen-vid--mordoffrets-kropp/
Stora oron för Marie: ”Greppar halmstrån”,/nyheter/sverige/cancersjuka-kraver-svar-efter-medicinavslojande/
Nya larm om cancer- medicin: Risk att dö,/nyheter/sverige/nya-larm-om-vanliga-cancermedicinen-allvarligt/
Stoppar ryskt köp,/nyheter/varlden/finland-stoppar-ryskt-kop-av-skargardstomt/
Värsta orkanen hittills – närmar sig Jamaica,/nyheter/varlden/melissa-kraftigaste-orkanen-i-ar-vantas-sla-mot-jamaica/
Planet fångar makalös film från ”stormens öga”,/tv/nyheter/varlden/har-flyger-planet-in-i-stormens-oga/
”Är dags” – Trumps hot mot presidenten,/nyheter/varlden/trump-hotet-mot--presidenten-ar-dags-for-honom/
Venezuela: Har gripit CIA-agenter,/nyheter/varlden/maduro-vi-har-gripit-cia-agenter/
Ukrainas plan – efter Trumps ord,/nyheter/varlden/ukrainas-plan-efter-trumps-ord/
Putins drag mot Trump: Avslutar kärnvapenavtal,/nyheter/varlden/putins-drag-mot-trump-avslutar-karnvapenavtal/
Syrliga piken efter kärnvapenhotet,https://www.expressen.se/tv/nyheter/varlden/trumps-syrliga-passning-till-putin
Sida slår tillbaka: Vi sponsrar inte Hamas,/nyheter/sverige/sida-vi-sponsrar-inte-terrorism/
Saab vill öppna fabrik i Ukraina,/nyheter/varlden/saab-vill-oppna-fabrik-i-ukraina/
Olles vän sprang in med skottskada,/nyheter/sverige/olle-sag-skottskadade-vannen-springa-in-pa-garden-i-klippan/
Man ihjälskjuten – flera vapen har beslagtagits,/nyheter/sverige/skjuten-man-hittad-i-skog-i-klippan/
Prinsessan överraskade – bilder från galakvällen,/nyheter/kungligt/kunglig-glans-pa-premiar-for-alexandra-charles/
Försvarsmaktens nya vapen: Ytterligare steg,/nyheter/sverige/forsvarsmaktens-nya-vapen/
Gåtan med krascherna – Trump: Inget sabotage,/nyheter/varlden/efter-dubbla-krascherna-trump-nekar-till-sabotage/
"Slår till vid turistön – hittar 6,5 ton kokain",/tv/nyheter/varlden/efter-usas-tips-slar-till-i-svenskparadiset/
Thailands regler – efter dödsfallet,/nyheter/varlden/riktlinjerna-i-thailand-efter-drottningens-dod/
Larm om fågelinfluensa – 1 000 kalkoner avlivas,/nyheter/sverige/fagelinfluensa-konstaterad-pa-kalkonfarm-i-skane/
Polisens varning inför halloween,/nyheter/sverige/polisens-varning-infor-halloween-att-bara-leksaksvapen-kan-bli-farligt/
Bianca Ingrossos stalker döms igen,https://www.expressen.se/nyheter/expressen-direkt/?post=2e789745-12cf-4a9a-902f-ec1a4e427e2d
Spara tusenlappar – välj rätt bilförsäkring,https://teknikensvarld.expressen.se/nyheter/konsument/valj-ratt-bilforsakring-manga-tusenlappar-att-spara/
Svenskar försvann i albansk nationalpark,/nyheter/varlden/svenskar-forsvann-i-albansk-nationalpark/
Peth-tester slopas efter kritikstormen,/nyheter/sverige/efter-kritiken-peth-test-for-korkort-kan-slopas/
Larmar om Melissa – starkast någonsin,/nyheter/varlden/megaorkanen-melissa-narmar-sig-jamaica-tusentals-evakueras/
Melania hånas efter krigsorden,https://www.expressen.se/tv/nyheter/varlden/kremls-diss-mot-melania-trump-
Trumps blixtändring efter arga samtalet,/nyheter/varlden/donald-trumps-varning-till-mike-pence-innan-stormningen/
Putin-toppens kaxiga besked,/nyheter/varlden/kirill-dmitrijevs-kaxiga-besked-om-oljesanktionerna-putins-man-i-usa/
Parets mardröm: Först Northvolt – nu Stegra,/nyheter/sverige/boden-haller-andan-stalbolaget--stegra-riskerar-konkurs/
"Saria, 13: ”Känns lite läskigt när jag går ut”",/nyheter/krim/tredje-dodskjutningen-i-ar-i-gavle--/
Man gripen efter dödsskjutningen,/nyheter/krim/sorg-efter-ny-skjutning-i-gavle-/
Politikernas ilska efter helgens våldsdåd,/nyheter/politik/politikers-ilska-efter-helgens-valdsdad--/
30 ”skuggfartyg” – på bara en vecka,/nyheter/sverige/jakligt-manga-ryska-skuggfartyg-i-finska-viken/
Flera bilar i olycka – köer på morgonen,https://www.expressen.se/nyheter/expressen-direkt/?post=1c36b49e-bf04-44cc-9a15-4c1bc3e1c974
M-topparna pekas ut i hemlig mätning,/nyheter/politik/moderaternas-fargkarta-ska-ge-valvinst-nasta-ar/
Kontakta redaktionen direkt,/nyheter/har-du-ett-nyhetstips-eller-bilder/
Snusket på Stureplanskrogarna,/nyheter/sverige/stureplanskrogar-inifran-rattspillning-i-torrforrad/
Spa-snusket: Musbajs och mögel,/nyheter/sverige/snusket-pa-svenska-spa-anlaggningar/
"Stjäl lyx för 4,5 milj – på 100 sekunder",/tv/nyheter/sverige/har-stjal-tjuvarna-vaskor-for-45-miljoner-kronor/
