Heading,URL
Trumps nya hårda attack mot Europa,/tv/nyheter/varlden/trumps-nya-harda-attack-mot-europa/
Här dundrar lavinen nerför berget,/tv/nyheter/varlden/har-blir-svenskarna-vittnen-till-lavinen/
Ukraina slår mot viktiga robot-fabriken,/tv/nyheter/varlden/ukraina-slar-mot-viktiga-robot-fabriken/
Tvingas nödlanda – ”blod och tänder” överallt,/tv/nyheter/varlden/tvingas-nodlanda-blod-och-tander-overallt/
Skräcken i skidbacken efter oväntade besöket,/tv/nyheter/skracken-i-skidbacken-efter-ovantade-besoket/
Eldkaoset på motorvägen – flera döda i explosion,/tv/nyheter/varlden/eldkaoset-pa-motorvagen-flera-doda-i-explosion/
Parets förbjudna snusk vid tempelaltaret,/tv/nyheter/varlden/parets-forbjudna-snusk-vid-tempelaltaret-/
Trumps märkliga hot mot regimen,/tv/nyheter/varlden/trumps-markliga-hot-fantastiskt/
Totalt snökaos lamslår Moskva,/tv/nyheter/varlden/moskva-lamslaget/
JUST NU: Pojke stickskadad,https://www.expressen.se/nyheter/expressen-direkt/?post=3db9364c-fb2a-4b4d-984f-03361e4fab16
JUST NU: Elva barn evakuerade,https://www.expressen.se/nyheter/expressen-direkt/?post=c8714a3f-c9d7-48f6-bd40-f36c8b1838f9
JUST NU: Risk för trafikkaos,https://www.expressen.se/nyheter/expressen-direkt/?post=4309b185-639c-44a6-a98b-600191653732
Trumps plan sågas inifrån: Varför jävlas?,/nyheter/varlden/donald-trump-svarar-med-nya-tullar-kritiken-varfor-javlas/
Orden om Europa: Länderna pekas ut,/tv/nyheter/varlden/trumps-nya-harda-attack-mot-europa/
Trumps raseri mot: ”Skam för familjerna”,/nyheter/varlden/donald-trumps-raseri-mot--domarna-han-nominerade/
Kan få betala 1 580 miljarder,/nyheter/varlden/trumps-regering-kan-tvingas-betala-tillbaka-1-580-miljarder/
Nya bilderna avslöjar livet före styckmordet,/nyheter/krim/nya-bilderna-avslojar-vilma-anderssons-liv-fore-mordet/
Gigantisk explosion på motorväg – flera döda,/tv/nyheter/varlden/eldkaoset-pa-motorvagen-flera-doda-i-explosion/
Tiobarnsmammans sluga plan lurade alla,/nyheter/sverige/atalet-tiobarnsmammans-bluff-gav-630000-i-bidrag/
Trump om gripandet av ex-prins Andrew,/tv/nyheter/trump-det-ar-skamligt/
Alla stängs av: ”Blod och tänder överallt”,/tv/nyheter/varlden/tvingas-nodlanda-blod-och-tander-overallt/
Prinsessan anklagas: ”Otroligt etikettsbrott”,/nyheter/kungligt/prinsessan-anklagas-otroligt-etikettsbrott/
Mullornas plan om Trump attackerar,/nyheter/varlden/bilderna-visar--iran-rustar-infor-mojlig-trumpattack/
Jorma blev påkörd av tåg – två gånger,/nyheter/sverige/jorma-dodades-av-taget-trots-tillbud-dagen-fore/
Oväntade besöket i skidbacken: ”Skrek”,/tv/nyheter/skracken-i-skidbacken-efter-ovantade-besoket/
Bilderna visar nya taktiken mot Putin,/tv/nyheter/varlden/bilderna-avslojar-nya-taktiken-mot-putin/
"Trumps utspel efter tullbeslutet: ""Jag kan göra vad jag vill""",/tv/nyheter/varlden/trumps-utspel-efter-tullbeslutet-jag-kan-gora-vad-jag-vill/
Här dundrar lavinen nerför berget,/tv/nyheter/varlden/har-blir-svenskarna-vittnen-till-lavinen/
Ukraina slår mot viktiga robot-fabriken,/tv/nyheter/varlden/ukraina-slar-mot-viktiga-robot-fabriken/
Hon lämnar barnen i Ubern – i två timmar,/tv/nyheter/varlden/hon-lamnar-barnen-i-ubern-i-tva-timmar/
Asos grundare död – föll 17 våningar,/tv/nyheter/varlden/asos-grundare-dod-foll-/
Trumps nya hårda attack mot Europa,/tv/nyheter/varlden/trumps-nya-harda-attack-mot-europa/
17-åring slet fram soft air gun vid Donken – döms,/tv/nyheter/sverige/17-aring-slet-fram-soft-air-gun-vid-donken-doms-/
"Svenska Felix, 18, såg dödslavinen",/nyheter/varlden/felix-18-bevittnade-lavinen-i-sankt-anton/
Film visar: Här dundrar lavinen nerför berget,/tv/nyheter/varlden/har-blir-svenskarna-vittnen-till-lavinen/
Filmklippet sprids av nazister och Hamas,/nyheter/sverige/sd-pa-kna-i-israel-sprids-av-nazister-och-hamas/
Lärarvikarie misstänks för 50 barnvåldtäkter,/nyheter/sverige/lararvikarie-misstanks-for-50-barnvaldtakter/
"Zaina, 23, utvisas: ”Jag förstår inte”",/nyheter/politik/zaina-23-utvisas-forstar-inte/
Quiz: Vad minns du från veckan som gått?,/nyheter/quiz-vad-minns-du--fran-veckan-som-gatt/
Fem journalister som kan vinna Guldkrattan,/nyheter/fem-journalister-som--kan-vinna-guldkrattan/
Hon lämnar barnen i Ubern – i två timmar,/tv/nyheter/varlden/hon-lamnar-barnen-i-ubern-i-tva-timmar/
Vändningen i vädret – 20 grader varmare,/nyheter/sverige/iskylan-forsvinner-har-blir-det-20-grader-varmare/
Vill ändra i lagen – för att stoppa ex-prinsen,/nyheter/kungligt/historisk-lagandring-kan-bli-slutet-for-ex-prinsen/
Ambassadören: Israel har rätt till hela Mellanöstern,/nyheter/varlden/ambassadoren-okej-om-israel-tar-mellanostern/
Barnskötaren ville vila – förgiftade ettåringar,/nyheter/varlden/barnskotaren-ville-vila--lurade-i-ettaringar-laxermedel/
Forskarnas dom om de populära dieterna,/nyheter/varlden/detta-sager-forskningen-om-de-populara-dieterna/
Toppchefen tvingades avslöja sin skyhöga lön,/nyheter/varlden/instagram-chefen-tvingades-avsloja-sina-skyhoga-inkomster/
Nyfödda får torkas med strävt papper,/nyheter/politik/nyfodda-torkas-med-stravt--papper-efter-sparkrav/
Nya uppgifter om Vilma Andersson,/nyheter/sverige/nya-uppgifter-om-vilma-andersson-inifran-rattspsyk-/
Trump vill ”nollställa” Nato: ”Oroväckande”,/nyheter/varlden/trumps-plan-vill--nollstalla-nato-orovackande/
Köldcoachens bästa tips för att klara vintern,https://www.expressen.se/tv/nyheter/koldcoachen-om-storheten-med-isbad-starker-psyket-hejdlost/
Det kan hända om USA bombar Iran,/nyheter/varlden/7-scenarier-det-kan-handa-om-usa-bombar-iran/
Trumps märkliga hot: ”Fantastiskt”,/tv/nyheter/varlden/trumps-markliga-hot-fantastiskt/
Slöt ett hemligt avtal – med hjälp av prinsen,/nyheter/varlden/andrews-radgivare-och-epstein-slot-megaaffar-i-kina/
Andrew riskerar livstids fängelse efter gripandet,/nyheter/varlden/exprins-andrew-riskerar-livstids-fangelse--/
Asos-grundare död – föll från 17:e våningen,/nyheter/varlden/asos-grundaren-quentin-griffiths-dod-foll-fran-balkong-17-vaningar-upp/
S vill se lex Landerholm: ”Uppenbar mörkläggning”,/nyheter/politik/s-vill-se-lex-landerholm-i-ku-uppenbar-morklaggning/
Ser ut ur fönstret – möts av skräcksyn,/tv/nyheter/varlden/ser-ut-ur-flygplansfonstret-mots-av-skracksynet/
Soldaten slog ihjäl Valentyna i Sverige,/nyheter/krim/valentyna-mordades-av-sin-make-mordvapnet-hans-rullstol/
S-beskedet: Vill se kemisk kastrering,/nyheter/politik/socialdemokraterna-positiva-till-kemisk-kastrering-av-pedofiler/
”Putin sitter fast i sin egen rävsax”,/nyheter/varlden/putin-sitter-fast-i--sin-egen-ravsax/
"Grattis på din dag, prinsessan Leonore",/nyheter/kungligt/grattis-pa-fodelsedagen-prinsessan-leonore/
Tidigare SD-politikern går till KD: ”Jätteroligt”,/nyheter/politik/ebba-hermansson-gar-fran-sd-till-kd/
Epsteins hemliga flickvän – skulle få ärva allra mest,/nyheter/varlden/epsteins-hemliga-flickvan-skulle-fa-arva-allra-mest/
Mette-Marits besked efter avslöjandet,/nyheter/varlden/mette-marits-nya-besked-efter-epsteinskandalen/
"De har fått sparken, avgått eller utreds",/nyheter/varlden/epsteinskandalen-de-har-fatt-sparken-avgatt-eller-utreds/
Kontakta redaktionen direkt,/nyheter/har-du-ett-nyhetstips-eller-bilder/
Svårt att hänga med?,/nyheter/fraga-getingen-/
Direktrapport: Allt om valet,/nyheter/politik/allt-om-valet-2026-folj-direktrapporten/
Här är det lättast att ta körkort,https://teknikensvarld.expressen.se/nyheter/bil-och-trafik/har-godkanns-flest-teoriprov-och-uppkorningar/
Tv-stjärnan våldtogs av ”bonusprinsen”,/nyheter/krim/polisen-misstanker-tv-stjarnan--linni-meister-valdtogs-av-bonusprinsen/
