Heading,URL
Sänker Putins fartyg – med hemligt svenskvapen,/tv/nyheter/varlden/hemliga-svenskvapnet-syns-i-kriget-slog-till-mot-putin/
Nya bilder: Kreditkort och ID bland vrakdelarna,/tv/nyheter/varlden/nya-bilder-kreditkort-och-id-bland-vrakdelarna/
"Stormen Dave i Fjällbacka: ""Då är gudarna med oss""",/tv/nyheter/sverige/stormen-dave-i-fjallbacka-da-ar-gudarna-med-oss/
Se Kinas enorma kärnvapenanläggning,/tv/nyheter/varlden/se-kinas-enorma-karnvapenanlaggning/
Mörka hemligheten avslöjas efter 40 år,/tv/nyheter/varlden/morka-hemligheten-avslojas-efter-30-ar/
Surfaren kommer i full fart – ser inte enorma djuret,/tv/nyheter/varlden/surfaren-kommer-i-full-fart-ser-inte-enorma-djuret/
Tåg mot Moskva spårade ur,/tv/nyheter/varlden/tag-mot-moskva-sparade-ur/
JUST NU: Pulverlarm,https://www.expressen.se/nyheter/expressen-direkt/?post=03304e38-6406-47e7-b710-3e581ad47aa7
JUST NU: Varnar för bilbarnstol,/nyheter/sverige/varnar-bilbarnstolen-kan-vara-livsfarlig-/
Trump ringde två samtal – då vände allt,/nyheter/varlden/spelet-bakom-sa-togs-vapenvilan-fram/
USA:s seger döms ut: ”En total förlust”,/nyheter/varlden/experten-iran-den-stora-vinnaren-efter-vapenvilan-med-usa-/
JUST NU: Största fallet sen 1991,https://www.expressen.se/nyheter/varlden/direktrapport-attackerna-i-iran/?post=669175e6-363e-466c-9199-078e5c6ee232
Här utropas ”seger” i iransk tv – hånar USA,/tv/nyheter/varlden/irans-firande-i-natt-uppnatt-stor-seger/
Vapenvila i natt – detta har hänt,/nyheter/varlden/vapenvila-mellan-usa-och-iran-det-har-har-hant-/
Pinsamma svaret när Vance ringer Trump,/tv/nyheter/varlden/har-ringer-vance-till-trump-kommer-till-rostbrevladan/
Magnatens 19-åriga dotter död i olycka,/nyheter/varlden/magnatens-19-ariga-dotter-dod-i-olycka/
SD-kravet: Ge Anne Ramberg sparken,/nyheter/politik/sds-krav-pa-regeringen-sparka-anne-ramberg-/
Trump-kritiker ersatt – han tar över stolen,/nyheter/varlden/efter-attacken-pa-trump-nu-ersatts-hans-kritiker/
Familjens chock – taket blåser av,/tv/nyheter/har-blaser-familjens-tak-av-i-stormen/
JUST NU: Klart med vapenvila – så vände allt,/nyheter/varlden/trump-gar-med-pa-vapenvila-i-tva-veckor/
De ska ordna fred: ”Kan spåra ur helt”,/nyheter/varlden/uppgifter-jd-vance-och-trumps-svarson-med-i-fredssamtal/
JUST NU: Irans besked,https://www.expressen.se/nyheter/varlden/direktrapport-attackerna-i-iran/?post=b6ba3186-9288-4a5b-8da3-f6cf5f6e0554
Motorcykeln exploderar – eldinferno i villaområdet,/tv/nyheter/varlden/motorcykeln-exploderar-barn-flyr-for-livet/
Kaoset i Ryssland – hel stad förstörs,/tv/nyheter/varlden/kaoset-i-ryssland-hel-stad-forstors/
Putins mardröm – krigsfartyg sprängs,https://www.expressen.se/tv/nyheter/varlden/spranger-putins-krigsskepp
Irans firande i natt: ”Uppnått stor seger”,/tv/nyheter/varlden/irans-firande-i-natt-uppnatt-stor-seger/
Här ringer Vance till Trump – kommer till röstbrevlådan,/tv/nyheter/varlden/har-ringer-vance-till-trump-kommer-till-rostbrevladan/
Påskharen applåderar – åt Trumps insats i Iran,/tv/nyheter/varlden/paskharen-appladerar-at-trumps-insats-i-iran/
Motorcykeln exploderar – barn flyr för livet,/tv/nyheter/varlden/motorcykeln-exploderar-barn-flyr-for-livet/
JD Vances mystiska sms – mitt under pressträffen,/tv/nyheter/varlden/jd-vance-mystiska-sms-mitt-under-presstraffen/
"Irans drag – bildar ""mänskliga sköldar""",/tv/nyheter/varlden/irans-drag-bildar-manskliga-skoldar/
Mammans panik – inser vem som är i bilen,/tv/nyheter/varlden/mammans-panik-inser-vem-som-ar-i-bilen/
Putins svaga punkt avslöjad: ”Försvårar”,/nyheter/varlden/hotet-mot-putin-dronarattacker-pa-stor-markyta/
Hemligt svenskvapen sänkte ryska fartyget,https://www.expressen.se/tv/nyheter/varlden/hemliga-svenskvapnet-syns-i-kriget-slog-till-mot-putin
Föddes på flygplan – barnets framtid oklar,/nyheter/varlden/foddes-pa-plan-i-luften-medborgarskap-oklart/
Ovanliga stödet – från Påskharen,https://www.expressen.se/tv/nyheter/varlden/paskharen-appladerar-at-trumps-insats-i-iran
Vem gjorde det avgörande målet?,/nyheter/sverige/vem-gjorde-det-avgorande-malet-/
Spekulationerna om medlarens ord,/nyheter/varlden/spekulationerna--om-medlarens-ord/
Försvarar Trumps hot: ”Välkommet”,/nyheter/varlden/trumps-hot-om-utplaning-mycket-valkommet/
Ny superteknik hittade piloten,/nyheter/varlden/nya-superteknologin--som-hittade-piloten/
Nya spektakulära bilden på jorden,/nyheter/varlden/artemis-fangade-unik-jordnedgang-pa-bild/
Vance får mystiskt sms – mitt under pressträffen,https://www.expressen.se/tv/nyheter/varlden/jd-vance-mystiska-sms-mitt-under-presstraffen
Scenariot som kan utlösa en global kris,/nyheter/varlden/4-scenarier-sa-kan-kriget-utvecklas-nu/
Vance sågar EU – försvarar Orbán,/nyheter/varlden/jd-vance-och-viktor-orban-haller-presstraff-i-ungern/
Orbáns udda drag – nobbar Vance,https://www.expressen.se/tv/nyheter/varlden/vance-pa-plats-nobbas-direkt-av-orban
Hittade arv på vinden – får inte ut pengarna,/nyheter/sverige/arvde-en-miljon-kronor-i-kontant-far-inte-pengarna/
Bombar direkt – efter Putins ord,https://www.expressen.se/tv/nyheter/varlden/ryssland-atergar-till-arbete-da-slar-ukraina-till
Erkände för häktesvakt: ”Har dödat två kurder”,/nyheter/krim/erkande-dubbelmord-for-haktesvakt-jag-har-dodat-tva-kurder/
Vill ge elever frukost – regeringen satsar,/nyheter/politik/regeringen-foreslar-sprakfrukost-for-barn/
Mammans panik – inser vem som är i stulna bilen,https://www.expressen.se/tv/nyheter/varlden/mammans-panik-inser-vem-som-ar-i-bilen
Drar ner på biståndet – kravet om migranterna,/nyheter/politik/minskar-bistandet-kraver-att-somalia-hindrar-migranter/
Plågade familj i dagar av misstag – fem döms,/nyheter/krim/fel-familj-utpressades-i-halmstad-fick-julhalsning/
Pekar ut Grönland – orden som oroar,https://www.expressen.se/tv/nyheter/varlden/trump-till-attack-mot-nato-startade-med-gronland
Pekar ut Grönland – efter sprickan i Nato,/nyheter/varlden/trump-pekar-ut-gronland-efter-sprickan-i-nato/
Åkte Tesla som körde själv – blir av med bil,/nyheter/sverige/man-fran-djursholm-utan-korkort-akte-sjalvkorande-tesla-doms/
Udda svaret på Trumps nya hot,/nyheter/varlden/trumps-tidsfrist-snart-slut-udda-uppmaningen-fran-iran/
Civila drabbas allt hårdare i Iran,/nyheter/varlden/larm-civila-drabbas-allt-hardare-i-iran/
Kvinna död i olycka – andra dödsoffret,https://www.expressen.se/nyheter/expressen-direkt/?post=a3586a47-53bf-4b61-8529-7a670c772056
Dansade på bröllop – sen dog de i varandras armar,/nyheter/varlden/dansade-pa-brollop-sen--dog-de-i-varandras-armar/
Slut på färska räkor efter stormen Dave,https://www.expressen.se/nyheter/expressen-direkt/?post=53007b63-f5c0-4b18-b462-44f46d96881e
Svensk man död efter lavinolycka,/nyheter/sverige/svensk-man-dod-i-lavinolycka-i-norge/
Dömda till sluten vård: Här lever ungdomarna,/nyheter/sverige/inifran-sis-hemmet-pengar-en-drom-for-manga/
"”Linnea”, 17, blev en av gängens barnsoldater",/nyheter/sverige/linnea-17-blev-en-av-gangens-barnsoldater/
Svårt att hänga med?,/nyheter/fraga-getingen-/
Direktrapport: Allt om valet,/nyheter/politik/allt-om-valet-2026-folj-direktrapporten/
