Heading,URL
Trumps kyliga drag – timmar före attacken,/tv/nyheter/varlden/trumps-kyliga-drag-timmar-fore-attacken/
Orbáns attack mot Zelenskyj,/tv/nyheter/varlden/orbans-attack/
"Lyxhotellet i brand –
enorma explosionen",/tv/nyheter/lyxhotellet-i-brand-enorma-explosionen/
Tyska hånet mot Trump: ”Vad sa du?”,/tv/nyheter/varlden/merz-han-mot-donald-trump/
Panikdraget – ser vad som döljer sig,/tv/nyheter/varlden/panikdraget-nar-han-ser-vad-som-doljer-sig/
JUST NU: Tänker inte förhandla,https://www.expressen.se/nyheter/varlden/direktrapport-attackerna-mot-iran/?post=d0579584-2ca4-4e08-99d2-883f6d9cbf4c
JUST NU: Högre bostadspriser,https://www.expressen.se/nyheter/expressen-direkt/?post=8ba227e1-0117-49db-b728-700d850c84ce
JUST NU: Nya attacker – fler länder dras in,/nyheter/varlden/eskaleringen-attacker-i-tva-nya-lander/
JUST NU: Explosioner,https://www.expressen.se/nyheter/varlden/direktrapport-attackerna-mot-iran/?post=7210d08f-9b14-4553-a7b2-63ecf537e8bb
Kraftiga explosioner i Beirut under natten,/tv/nyheter/varlden/israel-attackerar-efter-hizbollahs-dronare/
”Den mest avgörande händelsen på 25 år”,/nyheter/varlden/den-mest-avgorande--handelsen-pa-25-ar/
Attackerna och svaren – detta har hänt,/nyheter/varlden/usa-och-israel-i-attack-mot-iran-detta-har-hant/
Bråket i Schweiz innan Trumps beslut,/nyheter/varlden/braket-i-schweiz-da-tog-trump-beslutet-att-bomba-iran/
Hotet i rysk tv: Dags att slå till i Europa,/nyheter/varlden/ryska-hotet-mot-europa-dags-sla-till/
Kungabarnens ovanliga beslut,/nyheter/kungligt/kungabarnen-tar-ut-miljoner-i-vinst/
40 års Palme-trauma – bilderna sticker ut,/nyheter/sverige/40-ar-av-palme-trauma-bilderna-som-sticker-ut/
Hör knakande ljud – går rakt in i mardröm,/tv/nyheter/varlden/hor-knakande-ljud-gar-rakt-in-i-mardrom/
Försvunnen i nio dagar – ”mirakulöst” räddad,/nyheter/varlden/forsvunnen-i-nio-dagar-mirakulost-raddad/
Åtalet: Massör begick övergrepp på Yasuragi,/nyheter/sverige/atalet-massor-begick-overgrepp-pa-yasuragi/
Bilderna visar barnets väg till dubbla terrorn,/nyheter/krim/foxtrots-barnsoldat-innan-han-blev-terrorist-i-danmark/
Paret hatas efter bilderna: ”Idioter”,/tv/nyheter/varlden/paret-hatas-efter-bilderna-idioter/
Putins stora bakslag – specialstyrkor slår till,/tv/nyheter/varlden/belgien-tar-ryskt-tankfartyg-i-beslag/
Israel attackerar efter Hizbollahs drönare,/tv/nyheter/varlden/israel-attackerar-efter-hizbollahs-dronare/
Trump utlovar hämnd: ”Det hårdaste slaget”,/tv/nyheter/varlden/trump-utlovar-hamnd-det-hardaste-slaget/
Trumps kyliga drag – timmar före attacken,/tv/nyheter/varlden/trumps-kyliga-drag-timmar-fore-attacken/
Hör knakande ljud – går rakt in i mardröm,/tv/nyheter/varlden/hor-knakande-ljud-gar-rakt-in-i-mardrom/
Här tvingas Expressens reporter ner i skyddsrummet,/tv/nyheter/varlden/har-tvingas-expressens-reporter-ner-i-skyddsrummet/
Iran bekräftar: Högsta ledaren död i attacken,/tv/nyheter/varlden/iran-bekraftar-hogsta-ledaren-dod-i-attacken/
"Quiz: Vad minns du
från veckan som gått?",/nyheter/quiz-vad-minns-du-fran-veckan-som-gatt/
"Leo, 38, om smällen: ”Fönstren skakade”",/nyheter/varlden/leo-38-ar-i-qatar-fonstren-skakade/
Draget ska stoppa våldtäkter mot äldre,/nyheter/politik/efter-valdtakterna-mot-aldre-nu-skarps-kontrollerna/
Flygkaoset växer – svenskar fast,/nyheter/varlden/ud-sannolikt-tusentals-svenskar-fast-i-landerna-runt-iran/
Linas skräcknatt: Är det i dag jag dör?,/nyheter/varlden/18-ariga-linas-skracknatt-i-dubai-sokte-skydd-pa-toalett/
Domen: Attackerna kan pågå i veckor,/nyheter/varlden/experten-kan-paga-i-veckor-tills-man-knackt-ryggraden/
Diktatorernas raseriutbrott,/nyheter/varlden/irans-allierade-rasar-efter-ayatollans-dod-avskyvart/
Iraniernas glädje – firandet i Stockholm,/nyheter/sverige/ayatollans-dod-firades-i-stockholm-tarogd/
Man försökte våldta man – utvisas inte,/nyheter/sverige/man-forsokte-valdta--man-utvisas-inte/
Vem vann första Vasaloppet 1922?,/nyheter/sverige/vem-vann-forsta-vasaloppet-1922/
"Alvin, 19, körde av vägen för att rädda",/nyheter/sverige/alvin-19-korde-av-vagen-for-att-radda-andra/
Paret hatas efter bilderna: ”Idioter”,https://www.expressen.se/tv/nyheter/varlden/paret-hatas-efter-bilderna-idioter
GW efter äppelattacken i SVT: ”Vildsvinen glada”,/nyheter/sverige/gw-efter-appelattacken-i-svt-vildsvinen-glada/
Tio israeler döda i raketattacker,/nyheter/varlden/tio-israeler-dodade-i-raketattacker-allt-flog-i-luften/
Putins stora bakslag – specialstyrkor slår till,https://www.expressen.se/tv/nyheter/varlden/belgien-tar-ryskt-tankfartyg-i-beslag
Iran bekräftar: Ayatolla Ali Khamenei är död,/nyheter/varlden/uppgifter-ayatolla-khamenei-kan-ha-skadats-eller-dodats/
Glädje och sorg efter ledarens död: ”Skrek”,/nyheter/varlden/gladje-och-sorg-efter-khameneis-dod/
Iranska taktiken: Gömda bunkrar,/nyheter/sverige/iranska-taktiken-gomda-okenbunkrar/
Folkets dom mot kronprinsessan,/nyheter/varlden/folkets-dom-mot--kronprinsessan/
Prinsessor stoppas efter jätteskandalen,/nyheter/kungligt/prinsessor-stoppas--efter-jatteskandalen/
Därför kan ingen utreda Mette-Marit,/nyheter/varlden/darfor-kan-mette-marit-inte-granskas-av-polis/
Stor offensiv attack rakt mot ”hjärtat”,/nyheter/varlden/israel-slagit-till-mot-teherans-hjarta/
Maga-profilerna rasar mot Trump: ”Jävla lögnare”,/nyheter/varlden/maga-profilerna-rasar-mot-trump-javla-lognare/
USA:s konsulat stormat – uppgifter om flera döda,/nyheter/varlden/usas-konsulat-i-pakistan-stormat-uppgifter-om-flera-doda/
Domen: Regimen kvar utan ayatollan,/nyheter/varlden/irankannaren-regimen-kvar-utan-ayatollan/
Anledningen – därför slog Trump till nu,/nyheter/varlden/darfor-slog-usa-och-israel-till-mot-iran-just-nu/
Svårt att hänga med?,/nyheter/fraga-getingen-/
Direktrapport: Allt om valet,/nyheter/politik/allt-om-valet-2026-folj-direktrapporten/
Här är det lättast att ta körkort,https://teknikensvarld.expressen.se/nyheter/bil-och-trafik/har-godkanns-flest-teoriprov-och-uppkorningar/
Tv-stjärnan våldtogs av ”bonusprinsen”,/nyheter/krim/polisen-misstanker-tv-stjarnan--linni-meister-valdtogs-av-bonusprinsen/
