Heading,URL
Här sätts fyra ambulanser i brand,/tv/nyheter/varlden/har-satts-fyra-ambulanser-i-brand-/
Tappar det helt över teknikstrulet: ”Inte acceptabelt”,/tv/nyheter/sverige/tappar-det-helt-over-teknikstrulet-inte-acceptabelt/
Två hus rasade – kampen i spillrorna,/tv/nyheter/tva-hus-rasade-kampen-i-spillrorna/
Israel spränger alla broar över viktiga floden,/tv/nyheter/varlden/israel-spranger-alla-broar-over-viktiga-floden/
Pilotens räddning i stormen på turistön,/tv/nyheter/varlden/pilotens-panikdrag-i-stormen-pa-turiston/
Kastar hemmagjord bomb – tacklas,/tv/nyheter/dramatiska-filmen-har-brottas-terrormisstankte-emir-balat-ner-av-polis/
Här slår ukrainska drönare ner i Ryssland,/tv/nyheter/varlden/har-slar-ukrainska-dronare-ner-i-ryssland/
JUST NU: Oljeindustri i lågor i USA,https://www.expressen.se/tv/nyheter/varlden/rokmolnet-sprids-efter-oljeexplosion
JUST NU: Ikea återkallas ljus,https://www.expressen.se/nyheter/expressen-direkt/?post=6355db54-c6e5-40d2-b38e-dcc39645a7f7
JUST NU: Flera stora attacker – efter hoten,/nyheter/varlden/iran-trump-ska-fa-overraskning/
Terrorgrupp tros ligga bakom attentaten,/nyheter/varlden/misstanken-iransk-terrorgrupp-bakom-attacken-i-london/
"Jan, 98, nekas hjälp – hundratals vill hjälpa",/nyheter/sverige/jan-98-nekas-ledsagare--hundratals-vill-hjalpa-honom/
Fångar skräckens sekunder på film,/tv/nyheter/varlden/fangar-skrackens-sekunder-pa-film/
Test av sommardäck – det är bäst för dig,https://teknikensvarld.expressen.se/nyheter/konsument/test-billiga-dyra-sommardack-2026/
Saknar armar och ben – smet i Tesla efter mord,/nyheter/varlden/amputerade-cornhole-proffset-misstanks-for-mord/
Här erkänner Putin – går dåligt för Ryssland,/tv/nyheter/varlden/har-erkanner-putin-gar-daligt-for-ryssland/
Attack nära finska gränsen,/tv/nyheter/varlden/se-ukrainska-attacken-nara-finska-gransen/
Trumps oväntade attack,https://www.expressen.se/tv/nyheter/varlden/trump-attackerar-reportern
Ung man skjuten vid fotbollsplan,/nyheter/sverige/man-skjuten-vid-fotbollsplan-i-varby-gard/
TV: Rörligt ÅkessonLind,/tv/nyheter/sverige/tv-rorligt-akessonlind/
Ryter till åt Åkesson ”Det här är absurt”,/tv/nyheter/sverige/ryter-till-at-akesson/
Stort flygkaos i USA – Trumps hot,/tv/nyheter/varlden/stort-flygkaos-i-usa-trumps-hot/
Fångar skräckens sekunder på film,/tv/nyheter/varlden/fangar-skrackens-sekunder-pa-film/
Rökmolnet sprids efter oljeexplosion,/tv/nyheter/varlden/rokmolnet-sprids-efter-oljeexplosion/
Bråket i SVT mellan Lind och Åkesson,/tv/nyheter/sverige/ryter-till-at-akesson/
Här erkänner Putin – går dåligt för Ryssland,/tv/nyheter/varlden/har-erkanner-putin-gar-daligt-for-ryssland/
Militärt flygplan har kraschat i Colombia,/tv/nyheter/varlden/militart-flygplan-har-kraschat-i-colombia/
Agenter dyker upp på flygplatser,/tv/nyheter/varlden/agenter-dyker-upp-pa-flygplatser/
Trumps hot om avtal inte nås,/tv/nyheter/varlden/trumps-hot-om-avtal-inte-nas-/
Kackerlacka i maten på populära restaurangen,/nyheter/sverige/hittade-kackerlacka-i-maten-pa-populara-restaurangen-serverad/
Trump kan slå till mot Kuba – när som helst,/nyheter/varlden/donald-trump-forbereder-insats-mot-kuba/
"Polisens teori efter mordet på Hugo, 20",/nyheter/sverige/uppgifter-polisen-utreder-felskjutning-efter-mordet-pa-hugo-mosshagen-/
Strömmer om mordet i Örebro: ”Skakar om”,/nyheter/sverige/strommer-om-mordet-i-orebro-skakar-om/
Tidigare lagkamraten: ”Som en storebror”,/tv/nyheter/sverige/tidigare-lagkamraten-som-en-storebror/
Näringslivet ignorerar Säpos varning om Kina,/nyheter/varlden/naringslivet-ignorerar-sapos-varning-om-kina/
Iran: Attack mot USA-bas var bluff,/nyheter/varlden/iran-attacken-mot-basen-en--israelisk-bluff/
Knarkbossen – en av Europas mest jagade,/nyheter/sverige/knarkbossen-armin-moini--most-wanted/
Trumps nya villkor för ett slut på kriget,/nyheter/sverige/trump-om-iran-vill-se-nukleart-damm/
Trumps hot om avtal inte nås,/tv/nyheter/varlden/trumps-hot-om-avtal-inte-nas-/
Regeringen vill sänka skatten på drivmedel,/nyheter/politik/atgarder-for-sanka-energipriser/
Kris på ryska fartyget – ilskan mot Sverige,/nyheter/sverige/caffas-ryska-besattning-utan-mat-nodrop-utanfor-trelleborg/
Källor: Ledningen försöker lugna,/nyheter/politik/kallor-ledningen-forsoker-lugna/
Familjens fräcka kupp vid Slottet,/nyheter/sverige/familjens-bil-instangd-forsokte-bygga-ramp/
Vilda hoten – laddar för slag om Hormuz: ”Blir mycket värre”,/nyheter/varlden/hoten-flyger-uppladdning-for-slag-om-hormuzsundet/
Spränger alla viktiga broar,/tv/nyheter/varlden/israel-spranger-alla-broar-over-viktiga-floden/
Tålamodet slut: ”Sista varningen”,/nyheter/varlden/arablandernas-talamod-slut--sista-varning/
Passningen: ”Det får du fråga dem”,/tv/nyheter/sverige/mohamssons-passning-det-far-du-fraga-dem/
FN varnar: Allt lyser rött vid kriget i Iran,/nyheter/varlden/fn-varnar-jordens-alla-viktiga-klimatindikatorer-lyser-rott/
Göran parkerade på uppfarten – fick p-bot,/nyheter/sverige/goran-72-parkerade-pa-sin-garageuppfart-fick-p-bot/
Barnflickorna: Så är det hos Sveriges elit,/nyheter/sverige/sa-ar-det-att-vara-nanny-hos-rika-i-stockholm/
Svårt att hänga med?,/nyheter/fraga-getingen-/
Direktrapport: Allt om valet,/nyheter/politik/allt-om-valet-2026-folj-direktrapporten/
