Heading,URL
Bildt om Trumps brev: ”Stackars...”,/tv/nyheter/varlden/bildt-om-trumps-brev-stackars/
Springer maraton i gruvan: ”Jävla pissigt”,/tv/nyheter/sverige/expressen-springer-varldens-djupaste-marathon-/
Danska politikern om Trump-toppen: ”Våldtäktsman”,/tv/nyheter/varlden/danska-politikern-om-miller-valdtaktsman/
Kina svarar Trump: ”Sluta använda oss”,/tv/nyheter/varlden/kina-svarar-trump-sluta-anvanda-oss/
Hagelkaos på semesterön,/tv/nyheter/varlden/hagelkaos-pa-semesteron/
Tolvåring svårt skadad i hajattack,/tv/nyheter/varlden/tolvaring-svart-skadad-i-hajattack/
Kängan mot Trump – från egna partiet,/tv/nyheter/varlden/kangan-mot-trump-fran-egna-partiet/
Hotet i rysk tv: ”Då tar vi resten”,/tv/nyheter/varlden/hotet-i-rysk-stats-tv-vi-far-resten/
Sandras experiment i galna kylan,/tv/nyheter/sverige/sandras-experiment-i-galna-kylan/
JUST NU: Trump bjuder in Sverige,https://www.expressen.se/nyheter/expressen-direkt/?post=8ce3c910-b03b-4e44-a9a1-c5814d0f2e10
JUST NU: Musk ger sig in i valet,https://www.expressen.se/nyheter/expressen-direkt/?post=53da5bb1-35b0-4f42-85c6-d428653f1a4d
JUST NU: Trump vill förhandla på toppmötet,/nyheter/varlden/trump-ska-prata-om-att-kopa-gronland-i-davos/
Ilskan mot Macron – nya hotet,/tv/nyheter/varlden/harda-orden-till-norge-bryr-mig-inte/
Ryska glädjen över planen: ”Dårhus”,/nyheter/varlden/ryska-gladjen-over-trumps--plan-darhus/
Fick miljard i bidrag – nu stryper Sida allt,/nyheter/sverige/fran-en-miljard-till-0-kronor-i-bidrag-for-islamiska-bistandsorganisationen/
Mammans nya teori om försvunne sonen,/nyheter/varlden/mammans-nya-teori-om-forsvunne-sonen/
Barnflickorna: Så är det hos överklassen,/nyheter/sverige/sa-ar-det-att-vara-nanny-hos-rika-i-stockholm/
Ladda ned appen – få gratis premium,/nyheter/kronikorer/klas-granstrom/ladda-ned-appen-fa-gratis-premium-/
Här dyker Musks förbjudna bil upp,/nyheter/sverige/musks-forbjudna-cybertruck--stod-parkerad-mitt-i-lulea/
"Ihab, 43, dog i körskolebilen",/nyheter/sverige/trafikinspektoren-ihab-dog-i-korskolebilen-i-sodertalje/
Fjärde hajattacken – på 48 timmar,https://www.expressen.se/nyheter/expressen-direkt/?post=0a1f0ed0-190e-4443-a7df-bdfdc3b7b787
Hagelkaos slog mot semesterön,/tv/nyheter/varlden/hagelkaos-pa-semesteron/
Kina svarar Trump: ”Sluta använda oss”,/tv/nyheter/varlden/kina-svarar-trump-sluta-anvanda-oss/
Bisarra anklagelsen mot Norge,/tv/nyheter/varlden/harda-orden-till-norge-bryr-mig-inte/
Zelenskyjs varning,/tv/nyheter/varlden/zelenskyjs-varning/
Bildt om Trumps brev: ”Stackars...”,/tv/nyheter/varlden/bildt-om-trumps-brev-stackars/
Danska politikern om Trump-toppen: ”Våldtäktsman”,/tv/nyheter/varlden/danska-politikern-om-miller-valdtaktsman/
Musks AI gör fel – pekar ut Danmark,/tv/nyheter/varlden/musks-ai-gor-fel-pekar-ut-danmark/
Musks AI gör fel,/tv/nyheter/varlden/trumps-ai-gor-fel/
Springer maraton i gruvan: ”Jävla pissigt”,/tv/nyheter/sverige/expressen-springer-varldens-djupaste-marathon-/
Kina svarar Trump: ”Sluta använda oss”,/tv/nyheter/varlden/kina-svarar-trump-sluta-anvanda-oss/
Hagelkaos på semesterön,/tv/nyheter/varlden/hagelkaos-pa-semesteron/
Skulle till turistparadis – fastnade i trapphus,/nyheter/varlden/skulle-till-turistparadis-fastnade-i-trapphus/
Expert varnar för ”andra Tjernobyl”,/nyheter/varlden/varnar-for-ett--andra-tjernobyl/
Bildt om Trumps brev: ”Stackars...”,/tv/nyheter/varlden/bildt-om-trumps-brev-stackars/
Mördade hela sin familj – hemliga breven efteråt,/nyheter/varlden/mordade-frun-och-barnen-hemliga-breven-inifran-fangelset/
Springer världens djupaste maraton,https://www.expressen.se/tv/nyheter/sverige/expressen-springer-varldens-djupaste-marathon-
Prinsessan Madeleine sörjer döda modeikonen,/nyheter/kungligt/prinsessan-madeleines-sorg-efter-valentinos-dod/
Hemliga samtalen – om grannlandet,/nyheter/varlden/trumps-hemliga-samtal-samtidigt-som-han-hotar-gronland/
Ex-ministern: ”Nato står inför en kollaps”,/nyheter/varlden/tidigare-forsvarsministern-nato-star-infor-en-kollaps/
Klara beskedet: Bazookan laddad,/nyheter/politik/svantesson-bazookan--ar-laddad-mot-trump-/
Kanadas drag – slaget mot Trump,https://www.expressen.se/tv/nyheter/varlden/backar-gronland-vi-ar-oroade
Åtalas för grov våldtäkt – offret fick hjärnskakning,/nyheter/sverige/man-atalas-for-grov-valdtakt-gav-kvinna-hjarnskakning/
Skandalprinsen erkänner nya brott,/nyheter/kungligt/marius-borg-hoiby-atalas-for-nya-brott/
Trump erkänner om Sverige,/nyheter/varlden/trump-uppges-medge-kan-ha-feltolkat-trupperna-till-gronland/
EU:s lista – varorna som kan bli dyrare,/nyheter/varlden/amerikanska-varorna-som-kan-bli-dyrare-med-eu-tullar/
Hemliga planen: Så slog polisen ut ”Jordgubben”,/nyheter/krim/sa-slog-polisen-till-mot-jordgubbens-natverk/
S-toppens kritik mot ministern,/nyheter/politik/mikael-dambergs-kritik-mot-finansministern-naivt/
”Har Trump rätt om Grönland?”,/nyheter/varlden/trump-hotar-med-tullar-expressens-mats-larssons-svar-om-gronland/
Internet på väg tillbaka efter elva dagar i Iran,/nyheter/varlden/internet-pa-vag-tillbaka-efter-elva-dagar-i-iran/
Kritiserade dom – tvingas lämna,/nyheter/krim/namndemannen-pran-malhotra-uttalade-sig-om-dom-tvingas-lamna/
Chocksiffran inifrån: Prickskyttar på tak,/nyheter/varlden/lakarnas-chockrapport-fran-iran-16-500-doda/
Tre hajattacker – på ett dygn,https://www.expressen.se/tv/nyheter/varlden/tolvaring-svart-skadad-i-hajattack
SD-politikern Ulf Börkell frias för tjänstefel,/nyheter/sverige/sd-politikern-ulf-borkell-frias-for-tjanstefel/
Trump bjuder in Putin till fredsråd,/nyheter/varlden/putin-inbjuden-till-trumps-fredsrad-for-gaza/
Kontakta redaktionen direkt,/nyheter/har-du-ett-nyhetstips-eller-bilder/
Svårt att hänga med?,/nyheter/fraga-getingen-/
Kändisretreaten inifrån,/nyheter/sverige/kandisretreaten-baravara--inifran-beratta-inte-vad-vi-gor/
Snusk och fusk på Åres krogar,/nyheter/sverige/snusk-och-fusk-pa-ares-krogar-musbajs-spindelnat-och-felmarkt-kott/
