Heading,URL
Hundratusentals demonstrerar på gatorna i Ungern,/tv/nyheter/varlden/tiotusentals-demonstrerar-pa-gatorna-i-ungern-/
Här testar Kim Jong-Un och dottern robotar: ”Provokation”,/tv/nyheter/varlden/har-testar-kim-jong-un-och-dottern-robotar-provokation/
Här säger Trump fel – gång på gång,/tv/nyheter/varlden/har-sager-trump-fel-gang-pa-gang/
Roboten grips av polis – efter draget mot kvinnan,/tv/nyheter/varlden/roboten-grips-av-polis-efter-draget-mot-kvinnan/
Här går soldaterna på Stockholms gator,/tv/nyheter/sverige/1500-soldater-pa-plats-i-stockholm/
Putins robotar träffades – eldregnet över natthimlen,/tv/nyheter/har-sprangs-putins-vapen/
Fjällpaniken – skoterguiden slukas av lavin,/tv/nyheter/sverige/priit-begravdes-i-lavin-mirakulosa-vandningen/
Här bordar Kustbevakningen ryska fartyget,/tv/nyheter/sverige/har-bordar-kustbevakningen-ryska-fartyget/
JUST NU: Kilometerlånga köer,https://www.expressen.se/nyheter/expressen-direkt/?post=83b4b879-5090-45a4-be53-2c28f8ec6f3f
JUST NU: Akutstänger flygplatsen,https://www.expressen.se/tv/nyheter/varlden/blixtstanger-flygplatsen-i-dubai-
JUST NU: Polisinsats,/nyheter/krim/polisinsats-i-centrala-stockholm-/
Oljetopparna varnar Trump: ”Förstörelse”,/nyheter/varlden/oljetopparnas-dom-varningen-till-trump-om-oljepriset/
JUST NU: Irans vägran,https://www.expressen.se/tv/nyheter/varlden/donad-trump-vet-inte-om-jag-vill-gora-nagon-overenskommelse
Familjens raseri mot Trumps krig,/nyheter/varlden/familjens-ilska-mot-trump-efter-soldaternas-dod/
Iskylan mellan Trumps toppar,/nyheter/varlden/sprickan-mellan-vance-och-rubio-hackordningen/
Dotterns otäcka ord: ”Jag som gjort det”,/nyheter/krim/dottern-i-larmsamtalet--jag-som-har-gjort-det/
L dementerar – anklagar SVT,/nyheter/sverige/djupa-sprickan-vagrar-dela-bord-i-svt/
Utstötta apan Punch har fått vänner igen,/nyheter/varlden/utstotta-apan-punch-har-fatt-vanner-igen/
Teorin: Därför ljög han om storleken,/nyheter/varlden/marco-rubio-hanas-darfor-ljog-han-om-storleken/
Skräcken: Här tappar Teslan det fullständigt,/tv/nyheter/varlden/skracken-teslan-tappar-det-fullstandigt/
"Sus, 52, var hemlös i 13 år – sen vände livet",/nyheter/sverige/sus-52-var-hemlos-i-13-ar-nu-guidar-hon-folk-i-gamla-stan/
Trump pekas ut – som desperat,/nyheter/varlden/experten-desperat-oljehot-fran-trump/
Israel: Har tusentals mål kvar att bomba,/nyheter/varlden/idf-minst-tre-veckor-till-av-krig-/
32 bilder från 16 dagars krig,/nyheter/varlden/kriget-i-mellanostern-i-bilder/
Här intar soldater Stockholms gator,/tv/nyheter/sverige/1500-soldater-pa-plats-i-stockholm/
Enorm Ica-kö – alla vill ha samma vara,/tv/nyheter/varlden/har-far-expressens-reporter-tag-pa-omtalade-kaffeburken-/
"Donad Trump: ""Vet inte om jag vill göra någon överenskommelse""",/tv/nyheter/varlden/donad-trump-vet-inte-om-jag-vill-gora-nagon-overenskommelse/
Blixtstänger flygplatsen i Dubai,/tv/nyheter/varlden/blixtstanger-flygplatsen-i-dubai-/
Skräcken: Teslan tappar det fullständigt,/tv/nyheter/varlden/skracken-teslan-tappar-det-fullstandigt/
Hundratusentals demonstrerar på gatorna i Ungern,/tv/nyheter/varlden/tiotusentals-demonstrerar-pa-gatorna-i-ungern-/
Kostrådgivaren Alexander extremäter: ”Skulle aldrig rekommendera det”,/tv/nyheter/sverige/kostradgivaren-alexander-extremater-skulle-aldrig-rekommendera-det/
Spelade framgångsrik för att sälja kurser på Tiktok,/tv/nyheter/sverige/spelade-framgangsrik-for-att-salja-kurser-pa-tiktok/
Spelade framgångsrik för att sälja influencerns kurs,/tv/nyheter/sverige/spelade-framgangsrik-for-att-salja-influencerns-kurs/
Gymprofilens gåvor – familjen indragen,/nyheter/sverige/gymprofil-gav-miljoner-till-barnen-atalas-for-avancerat-brottsupplagg/
Fick fel burgare – gjorde SVT-inslag,/nyheter/sverige/svt-reporter-fick-fel-burgare-gjorde-inslag/
Anställda fick fel lön – får resa till Ullared,/nyheter/sverige/anstallda-fick-fel-lon-far-bussresa-till-ullared/
Sjukanmäld 114 dagar på ett år – fick sparken,/nyheter/varlden/sjukanmalde-sig-114-dagar-pa-ett-ar-fick-sparken/
Här slår ryssarna till – mot alla som passerar,/nyheter/varlden/dodens-vag-har-slar-ryssarna-till-mot-civila-som-flyr/
Netanyahus skämt – mitt i bombandet,/nyheter/varlden/netanyahus-skamt-mitt-i-bombandet/
Rånare skenavrättade offren: ”Jag vill inte dö”,/nyheter/sverige/ranare-skenavrattade-offren-jag-vill-inte-do/
Strandhäll sågas: ”Tvättäkta rasism”,/nyheter/politik/kritiken-mot-strandhall-tvattakta-rasism-/
Kritikernas plan: Locka tillbaka L-favoriten,/nyheter/sverige/uppgifter-tryck-pa-l-favoriten-att-gora-comeback/
Kraftmätning i Budapest – stora demonstrationer,/nyheter/varlden/kraftmatning-i-budapest-stora-demonstrationer/
Stort vulkanutbrott på Filippinerna,/tv/nyheter/varlden/stort-vulkanutbrott-i-onationen/
Tiktok-kurserna som lovar att göra dig rik,/nyheter/sverige/varning-for-tiktok-kurserna-som-lovar-att-gora-dig-rik/
"Mammans mardröm: Adam, 1, fördes bort",/nyheter/sverige/mammans-mardrom-adam-1-fordes-bort-fran-sverige/
Toppolitikern fick droger av Epstein,/nyheter/varlden/toppolitikern-peter-mandelson-fick-droger-av-epstein/
Nya hårda orden: Lättare med Putin,/nyheter/varlden/trump-zelenskyj-ar-den-sista-vi-behover-hjalp-av/
Gravarna förstörda av härjande vildsvin,/nyheter/sverige/har-forstor-vildsvinen-gravarna-ser-helt-galet-ut/
Churchill ersätts av djur – britter rasar,/nyheter/varlden/winston-churchill-ersatts-av-smavilt/
Chocken i matsalen: ”Absurd idé – eww”,/nyheter/sverige/chocken-i-skolmatsalen-fisk-med-ostbagar/
Bard hyllar SD-svängen – går med i Liberalerna,/nyheter/sverige/alexander-bard-gar-med-i-liberalerna-igen/
M-strategen om hotet från L-röster: Vågar inte,/nyheter/sverige/tidigare-m-strategen-om-stodroster-pa-liberalerna-vagar-inte/
Man ursinnig på trasig sexdocka,/nyheter/sverige/man-forbannad-pa-sexdocka-fran-borlange-sakerhetsrisk/
Svårt att hänga med?,/nyheter/fraga-getingen-/
Direktrapport: Allt om valet,/nyheter/politik/allt-om-valet-2026-folj-direktrapporten/
