Heading,URL
Olämpliga orden om Biden inför barnen,/tv/nyheter/varlden/olampliga-orden-om-biden-infor-barnen/
Irans firande i natt: ”Uppnått stor seger”,/tv/nyheter/varlden/irans-firande-i-natt-uppnatt-stor-seger/
Här ringer Vance till Trump – kommer till röstbrevlådan,/tv/nyheter/varlden/har-ringer-vance-till-trump-kommer-till-rostbrevladan/
Sänker Putins fartyg – med hemligt svenskvapen,/tv/nyheter/varlden/hemliga-svenskvapnet-syns-i-kriget-slog-till-mot-putin/
Nya bilder: Kreditkort och ID bland vrakdelarna,/tv/nyheter/varlden/nya-bilder-kreditkort-och-id-bland-vrakdelarna/
"Stormen Dave i Fjällbacka: ""Då är gudarna med oss""",/tv/nyheter/sverige/stormen-dave-i-fjallbacka-da-ar-gudarna-med-oss/
Se Kinas enorma kärnvapenanläggning,/tv/nyheter/varlden/se-kinas-enorma-karnvapenanlaggning/
JUST NU: Natteld mot Putins depå,https://www.expressen.se/tv/nyheter/varlden/attackerna-chockar-ryskockuperade-staden
Rasar efter nytt krismöte: ”Kom ihåg Grönland”,/nyheter/varlden/donald-trump-rasande-efter-krismotet-med-mark-rutte/
Bomberna faller över Beiruts ”Östermalm”,/nyheter/varlden/bomberna-faller-over-beiruts-ostermalm/
Hegseth: Kriget var en hämnd,/tv/nyheter/varlden/hegseth-kriget-var-en-hamnd/
Vance varning – hinten om Trump,/tv/nyheter/varlden/vance-varning-om-trump/
Ovanliga draget visar att han fruktar förlust,/nyheter/varlden/tecknet-pa-att-orban-fruktar-forlust-i-valet/
GW:s förvåning efter gripandet: ”Vet inte”,/nyheter/sverige/leif-gw-forvanad-over-gripandet-i-brattasmorden/
Misstänkt gripen – 20 år efter dubbelmordet,/nyheter/sverige/man-anhallen-misstankt-for-dubbelmordet-i-brattas/
Förvirringen i Vita huset – fångas av kamerorna,/tv/nyheter/stor-forvirring-i-vita-huset/
Andrew i stor kris – broderns utryckning,/nyheter/kungligt/andrew-krisar-brodern-prins-edward-pa-blixtbesok/
Vägrar förhör – hotas med åtal,/nyheter/varlden/pam-bondi-vagrar-forhor-om-epstein-hotas-med-atal/
Här brinner prinsens present för 400 000,/tv/nyheter/sverige/har-brinner-prinsens-present-upp/
Felet med såsen som får kunden dra pistol,/tv/nyheter/varlden/felet-pa-sasen-far-18-aringen-att-hota-med-pistol/
Attacker mot ryskockuperade staden,/tv/nyheter/varlden/attackerna-chockar-ryskockuperade-staden/
Vance varning om Trump,/tv/nyheter/varlden/vance-varning-om-trump/
Trump: Nato har misslyckats,/tv/nyheter/trump-nato-har-misslyckats/
Stor förvirring i Vita huset,/tv/nyheter/stor-forvirring-i-vita-huset/
”Största vågen av flyganfall sedan kriget började”,/tv/nyheter/storsta-vagen-av-flyganfall-sedan-kriget-borjade/
Ryska svaret på vapenvilan,/tv/nyheter/ryska-svaret-pa-vapenvilan/
Hegseth: Kriget var en hämnd,/tv/nyheter/varlden/hegseth-kriget-var-en-hamnd/
Cajsa och Axel förlorade båda sina barn – efter en dag,/tv/nyheter/obs-ska-ga-med-artikel-cajsa-och-axel-forlorade-bada-sina-barn-efter-en-dag/
Här brinner prinsens present upp,/tv/nyheter/sverige/har-brinner-prinsens-present-upp/
”Ett fruktansvärt brott och förlossningsvåld”,/nyheter/sverige/forlossningen-forcerades-fram-mot-olivias-vilja-/
JD Vance i ny attack mot Zelenskyj: ”Skandalöst”,/nyheter/varlden/vance-nya-attack-mot-zelenskyj/
Paret förlorade båda sina barn: ”En sorg”,/nyheter/sverige/cajsa-och-axel-forlorade-bada-sina-barn-lilla-tiden-vi-fick-betyder-allt/
Så vill han straffa ”de ohjälpsamma”,/nyheter/varlden/trump-vill-straffa-ohjalpsamma-nato-lander/
Ljög i deklarationen – döms till fängelse,/nyheter/sverige/ljog-i-deklarationen-doms-till-fangelse-/
Iran: Israel bryter mot vapenvilan,/nyheter/varlden/iran-israel-bryter-mot-vapenvilan/
Vem gjorde det avgörande målet?,/nyheter/sverige/vem-gjorde-det-avgorande-malet-/
Kusliga bilderna – här för han bort sjuåringen,/nyheter/varlden/fedex-budet-erkanner-mordet-pa-athena-strand/
Motattacken mot SD: ”En sell-out”,/nyheter/politik/ardalan-shekarabi-om-sd-toppen-en-sell-out/
Seriemördaren erkänner – har dödat åtta kvinnor,/nyheter/varlden/misstankta-seriemordaren-erkanner-dodat-atta-kvinnor/
Trump sågar Nato inför viktiga mötet,https://www.expressen.se/tv/nyheter/trump-nato-har-misslyckats
Sjuåriga flickans brev: ”Kan du endra lagen?”,/nyheter/politik/ulf-kristerssons-svar-till-sjuariga-flickan-om-barn-i-fangelse/
SMHI efter stormen: ”Solen dominerar”,/nyheter/sverige/efter-stormen-nu--drar-hogtrycket-in/
Ufo-experten försvann spårlöst – mysteriet växer,/nyheter/varlden/ufo-experten-forsvann--nu-vaxer-mysteriet/
Ämnet som förgiftade de anställda: ”Frekvent”,/nyheter/sverige/forundersokning-om-forgiftningar-pa-akademiska-laggs-ner/
Ryska kravet på Sverige: Lyssna,/nyheter/sverige/kaptenen-pa-caffa-misstanks-for-brott-ryssland-vill-lyssna-inifran-ambassaden/
Se när Caffa bordas – med dragna vapen,/tv/nyheter/sverige/se-tillslaget-bordar-baten-med-dragna-vapen/
Läkarna vill ersättas efter da Costa-fallet,/nyheter/sverige/lakarna-i-da-costa-fallet-vill-fa-ersattning-fran-regeringen/
Ilsknade till: Bet av makens tunga,/nyheter/sverige/kvinna-bet-av-sin-mans-tunga-otroligt-storig/
Experten: Det stora prisraset lär dröja,/nyheter/varlden/oljeexperten-kommer-ta-tid-innan-oljepriserna-ar-tillbaka-pa-det-normala-/
Svårt att hänga med?,/nyheter/fraga-getingen-/
Direktrapport: Allt om valet,/nyheter/politik/allt-om-valet-2026-folj-direktrapporten/
