Heading,URL
Nakenprotest i turiststaden,/tv/nyheter/varlden/protester-mot-ryska-deltagandet-i-konstutstallningen/
Filmar när Ukrainas nya supervapen träffar,/tv/nyheter/varlden/filmar-nar-ukrainas-nya-supervapen-traffar/
Skräcksynen i planet – ser ingenting,/tv/nyheter/varlden/skracksynen-i-planet-ser-ingenting/
Jättebrand i Iran – tiotal döda,/tv/nyheter/varlden/jattebrand-i-iran-tiotal-doda-/
Skyskrapa i lågor i Dubai,/tv/nyheter/varlden/skyskrapa-i-lagor-i-dubai/
Polisens fynd: Död man i krokodil,/tv/nyheter/varlden/polisens-fynd-dod-man-i-krokodil-/
Sätter eld på heliga templet,/tv/nyheter/varlden/satter-eld-pa-heliga-templet/
Explosion på fyrverkerifabrik – 20-tal döda,/tv/nyheter/varlden/20-tal-doda-i-explosion-pa-fyrverkerifabrik/
Avslöjar mörka hemligheten i svenskparadiset,/tv/nyheter/varlden/avslojar-morka-hemligheten-i-svenskparadiset/
JUST NU: Hackerattack mot universitet,/nyheter/sverige/global-hackerattack-mot-universitet-data-lackt/
JUST NU: Ny person smittad,https://www.expressen.se/nyheter/expressen-direkt/?post=c79a76d7-d5a4-42d2-a1fc-100d02d2132a
JUST NU: Putins industri i lågor,https://www.expressen.se/tv/nyheter/varlden/eldinferno-efter-attacker-mot-ryssland-i-natt
Svenska Yohanna: Jag drogades – sen fick jag en sexfilm,/nyheter/sverige/svenska-yohanna-jag-drogades-hos-epstein/
Smugglade minimobiler till anstalten – i vaginan,/nyheter/krim/smugglade-minimobiler-till-gangtopp-i-vaginan/
Rasar mot nakenchock i klassiska turiststaden,/tv/nyheter/varlden/nakenchock-i-venedig-vacker-starka-reaktioner-/
Orsaken till Åkessons nya look: ”Sorglig syn”,https://www.expressen.se/tv/nyheter/sverige/jimmie-akesson-om-sina-tander-sorglig-syn-
Nödläge utlyst – efter rysk attack,/tv/nyheter/varlden/massiv-skogsbrand-i-ukraina-startad-av-ryska-attacker/
USA bombar Iran – Trumps hotfulla ord,/nyheter/varlden/iran-smallar-hordes-pa-o-i-hormuz/
Här skjuter Iran mot USA:s fartyg,/tv/nyheter/varlden/har-skjuter-iran-mot-usas-fartyg/
Prinsens plötsliga öppning för Trump,/nyheter/varlden/prinsen-korde-over--trump-ger-gront-ljus/
Publiken skrattar åt Trump – efter orden,/tv/nyheter/varlden/publiken-brister-ut-i-skratt-efter-melanias-ord/
Louise intima relation med ån: ”Åsexuell”,/nyheter/sverige/louise-har-intim-relation-med-an-assman-vackte-kanslor-jag-inte-visste-fanns/
Raderar Demokraterna helt: ”Han måste rigga”,/nyheter/varlden/tennessee-ritar-om-valdistrikt-efter-beslutet-i-hogsta-domstolen/
"Rubios present till påven: ”Wow, ok”",/tv/nyheter/varlden/rubios-present-till-paven-wow-ok/
Greve misshandlade sin fru – 37 gånger,/nyheter/sverige/greven-nils-posse-misshandlade-sin-fru-i-flera-ar-doms/
Detaljerna inifrån: ”Jättemycket sprit”,/nyheter/sverige/detaljerna-inifran-jan-emanuels-fest/
L-politiker betalade svarta löner i flera år,/nyheter/politik/goran-lignell-betalade-svarta--loner-kandiderar-till-riksdagen/
"Rasar: ""Förbannad – det är byggmaffia""",/nyheter/sverige/byggnads-ordforande-fruktansvart-cyniskt/
Hade skräckviruset – sattes på flygplan,/nyheter/varlden/kvinna-smittad-med--skrackvirus-sattes-i-plan/
Nakenprotest mitt i stora turiststaden,/tv/nyheter/varlden/protester-mot-ryska-deltagandet-i-konstutstallningen/
Död man i krokodil – ”Enormt full mage”,/tv/nyheter/varlden/polisens-fynd-dod-man-i-krokodil-/
Eldinferno efter attacker mot Ryssland i natt,/tv/nyheter/varlden/eldinferno-efter-attacker-mot-ryssland-i-natt/
Jimmie Åkesson om sina tänder: ”Sorglig syn”,/tv/nyheter/sverige/jimmie-akesson-om-sina-tander-sorglig-syn-/
Här skjuter Iran mot USA:s fartyg,/tv/nyheter/varlden/har-skjuter-iran-mot-usas-fartyg/
"Rubios present till påven: ”Wow, ok”",/tv/nyheter/varlden/rubios-present-till-paven-wow-ok/
Nakenchock i Venedig väcker starka reaktioner,/tv/nyheter/varlden/nakenchock-i-venedig-vacker-starka-reaktioner-/
Sveriges nya hemliga spionmyndighet,/tv/nyheter/sverige/sveriges-nya-hemliga-spionmyndighet/
Här filmas skytten före trippelmordet,/tv/nyheter/skytten-fangas-pa-film-fore-trippelmordet/
Den är här – gör vår valkompass!,https://www.expressen.se/nyheter/politik/valkompass/
"Kan du Sveriges
landskapsblommor?",/nyheter/sverige/kan-du-sveriges-landskapsblommor/
Vem gjorde det avgörande målet?,/nyheter/sverige/vem-gjorde-det-avgorande-malet-/
Andrew angripen av maskerad man,/nyheter/kungligt/andrew-jagad-av-maskerad-man/
Lurade till sig unik urna på äldreboende,/nyheter/sverige/konsttjuv-lanade-urna-fran-aldreboende-saldes-vidare-pa-auktion/
"Chloe, 21, klämdes ihjäl under hotellets garderob",/nyheter/varlden/chloe-21-klamdes-ihjal-under-garderob-/
Hon äter så slafsigt att jag inte vågar ha gäster,/nyheter/sverige/hennes-bordsskick-ar-vansinnigt-irriterande/
Hemligt SD-besök på M-mötet: ”Viktigt”,/nyheter/politik/hemliga-sd-besoket--pa-m-motet-viktigt/
Gjorde hål i bajamaja – filmade kvinnorna,/nyheter/sverige/polisen-misstanker-filmade-kvinnor-genom-hal-pa-bajamaja/
Godisklassiker inte längre svensk – nu säljs fabriken,/nyheter/sverige/alskade-godisklassikern-inte-langre-svensk-fabriken-sald/
Incident i jaktbutik – en person död,/nyheter/sverige/incident-i-jaktbutik-en-person-dod-i-ulricehamn/
Leavitt historisk – blev mamma igen,/nyheter/varlden/trumps-pressekreterare-karoline-leavitt-har-fatt-barn/
Trump hotades – då vände han tvärt,/nyheter/varlden/forklaringen-till-trumps-tvarvandning-saudiarabien-satte-stopp/
Publikens skratt – efter Melanias ord,https://www.expressen.se/tv/nyheter/varlden/publiken-brister-ut-i-skratt-efter-melanias-ord/
Iranska hånet mot Trumps positiva ord,/nyheter/varlden/irans-han-mot-trumps-utspel-om-samtalen/
Bråk i korridor – SD skyller på C-profilen,/nyheter/politik/brak-i-riksdagens-korridor-efter-mote/
Martins skräck på dödskryssningen,/nyheter/varlden/martin-anstee-vardas-pa-sjukhus-efter-utbrottet-av-hantavirus/
Lina och Emilia dog i olycka – förarna åtalas,/nyheter/sverige/lina-och-emilia-dog-nu-atalas-tva-bilforare-for-trafikolyckan/
M-toppen varnar: Kan dröja flera år,/nyheter/politik/m-toppen-varnar-kan-droja-flera-ar-till-nytt-kvittningssystem-/
Ilskan mot Tidö: ”Otroligt märkligt”,/nyheter/politik/kvittningsbraket-fortsatter-trots-nytt-mote/
Utpekade mannen har lämnat förklaring,/nyheter/sverige/forsvaret-finns-en-forklaring-till-dna-fynd/
Klev på bussen – då kom spårvagnen,/nyheter/sverige/buss-och-sparvagn-i-krock-i-goteborg/
Kristerssons löfte: Fler IVF-försök för syskon,/nyheter/politik/ulf-kristersson-gratis-ivf-forsok-for-syskon/
Kontakta redaktionen direkt,/nyheter/har-du-ett-nyhetstips-eller-bilder/
Svårt att hänga med?,/nyheter/fraga-getingen-/
Direktrapport: Allt om valet,/nyheter/politik/allt-om-valet-2026-folj-direktrapporten/
